[
  {
    "Location": "The Phoenecian",
    "Date": "06-19-2000",
    "Scientific Name": "Campylorhynchus brunneicapillus",
    "Common Name": "Cactus Wren",
    "Filename": "2000-06-19-cacwre.jpg",
    "County": "Maricopa",
    "State/Province": "US-AZ"
  },
  {
    "Location": "The Phoenecian",
    "Date": "06-19-2000",
    "Scientific Name": "Zenaida asiatica",
    "Common Name": "White-winged Dove",
    "Filename": "2000-06-19-whwdov.jpg",
    "County": "Maricopa",
    "State/Province": "US-AZ"
  },
  {
    "Location": "Santa Clara",
    "Date": "07-23-2000",
    "Scientific Name": "Athene cunicularia",
    "Common Name": "Burrowing Owl",
    "Filename": "2000-07-23-burowl.jpg",
    "County": "Santa Clara",
    "State/Province": "US-CA"
  },
  {
    "Location": "Bosque del Apache NWR",
    "Date": "11-26-2005",
    "Scientific Name": "Chen caerulescens",
    "Common Name": "Snow Goose",
    "Filename": "2005-11-26-snogoo.jpg",
    "County": "Socorro",
    "State/Province": "US-NM"
  },
  {
    "Location": "Reactivity",
    "Date": "01-15-2001",
    "Scientific Name": "Corvus corax",
    "Common Name": "Common Raven",
    "Filename": "2001-01-15-comrav.jpg",
    "County": "San Mateo",
    "State/Province": "US-CA"
  },
  {
    "Location": "Arcata Marsh",
    "Date": "06-16-2001",
    "Scientific Name": "Nycticorax nycticorax",
    "Common Name": "Black-crowned Night-Heron",
    "Filename": "2001-06-16-bcnher.jpg",
    "County": "Humboldt",
    "State/Province": "US-CA"
  },
  {
    "Location": "Morro Bay Estuary",
    "Date": "07-16-2001",
    "Scientific Name": "Numenius americanus",
    "Common Name": "Long-billed Curlew",
    "Filename": "2001-07-16-lobcur.jpg",
    "County": "San Luis Obispo",
    "State/Province": "US-CA"
  },
  {
    "Location": "Morro Bay Estuary",
    "Date": "07-16-2001",
    "Scientific Name": "Falco peregrinus",
    "Common Name": "Peregrine Falcon",
    "Filename": "2001-07-16-perfal.jpg",
    "County": "San Luis Obispo",
    "State/Province": "US-CA"
  },
  {
    "Location": "Monterey Bay",
    "Date": "11-03-2001",
    "Scientific Name": "Pelecanus occidentalis",
    "Common Name": "Brown Pelican",
    "Filename": "2001-11-03-brnpel.jpg",
    "County": "Monterey",
    "State/Province": "US-CA"
  },
  {
    "Location": "Smith Creek Fire Station",
    "Date": "01-21-2002",
    "Scientific Name": "Glaucidium gnoma",
    "Common Name": "Northern Pygmy-Owl",
    "Filename": "2002-01-21-nopowl.jpg",
    "County": "Santa Clara",
    "State/Province": "US-CA"
  },
  {
    "Location": "Malheur NWR",
    "Date": "04-21-2002",
    "Scientific Name": "Centrocercus urophasianus",
    "Common Name": "Greater Sage-Grouse",
    "Filename": "2002-04-21-saggro.jpg",
    "County": "Harney",
    "State/Province": "US-OR"
  },
  {
    "Location": "Palo Alto Duck Pond",
    "Date": "05-05-2002",
    "Scientific Name": "Numenius phaeopus",
    "Common Name": "Whimbrel",
    "Filename": "2002-05-05-whimbr.jpg",
    "County": "Santa Clara",
    "State/Province": "US-CA"
  },
  {
    "Location": "Andrew Molera",
    "Date": "08-31-2002",
    "Scientific Name": "Haematopus bachmani",
    "Common Name": "Black Oystercatcher",
    "Filename": "2002-08-31-blkoys.jpg",
    "County": "Monterey",
    "State/Province": "US-CA"
  },
  {
    "Location": "Andrew Molera",
    "Date": "08-31-2002",
    "Scientific Name": "Mergus merganser",
    "Common Name": "Common Merganser",
    "Filename": "2002-08-31-commer.jpg",
    "County": "Monterey",
    "State/Province": "US-CA"
  },
  {
    "Location": "Carmel River",
    "Date": "09-01-2002",
    "Scientific Name": "Picoides pubescens",
    "Common Name": "Downy Woodpecker",
    "Filename": "2002-09-01-dowwoo.jpg",
    "County": "Monterey",
    "State/Province": "US-CA"
  },
  {
    "Location": "Carmel River",
    "Date": "09-02-2002",
    "Scientific Name": "Bubo virginianus",
    "Common Name": "Great Horned Owl",
    "Filename": "2002-09-02-grhowl.jpg",
    "County": "Monterey",
    "State/Province": "US-CA"
  },
  {
    "Location": "Charleston Slough",
    "Date": "09-14-2002",
    "Scientific Name": "Pelecanus erythrorhynchos",
    "Common Name": "American White Pelican",
    "Filename": "2002-09-14-amwpel.jpg",
    "County": "Santa Clara",
    "State/Province": "US-CA"
  },
  {
    "Location": "Rural Areas of Humboldt County",
    "Date": "10-13-2002",
    "Scientific Name": "Gavia immer",
    "Common Name": "Common Loon",
    "Filename": "2002-10-13-comloo.jpg",
    "County": "Humboldt",
    "State/Province": "US-CA"
  },
  {
    "Location": "Rural Areas of Humboldt County",
    "Date": "10-13-2002",
    "Scientific Name": "Tringa melanoleuca",
    "Common Name": "Greater Yellowlegs",
    "Filename": "2002-10-13-greyel.jpg",
    "County": "Humboldt",
    "State/Province": "US-CA"
  },
  {
    "Location": "Calero Reservoir",
    "Date": "11-17-2002",
    "Scientific Name": "Melanerpes formicivorus",
    "Common Name": "Acorn Woodpecker",
    "Filename": "2002-11-17-acowoo.jpg",
    "County": "Santa Clara",
    "State/Province": "US-CA"
  },
  {
    "Location": "Coyote Creek Field Station",
    "Date": "12-01-2002",
    "Scientific Name": "Falco columbarius",
    "Common Name": "Merlin",
    "Filename": "2002-12-01-merlin.jpg",
    "County": "Santa Clara",
    "State/Province": "US-CA"
  },
  {
    "Location": "Donald M. Somers Water Pollution Control Plant",
    "Date": "01-01-2003",
    "Scientific Name": "Megaceryle alcyon",
    "Common Name": "Belted Kingfisher",
    "Filename": "2003-01-01-belkin.jpg",
    "County": "Santa Clara",
    "State/Province": "US-CA"
  },
  {
    "Location": "Donald M. Somers Water Pollution Control Plant",
    "Date": "01-01-2003",
    "Scientific Name": "Butorides virescens",
    "Common Name": "Green Heron",
    "Filename": "2003-01-01-grnher.jpg",
    "County": "Santa Clara",
    "State/Province": "US-CA"
  },
  {
    "Location": "Donald M. Somers Water Pollution Control Plant",
    "Date": "01-01-2003",
    "Scientific Name": "Elanus leucurus",
    "Common Name": "White-tailed Kite",
    "Filename": "2003-01-01-whtkit.jpg",
    "County": "Santa Clara",
    "State/Province": "US-CA"
  },
  {
    "Location": "Pillar Point",
    "Date": "01-05-2003",
    "Scientific Name": "Pluvialis squatarola",
    "Common Name": "Black-bellied Plover",
    "Filename": "2003-01-05-bkbplo.jpg",
    "County": "San Mateo",
    "State/Province": "US-CA"
  },
  {
    "Location": "Princeton Harbor",
    "Date": "01-05-2003",
    "Scientific Name": "Sula leucogaster",
    "Common Name": "Brown Booby",
    "Filename": "2003-01-05-brnboo.jpg",
    "County": "San Mateo",
    "State/Province": "US-CA"
  },
  {
    "Location": "Princeton Harbor",
    "Date": "01-05-2003",
    "Scientific Name": "Bucephala albeola",
    "Common Name": "Bufflehead",
    "Filename": "2003-01-05-buffle.jpg",
    "County": "San Mateo",
    "State/Province": "US-CA"
  },
  {
    "Location": "Princeton Harbor",
    "Date": "01-05-2003",
    "Scientific Name": "Gavia immer",
    "Common Name": "Common Loon",
    "Filename": "2003-01-05-comloo.jpg",
    "County": "San Mateo",
    "State/Province": "US-CA"
  },
  {
    "Location": "Panoche Valley--general area (SBT Co.)",
    "Date": "01-11-2003",
    "Scientific Name": "Buteo regalis",
    "Common Name": "Ferruginous Hawk",
    "Filename": "2003-01-11-ferhaw.jpg",
    "County": "San Benito",
    "State/Province": "US-CA"
  },
  {
    "Location": "Panoche Valley--general area (SBT Co.)",
    "Date": "01-11-2003",
    "Scientific Name": "Geococcyx californianus",
    "Common Name": "Greater Roadrunner",
    "Filename": "2003-01-11-greroa.jpg",
    "County": "San Benito",
    "State/Province": "US-CA"
  },
  {
    "Location": "Charleston Slough",
    "Date": "03-02-2003",
    "Scientific Name": "Podiceps nigricollis",
    "Common Name": "Eared Grebe",
    "Filename": "2003-03-02-eargre.jpg",
    "County": "Santa Clara",
    "State/Province": "US-CA"
  },
  {
    "Location": "Salton Sea",
    "Date": "03-24-2003",
    "Scientific Name": "Bubulcus ibis",
    "Common Name": "Cattle Egret",
    "Filename": "2003-03-24-categr.jpg",
    "County": "Imperial",
    "State/Province": "US-CA"
  },
  {
    "Location": "San Diego",
    "Date": "03-28-2003",
    "Scientific Name": "Calidris virgata",
    "Common Name": "Surfbird",
    "Filename": "2003-03-28-surfbi.jpg",
    "County": "San Diego",
    "State/Province": "US-CA"
  },
  {
    "Location": "San Diego",
    "Date": "03-29-2003",
    "Scientific Name": "Rynchops niger",
    "Common Name": "Black Skimmer",
    "Filename": "2003-03-29-blkski.jpg",
    "County": "San Diego",
    "State/Province": "US-CA"
  },
  {
    "Location": "San Diego",
    "Date": "03-29-2003",
    "Scientific Name": "Phalacrocorax pelagicus",
    "Common Name": "Pelagic Cormorant",
    "Filename": "2003-03-29-pelcor.jpg",
    "County": "San Diego",
    "State/Province": "US-CA"
  },
  {
    "Location": "Rural Areas of Siskiyou County",
    "Date": "08-19-2003",
    "Scientific Name": "Haliaeetus leucocephalus",
    "Common Name": "Bald Eagle",
    "Filename": "2003-08-19-baleag.jpg",
    "County": "Siskiyou",
    "State/Province": "US-CA"
  },
  {
    "Location": "Charleston Slough",
    "Date": "10-04-2003",
    "Scientific Name": "Calidris minutilla",
    "Common Name": "Least Sandpiper",
    "Filename": "2003-10-04-leasan.jpg",
    "County": "Santa Clara",
    "State/Province": "US-CA"
  },
  {
    "Location": "Palo Alto Duck Pond",
    "Date": "10-07-2003",
    "Scientific Name": "Fulica americana",
    "Common Name": "American Coot",
    "Filename": "2003-10-07-amecoo.jpg",
    "County": "Santa Clara",
    "State/Province": "US-CA"
  },
  {
    "Location": "Palo Alto Duck Pond",
    "Date": "10-07-2003",
    "Scientific Name": "Anas platyrhynchos",
    "Common Name": "Mallard",
    "Filename": "2003-10-07-mallar.jpg",
    "County": "Santa Clara",
    "State/Province": "US-CA"
  },
  {
    "Location": "Charleston Slough",
    "Date": "10-12-2003",
    "Scientific Name": "Psaltriparus minimus",
    "Common Name": "Bushtit",
    "Filename": "2003-10-12-bushti.jpg",
    "County": "Santa Clara",
    "State/Province": "US-CA"
  },
  {
    "Location": "Charleston Slough",
    "Date": "10-12-2003",
    "Scientific Name": "Accipiter cooperii",
    "Common Name": "Cooper's Hawk",
    "Filename": "2003-10-12-coohaw.jpg",
    "County": "Santa Clara",
    "State/Province": "US-CA"
  },
  {
    "Location": "Charleston Slough",
    "Date": "10-12-2003",
    "Scientific Name": "Zonotrichia atricapilla",
    "Common Name": "Golden-crowned Sparrow",
    "Filename": "2003-10-12-gocspa.jpg",
    "County": "Santa Clara",
    "State/Province": "US-CA"
  },
  {
    "Location": "Shoreline Lake",
    "Date": "10-12-2003",
    "Scientific Name": "Larus delawarensis",
    "Common Name": "Ring-billed Gull",
    "Filename": "2003-10-12-ribgul.jpg",
    "County": "Santa Clara",
    "State/Province": "US-CA"
  },
  {
    "Location": "Charleston Slough",
    "Date": "10-12-2003",
    "Scientific Name": "Aechmophorus occidentalis",
    "Common Name": "Western Grebe",
    "Filename": "2003-10-12-wesgre.jpg",
    "County": "Santa Clara",
    "State/Province": "US-CA"
  },
  {
    "Location": "Foster City Radio Tower",
    "Date": "10-31-2003",
    "Scientific Name": "Anas acuta",
    "Common Name": "Northern Pintail",
    "Filename": "2003-10-31-norpin.jpg",
    "County": "San Mateo",
    "State/Province": "US-CA"
  },
  {
    "Location": "Foster City Radio Tower",
    "Date": "10-31-2003",
    "Scientific Name": "Egretta thula",
    "Common Name": "Snowy Egret",
    "Filename": "2003-10-31-snoegr.jpg",
    "County": "San Mateo",
    "State/Province": "US-CA"
  },
  {
    "Location": "Southwest Wisconsin",
    "Date": "11-07-2003",
    "Scientific Name": "Cardinalis cardinalis",
    "Common Name": "Northern Cardinal",
    "Filename": "2003-11-07-norcar.jpg",
    "County": "Crawford",
    "State/Province": "US-WI"
  },
  {
    "Location": "Southwest Wisconsin",
    "Date": "11-07-2003",
    "Scientific Name": "Melanerpes carolinus",
    "Common Name": "Red-bellied Woodpecker",
    "Filename": "2003-11-07-rebwoo.jpg",
    "County": "Crawford",
    "State/Province": "US-WI"
  },
  {
    "Location": "Southwest Wisconsin",
    "Date": "11-07-2003",
    "Scientific Name": "Sitta carolinensis",
    "Common Name": "White-breasted Nuthatch",
    "Filename": "2003-11-07-whbnut.jpg",
    "County": "Crawford",
    "State/Province": "US-WI"
  },
  {
    "Location": "Upper Mississippi NWR",
    "Date": "11-08-2003",
    "Scientific Name": "Cygnus buccinator",
    "Common Name": "Trumpeter Swan",
    "Filename": "2003-11-08-truswa.jpg",
    "County": "Jo Daviess",
    "State/Province": "US-IL"
  },
  {
    "Location": "Los Alamitos Water Recharge Pond",
    "Date": "12-07-2003",
    "Scientific Name": "Botaurus lentiginosus",
    "Common Name": "American Bittern",
    "Filename": "2003-12-07-amebit.jpg",
    "County": "Santa Clara",
    "State/Province": "US-CA"
  },
  {
    "Location": "Palo Alto Duck Pond",
    "Date": "01-02-2004",
    "Scientific Name": "Recurvirostra americana",
    "Common Name": "American Avocet",
    "Filename": "2004-01-02-ameavo.jpg",
    "County": "Santa Clara",
    "State/Province": "US-CA"
  },
  {
    "Location": "Palo Alto Duck Pond",
    "Date": "01-02-2004",
    "Scientific Name": "Sayornis nigricans",
    "Common Name": "Black Phoebe",
    "Filename": "2004-01-02-blkpho.jpg",
    "County": "Santa Clara",
    "State/Province": "US-CA"
  },
  {
    "Location": "Grant Ranch County Park",
    "Date": "01-10-2004",
    "Scientific Name": "Toxostoma redivivum",
    "Common Name": "California Thrasher",
    "Filename": "2004-01-10-calthr.jpg",
    "County": "Santa Clara",
    "State/Province": "US-CA"
  },
  {
    "Location": "Mount Hamilton",
    "Date": "01-10-2004",
    "Scientific Name": "Melanerpes lewis",
    "Common Name": "Lewis's Woodpecker",
    "Filename": "2004-01-10-lewwoo.jpg",
    "County": "Santa Clara",
    "State/Province": "US-CA"
  },
  {
    "Location": "Mount Hamilton",
    "Date": "01-10-2004",
    "Scientific Name": "Buteo jamaicensis",
    "Common Name": "Red-tailed Hawk",
    "Filename": "2004-01-10-rethaw.jpg",
    "County": "Santa Clara",
    "State/Province": "US-CA"
  },
  {
    "Location": "Mount Hamilton",
    "Date": "01-10-2004",
    "Scientific Name": "Sialia mexicana",
    "Common Name": "Western Bluebird",
    "Filename": "2004-01-10-wesblu.jpg",
    "County": "Santa Clara",
    "State/Province": "US-CA"
  },
  {
    "Location": "Grant Ranch County Park",
    "Date": "01-10-2004",
    "Scientific Name": "Zonotrichia albicollis",
    "Common Name": "White-throated Sparrow",
    "Filename": "2004-01-10-whtspa.jpg",
    "County": "Santa Clara",
    "State/Province": "US-CA"
  },
  {
    "Location": "Mount Hamilton",
    "Date": "01-10-2004",
    "Scientific Name": "Pica nuttalli",
    "Common Name": "Yellow-billed Magpie",
    "Filename": "2004-01-10-yebmag.jpg",
    "County": "Santa Clara",
    "State/Province": "US-CA"
  },
  {
    "Location": "Calero Reservoir",
    "Date": "01-11-2004",
    "Scientific Name": "Buteo regalis",
    "Common Name": "Ferruginous Hawk",
    "Filename": "2004-01-11-ferhaw.jpg",
    "County": "Santa Clara",
    "State/Province": "US-CA"
  },
  {
    "Location": "Calero Reservoir",
    "Date": "01-11-2004",
    "Scientific Name": "Charadrius vociferus",
    "Common Name": "Killdeer",
    "Filename": "2004-01-11-killde.jpg",
    "County": "Santa Clara",
    "State/Province": "US-CA"
  },
  {
    "Location": "Charleston Slough",
    "Date": "01-12-2004",
    "Scientific Name": "Calypte anna",
    "Common Name": "Anna's Hummingbird",
    "Filename": "2004-01-12-annhum.jpg",
    "County": "Santa Clara",
    "State/Province": "US-CA"
  },
  {
    "Location": "Shoreline Lake",
    "Date": "01-12-2004",
    "Scientific Name": "Melozone crissalis",
    "Common Name": "California Towhee",
    "Filename": "2004-01-12-caltow.jpg",
    "County": "Santa Clara",
    "State/Province": "US-CA"
  },
  {
    "Location": "Shoreline Lake",
    "Date": "01-12-2004",
    "Scientific Name": "Melanitta perspicillata",
    "Common Name": "Surf Scoter",
    "Filename": "2004-01-12-sursco.jpg",
    "County": "Santa Clara",
    "State/Province": "US-CA"
  },
  {
    "Location": "Shoreline Lake",
    "Date": "01-12-2004",
    "Scientific Name": "Tringa semipalmata",
    "Common Name": "Willet",
    "Filename": "2004-01-12-willet.jpg",
    "County": "Santa Clara",
    "State/Province": "US-CA"
  },
  {
    "Location": "Golden Gate Park",
    "Date": "01-17-2004",
    "Scientific Name": "Catharus guttatus",
    "Common Name": "Hermit Thrush",
    "Filename": "2004-01-17-herthr.jpg",
    "County": "San Francisco",
    "State/Province": "US-CA"
  },
  {
    "Location": "Stowe Lake",
    "Date": "01-17-2004",
    "Scientific Name": "Larus canus",
    "Common Name": "Mew Gull",
    "Filename": "2004-01-17-mewgul.jpg",
    "County": "San Francisco",
    "State/Province": "US-CA"
  },
  {
    "Location": "Lake Merced",
    "Date": "01-17-2004",
    "Scientific Name": "Larus occidentalis",
    "Common Name": "Western Gull",
    "Filename": "2004-01-17-wesgul.jpg",
    "County": "San Francisco",
    "State/Province": "US-CA"
  },
  {
    "Location": "Coast Guard Pier",
    "Date": "01-18-2004",
    "Scientific Name": "Falco sparverius",
    "Common Name": "American Kestrel",
    "Filename": "2004-01-18-amekes.jpg",
    "County": "Monterey",
    "State/Province": "US-CA"
  },
  {
    "Location": "Coast Guard Pier",
    "Date": "01-18-2004",
    "Scientific Name": "Histrionicus histrionicus",
    "Common Name": "Harlequin Duck",
    "Filename": "2004-01-18-harduc.jpg",
    "County": "Monterey",
    "State/Province": "US-CA"
  },
  {
    "Location": "Coast Guard Pier",
    "Date": "01-18-2004",
    "Scientific Name": "Larus heermanni",
    "Common Name": "Heermann's Gull",
    "Filename": "2004-01-18-heegul.jpg",
    "County": "Monterey",
    "State/Province": "US-CA"
  },
  {
    "Location": "Moss Landing State Beach",
    "Date": "01-18-2004",
    "Scientific Name": "Numenius americanus",
    "Common Name": "Long-billed Curlew",
    "Filename": "2004-01-18-lobcur.jpg",
    "County": "Monterey",
    "State/Province": "US-CA"
  },
  {
    "Location": "Merced NWR",
    "Date": "01-19-2004",
    "Scientific Name": "Buteo lineatus",
    "Common Name": "Red-shouldered Hawk",
    "Filename": "2004-01-19-reshaw.jpg",
    "County": "Merced",
    "State/Province": "US-CA"
  },
  {
    "Location": "Merced NWR",
    "Date": "01-19-2004",
    "Scientific Name": "Regulus calendula",
    "Common Name": "Ruby-crowned Kinglet",
    "Filename": "2004-01-19-ruckin.jpg",
    "County": "Merced",
    "State/Province": "US-CA"
  },
  {
    "Location": "Merced NWR",
    "Date": "01-19-2004",
    "Scientific Name": "Plegadis chihi",
    "Common Name": "White-faced Ibis",
    "Filename": "2004-01-19-whfibi.jpg",
    "County": "Merced",
    "State/Province": "US-CA"
  },
  {
    "Location": "Pt. Reyes National Seashore",
    "Date": "01-24-2004",
    "Scientific Name": "Callipepla californica",
    "Common Name": "California Quail",
    "Filename": "2004-01-24-calqua.jpg",
    "County": "Marin",
    "State/Province": "US-CA"
  },
  {
    "Location": "Pt. Reyes National Seashore",
    "Date": "01-24-2004",
    "Scientific Name": "Anas penelope",
    "Common Name": "Eurasian Wigeon",
    "Filename": "2004-01-24-eurwig.jpg",
    "County": "Marin",
    "State/Province": "US-CA"
  },
  {
    "Location": "Pt. Reyes National Seashore",
    "Date": "01-25-2004",
    "Scientific Name": "Accipiter cooperii",
    "Common Name": "Cooper's Hawk",
    "Filename": "2004-01-25-coohaw.jpg",
    "County": "Marin",
    "State/Province": "US-CA"
  },
  {
    "Location": "Pt. Reyes National Seashore",
    "Date": "01-25-2004",
    "Scientific Name": "Larus glaucescens",
    "Common Name": "Glaucous-winged Gull",
    "Filename": "2004-01-25-glwgul.jpg",
    "County": "Marin",
    "State/Province": "US-CA"
  },
  {
    "Location": "Pt. Reyes National Seashore",
    "Date": "01-25-2004",
    "Scientific Name": "Aquila chrysaetos",
    "Common Name": "Golden Eagle",
    "Filename": "2004-01-25-goleag.jpg",
    "County": "Marin",
    "State/Province": "US-CA"
  },
  {
    "Location": "Palo Alto Duck Pond",
    "Date": "01-31-2004",
    "Scientific Name": "Psaltriparus minimus",
    "Common Name": "Bushtit",
    "Filename": "2004-01-31-bushti.jpg",
    "County": "Santa Clara",
    "State/Province": "US-CA"
  },
  {
    "Location": "Palo Alto Duck Pond",
    "Date": "01-31-2004",
    "Scientific Name": "Podiceps nigricollis",
    "Common Name": "Eared Grebe",
    "Filename": "2004-01-31-eargre.jpg",
    "County": "Santa Clara",
    "State/Province": "US-CA"
  },
  {
    "Location": "Palo Alto Duck Pond",
    "Date": "01-31-2004",
    "Scientific Name": "Lophodytes cucullatus",
    "Common Name": "Hooded Merganser",
    "Filename": "2004-01-31-hoomer.jpg",
    "County": "Santa Clara",
    "State/Province": "US-CA"
  },
  {
    "Location": "Palo Alto Duck Pond",
    "Date": "01-31-2004",
    "Scientific Name": "Buteo jamaicensis",
    "Common Name": "Red-tailed Hawk",
    "Filename": "2004-01-31-rethaw.jpg",
    "County": "Santa Clara",
    "State/Province": "US-CA"
  },
  {
    "Location": "Charleston Slough",
    "Date": "02-08-2004",
    "Scientific Name": "Aythya valisineria",
    "Common Name": "Canvasback",
    "Filename": "2004-02-08-canvas.jpg",
    "County": "Santa Clara",
    "State/Province": "US-CA"
  },
  {
    "Location": "Parcourse Marsh",
    "Date": "02-22-2004",
    "Scientific Name": "Ardea alba",
    "Common Name": "Great Egret",
    "Filename": "2004-02-22-greegr.jpg",
    "County": "Santa Clara",
    "State/Province": "US-CA"
  },
  {
    "Location": "Sunnyvale Baylands",
    "Date": "03-02-2004",
    "Scientific Name": "Oxyura jamaicensis",
    "Common Name": "Ruddy Duck",
    "Filename": "2004-03-02-rudduc.jpg",
    "County": "Santa Clara",
    "State/Province": "US-CA"
  },
  {
    "Location": "Sunnyvale Baylands",
    "Date": "03-02-2004",
    "Scientific Name": "Sayornis saya",
    "Common Name": "Say's Phoebe",
    "Filename": "2004-03-02-saypho.jpg",
    "County": "Santa Clara",
    "State/Province": "US-CA"
  },
  {
    "Location": "Clifton Court Forebay",
    "Date": "03-06-2004",
    "Scientific Name": "Plectrophenax nivalis",
    "Common Name": "Snow Bunting",
    "Filename": "2004-03-06-snobun.jpg",
    "County": "Contra Costa",
    "State/Province": "US-CA"
  },
  {
    "Location": "Palo Alto Duck Pond",
    "Date": "01-31-2004",
    "Scientific Name": "Aythya marila",
    "Common Name": "Greater Scaup",
    "Filename": "2004-01-31-gresca.jpg",
    "County": "Santa Clara",
    "State/Province": "US-CA"
  },
  {
    "Location": "Palo Alto Duck Pond",
    "Date": "01-31-2004",
    "Scientific Name": "Aythya affinis",
    "Common Name": "Lesser Scaup",
    "Filename": "2004-01-31-lessca.jpg",
    "County": "Santa Clara",
    "State/Province": "US-CA"
  },
  {
    "Location": "Foster City Radio Tower",
    "Date": "12-03-2003",
    "Scientific Name": "Cathartes aura",
    "Common Name": "Turkey Vulture",
    "Filename": "2003-12-03-turvul.jpg",
    "County": "San Mateo",
    "State/Province": "US-CA"
  },
  {
    "Location": "Palo Alto Duck Pond",
    "Date": "12-03-2003",
    "Scientific Name": "Phasianus colchicus",
    "Common Name": "Ring-necked Pheasant",
    "Filename": "2003-12-03-rinphe.jpg",
    "County": "Santa Clara",
    "State/Province": "US-CA"
  },
  {
    "Location": "Palo Alto Duck Pond",
    "Date": "12-03-2003",
    "Scientific Name": "Rallus obsoletus",
    "Common Name": "Ridgway's Rail",
    "Filename": "2003-12-03-clarai.jpg",
    "County": "Santa Clara",
    "State/Province": "US-CA"
  },
  {
    "Location": "Palo Alto Duck Pond",
    "Date": "12-03-2003",
    "Scientific Name": "Zonotrichia leucophrys",
    "Common Name": "White-crowned Sparrow",
    "Filename": "2003-12-03-whcspa.jpg",
    "County": "Santa Clara",
    "State/Province": "US-CA"
  },
  {
    "Location": "Sunnyvale Baylands",
    "Date": "03-02-2004",
    "Scientific Name": "Branta canadensis",
    "Common Name": "Canada Goose",
    "Filename": "2004-03-02-cangoo.jpg",
    "County": "Santa Clara",
    "State/Province": "US-CA"
  },
  {
    "Location": "Palo Alto Duck Pond",
    "Date": "03-31-2004",
    "Scientific Name": "Hirundo rustica",
    "Common Name": "Barn Swallow",
    "Filename": "2004-03-31-barswa.jpg",
    "County": "Santa Clara",
    "State/Province": "US-CA"
  },
  {
    "Location": "Palo Alto Duck Pond",
    "Date": "03-31-2004",
    "Scientific Name": "Petrochelidon pyrrhonota",
    "Common Name": "Cliff Swallow",
    "Filename": "2004-03-31-cliswa.jpg",
    "County": "Santa Clara",
    "State/Province": "US-CA"
  },
  {
    "Location": "Palo Alto Duck Pond",
    "Date": "03-31-2004",
    "Scientific Name": "Corvus brachyrhynchos",
    "Common Name": "American Crow",
    "Filename": "2004-03-31-amecro.jpg",
    "County": "Santa Clara",
    "State/Province": "US-CA"
  },
  {
    "Location": "Palo Alto Duck Pond",
    "Date": "03-31-2004",
    "Scientific Name": "Melospiza melodia",
    "Common Name": "Song Sparrow",
    "Filename": "2004-03-31-sonspa.jpg",
    "County": "Santa Clara",
    "State/Province": "US-CA"
  },
  {
    "Location": "Don Edwards Center",
    "Date": "04-10-2004",
    "Scientific Name": "Chroicocephalus philadelphia",
    "Common Name": "Bonaparte's Gull",
    "Filename": "2004-04-10-bongul.jpg",
    "County": "Santa Clara",
    "State/Province": "US-CA"
  },
  {
    "Location": "Don Edwards Center",
    "Date": "04-10-2004",
    "Scientific Name": "Himantopus mexicanus",
    "Common Name": "Black-necked Stilt",
    "Filename": "2004-04-10-bknsti.jpg",
    "County": "Santa Clara",
    "State/Province": "US-CA"
  },
  {
    "Location": "Don Edwards Center",
    "Date": "04-10-2004",
    "Scientific Name": "Passerculus sandwichensis",
    "Common Name": "Savannah Sparrow",
    "Filename": "2004-04-10-savspa.jpg",
    "County": "Santa Clara",
    "State/Province": "US-CA"
  },
  {
    "Location": "Don Edwards Center",
    "Date": "04-10-2004",
    "Scientific Name": "Cistothorus palustris",
    "Common Name": "Marsh Wren",
    "Filename": "2004-04-10-marwre.jpg",
    "County": "Santa Clara",
    "State/Province": "US-CA"
  },
  {
    "Location": "Don Edwards Center",
    "Date": "04-10-2004",
    "Scientific Name": "Athene cunicularia",
    "Common Name": "Burrowing Owl",
    "Filename": "2004-04-10-burowl.jpg",
    "County": "Santa Clara",
    "State/Province": "US-CA"
  },
  {
    "Location": "Port Aransas",
    "Date": "04-14-2004",
    "Scientific Name": "Leucophaeus atricilla",
    "Common Name": "Laughing Gull",
    "Filename": "2004-04-14-laugul.jpg",
    "County": "Nueces",
    "State/Province": "US-TX"
  },
  {
    "Location": "Port Aransas",
    "Date": "04-14-2004",
    "Scientific Name": "Quiscalus mexicanus",
    "Common Name": "Great-tailed Grackle",
    "Filename": "2004-04-14-grtgra.jpg",
    "County": "Nueces",
    "State/Province": "US-TX"
  },
  {
    "Location": "Port Aransas",
    "Date": "04-14-2004",
    "Scientific Name": "Setophaga virens",
    "Common Name": "Black-throated Green Warbler",
    "Filename": "2004-04-14-btnwar.jpg",
    "County": "Nueces",
    "State/Province": "US-TX"
  },
  {
    "Location": "Port Aransas",
    "Date": "04-14-2004",
    "Scientific Name": "Bubulcus ibis",
    "Common Name": "Cattle Egret",
    "Filename": "2004-04-14-categr.jpg",
    "County": "Nueces",
    "State/Province": "US-TX"
  },
  {
    "Location": "Port Aransas",
    "Date": "04-14-2004",
    "Scientific Name": "Dendrocygna autumnalis",
    "Common Name": "Black-bellied Whistling-Duck",
    "Filename": "2004-04-14-bbwduc.jpg",
    "County": "Nueces",
    "State/Province": "US-TX"
  },
  {
    "Location": "Port Aransas",
    "Date": "04-14-2004",
    "Scientific Name": "Thalasseus sandvicensis",
    "Common Name": "Sandwich Tern",
    "Filename": "2004-04-14-santer.jpg",
    "County": "Nueces",
    "State/Province": "US-TX"
  },
  {
    "Location": "Port Aransas",
    "Date": "04-14-2004",
    "Scientific Name": "Thalasseus maximus",
    "Common Name": "Royal Tern",
    "Filename": "2004-04-14-royter.jpg",
    "County": "Nueces",
    "State/Province": "US-TX"
  },
  {
    "Location": "Port Aransas",
    "Date": "04-14-2004",
    "Scientific Name": "Rynchops niger",
    "Common Name": "Black Skimmer",
    "Filename": "2004-04-14-blkski.jpg",
    "County": "Nueces",
    "State/Province": "US-TX"
  },
  {
    "Location": "Port Aransas",
    "Date": "04-14-2004",
    "Scientific Name": "Falco peregrinus",
    "Common Name": "Peregrine Falcon",
    "Filename": "2004-04-14-perfal.jpg",
    "County": "Nueces",
    "State/Province": "US-TX"
  },
  {
    "Location": "Port Aransas",
    "Date": "04-14-2004",
    "Scientific Name": "Grus americana",
    "Common Name": "Whooping Crane",
    "Filename": "2004-04-14-whocra.jpg",
    "County": "Nueces",
    "State/Province": "US-TX"
  },
  {
    "Location": "Port Aransas",
    "Date": "04-14-2004",
    "Scientific Name": "Haematopus palliatus",
    "Common Name": "American Oystercatcher",
    "Filename": "2004-04-14-ameoys.jpg",
    "County": "Nueces",
    "State/Province": "US-TX"
  },
  {
    "Location": "Port Aransas",
    "Date": "04-14-2004",
    "Scientific Name": "Ardea herodias",
    "Common Name": "Great Blue Heron",
    "Filename": "2004-04-14-grbher.jpg",
    "County": "Nueces",
    "State/Province": "US-TX"
  },
  {
    "Location": "Port Aransas",
    "Date": "04-14-2004",
    "Scientific Name": "Dendrocygna bicolor",
    "Common Name": "Fulvous Whistling-Duck",
    "Filename": "2004-04-14-fuwduc.jpg",
    "County": "Nueces",
    "State/Province": "US-TX"
  },
  {
    "Location": "Corpus Christi",
    "Date": "04-15-2004",
    "Scientific Name": "Egretta rufescens",
    "Common Name": "Reddish Egret",
    "Filename": "2004-04-15-redegr.jpg",
    "County": "Nueces",
    "State/Province": "US-TX"
  },
  {
    "Location": "Corpus Christi",
    "Date": "04-15-2004",
    "Scientific Name": "Mimus polyglottos",
    "Common Name": "Northern Mockingbird",
    "Filename": "2004-04-15-normoc.jpg",
    "County": "Nueces",
    "State/Province": "US-TX"
  },
  {
    "Location": "Corpus Christi",
    "Date": "04-15-2004",
    "Scientific Name": "Passerina cyanea",
    "Common Name": "Indigo Bunting",
    "Filename": "2004-04-15-indbun.jpg",
    "County": "Nueces",
    "State/Province": "US-TX"
  },
  {
    "Location": "Corpus Christi",
    "Date": "04-15-2004",
    "Scientific Name": "Chordeiles minor",
    "Common Name": "Common Nighthawk",
    "Filename": "2004-04-15-comnig.jpg",
    "County": "Nueces",
    "State/Province": "US-TX"
  },
  {
    "Location": "Corpus Christi",
    "Date": "04-15-2004",
    "Scientific Name": "Tyrannus verticalis",
    "Common Name": "Western Kingbird",
    "Filename": "2004-04-15-weskin.jpg",
    "County": "Nueces",
    "State/Province": "US-TX"
  },
  {
    "Location": "Corpus Christi",
    "Date": "04-15-2004",
    "Scientific Name": "Tyrannus tyrannus",
    "Common Name": "Eastern Kingbird",
    "Filename": "2004-04-15-easkin.jpg",
    "County": "Nueces",
    "State/Province": "US-TX"
  },
  {
    "Location": "Corpus Christi",
    "Date": "04-15-2004",
    "Scientific Name": "Arenaria interpres",
    "Common Name": "Ruddy Turnstone",
    "Filename": "2004-04-15-rudtur.jpg",
    "County": "Nueces",
    "State/Province": "US-TX"
  },
  {
    "Location": "Sabal Palm Audubon Sanctuary",
    "Date": "04-17-2004",
    "Scientific Name": "Ortalis vetula",
    "Common Name": "Plain Chachalaca",
    "Filename": "2004-04-17-placha.jpg",
    "County": "Cameron",
    "State/Province": "US-TX"
  },
  {
    "Location": "Sabal Palm Audubon Sanctuary",
    "Date": "04-17-2004",
    "Scientific Name": "Molothrus aeneus",
    "Common Name": "Bronzed Cowbird",
    "Filename": "2004-04-17-brocow.jpg",
    "County": "Cameron",
    "State/Province": "US-TX"
  },
  {
    "Location": "Sabal Palm Audubon Sanctuary",
    "Date": "04-17-2004",
    "Scientific Name": "Cyanocorax yncas",
    "Common Name": "Green Jay",
    "Filename": "2004-04-17-grnjay.jpg",
    "County": "Cameron",
    "State/Province": "US-TX"
  },
  {
    "Location": "Sabal Palm Audubon Sanctuary",
    "Date": "04-17-2004",
    "Scientific Name": "Phalacrocorax brasilianus",
    "Common Name": "Neotropic Cormorant",
    "Filename": "2004-04-17-neocor.jpg",
    "County": "Cameron",
    "State/Province": "US-TX"
  },
  {
    "Location": "Sabal Palm Audubon Sanctuary",
    "Date": "04-17-2004",
    "Scientific Name": "Anas discors",
    "Common Name": "Blue-winged Teal",
    "Filename": "2004-04-17-buwtea.jpg",
    "County": "Cameron",
    "State/Province": "US-TX"
  },
  {
    "Location": "Brownsville",
    "Date": "04-17-2004",
    "Scientific Name": "Gallinula galeata",
    "Common Name": "Common Gallinule",
    "Filename": "2004-04-17-comgal.jpg",
    "County": "Cameron",
    "State/Province": "US-TX"
  },
  {
    "Location": "Sabal Palm Audubon Sanctuary",
    "Date": "04-17-2004",
    "Scientific Name": "Megaceryle torquata",
    "Common Name": "Ringed Kingfisher",
    "Filename": "2004-04-17-rinkin.jpg",
    "County": "Cameron",
    "State/Province": "US-TX"
  },
  {
    "Location": "Sabal Palm Audubon Sanctuary",
    "Date": "04-17-2004",
    "Scientific Name": "Leptotila verreauxi",
    "Common Name": "White-tipped Dove",
    "Filename": "2004-04-17-whtdov.jpg",
    "County": "Cameron",
    "State/Province": "US-TX"
  },
  {
    "Location": "Brownsville",
    "Date": "04-17-2004",
    "Scientific Name": "Pitangus sulphuratus",
    "Common Name": "Great Kiskadee",
    "Filename": "2004-04-17-grekis.jpg",
    "County": "Cameron",
    "State/Province": "US-TX"
  },
  {
    "Location": "Sabal Palm Audubon Sanctuary",
    "Date": "04-17-2004",
    "Scientific Name": "Toxostoma longirostre",
    "Common Name": "Long-billed Thrasher",
    "Filename": "2004-04-17-lobthr.jpg",
    "County": "Cameron",
    "State/Province": "US-TX"
  },
  {
    "Location": "Sabal Palm Audubon Sanctuary",
    "Date": "04-17-2004",
    "Scientific Name": "Zenaida asiatica",
    "Common Name": "White-winged Dove",
    "Filename": "2004-04-17-whwdov.jpg",
    "County": "Cameron",
    "State/Province": "US-TX"
  },
  {
    "Location": "Brownsville",
    "Date": "04-17-2004",
    "Scientific Name": "Rallus crepitans",
    "Common Name": "Clapper Rail",
    "Filename": "2004-04-17-clarai.jpg",
    "County": "Cameron",
    "State/Province": "US-TX"
  },
  {
    "Location": "Brownsville",
    "Date": "04-17-2004",
    "Scientific Name": "Egretta tricolor",
    "Common Name": "Tricolored Heron",
    "Filename": "2004-04-17-triher.jpg",
    "County": "Cameron",
    "State/Province": "US-TX"
  },
  {
    "Location": "Brownsville",
    "Date": "04-17-2004",
    "Scientific Name": "Charadrius semipalmatus",
    "Common Name": "Semipalmated Plover",
    "Filename": "2004-04-17-semplo.jpg",
    "County": "Cameron",
    "State/Province": "US-TX"
  },
  {
    "Location": "Brownsville",
    "Date": "04-17-2004",
    "Scientific Name": "Pluvialis squatarola",
    "Common Name": "Black-bellied Plover",
    "Filename": "2004-04-17-bkbplo.jpg",
    "County": "Cameron",
    "State/Province": "US-TX"
  },
  {
    "Location": "Brownsville",
    "Date": "04-17-2004",
    "Scientific Name": "Amazilia yucatanensis",
    "Common Name": "Buff-bellied Hummingbird",
    "Filename": "2004-04-17-bubhum.jpg",
    "County": "Cameron",
    "State/Province": "US-TX"
  },
  {
    "Location": "Brownsville",
    "Date": "04-17-2004",
    "Scientific Name": "Tyrannus couchii",
    "Common Name": "Couch's Kingbird",
    "Filename": "2004-04-17-coukin.jpg",
    "County": "Cameron",
    "State/Province": "US-TX"
  },
  {
    "Location": "Brownsville",
    "Date": "04-17-2004",
    "Scientific Name": "Ixobrychus exilis",
    "Common Name": "Least Bittern",
    "Filename": "2004-04-17-leabit.jpg",
    "County": "Cameron",
    "State/Province": "US-TX"
  },
  {
    "Location": "Brownsville",
    "Date": "04-17-2004",
    "Scientific Name": "Tringa solitaria",
    "Common Name": "Solitary Sandpiper",
    "Filename": "2004-04-17-solsan.jpg",
    "County": "Cameron",
    "State/Province": "US-TX"
  },
  {
    "Location": "Brownsville",
    "Date": "04-17-2004",
    "Scientific Name": "Limnodromus scolopaceus",
    "Common Name": "Long-billed Dowitcher",
    "Filename": "2004-04-17-lobdow.jpg",
    "County": "Cameron",
    "State/Province": "US-TX"
  },
  {
    "Location": "Sabal Palm Audubon Sanctuary",
    "Date": "04-17-2004",
    "Scientific Name": "Melanerpes aurifrons",
    "Common Name": "Golden-fronted Woodpecker",
    "Filename": "2004-04-17-gofwoo.jpg",
    "County": "Cameron",
    "State/Province": "US-TX"
  },
  {
    "Location": "Port Aransas",
    "Date": "04-16-2004",
    "Scientific Name": "Buteo swainsoni",
    "Common Name": "Swainson's Hawk",
    "Filename": "2004-04-16-swahaw.jpg",
    "County": "Nueces",
    "State/Province": "US-TX"
  },
  {
    "Location": "Laredo",
    "Date": "04-19-2004",
    "Scientific Name": "Arremonops rufivirgatus",
    "Common Name": "Olive Sparrow",
    "Filename": "2004-04-19-olispa.jpg",
    "County": "Webb",
    "State/Province": "US-TX"
  },
  {
    "Location": "McAllen",
    "Date": "04-18-2004",
    "Scientific Name": "Porphyrio martinicus",
    "Common Name": "Purple Gallinule",
    "Filename": "2004-04-18-purgal.jpg",
    "County": "Hidalgo",
    "State/Province": "US-TX"
  },
  {
    "Location": "McAllen",
    "Date": "04-18-2004",
    "Scientific Name": "Buteo plagiatus",
    "Common Name": "Gray Hawk",
    "Filename": "2004-04-18-gryhaw.jpg",
    "County": "Hidalgo",
    "State/Province": "US-TX"
  },
  {
    "Location": "McAllen",
    "Date": "04-18-2004",
    "Scientific Name": "Amazona albifrons",
    "Common Name": "White-fronted Parrot",
    "Filename": "2004-04-18-whfpar.jpg",
    "County": "Hidalgo",
    "State/Province": "US-TX"
  },
  {
    "Location": "McAllen",
    "Date": "04-18-2004",
    "Scientific Name": "Chordeiles acutipennis",
    "Common Name": "Lesser Nighthawk",
    "Filename": "2004-04-18-lesnig.jpg",
    "County": "Hidalgo",
    "State/Province": "US-TX"
  },
  {
    "Location": "McAllen",
    "Date": "04-18-2004",
    "Scientific Name": "Turdus grayi",
    "Common Name": "Clay-colored Thrush",
    "Filename": "2004-04-18-clcrob.jpg",
    "County": "Hidalgo",
    "State/Province": "US-TX"
  },
  {
    "Location": "Laredo",
    "Date": "04-19-2004",
    "Scientific Name": "Tyrannus forficatus",
    "Common Name": "Scissor-tailed Flycatcher",
    "Filename": "2004-04-19-sctfly.jpg",
    "County": "Webb",
    "State/Province": "US-TX"
  },
  {
    "Location": "Laredo",
    "Date": "04-19-2004",
    "Scientific Name": "Columbina inca",
    "Common Name": "Inca Dove",
    "Filename": "2004-04-19-incdov.jpg",
    "County": "Webb",
    "State/Province": "US-TX"
  },
  {
    "Location": "Leakey",
    "Date": "04-20-2004",
    "Scientific Name": "Chondestes grammacus",
    "Common Name": "Lark Sparrow",
    "Filename": "2004-04-20-larspa.jpg",
    "County": "Real",
    "State/Province": "US-TX"
  },
  {
    "Location": "Laredo",
    "Date": "04-19-2004",
    "Scientific Name": "Campylorhynchus brunneicapillus",
    "Common Name": "Cactus Wren",
    "Filename": "2004-04-19-cacwre.jpg",
    "County": "Webb",
    "State/Province": "US-TX"
  },
  {
    "Location": "Laredo",
    "Date": "04-19-2004",
    "Scientific Name": "Pyrocephalus rubinus",
    "Common Name": "Vermilion Flycatcher",
    "Filename": "2004-04-19-verfly.jpg",
    "County": "Webb",
    "State/Province": "US-TX"
  },
  {
    "Location": "Leakey",
    "Date": "04-20-2004",
    "Scientific Name": "Pluvialis dominica",
    "Common Name": "American Golden-Plover",
    "Filename": "2004-04-20-amgplo.jpg",
    "County": "Real",
    "State/Province": "US-TX"
  },
  {
    "Location": "Leakey",
    "Date": "04-20-2004",
    "Scientific Name": "Meleagris gallopavo",
    "Common Name": "Wild Turkey",
    "Filename": "2004-04-20-wiltur.jpg",
    "County": "Real",
    "State/Province": "US-TX"
  },
  {
    "Location": "Leakey",
    "Date": "04-20-2004",
    "Scientific Name": "Spizella passerina",
    "Common Name": "Chipping Sparrow",
    "Filename": "2004-04-20-chispa.jpg",
    "County": "Real",
    "State/Province": "US-TX"
  },
  {
    "Location": "Leakey",
    "Date": "04-20-2004",
    "Scientific Name": "Cardinalis cardinalis",
    "Common Name": "Northern Cardinal",
    "Filename": "2004-04-20-norcar.jpg",
    "County": "Real",
    "State/Province": "US-TX"
  },
  {
    "Location": "Leakey",
    "Date": "04-20-2004",
    "Scientific Name": "Vireo griseus",
    "Common Name": "White-eyed Vireo",
    "Filename": "2004-04-20-whevir.jpg",
    "County": "Real",
    "State/Province": "US-TX"
  },
  {
    "Location": "Leakey",
    "Date": "04-20-2004",
    "Scientific Name": "Setophaga chrysoparia",
    "Common Name": "Golden-cheeked Warbler",
    "Filename": "2004-04-20-gchwar.jpg",
    "County": "Real",
    "State/Province": "US-TX"
  },
  {
    "Location": "Leakey",
    "Date": "04-20-2004",
    "Scientific Name": "Passerina amoena",
    "Common Name": "Lazuli Bunting",
    "Filename": "2004-04-20-lazbun.jpg",
    "County": "Real",
    "State/Province": "US-TX"
  },
  {
    "Location": "Leakey",
    "Date": "04-20-2004",
    "Scientific Name": "Piranga rubra",
    "Common Name": "Summer Tanager",
    "Filename": "2004-04-20-sumtan.jpg",
    "County": "Real",
    "State/Province": "US-TX"
  },
  {
    "Location": "Leakey",
    "Date": "04-20-2004",
    "Scientific Name": "Archilochus alexandri",
    "Common Name": "Black-chinned Hummingbird",
    "Filename": "2004-04-20-bkchum.jpg",
    "County": "Real",
    "State/Province": "US-TX"
  },
  {
    "Location": "Leakey",
    "Date": "04-21-2004",
    "Scientific Name": "Cathartes aura",
    "Common Name": "Turkey Vulture",
    "Filename": "2004-04-21-turvul.jpg",
    "County": "Real",
    "State/Province": "US-TX"
  },
  {
    "Location": "Leakey",
    "Date": "04-21-2004",
    "Scientific Name": "Coragyps atratus",
    "Common Name": "Black Vulture",
    "Filename": "2004-04-21-blkvul.jpg",
    "County": "Real",
    "State/Province": "US-TX"
  },
  {
    "Location": "Leakey",
    "Date": "04-21-2004",
    "Scientific Name": "Buteo albonotatus",
    "Common Name": "Zone-tailed Hawk",
    "Filename": "2004-04-21-zothaw.jpg",
    "County": "Real",
    "State/Province": "US-TX"
  },
  {
    "Location": "Leakey",
    "Date": "04-21-2004",
    "Scientific Name": "Aphelocoma woodhouseii",
    "Common Name": "Woodhouse's Scrub-Jay",
    "Filename": "2004-04-21-wesjay.jpg",
    "County": "Real",
    "State/Province": "US-TX"
  },
  {
    "Location": "Leakey",
    "Date": "04-22-2004",
    "Scientific Name": "Catherpes mexicanus",
    "Common Name": "Canyon Wren",
    "Filename": "2004-04-22-canwre.jpg",
    "County": "Real",
    "State/Province": "US-TX"
  },
  {
    "Location": "Mount Hamilton",
    "Date": "01-10-2004",
    "Scientific Name": "Poecile rufescens",
    "Common Name": "Chestnut-backed Chickadee",
    "Filename": "2004-01-10-chbchi.jpg",
    "County": "Santa Clara",
    "State/Province": "US-CA"
  },
  {
    "Location": "Charleston Slough",
    "Date": "11-29-2003",
    "Scientific Name": "Circus cyaneus",
    "Common Name": "Northern Harrier",
    "Filename": "2003-11-29-norhar.jpg",
    "County": "Santa Clara",
    "State/Province": "US-CA"
  },
  {
    "Location": "Our House",
    "Date": "10-10-2003",
    "Scientific Name": "Zenaida macroura",
    "Common Name": "Mourning Dove",
    "Filename": "2003-10-10-moudov.jpg",
    "County": "Santa Clara",
    "State/Province": "US-CA"
  },
  {
    "Location": "Our House",
    "Date": "10-10-2003",
    "Scientific Name": "Columba livia (Feral Pigeon)",
    "Common Name": "Rock Pigeon (Feral Pigeon)",
    "Filename": "2003-10-10-rocdov.jpg",
    "County": "Santa Clara",
    "State/Province": "US-CA"
  },
  {
    "Location": "Rancho San Antonio",
    "Date": "11-02-2003",
    "Scientific Name": "Picoides nuttallii",
    "Common Name": "Nuttall's Woodpecker",
    "Filename": "2003-11-02-nutwoo.jpg",
    "County": "Santa Clara",
    "State/Province": "US-CA"
  },
  {
    "Location": "Rancho San Antonio",
    "Date": "11-02-2003",
    "Scientific Name": "Melanerpes formicivorus",
    "Common Name": "Acorn Woodpecker",
    "Filename": "2003-11-02-acowoo.jpg",
    "County": "Santa Clara",
    "State/Province": "US-CA"
  },
  {
    "Location": "Charleston Slough",
    "Date": "03-05-2004",
    "Scientific Name": "Calypte anna",
    "Common Name": "Anna's Hummingbird",
    "Filename": "2004-03-05-annhum.jpg",
    "County": "Santa Clara",
    "State/Province": "US-CA"
  },
  {
    "Location": "Charleston Slough",
    "Date": "03-05-2004",
    "Scientific Name": "Sturnella neglecta",
    "Common Name": "Western Meadowlark",
    "Filename": "2004-03-05-wesmea.jpg",
    "County": "Santa Clara",
    "State/Province": "US-CA"
  },
  {
    "Location": "Shoreline Lake",
    "Date": "03-05-2004",
    "Scientific Name": "Bucephala clangula",
    "Common Name": "Common Goldeneye",
    "Filename": "2004-03-05-comgol.jpg",
    "County": "Santa Clara",
    "State/Province": "US-CA"
  },
  {
    "Location": "Palo Alto Duck Pond",
    "Date": "04-30-2004",
    "Scientific Name": "Nycticorax nycticorax",
    "Common Name": "Black-crowned Night-Heron",
    "Filename": "2004-04-30-bcnher.jpg",
    "County": "Santa Clara",
    "State/Province": "US-CA"
  },
  {
    "Location": "Mount Hamilton",
    "Date": "05-15-2004",
    "Scientific Name": "Spinus lawrencei",
    "Common Name": "Lawrence's Goldfinch",
    "Filename": "2004-05-15-lawgol.jpg",
    "County": "Santa Clara",
    "State/Province": "US-CA"
  },
  {
    "Location": "Mount Hamilton",
    "Date": "05-15-2004",
    "Scientific Name": "Empidonax difficilis",
    "Common Name": "Pacific-slope Flycatcher",
    "Filename": "2004-05-15-pasfly.jpg",
    "County": "Santa Clara",
    "State/Province": "US-CA"
  },
  {
    "Location": "Grant Ranch County Park",
    "Date": "05-15-2004",
    "Scientific Name": "Hydroprogne caspia",
    "Common Name": "Caspian Tern",
    "Filename": "2004-05-15-caster.jpg",
    "County": "Santa Clara",
    "State/Province": "US-CA"
  },
  {
    "Location": "Mount Hamilton",
    "Date": "05-15-2004",
    "Scientific Name": "Troglodytes aedon",
    "Common Name": "House Wren",
    "Filename": "2004-05-15-houwre.jpg",
    "County": "Santa Clara",
    "State/Province": "US-CA"
  },
  {
    "Location": "San Francisco Zoo",
    "Date": "05-08-2004",
    "Scientific Name": "Passer domesticus",
    "Common Name": "House Sparrow",
    "Filename": "2004-05-08-houspa.jpg",
    "County": "San Francisco",
    "State/Province": "US-CA"
  },
  {
    "Location": "Palo Alto Duck Pond",
    "Date": "05-23-2004",
    "Scientific Name": "Himantopus mexicanus",
    "Common Name": "Black-necked Stilt",
    "Filename": "2004-05-23-bknsti.jpg",
    "County": "Santa Clara",
    "State/Province": "US-CA"
  },
  {
    "Location": "Palo Alto Duck Pond",
    "Date": "05-23-2004",
    "Scientific Name": "Nycticorax nycticorax",
    "Common Name": "Black-crowned Night-Heron",
    "Filename": "2004-05-23-bcnher-crw_8756.jpg",
    "County": "Santa Clara",
    "State/Province": "US-CA"
  },
  {
    "Location": "Palo Alto Duck Pond",
    "Date": "05-23-2004",
    "Scientific Name": "Recurvirostra americana",
    "Common Name": "American Avocet",
    "Filename": "2004-05-23-ameavo.jpg",
    "County": "Santa Clara",
    "State/Province": "US-CA"
  },
  {
    "Location": "Palo Alto Duck Pond",
    "Date": "05-23-2004",
    "Scientific Name": "Euphagus cyanocephalus",
    "Common Name": "Brewer's Blackbird",
    "Filename": "2004-05-23-brebla.jpg",
    "County": "Santa Clara",
    "State/Province": "US-CA"
  },
  {
    "Location": "Palo Alto Duck Pond",
    "Date": "05-23-2004",
    "Scientific Name": "Circus cyaneus",
    "Common Name": "Northern Harrier",
    "Filename": "2004-05-23-norhar.jpg",
    "County": "Santa Clara",
    "State/Province": "US-CA"
  },
  {
    "Location": "Foster City Radio Tower",
    "Date": "05-25-2004",
    "Scientific Name": "Anas acuta",
    "Common Name": "Northern Pintail",
    "Filename": "2004-05-25-norpin.jpg",
    "County": "San Mateo",
    "State/Province": "US-CA"
  },
  {
    "Location": "Foster City Radio Tower",
    "Date": "05-25-2004",
    "Scientific Name": "Sterna forsteri",
    "Common Name": "Forster's Tern",
    "Filename": "2004-05-25-forter.jpg",
    "County": "San Mateo",
    "State/Province": "US-CA"
  },
  {
    "Location": "Foster City Radio Tower",
    "Date": "05-25-2004",
    "Scientific Name": "Haemorhous mexicanus",
    "Common Name": "House Finch",
    "Filename": "2004-05-25-houfin.jpg",
    "County": "San Mateo",
    "State/Province": "US-CA"
  },
  {
    "Location": "Charleston Slough",
    "Date": "05-25-2004",
    "Scientific Name": "Mimus polyglottos",
    "Common Name": "Northern Mockingbird",
    "Filename": "2004-05-25-normoc.jpg",
    "County": "Santa Clara",
    "State/Province": "US-CA"
  },
  {
    "Location": "Foster City Radio Tower",
    "Date": "05-25-2004",
    "Scientific Name": "Pelecanus erythrorhynchos",
    "Common Name": "American White Pelican",
    "Filename": "2004-05-25-amwpel.jpg",
    "County": "San Mateo",
    "State/Province": "US-CA"
  },
  {
    "Location": "Sunnyvale Baylands",
    "Date": "05-19-2004",
    "Scientific Name": "Agelaius phoeniceus",
    "Common Name": "Red-winged Blackbird",
    "Filename": "2004-05-19-rewbla.jpg",
    "County": "Santa Clara",
    "State/Province": "US-CA"
  },
  {
    "Location": "San Francisco Zoo",
    "Date": "05-08-2004",
    "Scientific Name": "Larus occidentalis",
    "Common Name": "Western Gull",
    "Filename": "2004-05-08-wesgul.jpg",
    "County": "San Francisco",
    "State/Province": "US-CA"
  },
  {
    "Location": "Mount Hamilton",
    "Date": "05-15-2004",
    "Scientific Name": "Contopus cooperi",
    "Common Name": "Olive-sided Flycatcher",
    "Filename": "2004-05-15-olsfly.jpg",
    "County": "Santa Clara",
    "State/Province": "US-CA"
  },
  {
    "Location": "Downtown Palo Alto",
    "Date": "03-16-2004",
    "Scientific Name": "Picoides pubescens",
    "Common Name": "Downy Woodpecker",
    "Filename": "2004-03-16-dowwoo.jpg",
    "County": "Santa Clara",
    "State/Province": "US-CA"
  },
  {
    "Location": "Lithia Park",
    "Date": "06-05-2004",
    "Scientific Name": "Turdus migratorius",
    "Common Name": "American Robin",
    "Filename": "2004-06-05-amerob.jpg",
    "County": "Jackson",
    "State/Province": "US-OR"
  },
  {
    "Location": "Lithia Park",
    "Date": "06-05-2004",
    "Scientific Name": "Sturnus vulgaris",
    "Common Name": "European Starling",
    "Filename": "2004-06-05-eursta.jpg",
    "County": "Jackson",
    "State/Province": "US-OR"
  },
  {
    "Location": "Merced NWR",
    "Date": "01-19-2004",
    "Scientific Name": "Buteo jamaicensis",
    "Common Name": "Red-tailed Hawk",
    "Filename": "2004-01-19-rethaw.jpg",
    "County": "Merced",
    "State/Province": "US-CA"
  },
  {
    "Location": "Palo Alto Duck Pond",
    "Date": "05-22-2004",
    "Scientific Name": "Fulica americana",
    "Common Name": "American Coot",
    "Filename": "2004-05-22-amecoo.jpg",
    "County": "Santa Clara",
    "State/Province": "US-CA"
  },
  {
    "Location": "Rural Areas of San Mateo County",
    "Date": "06-12-2004",
    "Scientific Name": "Pelecanus occidentalis",
    "Common Name": "Brown Pelican",
    "Filename": "2004-06-12-brnpel.jpg",
    "County": "San Mateo",
    "State/Province": "US-CA"
  },
  {
    "Location": "Rural Areas of San Mateo County",
    "Date": "06-12-2004",
    "Scientific Name": "Phalacrocorax auritus",
    "Common Name": "Double-crested Cormorant",
    "Filename": "2004-06-12-doccor.jpg",
    "County": "San Mateo",
    "State/Province": "US-CA"
  },
  {
    "Location": "Rural Areas of San Mateo County",
    "Date": "06-12-2004",
    "Scientific Name": "Larus occidentalis",
    "Common Name": "Western Gull",
    "Filename": "2004-06-12-wesgul.jpg",
    "County": "San Mateo",
    "State/Province": "US-CA"
  },
  {
    "Location": "Donald M. Somers Water Pollution Control Plant",
    "Date": "12-13-2003",
    "Scientific Name": "Oreoscoptes montanus",
    "Common Name": "Sage Thrasher",
    "Filename": "2003-12-13-sagthr.jpg",
    "County": "Santa Clara",
    "State/Province": "US-CA"
  },
  {
    "Location": "Palo Alto Duck Pond",
    "Date": "04-30-2004",
    "Scientific Name": "Egretta thula",
    "Common Name": "Snowy Egret",
    "Filename": "2004-04-30-snoegr.jpg",
    "County": "Santa Clara",
    "State/Province": "US-CA"
  },
  {
    "Location": "Reactivity",
    "Date": "01-13-2004",
    "Scientific Name": "Elanus leucurus",
    "Common Name": "White-tailed Kite",
    "Filename": "2004-01-13-whtkit.jpg",
    "County": "San Mateo",
    "State/Province": "US-CA"
  },
  {
    "Location": "Palo Alto Duck Pond",
    "Date": "04-30-2004",
    "Scientific Name": "Anas strepera",
    "Common Name": "Gadwall",
    "Filename": "2004-04-30-gadwal.jpg",
    "County": "Santa Clara",
    "State/Province": "US-CA"
  },
  {
    "Location": "Charleston Slough",
    "Date": "06-27-2004",
    "Scientific Name": "Podilymbus podiceps",
    "Common Name": "Pied-billed Grebe",
    "Filename": "2004-06-27-pibgre.jpg",
    "County": "Santa Clara",
    "State/Province": "US-CA"
  },
  {
    "Location": "Stanford University",
    "Date": "06-28-2004",
    "Scientific Name": "Spinus tristis",
    "Common Name": "American Goldfinch",
    "Filename": "2004-06-28-amegfi.jpg",
    "County": "Santa Clara",
    "State/Province": "US-CA"
  },
  {
    "Location": "Pt. Reyes National Seashore",
    "Date": "07-05-2004",
    "Scientific Name": "Cathartes aura",
    "Common Name": "Turkey Vulture",
    "Filename": "2004-07-05-turvul.jpg",
    "County": "Marin",
    "State/Province": "US-CA"
  },
  {
    "Location": "Pt. Reyes National Seashore",
    "Date": "07-05-2004",
    "Scientific Name": "Callipepla californica",
    "Common Name": "California Quail",
    "Filename": "2004-07-05-calqua.jpg",
    "County": "Marin",
    "State/Province": "US-CA"
  },
  {
    "Location": "Pt. Reyes National Seashore",
    "Date": "07-05-2004",
    "Scientific Name": "Cepphus columba",
    "Common Name": "Pigeon Guillemot",
    "Filename": "2004-07-05-piggui.jpg",
    "County": "Marin",
    "State/Province": "US-CA"
  },
  {
    "Location": "Pt. Reyes National Seashore",
    "Date": "07-05-2004",
    "Scientific Name": "Cardellina pusilla",
    "Common Name": "Wilson's Warbler",
    "Filename": "2004-07-05-wlswar.jpg",
    "County": "Marin",
    "State/Province": "US-CA"
  },
  {
    "Location": "Pt. Reyes National Seashore",
    "Date": "07-05-2004",
    "Scientific Name": "Passerculus sandwichensis",
    "Common Name": "Savannah Sparrow",
    "Filename": "2004-07-05-savspa.jpg",
    "County": "Marin",
    "State/Province": "US-CA"
  },
  {
    "Location": "Pt. Reyes National Seashore",
    "Date": "09-04-2004",
    "Scientific Name": "Empidonax traillii",
    "Common Name": "Willow Flycatcher",
    "Filename": "2004-09-04-wilfly.jpg",
    "County": "Marin",
    "State/Province": "US-CA"
  },
  {
    "Location": "Pt. Reyes National Seashore",
    "Date": "09-04-2004",
    "Scientific Name": "Sitta canadensis",
    "Common Name": "Red-breasted Nuthatch",
    "Filename": "2004-09-04-rebnut.jpg",
    "County": "Marin",
    "State/Province": "US-CA"
  },
  {
    "Location": "Pt. Reyes National Seashore",
    "Date": "09-04-2004",
    "Scientific Name": "Setophaga occidentalis",
    "Common Name": "Hermit Warbler",
    "Filename": "2004-09-04-herwar.jpg",
    "County": "Marin",
    "State/Province": "US-CA"
  },
  {
    "Location": "Coyote Creek Field Station",
    "Date": "09-06-2004",
    "Scientific Name": "Falco peregrinus",
    "Common Name": "Peregrine Falcon",
    "Filename": "2004-09-06-perfal.jpg",
    "County": "Santa Clara",
    "State/Province": "US-CA"
  },
  {
    "Location": "Picchetti Ranch",
    "Date": "09-05-2004",
    "Scientific Name": "Junco hyemalis",
    "Common Name": "Dark-eyed Junco",
    "Filename": "2004-09-05-daejun.jpg",
    "County": "Santa Clara",
    "State/Province": "US-CA"
  },
  {
    "Location": "Don Edwards Center",
    "Date": "09-06-2004",
    "Scientific Name": "Phalaropus tricolor",
    "Common Name": "Wilson's Phalarope",
    "Filename": "2004-09-06-wilpha.jpg",
    "County": "Santa Clara",
    "State/Province": "US-CA"
  },
  {
    "Location": "Rural Areas of San Benito County",
    "Date": "09-18-2004",
    "Scientific Name": "Pica nuttalli",
    "Common Name": "Yellow-billed Magpie",
    "Filename": "2004-09-18-yebmag.jpg",
    "County": "San Benito",
    "State/Province": "US-CA"
  },
  {
    "Location": "Rural Areas of San Benito County",
    "Date": "09-18-2004",
    "Scientific Name": "Selasphorus rufus",
    "Common Name": "Rufous Hummingbird",
    "Filename": "2004-09-18-rufhum.jpg",
    "County": "San Benito",
    "State/Province": "US-CA"
  },
  {
    "Location": "Charleston Slough",
    "Date": "09-10-2004",
    "Scientific Name": "Limosa fedoa",
    "Common Name": "Marbled Godwit",
    "Filename": "2004-09-10-margod.jpg",
    "County": "Santa Clara",
    "State/Province": "US-CA"
  },
  {
    "Location": "Palo Alto Duck Pond",
    "Date": "07-20-2004",
    "Scientific Name": "Accipiter cooperii",
    "Common Name": "Cooper's Hawk",
    "Filename": "2004-07-20-coohaw.jpg",
    "County": "Santa Clara",
    "State/Province": "US-CA"
  },
  {
    "Location": "Santa Cruz",
    "Date": "09-25-2004",
    "Scientific Name": "Arenaria melanocephala",
    "Common Name": "Black Turnstone",
    "Filename": "2004-09-25-blktur.jpg",
    "County": "Santa Cruz",
    "State/Province": "US-CA"
  },
  {
    "Location": "Santa Cruz",
    "Date": "09-25-2004",
    "Scientific Name": "Phalaropus lobatus",
    "Common Name": "Red-necked Phalarope",
    "Filename": "2004-09-25-renpha.jpg",
    "County": "Santa Cruz",
    "State/Province": "US-CA"
  },
  {
    "Location": "Starbucks Pond",
    "Date": "10-04-2004",
    "Scientific Name": "Egretta thula",
    "Common Name": "Snowy Egret",
    "Filename": "2004-10-04-snoegr.jpg",
    "County": "San Mateo",
    "State/Province": "US-CA"
  },
  {
    "Location": "Starbucks Pond",
    "Date": "10-04-2004",
    "Scientific Name": "Phalacrocorax auritus",
    "Common Name": "Double-crested Cormorant",
    "Filename": "2004-10-04-doccor.jpg",
    "County": "San Mateo",
    "State/Province": "US-CA"
  },
  {
    "Location": "Charleston Slough",
    "Date": "10-09-2004",
    "Scientific Name": "Egretta thula",
    "Common Name": "Snowy Egret",
    "Filename": "2004-10-09-snoegr.jpg",
    "County": "Santa Clara",
    "State/Province": "US-CA"
  },
  {
    "Location": "Rural Areas of San Mateo County",
    "Date": "10-10-2004",
    "Scientific Name": "Calamospiza melanocorys",
    "Common Name": "Lark Bunting",
    "Filename": "2004-10-10-larbun.jpg",
    "County": "San Mateo",
    "State/Province": "US-CA"
  },
  {
    "Location": "Rural Areas of San Mateo County",
    "Date": "10-10-2004",
    "Scientific Name": "Anas strepera",
    "Common Name": "Gadwall",
    "Filename": "2004-10-10-gadwal.jpg",
    "County": "San Mateo",
    "State/Province": "US-CA"
  },
  {
    "Location": "Nortel Networks",
    "Date": "10-16-2004",
    "Scientific Name": "Passerella iliaca",
    "Common Name": "Fox Sparrow",
    "Filename": "2004-10-16-foxspa.jpg",
    "County": "Santa Clara",
    "State/Province": "US-CA"
  },
  {
    "Location": "Malheur NWR",
    "Date": "10-22-2004",
    "Scientific Name": "Cinclus mexicanus",
    "Common Name": "American Dipper",
    "Filename": "2004-10-22-amedip.jpg",
    "County": "Harney",
    "State/Province": "US-OR"
  },
  {
    "Location": "Malheur NWR",
    "Date": "10-23-2004",
    "Scientific Name": "Buteo regalis",
    "Common Name": "Ferruginous Hawk",
    "Filename": "2004-10-23-ferhaw.jpg",
    "County": "Harney",
    "State/Province": "US-OR"
  },
  {
    "Location": "Malheur NWR",
    "Date": "10-23-2004",
    "Scientific Name": "Sitta canadensis",
    "Common Name": "Red-breasted Nuthatch",
    "Filename": "2004-10-23-rebnut.jpg",
    "County": "Harney",
    "State/Province": "US-OR"
  },
  {
    "Location": "Malheur NWR",
    "Date": "10-23-2004",
    "Scientific Name": "Ixoreus naevius",
    "Common Name": "Varied Thrush",
    "Filename": "2004-10-23-varthr.jpg",
    "County": "Harney",
    "State/Province": "US-OR"
  },
  {
    "Location": "Charleston Slough",
    "Date": "10-29-2004",
    "Scientific Name": "Accipiter cooperii",
    "Common Name": "Cooper's Hawk",
    "Filename": "2004-10-29-coohaw.jpg",
    "County": "Santa Clara",
    "State/Province": "US-CA"
  },
  {
    "Location": "Charleston Slough",
    "Date": "10-31-2004",
    "Scientific Name": "Setophaga coronata",
    "Common Name": "Yellow-rumped Warbler",
    "Filename": "2004-10-31-yerwar.jpg",
    "County": "Santa Clara",
    "State/Province": "US-CA"
  },
  {
    "Location": "Charleston Slough",
    "Date": "10-31-2004",
    "Scientific Name": "Podilymbus podiceps",
    "Common Name": "Pied-billed Grebe",
    "Filename": "2004-10-31-pibgre.jpg",
    "County": "Santa Clara",
    "State/Province": "US-CA"
  },
  {
    "Location": "Foster City Radio Tower",
    "Date": "11-06-2004",
    "Scientific Name": "Setophaga palmarum",
    "Common Name": "Palm Warbler",
    "Filename": "2004-11-06-palwar.jpg",
    "County": "San Mateo",
    "State/Province": "US-CA"
  },
  {
    "Location": "Foster City Radio Tower",
    "Date": "11-06-2004",
    "Scientific Name": "Limosa fedoa",
    "Common Name": "Marbled Godwit",
    "Filename": "2004-11-06-margod.jpg",
    "County": "San Mateo",
    "State/Province": "US-CA"
  },
  {
    "Location": "Foster City Radio Tower",
    "Date": "11-06-2004",
    "Scientific Name": "Sayornis saya",
    "Common Name": "Say's Phoebe",
    "Filename": "2004-11-06-saypho.jpg",
    "County": "San Mateo",
    "State/Province": "US-CA"
  },
  {
    "Location": "Foster City Radio Tower",
    "Date": "11-05-2004",
    "Scientific Name": "Spizella pallida",
    "Common Name": "Clay-colored Sparrow",
    "Filename": "2004-11-05-clcspa.jpg",
    "County": "San Mateo",
    "State/Province": "US-CA"
  },
  {
    "Location": "Don Edwards Center",
    "Date": "09-06-2004",
    "Scientific Name": "Cathartes aura",
    "Common Name": "Turkey Vulture",
    "Filename": "2004-09-06-turvul.jpg",
    "County": "Santa Clara",
    "State/Province": "US-CA"
  },
  {
    "Location": "Charleston Slough",
    "Date": "11-12-2004",
    "Scientific Name": "Podiceps auritus",
    "Common Name": "Horned Grebe",
    "Filename": "2004-11-12-horgre.jpg",
    "County": "Santa Clara",
    "State/Province": "US-CA"
  },
  {
    "Location": "Rural Areas of San Mateo County",
    "Date": "11-12-2004",
    "Scientific Name": "Circus cyaneus",
    "Common Name": "Northern Harrier",
    "Filename": "2004-11-12-norhar.jpg",
    "County": "San Mateo",
    "State/Province": "US-CA"
  },
  {
    "Location": "Southwest Wisconsin",
    "Date": "11-14-2004",
    "Scientific Name": "Haliaeetus leucocephalus",
    "Common Name": "Bald Eagle",
    "Filename": "2004-11-14-baleag.jpg",
    "County": "Crawford",
    "State/Province": "US-WI"
  },
  {
    "Location": "Foster City Radio Tower",
    "Date": "11-19-2004",
    "Scientific Name": "Anas cyanoptera",
    "Common Name": "Cinnamon Teal",
    "Filename": "2004-11-19-cintea.jpg",
    "County": "San Mateo",
    "State/Province": "US-CA"
  },
  {
    "Location": "Foster City Radio Tower",
    "Date": "11-19-2004",
    "Scientific Name": "Anas americana",
    "Common Name": "American Wigeon",
    "Filename": "2004-11-19-amewig.jpg",
    "County": "San Mateo",
    "State/Province": "US-CA"
  },
  {
    "Location": "Foster City Radio Tower",
    "Date": "11-17-2004",
    "Scientific Name": "Anas crecca",
    "Common Name": "Green-winged Teal",
    "Filename": "2004-11-17-gnwtea.jpg",
    "County": "San Mateo",
    "State/Province": "US-CA"
  },
  {
    "Location": "Sacramento NWR",
    "Date": "11-26-2004",
    "Scientific Name": "Anser albifrons",
    "Common Name": "Greater White-fronted Goose",
    "Filename": "2004-11-26-gwfgoo.jpg",
    "County": "Glenn",
    "State/Province": "US-CA"
  },
  {
    "Location": "Sacramento NWR",
    "Date": "11-26-2004",
    "Scientific Name": "Chen rossii",
    "Common Name": "Ross's Goose",
    "Filename": "2004-11-26-rosgoo.jpg",
    "County": "Glenn",
    "State/Province": "US-CA"
  },
  {
    "Location": "Sacramento NWR",
    "Date": "11-26-2004",
    "Scientific Name": "Anas strepera",
    "Common Name": "Gadwall",
    "Filename": "2004-11-26-gadwal.jpg",
    "County": "Glenn",
    "State/Province": "US-CA"
  },
  {
    "Location": "Sacramento NWR",
    "Date": "11-26-2004",
    "Scientific Name": "Buteo lineatus",
    "Common Name": "Red-shouldered Hawk",
    "Filename": "2004-11-26-reshaw.jpg",
    "County": "Glenn",
    "State/Province": "US-CA"
  },
  {
    "Location": "Sacramento NWR",
    "Date": "11-26-2004",
    "Scientific Name": "Plegadis chihi",
    "Common Name": "White-faced Ibis",
    "Filename": "2004-11-26-whfibi.jpg",
    "County": "Glenn",
    "State/Province": "US-CA"
  },
  {
    "Location": "Coyote Creek Field Station",
    "Date": "11-24-2004",
    "Scientific Name": "Elanus leucurus",
    "Common Name": "White-tailed Kite",
    "Filename": "2004-11-24-whtkit.jpg",
    "County": "Santa Clara",
    "State/Province": "US-CA"
  },
  {
    "Location": "Coyote Creek Field Station",
    "Date": "11-24-2004",
    "Scientific Name": "Lanius ludovicianus",
    "Common Name": "Loggerhead Shrike",
    "Filename": "2004-11-24-logshr.jpg",
    "County": "Santa Clara",
    "State/Province": "US-CA"
  },
  {
    "Location": "Coyote Creek Field Station",
    "Date": "11-24-2004",
    "Scientific Name": "Larus occidentalis",
    "Common Name": "Western Gull",
    "Filename": "2004-11-24-wesgul.jpg",
    "County": "Santa Clara",
    "State/Province": "US-CA"
  },
  {
    "Location": "Sacramento NWR",
    "Date": "11-27-2004",
    "Scientific Name": "Chen caerulescens",
    "Common Name": "Snow Goose",
    "Filename": "2004-11-27-snogoo.jpg",
    "County": "Glenn",
    "State/Province": "US-CA"
  },
  {
    "Location": "Sacramento NWR",
    "Date": "11-27-2004",
    "Scientific Name": "Lanius ludovicianus",
    "Common Name": "Loggerhead Shrike",
    "Filename": "2004-11-27-logshr.jpg",
    "County": "Glenn",
    "State/Province": "US-CA"
  },
  {
    "Location": "Sacramento NWR",
    "Date": "11-27-2004",
    "Scientific Name": "Anthus rubescens",
    "Common Name": "American Pipit",
    "Filename": "2004-11-27-amepip.jpg",
    "County": "Glenn",
    "State/Province": "US-CA"
  },
  {
    "Location": "Foster City Radio Tower",
    "Date": "12-05-2004",
    "Scientific Name": "Numenius americanus",
    "Common Name": "Long-billed Curlew",
    "Filename": "2004-12-05-lobcur.jpg",
    "County": "San Mateo",
    "State/Province": "US-CA"
  },
  {
    "Location": "Foster City Radio Tower",
    "Date": "11-30-2004",
    "Scientific Name": "Geothlypis trichas",
    "Common Name": "Common Yellowthroat",
    "Filename": "2004-11-30-comyel.jpg",
    "County": "San Mateo",
    "State/Province": "US-CA"
  },
  {
    "Location": "Drawbridge",
    "Date": "12-19-2004",
    "Scientific Name": "Buteo jamaicensis",
    "Common Name": "Red-tailed Hawk",
    "Filename": "2004-12-19-rethaw.jpg",
    "County": "Alameda",
    "State/Province": "US-CA"
  },
  {
    "Location": "Drawbridge",
    "Date": "12-19-2004",
    "Scientific Name": "Aquila chrysaetos",
    "Common Name": "Golden Eagle",
    "Filename": "2004-12-19-goleag.jpg",
    "County": "Alameda",
    "State/Province": "US-CA"
  },
  {
    "Location": "Drawbridge",
    "Date": "12-19-2004",
    "Scientific Name": "Charadrius nivosus",
    "Common Name": "Snowy Plover",
    "Filename": "2004-12-19-snoplo.jpg",
    "County": "Alameda",
    "State/Province": "US-CA"
  },
  {
    "Location": "Ulistac Natural Area",
    "Date": "11-28-2004",
    "Scientific Name": "Zonotrichia leucophrys",
    "Common Name": "White-crowned Sparrow",
    "Filename": "2004-11-28-whcspa.jpg",
    "County": "Santa Clara",
    "State/Province": "US-CA"
  },
  {
    "Location": "Ulistac Natural Area",
    "Date": "11-28-2004",
    "Scientific Name": "Colaptes auratus",
    "Common Name": "Northern Flicker",
    "Filename": "2004-11-28-norfli.jpg",
    "County": "Santa Clara",
    "State/Province": "US-CA"
  },
  {
    "Location": "Sunnyvale Baylands",
    "Date": "11-28-2004",
    "Scientific Name": "Sturnella neglecta",
    "Common Name": "Western Meadowlark",
    "Filename": "2004-11-28-wesmea.jpg",
    "County": "Santa Clara",
    "State/Province": "US-CA"
  },
  {
    "Location": "Ulistac Natural Area",
    "Date": "11-28-2004",
    "Scientific Name": "Mimus polyglottos",
    "Common Name": "Northern Mockingbird",
    "Filename": "2004-11-28-normoc.jpg",
    "County": "Santa Clara",
    "State/Province": "US-CA"
  },
  {
    "Location": "Vasona Creek",
    "Date": "12-29-2004",
    "Scientific Name": "Mergus merganser",
    "Common Name": "Common Merganser",
    "Filename": "2004-12-29-commer.jpg",
    "County": "Santa Clara",
    "State/Province": "US-CA"
  },
  {
    "Location": "Vasona Creek",
    "Date": "12-29-2004",
    "Scientific Name": "Pandion haliaetus",
    "Common Name": "Osprey",
    "Filename": "2004-12-29-osprey.jpg",
    "County": "Santa Clara",
    "State/Province": "US-CA"
  },
  {
    "Location": "Coyote Point Marina",
    "Date": "01-09-2005",
    "Scientific Name": "Junco hyemalis",
    "Common Name": "Dark-eyed Junco",
    "Filename": "2005-01-09-daejun.jpg",
    "County": "San Mateo",
    "State/Province": "US-CA"
  },
  {
    "Location": "Lake Merritt",
    "Date": "01-11-2005",
    "Scientific Name": "Aythya valisineria",
    "Common Name": "Canvasback",
    "Filename": "2005-01-11-canvas.jpg",
    "County": "Alameda",
    "State/Province": "US-CA"
  },
  {
    "Location": "MLK Jr. Regional Shoreline--Arrowhead Marsh",
    "Date": "01-11-2005",
    "Scientific Name": "Rallus obsoletus",
    "Common Name": "Ridgway's Rail",
    "Filename": "2005-01-11-clarai.jpg",
    "County": "Alameda",
    "State/Province": "US-CA"
  },
  {
    "Location": "Lake Merritt",
    "Date": "01-11-2005",
    "Scientific Name": "Larus glaucescens",
    "Common Name": "Glaucous-winged Gull",
    "Filename": "2005-01-11-glwgul.jpg",
    "County": "Alameda",
    "State/Province": "US-CA"
  },
  {
    "Location": "Merced NWR",
    "Date": "01-15-2005",
    "Scientific Name": "Bubulcus ibis",
    "Common Name": "Cattle Egret",
    "Filename": "2005-01-15-categr.jpg",
    "County": "Merced",
    "State/Province": "US-CA"
  },
  {
    "Location": "Merced NWR",
    "Date": "01-15-2005",
    "Scientific Name": "Porzana carolina",
    "Common Name": "Sora",
    "Filename": "2005-01-15-sora.jpg",
    "County": "Merced",
    "State/Province": "US-CA"
  },
  {
    "Location": "Monterey Bay",
    "Date": "01-16-2005",
    "Scientific Name": "Buteo lineatus",
    "Common Name": "Red-shouldered Hawk",
    "Filename": "2005-01-16-reshaw.jpg",
    "County": "Monterey",
    "State/Province": "US-CA"
  },
  {
    "Location": "Monterey Bay",
    "Date": "01-16-2005",
    "Scientific Name": "Cyanocitta stelleri",
    "Common Name": "Steller's Jay",
    "Filename": "2005-01-16-stejay.jpg",
    "County": "Monterey",
    "State/Province": "US-CA"
  },
  {
    "Location": "Monterey Bay",
    "Date": "01-16-2005",
    "Scientific Name": "Thryomanes bewickii",
    "Common Name": "Bewick's Wren",
    "Filename": "2005-01-16-bewwre.jpg",
    "County": "Monterey",
    "State/Province": "US-CA"
  },
  {
    "Location": "Our House",
    "Date": "12-31-2004",
    "Scientific Name": "Spinus psaltria",
    "Common Name": "Lesser Goldfinch",
    "Filename": "2004-12-31-lesgol.jpg",
    "County": "Santa Clara",
    "State/Province": "US-CA"
  },
  {
    "Location": "Don Edwards Center",
    "Date": "09-06-2004",
    "Scientific Name": "Calidris minutilla",
    "Common Name": "Least Sandpiper",
    "Filename": "2004-09-06-leasan.jpg",
    "County": "Santa Clara",
    "State/Province": "US-CA"
  },
  {
    "Location": "Southwest Wisconsin",
    "Date": "11-07-2003",
    "Scientific Name": "Cyanocitta cristata",
    "Common Name": "Blue Jay",
    "Filename": "2003-11-07-blujay.jpg",
    "County": "Crawford",
    "State/Province": "US-WI"
  },
  {
    "Location": "Shoreline Lake",
    "Date": "02-04-2005",
    "Scientific Name": "Bucephala clangula",
    "Common Name": "Common Goldeneye",
    "Filename": "2005-02-04-comgol.jpg",
    "County": "Santa Clara",
    "State/Province": "US-CA"
  },
  {
    "Location": "Charleston Slough",
    "Date": "02-04-2005",
    "Scientific Name": "Larus delawarensis",
    "Common Name": "Ring-billed Gull",
    "Filename": "2005-02-04-ribgul.jpg",
    "County": "Santa Clara",
    "State/Province": "US-CA"
  },
  {
    "Location": "Shoreline Lake",
    "Date": "02-09-2005",
    "Scientific Name": "Melanitta perspicillata",
    "Common Name": "Surf Scoter",
    "Filename": "2005-02-09-sursco.jpg",
    "County": "Santa Clara",
    "State/Province": "US-CA"
  },
  {
    "Location": "Shoreline Lake",
    "Date": "02-09-2005",
    "Scientific Name": "Fulica americana",
    "Common Name": "American Coot",
    "Filename": "2005-02-09-amecoo.jpg",
    "County": "Santa Clara",
    "State/Province": "US-CA"
  },
  {
    "Location": "Shoreline Lake",
    "Date": "02-09-2005",
    "Scientific Name": "Podilymbus podiceps",
    "Common Name": "Pied-billed Grebe",
    "Filename": "2005-02-09-pibgre.jpg",
    "County": "Santa Clara",
    "State/Province": "US-CA"
  },
  {
    "Location": "Palo Alto Duck Pond",
    "Date": "02-10-2005",
    "Scientific Name": "Branta canadensis",
    "Common Name": "Canada Goose",
    "Filename": "2005-02-10-cangoo.jpg",
    "County": "Santa Clara",
    "State/Province": "US-CA"
  },
  {
    "Location": "Sunnyvale Baylands",
    "Date": "02-21-2005",
    "Scientific Name": "Sayornis saya",
    "Common Name": "Say's Phoebe",
    "Filename": "2005-02-21-saypho.jpg",
    "County": "Santa Clara",
    "State/Province": "US-CA"
  },
  {
    "Location": "Sunnyvale Baylands",
    "Date": "02-21-2005",
    "Scientific Name": "Buteo jamaicensis",
    "Common Name": "Red-tailed Hawk",
    "Filename": "2005-02-21-rethaw.jpg",
    "County": "Santa Clara",
    "State/Province": "US-CA"
  },
  {
    "Location": "Charleston Slough",
    "Date": "02-04-2005",
    "Scientific Name": "Passerella iliaca",
    "Common Name": "Fox Sparrow",
    "Filename": "2005-02-04-foxspa.jpg",
    "County": "Santa Clara",
    "State/Province": "US-CA"
  },
  {
    "Location": "Southwest Wisconsin",
    "Date": "11-16-2004",
    "Scientific Name": "Poecile atricapillus",
    "Common Name": "Black-capped Chickadee",
    "Filename": "2004-11-16-bkcchi.jpg",
    "County": "Crawford",
    "State/Province": "US-WI"
  },
  {
    "Location": "Charleston Slough",
    "Date": "02-11-2005",
    "Scientific Name": "Agelaius phoeniceus",
    "Common Name": "Red-winged Blackbird",
    "Filename": "2005-02-11-rewbla.jpg",
    "County": "Santa Clara",
    "State/Province": "US-CA"
  },
  {
    "Location": "Our House",
    "Date": "03-21-2005",
    "Scientific Name": "Bombycilla cedrorum",
    "Common Name": "Cedar Waxwing",
    "Filename": "2005-03-21-cedwax.jpg",
    "County": "Santa Clara",
    "State/Province": "US-CA"
  },
  {
    "Location": "McClellan Ranch Preserve",
    "Date": "04-02-2005",
    "Scientific Name": "Baeolophus inornatus",
    "Common Name": "Oak Titmouse",
    "Filename": "2005-04-02-oaktit.jpg",
    "County": "Santa Clara",
    "State/Province": "US-CA"
  },
  {
    "Location": "Bear Creek Greenway",
    "Date": "04-09-2005",
    "Scientific Name": "Pipilo maculatus",
    "Common Name": "Spotted Towhee",
    "Filename": "2005-04-09-spotow.jpg",
    "County": "Jackson",
    "State/Province": "US-OR"
  },
  {
    "Location": "Laguna Atascosa NWR",
    "Date": "04-20-2005",
    "Scientific Name": "Eudocimus albus",
    "Common Name": "White Ibis",
    "Filename": "2005-04-20-whiibi.jpg",
    "County": "Cameron",
    "State/Province": "US-TX"
  },
  {
    "Location": "Laguna Atascosa NWR",
    "Date": "04-20-2005",
    "Scientific Name": "Platalea ajaja",
    "Common Name": "Roseate Spoonbill",
    "Filename": "2005-04-20-rosspo.jpg",
    "County": "Cameron",
    "State/Province": "US-TX"
  },
  {
    "Location": "Sabal Palm Audubon Sanctuary",
    "Date": "04-21-2005",
    "Scientific Name": "Tachybaptus dominicus",
    "Common Name": "Least Grebe",
    "Filename": "2005-04-21-leagre.jpg",
    "County": "Cameron",
    "State/Province": "US-TX"
  },
  {
    "Location": "Sabal Palm Audubon Sanctuary",
    "Date": "04-21-2005",
    "Scientific Name": "Nyctanassa violacea",
    "Common Name": "Yellow-crowned Night-Heron",
    "Filename": "2005-04-21-ycnher.jpg",
    "County": "Cameron",
    "State/Province": "US-TX"
  },
  {
    "Location": "Old Port Isabel Road",
    "Date": "04-21-2005",
    "Scientific Name": "Geranoaetus albicaudatus",
    "Common Name": "White-tailed Hawk",
    "Filename": "2005-04-21-whthaw.jpg",
    "County": "Cameron",
    "State/Province": "US-TX"
  },
  {
    "Location": "Sabal Palm Audubon Sanctuary",
    "Date": "04-21-2005",
    "Scientific Name": "Tringa flavipes",
    "Common Name": "Lesser Yellowlegs",
    "Filename": "2005-04-21-lesyel.jpg",
    "County": "Cameron",
    "State/Province": "US-TX"
  },
  {
    "Location": "South Padre Island",
    "Date": "04-21-2005",
    "Scientific Name": "Calidris melanotos",
    "Common Name": "Pectoral Sandpiper",
    "Filename": "2005-04-21-pecsan.jpg",
    "County": "Cameron",
    "State/Province": "US-TX"
  },
  {
    "Location": "Sabal Palm Audubon Sanctuary",
    "Date": "04-21-2005",
    "Scientific Name": "Crotophaga sulcirostris",
    "Common Name": "Groove-billed Ani",
    "Filename": "2005-04-21-grbani.jpg",
    "County": "Cameron",
    "State/Province": "US-TX"
  },
  {
    "Location": "South Padre Island",
    "Date": "04-21-2005",
    "Scientific Name": "Chordeiles acutipennis",
    "Common Name": "Lesser Nighthawk",
    "Filename": "2005-04-21-lesnig.jpg",
    "County": "Cameron",
    "State/Province": "US-TX"
  },
  {
    "Location": "Sabal Palm Audubon Sanctuary",
    "Date": "04-21-2005",
    "Scientific Name": "Vermivora cyanoptera",
    "Common Name": "Blue-winged Warbler",
    "Filename": "2005-04-21-buwwar.jpg",
    "County": "Cameron",
    "State/Province": "US-TX"
  },
  {
    "Location": "South Padre Island",
    "Date": "04-21-2005",
    "Scientific Name": "Oreothlypis ruficapilla",
    "Common Name": "Nashville Warbler",
    "Filename": "2005-04-21-naswar.jpg",
    "County": "Cameron",
    "State/Province": "US-TX"
  },
  {
    "Location": "Sabal Palm Audubon Sanctuary",
    "Date": "04-21-2005",
    "Scientific Name": "Parkesia motacilla",
    "Common Name": "Louisiana Waterthrush",
    "Filename": "2005-04-21-louwat.jpg",
    "County": "Cameron",
    "State/Province": "US-TX"
  },
  {
    "Location": "South Padre Island",
    "Date": "04-21-2005",
    "Scientific Name": "Pheucticus ludovicianus",
    "Common Name": "Rose-breasted Grosbeak",
    "Filename": "2005-04-21-robgro.jpg",
    "County": "Cameron",
    "State/Province": "US-TX"
  },
  {
    "Location": "South Padre Island",
    "Date": "04-21-2005",
    "Scientific Name": "Spiza americana",
    "Common Name": "Dickcissel",
    "Filename": "2005-04-21-dickci.jpg",
    "County": "Cameron",
    "State/Province": "US-TX"
  },
  {
    "Location": "South Padre Island",
    "Date": "04-21-2005",
    "Scientific Name": "Icterus spurius",
    "Common Name": "Orchard Oriole",
    "Filename": "2005-04-21-orcori.jpg",
    "County": "Cameron",
    "State/Province": "US-TX"
  },
  {
    "Location": "Santa Ana NWR",
    "Date": "04-22-2005",
    "Scientific Name": "Pitangus sulphuratus",
    "Common Name": "Great Kiskadee",
    "Filename": "2005-04-22-grekis.jpg",
    "County": "Hidalgo",
    "State/Province": "US-TX"
  },
  {
    "Location": "South Padre Island",
    "Date": "04-23-2005",
    "Scientific Name": "Pandion haliaetus",
    "Common Name": "Osprey",
    "Filename": "2005-04-23-osprey.jpg",
    "County": "Cameron",
    "State/Province": "US-TX"
  },
  {
    "Location": "South Padre Island",
    "Date": "04-23-2005",
    "Scientific Name": "Calidris alba",
    "Common Name": "Sanderling",
    "Filename": "2005-04-23-sander.jpg",
    "County": "Cameron",
    "State/Province": "US-TX"
  },
  {
    "Location": "South Padre Island",
    "Date": "04-23-2005",
    "Scientific Name": "Leucophaeus atricilla",
    "Common Name": "Laughing Gull",
    "Filename": "2005-04-23-laugul.jpg",
    "County": "Cameron",
    "State/Province": "US-TX"
  },
  {
    "Location": "South Padre Island",
    "Date": "04-23-2005",
    "Scientific Name": "Leucophaeus pipixcan",
    "Common Name": "Franklin's Gull",
    "Filename": "2005-04-23-fragul.jpg",
    "County": "Cameron",
    "State/Province": "US-TX"
  },
  {
    "Location": "South Padre Island",
    "Date": "04-23-2005",
    "Scientific Name": "Sternula antillarum",
    "Common Name": "Least Tern",
    "Filename": "2005-04-23-leater.jpg",
    "County": "Cameron",
    "State/Province": "US-TX"
  },
  {
    "Location": "Frontera Audubon",
    "Date": "04-24-2005",
    "Scientific Name": "Columbina inca",
    "Common Name": "Inca Dove",
    "Filename": "2005-04-24-incdov.jpg",
    "County": "Hidalgo",
    "State/Province": "US-TX"
  },
  {
    "Location": "Frontera Audubon",
    "Date": "04-24-2005",
    "Scientific Name": "Vireo griseus",
    "Common Name": "White-eyed Vireo",
    "Filename": "2005-04-24-whevir.jpg",
    "County": "Hidalgo",
    "State/Province": "US-TX"
  },
  {
    "Location": "Anzalduas County Park",
    "Date": "04-24-2005",
    "Scientific Name": "Vireo olivaceus",
    "Common Name": "Red-eyed Vireo",
    "Filename": "2005-04-24-reevir.jpg",
    "County": "Hidalgo",
    "State/Province": "US-TX"
  },
  {
    "Location": "Charleston Slough",
    "Date": "10-12-2005",
    "Scientific Name": "Anas discors",
    "Common Name": "Blue-winged Teal",
    "Filename": "2005-10-12-buwtea.jpg",
    "County": "Santa Clara",
    "State/Province": "US-CA"
  },
  {
    "Location": "Frontera Audubon",
    "Date": "04-24-2005",
    "Scientific Name": "Toxostoma curvirostre",
    "Common Name": "Curve-billed Thrasher",
    "Filename": "2005-04-24-cubthr.jpg",
    "County": "Hidalgo",
    "State/Province": "US-TX"
  },
  {
    "Location": "Anzalduas County Park",
    "Date": "04-24-2005",
    "Scientific Name": "Turdus grayi",
    "Common Name": "Clay-colored Thrush",
    "Filename": "2005-04-24-clcrob.jpg",
    "County": "Hidalgo",
    "State/Province": "US-TX"
  },
  {
    "Location": "Stevens Creek County Park",
    "Date": "05-01-2005",
    "Scientific Name": "Certhia americana",
    "Common Name": "Brown Creeper",
    "Filename": "2005-05-01-brncre.jpg",
    "County": "Santa Clara",
    "State/Province": "US-CA"
  },
  {
    "Location": "Reactivity",
    "Date": "05-13-2005",
    "Scientific Name": "Molothrus ater",
    "Common Name": "Brown-headed Cowbird",
    "Filename": "2005-05-13-bnhcow.jpg",
    "County": "San Mateo",
    "State/Province": "US-CA"
  },
  {
    "Location": "Charleston Slough",
    "Date": "05-24-2005",
    "Scientific Name": "Recurvirostra americana",
    "Common Name": "American Avocet",
    "Filename": "2005-05-24-ameavo.jpg",
    "County": "Santa Clara",
    "State/Province": "US-CA"
  },
  {
    "Location": "Cape May",
    "Date": "06-09-2005",
    "Scientific Name": "Pandion haliaetus",
    "Common Name": "Osprey",
    "Filename": "2005-06-09-osprey.jpg",
    "County": "Cape May",
    "State/Province": "US-NJ"
  },
  {
    "Location": "Cape May",
    "Date": "06-09-2005",
    "Scientific Name": "Charadrius melodus",
    "Common Name": "Piping Plover",
    "Filename": "2005-06-09-pipplo.jpg",
    "County": "Cape May",
    "State/Province": "US-NJ"
  },
  {
    "Location": "Cape May",
    "Date": "06-09-2005",
    "Scientific Name": "Haematopus palliatus",
    "Common Name": "American Oystercatcher",
    "Filename": "2005-06-09-ameoys.jpg",
    "County": "Cape May",
    "State/Province": "US-NJ"
  },
  {
    "Location": "Cape May",
    "Date": "06-09-2005",
    "Scientific Name": "Larus marinus",
    "Common Name": "Great Black-backed Gull",
    "Filename": "2005-06-09-gbbgul.jpg",
    "County": "Cape May",
    "State/Province": "US-NJ"
  },
  {
    "Location": "Cape May",
    "Date": "06-09-2005",
    "Scientific Name": "Thalasseus maximus",
    "Common Name": "Royal Tern",
    "Filename": "2005-06-09-royter.jpg",
    "County": "Cape May",
    "State/Province": "US-NJ"
  },
  {
    "Location": "Cape May",
    "Date": "06-09-2005",
    "Scientific Name": "Sterna hirundo",
    "Common Name": "Common Tern",
    "Filename": "2005-06-09-comter.jpg",
    "County": "Cape May",
    "State/Province": "US-NJ"
  },
  {
    "Location": "Cape May",
    "Date": "06-09-2005",
    "Scientific Name": "Progne subis",
    "Common Name": "Purple Martin",
    "Filename": "2005-06-09-purmar.jpg",
    "County": "Cape May",
    "State/Province": "US-NJ"
  },
  {
    "Location": "Cape May",
    "Date": "06-10-2005",
    "Scientific Name": "Cygnus olor",
    "Common Name": "Mute Swan",
    "Filename": "2005-06-10-mutswa.jpg",
    "County": "Cape May",
    "State/Province": "US-NJ"
  },
  {
    "Location": "Cape May",
    "Date": "06-10-2005",
    "Scientific Name": "Dumetella carolinensis",
    "Common Name": "Gray Catbird",
    "Filename": "2005-06-10-grycat.jpg",
    "County": "Cape May",
    "State/Province": "US-NJ"
  },
  {
    "Location": "Charleston Slough",
    "Date": "02-11-2005",
    "Scientific Name": "Larus glaucescens",
    "Common Name": "Glaucous-winged Gull",
    "Filename": "2005-02-11-glwgul.jpg",
    "County": "Santa Clara",
    "State/Province": "US-CA"
  },
  {
    "Location": "Charleston Slough",
    "Date": "06-14-2005",
    "Scientific Name": "Plegadis chihi",
    "Common Name": "White-faced Ibis",
    "Filename": "2005-06-14-whfibi.jpg",
    "County": "Santa Clara",
    "State/Province": "US-CA"
  },
  {
    "Location": "Kern River Preserve",
    "Date": "06-23-2005",
    "Scientific Name": "Empidonax traillii",
    "Common Name": "Willow Flycatcher",
    "Filename": "2005-06-23-wilfly.jpg",
    "County": "Kern",
    "State/Province": "US-CA"
  },
  {
    "Location": "Kern River Preserve",
    "Date": "06-23-2005",
    "Scientific Name": "Tachycineta bicolor",
    "Common Name": "Tree Swallow",
    "Filename": "2005-06-23-treswa.jpg",
    "County": "Kern",
    "State/Province": "US-CA"
  },
  {
    "Location": "Piute Mountains",
    "Date": "06-24-2005",
    "Scientific Name": "Falco sparverius",
    "Common Name": "American Kestrel",
    "Filename": "2005-06-24-amekes.jpg",
    "County": "Unknown",
    "State/Province": "Unknown"
  },
  {
    "Location": "Piute Mountains",
    "Date": "06-24-2005",
    "Scientific Name": "Callipepla californica",
    "Common Name": "California Quail",
    "Filename": "2005-06-24-calqua.jpg",
    "County": "Unknown",
    "State/Province": "Unknown"
  },
  {
    "Location": "Kern River Preserve",
    "Date": "06-24-2005",
    "Scientific Name": "Streptopelia decaocto",
    "Common Name": "Eurasian Collared-Dove",
    "Filename": "2005-06-24-eucdov.jpg",
    "County": "Kern",
    "State/Province": "US-CA"
  },
  {
    "Location": "Piute Mountains",
    "Date": "06-24-2005",
    "Scientific Name": "Contopus sordidulus",
    "Common Name": "Western Wood-Pewee",
    "Filename": "2005-06-24-wewpew.jpg",
    "County": "Unknown",
    "State/Province": "Unknown"
  },
  {
    "Location": "Piute Mountains",
    "Date": "06-24-2005",
    "Scientific Name": "Salpinctes obsoletus",
    "Common Name": "Rock Wren",
    "Filename": "2005-06-24-rocwre.jpg",
    "County": "Unknown",
    "State/Province": "Unknown"
  },
  {
    "Location": "Piute Mountains",
    "Date": "06-24-2005",
    "Scientific Name": "Setophaga coronata",
    "Common Name": "Yellow-rumped Warbler",
    "Filename": "2005-06-24-yerwar.jpg",
    "County": "Unknown",
    "State/Province": "Unknown"
  },
  {
    "Location": "Piute Mountains",
    "Date": "06-24-2005",
    "Scientific Name": "Piranga rubra",
    "Common Name": "Summer Tanager",
    "Filename": "2005-06-24-sumtan.jpg",
    "County": "Unknown",
    "State/Province": "Unknown"
  },
  {
    "Location": "Fay Ranch Road",
    "Date": "06-24-2005",
    "Scientific Name": "Passerculus sandwichensis",
    "Common Name": "Savannah Sparrow",
    "Filename": "2005-06-24-savspa.jpg",
    "County": "Kern",
    "State/Province": "US-CA"
  },
  {
    "Location": "Fay Ranch Road",
    "Date": "06-24-2005",
    "Scientific Name": "Passerina caerulea",
    "Common Name": "Blue Grosbeak",
    "Filename": "2005-06-24-blugrb.jpg",
    "County": "Kern",
    "State/Province": "US-CA"
  },
  {
    "Location": "Chimney Creek Campground",
    "Date": "06-25-2005",
    "Scientific Name": "Vireo plumbeus",
    "Common Name": "Plumbeous Vireo",
    "Filename": "2005-06-25-pluvir.jpg",
    "County": "Tulare",
    "State/Province": "US-CA"
  },
  {
    "Location": "Chimney Creek Campground",
    "Date": "06-25-2005",
    "Scientific Name": "Sialia currucoides",
    "Common Name": "Mountain Bluebird",
    "Filename": "2005-06-25-moublu.jpg",
    "County": "Tulare",
    "State/Province": "US-CA"
  },
  {
    "Location": "Chimney Creek Campground",
    "Date": "06-25-2005",
    "Scientific Name": "Myadestes townsendi",
    "Common Name": "Townsend's Solitaire",
    "Filename": "2005-06-25-towsol.jpg",
    "County": "Tulare",
    "State/Province": "US-CA"
  },
  {
    "Location": "Chimney Creek Campground",
    "Date": "06-25-2005",
    "Scientific Name": "Setophaga nigrescens",
    "Common Name": "Black-throated Gray Warbler",
    "Filename": "2005-06-25-btywar.jpg",
    "County": "Tulare",
    "State/Province": "US-CA"
  },
  {
    "Location": "Chimney Creek Campground",
    "Date": "06-25-2005",
    "Scientific Name": "Piranga ludoviciana",
    "Common Name": "Western Tanager",
    "Filename": "2005-06-25-westan.jpg",
    "County": "Tulare",
    "State/Province": "US-CA"
  },
  {
    "Location": "Chimney Creek Campground",
    "Date": "06-25-2005",
    "Scientific Name": "Haemorhous purpureus",
    "Common Name": "Purple Finch",
    "Filename": "2005-06-25-purfin.jpg",
    "County": "Tulare",
    "State/Province": "US-CA"
  },
  {
    "Location": "Merced NWR",
    "Date": "06-26-2005",
    "Scientific Name": "Buteo swainsoni",
    "Common Name": "Swainson's Hawk",
    "Filename": "2005-06-26-swahaw.jpg",
    "County": "Merced",
    "State/Province": "US-CA"
  },
  {
    "Location": "Johnsondale Bridge",
    "Date": "06-26-2005",
    "Scientific Name": "Cypseloides niger",
    "Common Name": "Black Swift",
    "Filename": "2005-06-26-blkswi.jpg",
    "County": "Tulare",
    "State/Province": "US-CA"
  },
  {
    "Location": "Holey Meadow",
    "Date": "06-26-2005",
    "Scientific Name": "Sphyrapicus ruber",
    "Common Name": "Red-breasted Sapsucker",
    "Filename": "2005-06-26-rebsap.jpg",
    "County": "Tulare",
    "State/Province": "US-CA"
  },
  {
    "Location": "Quaking Aspen Meadow",
    "Date": "06-26-2005",
    "Scientific Name": "Picoides albolarvatus",
    "Common Name": "White-headed Woodpecker",
    "Filename": "2005-06-26-whhwoo.jpg",
    "County": "Tulare",
    "State/Province": "US-CA"
  },
  {
    "Location": "Holey Meadow",
    "Date": "06-26-2005",
    "Scientific Name": "Geothlypis tolmiei",
    "Common Name": "MacGillivray's Warbler",
    "Filename": "2005-06-26-macwar.jpg",
    "County": "Tulare",
    "State/Province": "US-CA"
  },
  {
    "Location": "Holey Meadow",
    "Date": "06-26-2005",
    "Scientific Name": "Pipilo chlorurus",
    "Common Name": "Green-tailed Towhee",
    "Filename": "2005-06-26-gnttow.jpg",
    "County": "Tulare",
    "State/Province": "US-CA"
  },
  {
    "Location": "Holey Meadow",
    "Date": "06-26-2005",
    "Scientific Name": "Melospiza lincolnii",
    "Common Name": "Lincoln's Sparrow",
    "Filename": "2005-06-26-linspa.jpg",
    "County": "Tulare",
    "State/Province": "US-CA"
  },
  {
    "Location": "Stevens Creek County Park",
    "Date": "06-28-2005",
    "Scientific Name": "Polioptila caerulea",
    "Common Name": "Blue-gray Gnatcatcher",
    "Filename": "2005-06-28-buggna.jpg",
    "County": "Santa Clara",
    "State/Province": "US-CA"
  },
  {
    "Location": "Stevens Creek County Park",
    "Date": "06-28-2005",
    "Scientific Name": "Cyanocitta stelleri",
    "Common Name": "Steller's Jay",
    "Filename": "2005-06-28-stejay.jpg",
    "County": "Santa Clara",
    "State/Province": "US-CA"
  },
  {
    "Location": "Stevens Creek County Park",
    "Date": "06-28-2005",
    "Scientific Name": "Thryomanes bewickii",
    "Common Name": "Bewick's Wren",
    "Filename": "2005-06-28-bewwre.jpg",
    "County": "Santa Clara",
    "State/Province": "US-CA"
  },
  {
    "Location": "Don Edwards Center",
    "Date": "06-27-2005",
    "Scientific Name": "Athene cunicularia",
    "Common Name": "Burrowing Owl",
    "Filename": "2005-06-27-burowl.jpg",
    "County": "Santa Clara",
    "State/Province": "US-CA"
  },
  {
    "Location": "Foster City Radio Tower",
    "Date": "06-28-2005",
    "Scientific Name": "Limosa fedoa",
    "Common Name": "Marbled Godwit",
    "Filename": "2005-06-28-margod.jpg",
    "County": "San Mateo",
    "State/Province": "US-CA"
  },
  {
    "Location": "Pikes Peak",
    "Date": "08-08-2005",
    "Scientific Name": "Spizella passerina",
    "Common Name": "Chipping Sparrow",
    "Filename": "2005-08-08-chispa.jpg",
    "County": "Clayton",
    "State/Province": "US-IA"
  },
  {
    "Location": "Pikes Peak",
    "Date": "08-08-2005",
    "Scientific Name": "Archilochus colubris",
    "Common Name": "Ruby-throated Hummingbird",
    "Filename": "2005-08-08-rthhum.jpg",
    "County": "Clayton",
    "State/Province": "US-IA"
  },
  {
    "Location": "Hayward Regional Shoreline",
    "Date": "08-31-2005",
    "Scientific Name": "Calidris mauri",
    "Common Name": "Western Sandpiper",
    "Filename": "2005-08-31-wessan.jpg",
    "County": "Alameda",
    "State/Province": "US-CA"
  },
  {
    "Location": "Hayward Regional Shoreline",
    "Date": "08-31-2005",
    "Scientific Name": "Tringa semipalmata",
    "Common Name": "Willet",
    "Filename": "2005-08-31-willet.jpg",
    "County": "Alameda",
    "State/Province": "US-CA"
  },
  {
    "Location": "Hayward Regional Shoreline",
    "Date": "08-31-2005",
    "Scientific Name": "Pluvialis squatarola",
    "Common Name": "Black-bellied Plover",
    "Filename": "2005-08-31-bkbplo.jpg",
    "County": "Alameda",
    "State/Province": "US-CA"
  },
  {
    "Location": "Hayward Regional Shoreline",
    "Date": "08-31-2005",
    "Scientific Name": "Setophaga townsendi",
    "Common Name": "Townsend's Warbler",
    "Filename": "2005-08-31-towwar.jpg",
    "County": "Alameda",
    "State/Province": "US-CA"
  },
  {
    "Location": "Coyote Hills Regional Park",
    "Date": "09-05-2005",
    "Scientific Name": "Pelecanus erythrorhynchos",
    "Common Name": "American White Pelican",
    "Filename": "2005-09-05-amwpel.jpg",
    "County": "Alameda",
    "State/Province": "US-CA"
  },
  {
    "Location": "Pearson-Arastradero Preserve",
    "Date": "09-07-2005",
    "Scientific Name": "Buteo jamaicensis",
    "Common Name": "Red-tailed Hawk",
    "Filename": "2005-09-07-rethaw.jpg",
    "County": "Santa Clara",
    "State/Province": "US-CA"
  },
  {
    "Location": "Pearson-Arastradero Preserve",
    "Date": "09-07-2005",
    "Scientific Name": "Psaltriparus minimus",
    "Common Name": "Bushtit",
    "Filename": "2005-09-07-bushti.jpg",
    "County": "Santa Clara",
    "State/Province": "US-CA"
  },
  {
    "Location": "Don Edwards Center",
    "Date": "09-14-2005",
    "Scientific Name": "Hydroprogne caspia",
    "Common Name": "Caspian Tern",
    "Filename": "2005-09-14-caster.jpg",
    "County": "Santa Clara",
    "State/Province": "US-CA"
  },
  {
    "Location": "Don Edwards Center",
    "Date": "09-14-2005",
    "Scientific Name": "Hirundo rustica",
    "Common Name": "Barn Swallow",
    "Filename": "2005-09-14-barswa.jpg",
    "County": "Santa Clara",
    "State/Province": "US-CA"
  },
  {
    "Location": "Bodega Bay",
    "Date": "09-24-2005",
    "Scientific Name": "Gavia pacifica",
    "Common Name": "Pacific Loon",
    "Filename": "2005-09-24-pacloo.jpg",
    "County": "Marin",
    "State/Province": "US-CA"
  },
  {
    "Location": "Bodega Bay",
    "Date": "09-24-2005",
    "Scientific Name": "Setophaga petechia",
    "Common Name": "Yellow Warbler",
    "Filename": "2005-09-24-yelwar.jpg",
    "County": "Marin",
    "State/Province": "US-CA"
  },
  {
    "Location": "Bodega Bay",
    "Date": "09-25-2005",
    "Scientific Name": "Phoebastria nigripes",
    "Common Name": "Black-footed Albatross",
    "Filename": "2005-09-25-bkfalb.jpg",
    "County": "Marin",
    "State/Province": "US-CA"
  },
  {
    "Location": "Bodega Bay",
    "Date": "09-25-2005",
    "Scientific Name": "Fulmarus glacialis",
    "Common Name": "Northern Fulmar",
    "Filename": "2005-09-25-norful.jpg",
    "County": "Marin",
    "State/Province": "US-CA"
  },
  {
    "Location": "Bodega Bay",
    "Date": "09-25-2005",
    "Scientific Name": "Ardenna creatopus",
    "Common Name": "Pink-footed Shearwater",
    "Filename": "2005-09-25-pifshe.jpg",
    "County": "Marin",
    "State/Province": "US-CA"
  },
  {
    "Location": "Bodega Bay",
    "Date": "09-25-2005",
    "Scientific Name": "Ardenna bulleri",
    "Common Name": "Buller's Shearwater",
    "Filename": "2005-09-25-bulshe.jpg",
    "County": "Marin",
    "State/Province": "US-CA"
  },
  {
    "Location": "Bodega Bay",
    "Date": "09-25-2005",
    "Scientific Name": "Ardenna grisea",
    "Common Name": "Sooty Shearwater",
    "Filename": "2005-09-25-sooshe.jpg",
    "County": "Marin",
    "State/Province": "US-CA"
  },
  {
    "Location": "Bodega Bay",
    "Date": "09-25-2005",
    "Scientific Name": "Stercorarius maccormicki",
    "Common Name": "South Polar Skua",
    "Filename": "2005-09-25-sopsku.jpg",
    "County": "Marin",
    "State/Province": "US-CA"
  },
  {
    "Location": "Bodega Bay",
    "Date": "09-25-2005",
    "Scientific Name": "Larus argentatus",
    "Common Name": "Herring Gull",
    "Filename": "2005-09-25-hergul.jpg",
    "County": "Marin",
    "State/Province": "US-CA"
  },
  {
    "Location": "Bodega Bay",
    "Date": "09-25-2005",
    "Scientific Name": "Uria aalge",
    "Common Name": "Common Murre",
    "Filename": "2005-09-25-commur.jpg",
    "County": "Marin",
    "State/Province": "US-CA"
  },
  {
    "Location": "Bodega Bay",
    "Date": "09-25-2005",
    "Scientific Name": "Cerorhinca monocerata",
    "Common Name": "Rhinoceros Auklet",
    "Filename": "2005-09-25-rhiauk.jpg",
    "County": "Marin",
    "State/Province": "US-CA"
  },
  {
    "Location": "Charleston Slough",
    "Date": "10-12-2005",
    "Scientific Name": "Cistothorus palustris",
    "Common Name": "Marsh Wren",
    "Filename": "2005-10-12-marwre.jpg",
    "County": "Santa Clara",
    "State/Province": "US-CA"
  },
  {
    "Location": "Charleston Slough",
    "Date": "10-12-2005",
    "Scientific Name": "Phalacrocorax auritus",
    "Common Name": "Double-crested Cormorant",
    "Filename": "2005-10-12-doccor.jpg",
    "County": "Santa Clara",
    "State/Province": "US-CA"
  },
  {
    "Location": "Russian Ridge Open Space Preserve",
    "Date": "10-20-2005",
    "Scientific Name": "Thryomanes bewickii",
    "Common Name": "Bewick's Wren",
    "Filename": "2005-10-20-bewwre.jpg",
    "County": "San Mateo",
    "State/Province": "US-CA"
  },
  {
    "Location": "Yosemite",
    "Date": "10-03-2005",
    "Scientific Name": "Catherpes mexicanus",
    "Common Name": "Canyon Wren",
    "Filename": "2005-10-03-canwre.jpg",
    "County": "Mariposa",
    "State/Province": "US-CA"
  },
  {
    "Location": "Charleston Slough",
    "Date": "09-28-2005",
    "Scientific Name": "Porzana carolina",
    "Common Name": "Sora",
    "Filename": "2005-09-28-sora.jpg",
    "County": "Santa Clara",
    "State/Province": "US-CA"
  },
  {
    "Location": "Foster City Radio Tower",
    "Date": "10-10-2005",
    "Scientific Name": "Rynchops niger",
    "Common Name": "Black Skimmer",
    "Filename": "2005-10-10-blkski.jpg",
    "County": "San Mateo",
    "State/Province": "US-CA"
  },
  {
    "Location": "Los Gatos Creek County Park (aka Oka Ponds)",
    "Date": "11-09-2005",
    "Scientific Name": "Colaptes auratus",
    "Common Name": "Northern Flicker",
    "Filename": "2005-11-09-norfli.jpg",
    "County": "Santa Clara",
    "State/Province": "US-CA"
  },
  {
    "Location": "Los Gatos Creek County Park (aka Oka Ponds)",
    "Date": "11-09-2005",
    "Scientific Name": "Actitis macularius",
    "Common Name": "Spotted Sandpiper",
    "Filename": "2005-11-09-sptsan.jpg",
    "County": "Santa Clara",
    "State/Province": "US-CA"
  },
  {
    "Location": "Los Gatos Creek County Park (aka Oka Ponds)",
    "Date": "11-09-2005",
    "Scientific Name": "Calypte anna",
    "Common Name": "Anna's Hummingbird",
    "Filename": "2005-11-09-annhum.jpg",
    "County": "Santa Clara",
    "State/Province": "US-CA"
  },
  {
    "Location": "Charleston Slough",
    "Date": "11-03-2005",
    "Scientific Name": "Phalacrocorax auritus",
    "Common Name": "Double-crested Cormorant",
    "Filename": "2005-11-03-doccor.jpg",
    "County": "Santa Clara",
    "State/Province": "US-CA"
  },
  {
    "Location": "Charleston Slough",
    "Date": "11-03-2005",
    "Scientific Name": "Anas strepera",
    "Common Name": "Gadwall",
    "Filename": "2005-11-03-gadwal.jpg",
    "County": "Santa Clara",
    "State/Province": "US-CA"
  },
  {
    "Location": "Charleston Slough",
    "Date": "11-03-2005",
    "Scientific Name": "Nycticorax nycticorax",
    "Common Name": "Black-crowned Night-Heron",
    "Filename": "2005-11-03-bcnher.jpg",
    "County": "Santa Clara",
    "State/Province": "US-CA"
  },
  {
    "Location": "Coyote Creek Field Station",
    "Date": "11-16-2005",
    "Scientific Name": "Sturnella neglecta",
    "Common Name": "Western Meadowlark",
    "Filename": "2005-11-16-wesmea.jpg",
    "County": "Santa Clara",
    "State/Province": "US-CA"
  },
  {
    "Location": "Bosque del Apache NWR",
    "Date": "11-27-2005",
    "Scientific Name": "Picoides scalaris",
    "Common Name": "Ladder-backed Woodpecker",
    "Filename": "2005-11-27-labwoo.jpg",
    "County": "Socorro",
    "State/Province": "US-NM"
  },
  {
    "Location": "Bosque del Apache NWR",
    "Date": "11-28-2005",
    "Scientific Name": "Chen caerulescens",
    "Common Name": "Snow Goose",
    "Filename": "2005-11-28-snogoo.jpg",
    "County": "Socorro",
    "State/Province": "US-NM"
  },
  {
    "Location": "Bosque del Apache NWR",
    "Date": "11-28-2005",
    "Scientific Name": "Setophaga coronata",
    "Common Name": "Yellow-rumped Warbler",
    "Filename": "2005-11-28-yerwar.jpg",
    "County": "Socorro",
    "State/Province": "US-NM"
  },
  {
    "Location": "Bosque del Apache NWR",
    "Date": "11-28-2005",
    "Scientific Name": "Aythya collaris",
    "Common Name": "Ring-necked Duck",
    "Filename": "2005-11-28-rinduc.jpg",
    "County": "Socorro",
    "State/Province": "US-NM"
  },
  {
    "Location": "Bosque del Apache NWR",
    "Date": "11-28-2005",
    "Scientific Name": "Grus canadensis",
    "Common Name": "Sandhill Crane",
    "Filename": "2005-11-28-sancra.jpg",
    "County": "Socorro",
    "State/Province": "US-NM"
  },
  {
    "Location": "Bosque del Apache NWR",
    "Date": "11-29-2005",
    "Scientific Name": "Gallinago delicata",
    "Common Name": "Wilson's Snipe",
    "Filename": "2005-11-29-wilsni.jpg",
    "County": "Socorro",
    "State/Province": "US-NM"
  },
  {
    "Location": "Bosque del Apache NWR",
    "Date": "11-29-2005",
    "Scientific Name": "Zonotrichia leucophrys",
    "Common Name": "White-crowned Sparrow",
    "Filename": "2005-11-29-whcspa.jpg",
    "County": "Socorro",
    "State/Province": "US-NM"
  },
  {
    "Location": "Bosque del Apache NWR",
    "Date": "11-29-2005",
    "Scientific Name": "Cardinalis sinuatus",
    "Common Name": "Pyrrhuloxia",
    "Filename": "2005-11-29-pyrrhu.jpg",
    "County": "Socorro",
    "State/Province": "US-NM"
  },
  {
    "Location": "Shoreline Lake",
    "Date": "12-07-2005",
    "Scientific Name": "Melanitta perspicillata",
    "Common Name": "Surf Scoter",
    "Filename": "2005-12-07-sursco.jpg",
    "County": "Santa Clara",
    "State/Province": "US-CA"
  },
  {
    "Location": "Shoreline Lake",
    "Date": "12-07-2005",
    "Scientific Name": "Podilymbus podiceps",
    "Common Name": "Pied-billed Grebe",
    "Filename": "2005-12-07-pibgre.jpg",
    "County": "Santa Clara",
    "State/Province": "US-CA"
  },
  {
    "Location": "Shoreline Lake",
    "Date": "12-07-2005",
    "Scientific Name": "Phasianus colchicus",
    "Common Name": "Ring-necked Pheasant",
    "Filename": "2005-12-07-rinphe.jpg",
    "County": "Santa Clara",
    "State/Province": "US-CA"
  },
  {
    "Location": "Charleston Slough",
    "Date": "12-07-2005",
    "Scientific Name": "Tringa semipalmata",
    "Common Name": "Willet",
    "Filename": "2005-12-07-willet.jpg",
    "County": "Santa Clara",
    "State/Province": "US-CA"
  },
  {
    "Location": "Palo Alto Duck Pond",
    "Date": "01-01-2006",
    "Scientific Name": "Larus californicus",
    "Common Name": "California Gull",
    "Filename": "2006-01-01-calgul.jpg",
    "County": "Santa Clara",
    "State/Province": "US-CA"
  },
  {
    "Location": "Tidelands Park",
    "Date": "01-05-2006",
    "Scientific Name": "Aechmophorus clarkii",
    "Common Name": "Clark's Grebe",
    "Filename": "2006-01-05-clagre.jpg",
    "County": "San Luis Obispo",
    "State/Province": "US-CA"
  },
  {
    "Location": "Sunnyvale Baylands",
    "Date": "01-07-2006",
    "Scientific Name": "Ardea alba",
    "Common Name": "Great Egret",
    "Filename": "2006-01-07-greegr.jpg",
    "County": "Santa Clara",
    "State/Province": "US-CA"
  },
  {
    "Location": "Ogier Ponds",
    "Date": "01-08-2006",
    "Scientific Name": "Larus hyperboreus",
    "Common Name": "Glaucous Gull",
    "Filename": "2006-01-08-glagul.jpg",
    "County": "Santa Clara",
    "State/Province": "US-CA"
  },
  {
    "Location": "Ogier Ponds",
    "Date": "01-08-2006",
    "Scientific Name": "Picoides nuttallii",
    "Common Name": "Nuttall's Woodpecker",
    "Filename": "2006-01-08-nutwoo.jpg",
    "County": "Santa Clara",
    "State/Province": "US-CA"
  },
  {
    "Location": "Ogier Ponds",
    "Date": "01-08-2006",
    "Scientific Name": "Pandion haliaetus",
    "Common Name": "Osprey",
    "Filename": "2006-01-08-osprey.jpg",
    "County": "Santa Clara",
    "State/Province": "US-CA"
  },
  {
    "Location": "Ogier Ponds",
    "Date": "01-08-2006",
    "Scientific Name": "Aythya collaris",
    "Common Name": "Ring-necked Duck",
    "Filename": "2006-01-08-rinduc.jpg",
    "County": "Santa Clara",
    "State/Province": "US-CA"
  },
  {
    "Location": "Ogier Ponds",
    "Date": "01-08-2006",
    "Scientific Name": "Aythya americana",
    "Common Name": "Redhead",
    "Filename": "2006-01-08-redhea.jpg",
    "County": "Santa Clara",
    "State/Province": "US-CA"
  },
  {
    "Location": "Ogier Ponds",
    "Date": "01-08-2006",
    "Scientific Name": "Picoides pubescens",
    "Common Name": "Downy Woodpecker",
    "Filename": "2006-01-08-dowwoo.jpg",
    "County": "Santa Clara",
    "State/Province": "US-CA"
  },
  {
    "Location": "Coyote Creek Field Station",
    "Date": "01-07-2006",
    "Scientific Name": "Picoides pubescens",
    "Common Name": "Downy Woodpecker",
    "Filename": "2006-01-07-dowwoo.jpg",
    "County": "Santa Clara",
    "State/Province": "US-CA"
  },
  {
    "Location": "Coyote Hills Regional Park",
    "Date": "01-12-2006",
    "Scientific Name": "Psaltriparus minimus",
    "Common Name": "Bushtit",
    "Filename": "2006-01-12-bushti.jpg",
    "County": "Alameda",
    "State/Province": "US-CA"
  },
  {
    "Location": "Flannery Road",
    "Date": "01-14-2006",
    "Scientific Name": "Buteo regalis",
    "Common Name": "Ferruginous Hawk",
    "Filename": "2006-01-14-ferhaw.jpg",
    "County": "Solano",
    "State/Province": "US-CA"
  },
  {
    "Location": "Flannery Road",
    "Date": "01-14-2006",
    "Scientific Name": "Falco sparverius",
    "Common Name": "American Kestrel",
    "Filename": "2006-01-14-amekes.jpg",
    "County": "Solano",
    "State/Province": "US-CA"
  },
  {
    "Location": "Liberty Island Road",
    "Date": "01-14-2006",
    "Scientific Name": "Bubo scandiacus",
    "Common Name": "Snowy Owl",
    "Filename": "2006-01-14-snoowl.jpg",
    "County": "Solano",
    "State/Province": "US-CA"
  },
  {
    "Location": "Flannery Road",
    "Date": "01-14-2006",
    "Scientific Name": "Eremophila alpestris",
    "Common Name": "Horned Lark",
    "Filename": "2006-01-14-horlar.jpg",
    "County": "Solano",
    "State/Province": "US-CA"
  },
  {
    "Location": "Liberty Island Road",
    "Date": "01-14-2006",
    "Scientific Name": "Passerculus sandwichensis",
    "Common Name": "Savannah Sparrow",
    "Filename": "2006-01-14-savspa.jpg",
    "County": "Solano",
    "State/Province": "US-CA"
  },
  {
    "Location": "Fishermans Wharf",
    "Date": "01-21-2006",
    "Scientific Name": "Phalacrocorax penicillatus",
    "Common Name": "Brandt's Cormorant",
    "Filename": "2006-01-21-bracor.jpg",
    "County": "Monterey",
    "State/Province": "US-CA"
  },
  {
    "Location": "Fishermans Wharf",
    "Date": "01-21-2006",
    "Scientific Name": "Histrionicus histrionicus",
    "Common Name": "Harlequin Duck",
    "Filename": "2006-01-21-harduc.jpg",
    "County": "Monterey",
    "State/Province": "US-CA"
  },
  {
    "Location": "Charcoal Road",
    "Date": "01-26-2006",
    "Scientific Name": "Patagioenas fasciata",
    "Common Name": "Band-tailed Pigeon",
    "Filename": "2006-01-26-batpig.jpg",
    "County": "Santa Clara",
    "State/Province": "US-CA"
  },
  {
    "Location": "Shoreline Lake",
    "Date": "01-29-2006",
    "Scientific Name": "Bucephala clangula",
    "Common Name": "Common Goldeneye",
    "Filename": "2006-01-29-comgol.jpg",
    "County": "Santa Clara",
    "State/Province": "US-CA"
  },
  {
    "Location": "Donald M. Somers Water Pollution Control Plant",
    "Date": "12-14-2005",
    "Scientific Name": "Cistothorus palustris",
    "Common Name": "Marsh Wren",
    "Filename": "2005-12-14-marwre.jpg",
    "County": "Santa Clara",
    "State/Province": "US-CA"
  },
  {
    "Location": "Shoreline Lake",
    "Date": "02-02-2006",
    "Scientific Name": "Aythya valisineria",
    "Common Name": "Canvasback",
    "Filename": "2006-02-02-canvas.jpg",
    "County": "Santa Clara",
    "State/Province": "US-CA"
  },
  {
    "Location": "Castle Rock State Park",
    "Date": "02-20-2006",
    "Scientific Name": "Cyanocitta stelleri",
    "Common Name": "Steller's Jay",
    "Filename": "2006-02-20-stejay.jpg",
    "County": "Santa Cruz",
    "State/Province": "US-CA"
  },
  {
    "Location": "Grant Ranch County Park",
    "Date": "02-18-2006",
    "Scientific Name": "Sialia mexicana",
    "Common Name": "Western Bluebird",
    "Filename": "2006-02-18-wesblu.jpg",
    "County": "Santa Clara",
    "State/Province": "US-CA"
  },
  {
    "Location": "Grant Ranch County Park",
    "Date": "02-18-2006",
    "Scientific Name": "Catharus guttatus",
    "Common Name": "Hermit Thrush",
    "Filename": "2006-02-18-herthr.jpg",
    "County": "Santa Clara",
    "State/Province": "US-CA"
  },
  {
    "Location": "Don Edwards Center",
    "Date": "02-16-2006",
    "Scientific Name": "Passerella iliaca",
    "Common Name": "Fox Sparrow",
    "Filename": "2006-02-16-foxspa.jpg",
    "County": "Santa Clara",
    "State/Province": "US-CA"
  },
  {
    "Location": "Tidelands Park",
    "Date": "01-05-2006",
    "Scientific Name": "Anthus rubescens",
    "Common Name": "American Pipit",
    "Filename": "2006-01-05-amepip.jpg",
    "County": "San Luis Obispo",
    "State/Province": "US-CA"
  },
  {
    "Location": "Monte Bello Open Space Preserve",
    "Date": "03-11-2006",
    "Scientific Name": "Chamaea fasciata",
    "Common Name": "Wrentit",
    "Filename": "2006-03-11-wrenti.jpg",
    "County": "Santa Clara",
    "State/Province": "US-CA"
  },
  {
    "Location": "Coyote Hills Regional Park",
    "Date": "03-09-2006",
    "Scientific Name": "Elanus leucurus",
    "Common Name": "White-tailed Kite",
    "Filename": "2006-03-09-whtkit.jpg",
    "County": "Alameda",
    "State/Province": "US-CA"
  },
  {
    "Location": "Charleston Slough",
    "Date": "03-10-2006",
    "Scientific Name": "Calypte anna",
    "Common Name": "Anna's Hummingbird",
    "Filename": "2006-03-10-annhum.jpg",
    "County": "Santa Clara",
    "State/Province": "US-CA"
  },
  {
    "Location": "Our House",
    "Date": "03-12-2006",
    "Scientific Name": "Bombycilla cedrorum",
    "Common Name": "Cedar Waxwing",
    "Filename": "2006-03-12-cedwax.jpg",
    "County": "Santa Clara",
    "State/Province": "US-CA"
  },
  {
    "Location": "Andrew Molera",
    "Date": "03-18-2006",
    "Scientific Name": "Vireo huttoni",
    "Common Name": "Hutton's Vireo",
    "Filename": "2006-03-18-hutvir.jpg",
    "County": "Monterey",
    "State/Province": "US-CA"
  },
  {
    "Location": "Rocky Mountain NP (Larimer Co.) (Please consider using more specific locations.)",
    "Date": "02-12-2006",
    "Scientific Name": "Perisoreus canadensis",
    "Common Name": "Gray Jay",
    "Filename": "2006-02-12-gryjay.jpg",
    "County": "Larimer",
    "State/Province": "US-CO"
  },
  {
    "Location": "Rocky Mountain NP (Larimer Co.) (Please consider using more specific locations.)",
    "Date": "02-12-2006",
    "Scientific Name": "Pica hudsonia",
    "Common Name": "Black-billed Magpie",
    "Filename": "2006-02-12-bkbmag.jpg",
    "County": "Larimer",
    "State/Province": "US-CO"
  },
  {
    "Location": "Marlin Park",
    "Date": "03-30-2006",
    "Scientific Name": "Megaceryle alcyon",
    "Common Name": "Belted Kingfisher",
    "Filename": "2006-03-30-belkin.jpg",
    "County": "San Mateo",
    "State/Province": "US-CA"
  },
  {
    "Location": "Lake Merritt",
    "Date": "04-06-2006",
    "Scientific Name": "Podiceps nigricollis",
    "Common Name": "Eared Grebe",
    "Filename": "2006-04-06-eargre.jpg",
    "County": "Alameda",
    "State/Province": "US-CA"
  },
  {
    "Location": "Charleston Slough",
    "Date": "04-15-2006",
    "Scientific Name": "Melospiza melodia",
    "Common Name": "Song Sparrow",
    "Filename": "2006-04-15-sonspa.jpg",
    "County": "Santa Clara",
    "State/Province": "US-CA"
  },
  {
    "Location": "McClellan Ranch Preserve",
    "Date": "04-15-2006",
    "Scientific Name": "Bombycilla cedrorum",
    "Common Name": "Cedar Waxwing",
    "Filename": "2006-04-15-cedwax.jpg",
    "County": "Santa Clara",
    "State/Province": "US-CA"
  },
  {
    "Location": "McClellan Ranch Preserve",
    "Date": "04-15-2006",
    "Scientific Name": "Pheucticus melanocephalus",
    "Common Name": "Black-headed Grosbeak",
    "Filename": "2006-04-15-bkhgro.jpg",
    "County": "Santa Clara",
    "State/Province": "US-CA"
  },
  {
    "Location": "Foster City Radio Tower",
    "Date": "04-19-2006",
    "Scientific Name": "Calidris alpina",
    "Common Name": "Dunlin",
    "Filename": "2006-04-19-dunlin.jpg",
    "County": "San Mateo",
    "State/Province": "US-CA"
  },
  {
    "Location": "McClellan Ranch Preserve",
    "Date": "04-20-2006",
    "Scientific Name": "Icterus cucullatus",
    "Common Name": "Hooded Oriole",
    "Filename": "2006-04-20-hooori.jpg",
    "County": "Santa Clara",
    "State/Province": "US-CA"
  },
  {
    "Location": "McClellan Ranch Preserve",
    "Date": "04-20-2006",
    "Scientific Name": "Sialia mexicana",
    "Common Name": "Western Bluebird",
    "Filename": "2006-04-20-wesblu.jpg",
    "County": "Santa Clara",
    "State/Province": "US-CA"
  },
  {
    "Location": "McClellan Ranch Preserve",
    "Date": "04-20-2006",
    "Scientific Name": "Melospiza lincolnii",
    "Common Name": "Lincoln's Sparrow",
    "Filename": "2006-04-20-linspa.jpg",
    "County": "Santa Clara",
    "State/Province": "US-CA"
  },
  {
    "Location": "Carmel River",
    "Date": "04-29-2006",
    "Scientific Name": "Haematopus bachmani",
    "Common Name": "Black Oystercatcher",
    "Filename": "2006-04-29-blkoys.jpg",
    "County": "Monterey",
    "State/Province": "US-CA"
  },
  {
    "Location": "Santa Cruz",
    "Date": "04-28-2006",
    "Scientific Name": "Vireo gilvus",
    "Common Name": "Warbling Vireo",
    "Filename": "2006-04-28-warvir.jpg",
    "County": "Santa Cruz",
    "State/Province": "US-CA"
  },
  {
    "Location": "Elkhorn Slough",
    "Date": "04-30-2006",
    "Scientific Name": "Charadrius semipalmatus",
    "Common Name": "Semipalmated Plover",
    "Filename": "2006-04-30-semplo.jpg",
    "County": "Monterey",
    "State/Province": "US-CA"
  },
  {
    "Location": "Moss Landing State Beach",
    "Date": "04-30-2006",
    "Scientific Name": "Stelgidopteryx serripennis",
    "Common Name": "Northern Rough-winged Swallow",
    "Filename": "2006-04-30-nrwswa.jpg",
    "County": "Monterey",
    "State/Province": "US-CA"
  },
  {
    "Location": "Hidden Villa",
    "Date": "05-11-2006",
    "Scientific Name": "Myiarchus cinerascens",
    "Common Name": "Ash-throated Flycatcher",
    "Filename": "2006-05-11-astfly.jpg",
    "County": "Santa Clara",
    "State/Province": "US-CA"
  },
  {
    "Location": "Hidden Villa",
    "Date": "05-11-2006",
    "Scientific Name": "Chamaea fasciata",
    "Common Name": "Wrentit",
    "Filename": "2006-05-11-wrenti.jpg",
    "County": "Santa Clara",
    "State/Province": "US-CA"
  },
  {
    "Location": "Don Edwards Center",
    "Date": "04-27-2006",
    "Scientific Name": "Geothlypis trichas",
    "Common Name": "Common Yellowthroat",
    "Filename": "2006-04-27-comyel.jpg",
    "County": "Santa Clara",
    "State/Province": "US-CA"
  },
  {
    "Location": "Salinas River State Beach",
    "Date": "05-13-2006",
    "Scientific Name": "Charadrius nivosus",
    "Common Name": "Snowy Plover",
    "Filename": "2006-05-13-snoplo.jpg",
    "County": "Monterey",
    "State/Province": "US-CA"
  },
  {
    "Location": "Elkhorn Slough",
    "Date": "05-13-2006",
    "Scientific Name": "Cepphus columba",
    "Common Name": "Pigeon Guillemot",
    "Filename": "2006-05-13-piggui.jpg",
    "County": "Monterey",
    "State/Province": "US-CA"
  },
  {
    "Location": "Elkhorn Slough",
    "Date": "05-13-2006",
    "Scientific Name": "Gavia immer",
    "Common Name": "Common Loon",
    "Filename": "2006-05-13-comloo.jpg",
    "County": "Monterey",
    "State/Province": "US-CA"
  },
  {
    "Location": "Zmudowski SB",
    "Date": "05-13-2006",
    "Scientific Name": "Quiscalus mexicanus",
    "Common Name": "Great-tailed Grackle",
    "Filename": "2006-05-13-grtgra.jpg",
    "County": "Monterey",
    "State/Province": "US-CA"
  },
  {
    "Location": "Butterbredt Spring",
    "Date": "05-26-2006",
    "Scientific Name": "Catharus ustulatus",
    "Common Name": "Swainson's Thrush",
    "Filename": "2006-05-26-swathr.jpg",
    "County": "Kern",
    "State/Province": "US-CA"
  },
  {
    "Location": "Butterbredt Spring",
    "Date": "05-27-2006",
    "Scientific Name": "Setophaga ruticilla",
    "Common Name": "American Redstart",
    "Filename": "2006-05-27-amered.jpg",
    "County": "Kern",
    "State/Province": "US-CA"
  },
  {
    "Location": "California City",
    "Date": "05-27-2006",
    "Scientific Name": "Xanthocephalus xanthocephalus",
    "Common Name": "Yellow-headed Blackbird",
    "Filename": "2006-05-27-yehbla.jpg",
    "County": "Kern",
    "State/Province": "US-CA"
  },
  {
    "Location": "Jawbone Canyon Road",
    "Date": "05-28-2006",
    "Scientific Name": "Sturnella neglecta",
    "Common Name": "Western Meadowlark",
    "Filename": "2006-05-28-wesmea.jpg",
    "County": "Kern",
    "State/Province": "US-CA"
  },
  {
    "Location": "Butterbredt Spring",
    "Date": "05-29-2006",
    "Scientific Name": "Alectoris chukar",
    "Common Name": "Chukar",
    "Filename": "2006-05-29-chukar.jpg",
    "County": "Kern",
    "State/Province": "US-CA"
  },
  {
    "Location": "Kelso Valley Road",
    "Date": "05-29-2006",
    "Scientific Name": "Amphispiza bilineata",
    "Common Name": "Black-throated Sparrow",
    "Filename": "2006-05-29-bktspa.jpg",
    "County": "Kern",
    "State/Province": "US-CA"
  },
  {
    "Location": "Kelso Valley Road",
    "Date": "05-29-2006",
    "Scientific Name": "Artemisiospiza belli",
    "Common Name": "Bell's Sparrow",
    "Filename": "2006-05-29-sagspa.jpg",
    "County": "Kern",
    "State/Province": "US-CA"
  },
  {
    "Location": "Joseph D. Grant County Park",
    "Date": "05-21-2006",
    "Scientific Name": "Chondestes grammacus",
    "Common Name": "Lark Sparrow",
    "Filename": "2006-05-21-larspa.jpg",
    "County": "Santa Clara",
    "State/Province": "US-CA"
  },
  {
    "Location": "San Antonio Valley",
    "Date": "05-21-2006",
    "Scientific Name": "Tachycineta thalassina",
    "Common Name": "Violet-green Swallow",
    "Filename": "2006-05-21-vigswa.jpg",
    "County": "Santa Clara",
    "State/Province": "US-CA"
  },
  {
    "Location": "Rancho San Antonio",
    "Date": "06-03-2006",
    "Scientific Name": "Megascops kennicottii",
    "Common Name": "Western Screech-Owl",
    "Filename": "2006-06-03-wesowl.jpg",
    "County": "Santa Clara",
    "State/Province": "US-CA"
  },
  {
    "Location": "Palo Alto Duck Pond",
    "Date": "06-15-2006",
    "Scientific Name": "Oxyura jamaicensis",
    "Common Name": "Ruddy Duck",
    "Filename": "2006-06-15-rudduc.jpg",
    "County": "Santa Clara",
    "State/Province": "US-CA"
  },
  {
    "Location": "Hayward Regional Shoreline",
    "Date": "07-21-2006",
    "Scientific Name": "Calidris canutus",
    "Common Name": "Red Knot",
    "Filename": "2006-07-21-redkno.jpg",
    "County": "Alameda",
    "State/Province": "US-CA"
  },
  {
    "Location": "Don Edwards Center",
    "Date": "07-13-2006",
    "Scientific Name": "Charadrius vociferus",
    "Common Name": "Killdeer",
    "Filename": "2006-07-13-killde.jpg",
    "County": "Santa Clara",
    "State/Province": "US-CA"
  },
  {
    "Location": "Shoreline Lake",
    "Date": "08-03-2006",
    "Scientific Name": "Athene cunicularia",
    "Common Name": "Burrowing Owl",
    "Filename": "2006-08-03-burowl.jpg",
    "County": "Santa Clara",
    "State/Province": "US-CA"
  },
  {
    "Location": "Byron Hot Springs Road",
    "Date": "02-19-2007",
    "Scientific Name": "Asio flammeus",
    "Common Name": "Short-eared Owl",
    "Filename": "2007-02-19-sheowl.jpg",
    "County": "Contra Costa",
    "State/Province": "US-CA"
  },
  {
    "Location": "Hawk Hill",
    "Date": "10-08-2006",
    "Scientific Name": "Buteo platypterus",
    "Common Name": "Broad-winged Hawk",
    "Filename": "2006-10-08-brwhaw.jpg",
    "County": "Marin",
    "State/Province": "US-CA"
  },
  {
    "Location": "Hawk Hill",
    "Date": "10-08-2006",
    "Scientific Name": "Falco mexicanus",
    "Common Name": "Prairie Falcon",
    "Filename": "2006-10-08-prafal.jpg",
    "County": "Marin",
    "State/Province": "US-CA"
  },
  {
    "Location": "Sutro Heights Park",
    "Date": "10-08-2006",
    "Scientific Name": "Regulus satrapa",
    "Common Name": "Golden-crowned Kinglet",
    "Filename": "2006-10-08-gockin.jpg",
    "County": "San Francisco",
    "State/Province": "US-CA"
  },
  {
    "Location": "Sutro Heights Park",
    "Date": "10-08-2006",
    "Scientific Name": "Setophaga citrina",
    "Common Name": "Hooded Warbler",
    "Filename": "2006-10-08-hoowar.jpg",
    "County": "San Francisco",
    "State/Province": "US-CA"
  },
  {
    "Location": "Elkhorn Slough",
    "Date": "10-14-2006",
    "Scientific Name": "Uria aalge",
    "Common Name": "Common Murre",
    "Filename": "2006-10-14-commur.jpg",
    "County": "Monterey",
    "State/Province": "US-CA"
  },
  {
    "Location": "MLK Jr. Regional Shoreline--Arrowhead Marsh",
    "Date": "11-16-2006",
    "Scientific Name": "Rallus obsoletus",
    "Common Name": "Ridgway's Rail",
    "Filename": "2006-11-16-clarai.jpg",
    "County": "Alameda",
    "State/Province": "US-CA"
  },
  {
    "Location": "Ogier Ponds",
    "Date": "11-24-2006",
    "Scientific Name": "Pipilo chlorurus",
    "Common Name": "Green-tailed Towhee",
    "Filename": "2006-11-24-gnttow.jpg",
    "County": "Santa Clara",
    "State/Province": "US-CA"
  },
  {
    "Location": "Venice Beach",
    "Date": "11-30-2006",
    "Scientific Name": "Chroicocephalus philadelphia",
    "Common Name": "Bonaparte's Gull",
    "Filename": "2006-11-30-bongul.jpg",
    "County": "Los Angeles",
    "State/Province": "US-CA"
  },
  {
    "Location": "Saddle Creek Park",
    "Date": "12-23-2006",
    "Scientific Name": "Aramus guarauna",
    "Common Name": "Limpkin",
    "Filename": "2006-12-23-limpki.jpg",
    "County": "Polk",
    "State/Province": "US-FL"
  },
  {
    "Location": "Harry P. Leu Gardens",
    "Date": "12-23-2006",
    "Scientific Name": "Butorides virescens",
    "Common Name": "Green Heron",
    "Filename": "2006-12-23-grnher.jpg",
    "County": "Orange",
    "State/Province": "US-FL"
  },
  {
    "Location": "Venice Rookery",
    "Date": "12-27-2006",
    "Scientific Name": "Anhinga anhinga",
    "Common Name": "Anhinga",
    "Filename": "2006-12-27-anhing.jpg",
    "County": "Sarasota",
    "State/Province": "US-FL"
  },
  {
    "Location": "Venice Rookery",
    "Date": "12-27-2006",
    "Scientific Name": "Mycteria americana",
    "Common Name": "Wood Stork",
    "Filename": "2006-12-27-woosto.jpg",
    "County": "Sarasota",
    "State/Province": "US-FL"
  },
  {
    "Location": "Ding Darling NWR",
    "Date": "12-28-2006",
    "Scientific Name": "Platalea ajaja",
    "Common Name": "Roseate Spoonbill",
    "Filename": "2006-12-28-rosspo.jpg",
    "County": "Lee",
    "State/Province": "US-FL"
  },
  {
    "Location": "Mead Gardens",
    "Date": "12-30-2006",
    "Scientific Name": "Dryocopus pileatus",
    "Common Name": "Pileated Woodpecker",
    "Filename": "2006-12-30-pilwoo.jpg",
    "County": "Orange",
    "State/Province": "US-FL"
  },
  {
    "Location": "Moss Landing State Beach",
    "Date": "01-21-2007",
    "Scientific Name": "Clangula hyemalis",
    "Common Name": "Long-tailed Duck",
    "Filename": "2007-01-21-lotduc.jpg",
    "County": "Monterey",
    "State/Province": "US-CA"
  },
  {
    "Location": "Panoche Road",
    "Date": "01-26-2007",
    "Scientific Name": "Falco mexicanus",
    "Common Name": "Prairie Falcon",
    "Filename": "2007-01-26-prafal.jpg",
    "County": "San Benito",
    "State/Province": "US-CA"
  },
  {
    "Location": "Mercey Hot Springs",
    "Date": "01-26-2007",
    "Scientific Name": "Asio otus",
    "Common Name": "Long-eared Owl",
    "Filename": "2007-01-26-loeowl.jpg",
    "County": "Fresno",
    "State/Province": "US-CA"
  },
  {
    "Location": "Ryer Island",
    "Date": "01-27-2007",
    "Scientific Name": "Megaceryle alcyon",
    "Common Name": "Belted Kingfisher",
    "Filename": "2007-01-27-belkin.jpg",
    "County": "Solano",
    "State/Province": "US-CA"
  },
  {
    "Location": "Spring Lakes",
    "Date": "02-01-2007",
    "Scientific Name": "Cygnus atratus",
    "Common Name": "Black Swan",
    "Filename": "2007-02-01-blkswa.jpg",
    "County": "Santa Cruz",
    "State/Province": "US-CA"
  },
  {
    "Location": "Spring Lakes",
    "Date": "02-01-2007",
    "Scientific Name": "Butorides virescens",
    "Common Name": "Green Heron",
    "Filename": "2007-02-01-grnher.jpg",
    "County": "Santa Cruz",
    "State/Province": "US-CA"
  },
  {
    "Location": "Pt. Reyes National Seashore",
    "Date": "03-10-2007",
    "Scientific Name": "Cathartes aura",
    "Common Name": "Turkey Vulture",
    "Filename": "2007-03-10-turvul.jpg",
    "County": "Marin",
    "State/Province": "US-CA"
  },
  {
    "Location": "El Polin Loop",
    "Date": "03-15-2007",
    "Scientific Name": "Selasphorus sasin",
    "Common Name": "Allen's Hummingbird",
    "Filename": "2007-03-15-allhum.jpg",
    "County": "San Francisco",
    "State/Province": "US-CA"
  },
  {
    "Location": "Rancho San Antonio",
    "Date": "03-22-2007",
    "Scientific Name": "Meleagris gallopavo",
    "Common Name": "Wild Turkey",
    "Filename": "2007-03-22-wiltur.jpg",
    "County": "Santa Clara",
    "State/Province": "US-CA"
  },
  {
    "Location": "Rancho San Antonio",
    "Date": "03-22-2007",
    "Scientific Name": "Melanerpes formicivorus",
    "Common Name": "Acorn Woodpecker",
    "Filename": "2007-03-22-acowoo.jpg",
    "County": "Santa Clara",
    "State/Province": "US-CA"
  },
  {
    "Location": "Ed Levin County Park Sandy Wool",
    "Date": "04-12-2007",
    "Scientific Name": "Ammodramus savannarum",
    "Common Name": "Grasshopper Sparrow",
    "Filename": "2007-04-12-graspa.jpg",
    "County": "Santa Clara",
    "State/Province": "US-CA"
  },
  {
    "Location": "Stevens Creek County Park Villa Maria",
    "Date": "04-19-2007",
    "Scientific Name": "Turdus migratorius",
    "Common Name": "American Robin",
    "Filename": "2007-04-19-amerob.jpg",
    "County": "Santa Clara",
    "State/Province": "US-CA"
  },
  {
    "Location": "Shoreline Lake",
    "Date": "04-05-2007",
    "Scientific Name": "Icterus bullockii",
    "Common Name": "Bullock's Oriole",
    "Filename": "2007-04-05-bulori.jpg",
    "County": "Santa Clara",
    "State/Province": "US-CA"
  },
  {
    "Location": "Palo Alto Duck Pond",
    "Date": "04-05-2007",
    "Scientific Name": "Aechmophorus clarkii",
    "Common Name": "Clark's Grebe",
    "Filename": "2007-04-05-clagre.jpg",
    "County": "Santa Clara",
    "State/Province": "US-CA"
  },
  {
    "Location": "Monte Bello Open Space Preserve",
    "Date": "05-03-2007",
    "Scientific Name": "Passerina amoena",
    "Common Name": "Lazuli Bunting",
    "Filename": "2007-05-03-lazbun.jpg",
    "County": "Santa Clara",
    "State/Province": "US-CA"
  },
  {
    "Location": "Monte Bello Open Space Preserve",
    "Date": "05-03-2007",
    "Scientific Name": "Baeolophus inornatus",
    "Common Name": "Oak Titmouse",
    "Filename": "2007-05-03-oaktit.jpg",
    "County": "Santa Clara",
    "State/Province": "US-CA"
  },
  {
    "Location": "Sierra Azul Regional OSP",
    "Date": "05-31-2007",
    "Scientific Name": "Spizella atrogularis",
    "Common Name": "Black-chinned Sparrow",
    "Filename": "2007-05-31-bkcspa.jpg",
    "County": "Santa Clara",
    "State/Province": "US-CA"
  },
  {
    "Location": "Yuba Pass",
    "Date": "06-12-2007",
    "Scientific Name": "Phalaenoptilus nuttallii",
    "Common Name": "Common Poorwill",
    "Filename": "2007-06-12-compoo.jpg",
    "County": "Sierra",
    "State/Province": "US-CA"
  },
  {
    "Location": "Yuba Pass",
    "Date": "06-13-2007",
    "Scientific Name": "Coccothraustes vespertinus",
    "Common Name": "Evening Grosbeak",
    "Filename": "2007-06-13-evegro.jpg",
    "County": "Sierra",
    "State/Province": "US-CA"
  },
  {
    "Location": "Leduc",
    "Date": "07-01-2007",
    "Scientific Name": "Podiceps grisegena",
    "Common Name": "Red-necked Grebe",
    "Filename": "2007-07-01-rengre.jpg",
    "County": "Edmonton",
    "State/Province": "CA-AB"
  },
  {
    "Location": "Cold Lake Provincial Park",
    "Date": "07-04-2007",
    "Scientific Name": "Setophaga magnolia",
    "Common Name": "Magnolia Warbler",
    "Filename": "2007-07-04-magwar.jpg",
    "County": "St. Paul",
    "State/Province": "CA-AB"
  },
  {
    "Location": "Cold Lake Provincial Park",
    "Date": "07-04-2007",
    "Scientific Name": "Loxia leucoptera",
    "Common Name": "White-winged Crossbill",
    "Filename": "2007-07-04-whwcro.jpg",
    "County": "St. Paul",
    "State/Province": "CA-AB"
  },
  {
    "Location": "Sir Winston Churchill Provincial Park",
    "Date": "07-07-2007",
    "Scientific Name": "Ammodramus nelsoni",
    "Common Name": "Nelson's Sparrow",
    "Filename": "2007-07-07-nstspa.jpg",
    "County": "St. Paul",
    "State/Province": "CA-AB"
  },
  {
    "Location": "Slave Lake",
    "Date": "07-08-2007",
    "Scientific Name": "Sphyrapicus varius",
    "Common Name": "Yellow-bellied Sapsucker",
    "Filename": "2007-07-08-yebsap.jpg",
    "County": "Slave Lake",
    "State/Province": "CA-AB"
  },
  {
    "Location": "Jasper National Park",
    "Date": "07-10-2007",
    "Scientific Name": "Lagopus leucura",
    "Common Name": "White-tailed Ptarmigan",
    "Filename": "2007-07-10-whtpta.jpg",
    "County": "Banff",
    "State/Province": "CA-AB"
  },
  {
    "Location": "Monterey Bay",
    "Date": "08-26-2007",
    "Scientific Name": "Phoebastria nigripes",
    "Common Name": "Black-footed Albatross",
    "Filename": "2007-08-26-bkfalb.jpg",
    "County": "Monterey",
    "State/Province": "US-CA"
  },
  {
    "Location": "Pigeon Point",
    "Date": "07-26-2007",
    "Scientific Name": "Cepphus columba",
    "Common Name": "Pigeon Guillemot",
    "Filename": "2007-07-26-piggui.jpg",
    "County": "San Mateo",
    "State/Province": "US-CA"
  },
  {
    "Location": "Berkeley Marina",
    "Date": "09-08-2007",
    "Scientific Name": "Branta bernicla",
    "Common Name": "Brant",
    "Filename": "2007-09-08-brant.jpg",
    "County": "Alameda",
    "State/Province": "US-CA"
  },
  {
    "Location": "Bodega Bay",
    "Date": "09-14-2007",
    "Scientific Name": "Phoebastria nigripes",
    "Common Name": "Black-footed Albatross",
    "Filename": "2007-09-14-bkfalb.jpg",
    "County": "Marin",
    "State/Province": "US-CA"
  },
  {
    "Location": "Bodega Bay",
    "Date": "09-14-2007",
    "Scientific Name": "Oceanodroma homochroa",
    "Common Name": "Ashy Storm-Petrel",
    "Filename": "2007-09-14-asspet.jpg",
    "County": "Marin",
    "State/Province": "US-CA"
  },
  {
    "Location": "Bodega Bay",
    "Date": "09-14-2007",
    "Scientific Name": "Synthliboramphus hypoleucus",
    "Common Name": "Scripps's/Guadalupe Murrelet (Xantus's Murrelet)",
    "Filename": "2007-09-14-xanmur.jpg",
    "County": "Marin",
    "State/Province": "US-CA"
  },
  {
    "Location": "Bodega Bay",
    "Date": "09-14-2007",
    "Scientific Name": "Fratercula cirrhata",
    "Common Name": "Tufted Puffin",
    "Filename": "2007-09-14-tufpuf.jpg",
    "County": "Marin",
    "State/Province": "US-CA"
  },
  {
    "Location": "Bodega Bay",
    "Date": "09-14-2007",
    "Scientific Name": "Xema sabini",
    "Common Name": "Sabine's Gull",
    "Filename": "2007-09-14-sabgul.jpg",
    "County": "Marin",
    "State/Province": "US-CA"
  },
  {
    "Location": "Sierra Valley (SIE Co.)",
    "Date": "06-12-2007",
    "Scientific Name": "Xanthocephalus xanthocephalus",
    "Common Name": "Yellow-headed Blackbird",
    "Filename": "2007-06-12-yehbla.jpg",
    "County": "Sierra",
    "State/Province": "US-CA"
  },
  {
    "Location": "Charleston Slough",
    "Date": "12-19-2007",
    "Scientific Name": "Pelecanus occidentalis",
    "Common Name": "Brown Pelican",
    "Filename": "2007-12-19-brnpel.jpg",
    "County": "Santa Clara",
    "State/Province": "US-CA"
  },
  {
    "Location": "Rural Areas of Champaign County",
    "Date": "12-26-2007",
    "Scientific Name": "Cardinalis cardinalis",
    "Common Name": "Northern Cardinal",
    "Filename": "2007-12-26-norcar.jpg",
    "County": "Champaign",
    "State/Province": "US-IL"
  },
  {
    "Location": "Lake Tohopekaliga",
    "Date": "01-28-2008",
    "Scientific Name": "Coragyps atratus",
    "Common Name": "Black Vulture",
    "Filename": "2008-01-28-blkvul.jpg",
    "County": "Osceola",
    "State/Province": "US-FL"
  },
  {
    "Location": "Lake Tohopekaliga",
    "Date": "01-28-2008",
    "Scientific Name": "Rostrhamus sociabilis",
    "Common Name": "Snail Kite",
    "Filename": "2008-01-28-snakit.jpg",
    "County": "Osceola",
    "State/Province": "US-FL"
  },
  {
    "Location": "Lake Tohopekaliga",
    "Date": "01-28-2008",
    "Scientific Name": "Aramus guarauna",
    "Common Name": "Limpkin",
    "Filename": "2008-01-28-limpki.jpg",
    "County": "Osceola",
    "State/Province": "US-FL"
  },
  {
    "Location": "Lake Tohopekaliga",
    "Date": "01-28-2008",
    "Scientific Name": "Porphyrio martinicus",
    "Common Name": "Purple Gallinule",
    "Filename": "2008-01-28-purgal.jpg",
    "County": "Osceola",
    "State/Province": "US-FL"
  },
  {
    "Location": "Viera Wetlands",
    "Date": "01-27-2008",
    "Scientific Name": "Anas fulvigula",
    "Common Name": "Mottled Duck",
    "Filename": "2008-01-27-motduc.jpg",
    "County": "Brevard",
    "State/Province": "US-FL"
  },
  {
    "Location": "Viera Wetlands",
    "Date": "01-27-2008",
    "Scientific Name": "Anhinga anhinga",
    "Common Name": "Anhinga",
    "Filename": "2008-01-27-anhing.jpg",
    "County": "Brevard",
    "State/Province": "US-FL"
  },
  {
    "Location": "Viera Wetlands",
    "Date": "01-27-2008",
    "Scientific Name": "Botaurus lentiginosus",
    "Common Name": "American Bittern",
    "Filename": "2008-01-27-amebit.jpg",
    "County": "Brevard",
    "State/Province": "US-FL"
  },
  {
    "Location": "Viera Wetlands",
    "Date": "01-27-2008",
    "Scientific Name": "Egretta caerulea",
    "Common Name": "Little Blue Heron",
    "Filename": "2008-01-27-libher.jpg",
    "County": "Brevard",
    "State/Province": "US-FL"
  },
  {
    "Location": "Viera Wetlands",
    "Date": "01-27-2008",
    "Scientific Name": "Egretta tricolor",
    "Common Name": "Tricolored Heron",
    "Filename": "2008-01-27-triher.jpg",
    "County": "Brevard",
    "State/Province": "US-FL"
  },
  {
    "Location": "Lake Cypress",
    "Date": "01-26-2008",
    "Scientific Name": "Eudocimus albus",
    "Common Name": "White Ibis",
    "Filename": "2008-01-26-whiibi.jpg",
    "County": "Osceola",
    "State/Province": "US-FL"
  },
  {
    "Location": "Lake Cypress",
    "Date": "01-26-2008",
    "Scientific Name": "Haliaeetus leucocephalus",
    "Common Name": "Bald Eagle",
    "Filename": "2008-01-26-baleag.jpg",
    "County": "Osceola",
    "State/Province": "US-FL"
  },
  {
    "Location": "Lake Cypress",
    "Date": "01-26-2008",
    "Scientific Name": "Buteo lineatus",
    "Common Name": "Red-shouldered Hawk",
    "Filename": "2008-01-26-reshaw.jpg",
    "County": "Osceola",
    "State/Province": "US-FL"
  },
  {
    "Location": "Lake Cypress",
    "Date": "01-26-2008",
    "Scientific Name": "Caracara cheriway",
    "Common Name": "Crested Caracara",
    "Filename": "2008-01-26-crecar.jpg",
    "County": "Osceola",
    "State/Province": "US-FL"
  },
  {
    "Location": "Lake Cypress",
    "Date": "01-26-2008",
    "Scientific Name": "Strix varia",
    "Common Name": "Barred Owl",
    "Filename": "2008-01-26-brdowl.jpg",
    "County": "Osceola",
    "State/Province": "US-FL"
  },
  {
    "Location": "Lake Cypress",
    "Date": "01-26-2008",
    "Scientific Name": "Sturnella magna",
    "Common Name": "Eastern Meadowlark",
    "Filename": "2008-01-26-easmea.jpg",
    "County": "Osceola",
    "State/Province": "US-FL"
  },
  {
    "Location": "Lake Kissimmee",
    "Date": "01-26-2008",
    "Scientific Name": "Mycteria americana",
    "Common Name": "Wood Stork",
    "Filename": "2008-01-26-woosto.jpg",
    "County": "Osceola",
    "State/Province": "US-FL"
  },
  {
    "Location": "Overstreet Road",
    "Date": "01-26-2008",
    "Scientific Name": "Setophaga palmarum",
    "Common Name": "Palm Warbler",
    "Filename": "2008-01-26-palwar.jpg",
    "County": "Osceola",
    "State/Province": "US-FL"
  },
  {
    "Location": "Lake Tohopekaliga",
    "Date": "01-29-2008",
    "Scientific Name": "Eudocimus albus",
    "Common Name": "White Ibis",
    "Filename": "2008-01-29-whiibi.jpg",
    "County": "Osceola",
    "State/Province": "US-FL"
  },
  {
    "Location": "Lake Tohopekaliga",
    "Date": "01-29-2008",
    "Scientific Name": "Botaurus lentiginosus",
    "Common Name": "American Bittern",
    "Filename": "2008-01-29-amebit.jpg",
    "County": "Osceola",
    "State/Province": "US-FL"
  },
  {
    "Location": "Skylawn Memorial Park",
    "Date": "12-12-2007",
    "Scientific Name": "Loxia curvirostra",
    "Common Name": "Red Crossbill",
    "Filename": "2007-12-12-redcro.jpg",
    "County": "San Mateo",
    "State/Province": "US-CA"
  },
  {
    "Location": "Pearson-Arastradero Preserve",
    "Date": "11-30-2007",
    "Scientific Name": "Melanerpes lewis",
    "Common Name": "Lewis's Woodpecker",
    "Filename": "2007-11-30-lewwoo.jpg",
    "County": "Santa Clara",
    "State/Province": "US-CA"
  },
  {
    "Location": "Guadalupe Oak Grove Park (SCL Co.)",
    "Date": "08-29-2007",
    "Scientific Name": "Melanerpes formicivorus",
    "Common Name": "Acorn Woodpecker",
    "Filename": "2007-08-29-acowoo.jpg",
    "County": "Santa Clara",
    "State/Province": "US-CA"
  },
  {
    "Location": "Hidden Villa",
    "Date": "06-07-2007",
    "Scientific Name": "Pheucticus melanocephalus",
    "Common Name": "Black-headed Grosbeak",
    "Filename": "2007-06-07-bkhgro.jpg",
    "County": "Santa Clara",
    "State/Province": "US-CA"
  },
  {
    "Location": "Hidden Villa",
    "Date": "06-07-2007",
    "Scientific Name": "Aphelocoma californica",
    "Common Name": "California Scrub-Jay",
    "Filename": "2007-06-07-wesjay.jpg",
    "County": "Santa Clara",
    "State/Province": "US-CA"
  },
  {
    "Location": "Pearson-Arastradero Preserve",
    "Date": "02-27-2008",
    "Scientific Name": "Pipilo maculatus",
    "Common Name": "Spotted Towhee",
    "Filename": "2008-02-27-spotow.jpg",
    "County": "Santa Clara",
    "State/Province": "US-CA"
  },
  {
    "Location": "Don Edwards Center",
    "Date": "08-17-2007",
    "Scientific Name": "Phalaropus tricolor",
    "Common Name": "Wilson's Phalarope",
    "Filename": "2007-08-17-wilpha.jpg",
    "County": "Santa Clara",
    "State/Province": "US-CA"
  },
  {
    "Location": "Blufftop Coastal Park",
    "Date": "10-03-2007",
    "Scientific Name": "Spinus tristis",
    "Common Name": "American Goldfinch",
    "Filename": "2007-10-03-amegfi.jpg",
    "County": "San Mateo",
    "State/Province": "US-CA"
  },
  {
    "Location": "Palo Alto Duck Pond",
    "Date": "10-10-2007",
    "Scientific Name": "Setophaga petechia",
    "Common Name": "Yellow Warbler",
    "Filename": "2007-10-10-yelwar.jpg",
    "County": "Santa Clara",
    "State/Province": "US-CA"
  },
  {
    "Location": "Palo Alto Duck Pond",
    "Date": "04-05-2006",
    "Scientific Name": "Himantopus mexicanus",
    "Common Name": "Black-necked Stilt",
    "Filename": "2006-04-05-bknsti.jpg",
    "County": "Santa Clara",
    "State/Province": "US-CA"
  },
  {
    "Location": "Cascade Ranch",
    "Date": "01-22-2007",
    "Scientific Name": "Passerella iliaca",
    "Common Name": "Fox Sparrow",
    "Filename": "2007-01-22-foxspa.jpg",
    "County": "San Mateo",
    "State/Province": "US-CA"
  },
  {
    "Location": "Cascade Ranch",
    "Date": "01-22-2007",
    "Scientific Name": "Setophaga townsendi",
    "Common Name": "Townsend's Warbler",
    "Filename": "2007-01-22-towwar.jpg",
    "County": "San Mateo",
    "State/Province": "US-CA"
  },
  {
    "Location": "Cascade Ranch",
    "Date": "01-18-2007",
    "Scientific Name": "Setophaga townsendi",
    "Common Name": "Townsend's Warbler",
    "Filename": "2007-01-18-towwar.jpg",
    "County": "San Mateo",
    "State/Province": "US-CA"
  },
  {
    "Location": "Cascade Ranch",
    "Date": "01-18-2007",
    "Scientific Name": "Melospiza lincolnii",
    "Common Name": "Lincoln's Sparrow",
    "Filename": "2007-01-18-linspa.jpg",
    "County": "San Mateo",
    "State/Province": "US-CA"
  },
  {
    "Location": "Cascade Ranch",
    "Date": "01-18-2007",
    "Scientific Name": "Regulus calendula",
    "Common Name": "Ruby-crowned Kinglet",
    "Filename": "2007-01-18-ruckin.jpg",
    "County": "San Mateo",
    "State/Province": "US-CA"
  },
  {
    "Location": "Santa Cruz",
    "Date": "02-01-2007",
    "Scientific Name": "Larus occidentalis",
    "Common Name": "Western Gull",
    "Filename": "2007-02-01-wesgul.jpg",
    "County": "Santa Cruz",
    "State/Province": "US-CA"
  },
  {
    "Location": "Lake Merritt",
    "Date": "02-15-2007",
    "Scientific Name": "Podiceps nigricollis",
    "Common Name": "Eared Grebe",
    "Filename": "2007-02-15-eargre.jpg",
    "County": "Alameda",
    "State/Province": "US-CA"
  },
  {
    "Location": "Ogier Ponds",
    "Date": "03-01-2007",
    "Scientific Name": "Agelaius phoeniceus",
    "Common Name": "Red-winged Blackbird",
    "Filename": "2007-03-01-rewbla.jpg",
    "County": "Santa Clara",
    "State/Province": "US-CA"
  },
  {
    "Location": "Foster City Radio Tower",
    "Date": "04-23-2007",
    "Scientific Name": "Limnodromus griseus",
    "Common Name": "Short-billed Dowitcher",
    "Filename": "2007-04-23-shbdow.jpg",
    "County": "San Mateo",
    "State/Province": "US-CA"
  },
  {
    "Location": "Coyote Point Marina",
    "Date": "04-24-2007",
    "Scientific Name": "Charadrius semipalmatus",
    "Common Name": "Semipalmated Plover",
    "Filename": "2007-04-24-semplo.jpg",
    "County": "San Mateo",
    "State/Province": "US-CA"
  },
  {
    "Location": "Pearson-Arastradero Preserve",
    "Date": "06-28-2007",
    "Scientific Name": "Toxostoma redivivum",
    "Common Name": "California Thrasher",
    "Filename": "2007-06-28-calthr.jpg",
    "County": "Santa Clara",
    "State/Province": "US-CA"
  },
  {
    "Location": "Javelina Ranch / Martin Refuge",
    "Date": "04-06-2008",
    "Scientific Name": "Columbina passerina",
    "Common Name": "Common Ground-Dove",
    "Filename": "2008-04-06-cogdov.jpg",
    "County": "Hidalgo",
    "State/Province": "US-TX"
  },
  {
    "Location": "Javelina Ranch / Martin Refuge",
    "Date": "04-06-2008",
    "Scientific Name": "Caracara cheriway",
    "Common Name": "Crested Caracara",
    "Filename": "2008-04-06-crecar.jpg",
    "County": "Hidalgo",
    "State/Province": "US-TX"
  },
  {
    "Location": "Javelina Ranch / Martin Refuge",
    "Date": "04-06-2008",
    "Scientific Name": "Cyanocorax yncas",
    "Common Name": "Green Jay",
    "Filename": "2008-04-06-grnjay.jpg",
    "County": "Hidalgo",
    "State/Province": "US-TX"
  },
  {
    "Location": "Javelina Ranch / Martin Refuge",
    "Date": "04-06-2008",
    "Scientific Name": "Toxostoma curvirostre",
    "Common Name": "Curve-billed Thrasher",
    "Filename": "2008-04-06-cubthr.jpg",
    "County": "Hidalgo",
    "State/Province": "US-TX"
  },
  {
    "Location": "Javelina Ranch / Martin Refuge",
    "Date": "04-06-2008",
    "Scientific Name": "Callipepla squamata",
    "Common Name": "Scaled Quail",
    "Filename": "2008-04-06-scaqua.jpg",
    "County": "Hidalgo",
    "State/Province": "US-TX"
  },
  {
    "Location": "Harlingen",
    "Date": "04-07-2008",
    "Scientific Name": "Amazona viridigenalis",
    "Common Name": "Red-crowned Parrot",
    "Filename": "2008-04-07-recpar.jpg",
    "County": "Cameron",
    "State/Province": "US-TX"
  },
  {
    "Location": "El Canelo Ranch",
    "Date": "04-08-2008",
    "Scientific Name": "Glaucidium brasilianum",
    "Common Name": "Ferruginous Pygmy-Owl",
    "Filename": "2008-04-08-fepowl.jpg",
    "County": "Kenedy",
    "State/Province": "US-TX"
  },
  {
    "Location": "El Canelo Ranch",
    "Date": "04-08-2008",
    "Scientific Name": "Tyrannus forficatus",
    "Common Name": "Scissor-tailed Flycatcher",
    "Filename": "2008-04-08-sctfly.jpg",
    "County": "Kenedy",
    "State/Province": "US-TX"
  },
  {
    "Location": "Allen Williams's Yard",
    "Date": "04-08-2008",
    "Scientific Name": "Turdus assimilis",
    "Common Name": "White-throated Thrush",
    "Filename": "2008-04-08-whtrob.jpg",
    "County": "Hidalgo",
    "State/Province": "US-TX"
  },
  {
    "Location": "Hidalgo",
    "Date": "04-09-2008",
    "Scientific Name": "Pitangus sulphuratus",
    "Common Name": "Great Kiskadee",
    "Filename": "2008-04-09-grekis.jpg",
    "County": "Hidalgo",
    "State/Province": "US-TX"
  },
  {
    "Location": "Hidalgo",
    "Date": "04-09-2008",
    "Scientific Name": "Quiscalus mexicanus",
    "Common Name": "Great-tailed Grackle",
    "Filename": "2008-04-09-grtgra.jpg",
    "County": "Hidalgo",
    "State/Province": "US-TX"
  },
  {
    "Location": "Hidalgo",
    "Date": "04-09-2008",
    "Scientific Name": "Campylorhynchus brunneicapillus",
    "Common Name": "Cactus Wren",
    "Filename": "2008-04-09-cacwre.jpg",
    "County": "Hidalgo",
    "State/Province": "US-TX"
  },
  {
    "Location": "Hidalgo",
    "Date": "04-09-2008",
    "Scientific Name": "Baeolophus atricristatus",
    "Common Name": "Black-crested Titmouse",
    "Filename": "2008-04-09-bkctit.jpg",
    "County": "Hidalgo",
    "State/Province": "US-TX"
  },
  {
    "Location": "Frontera Audubon",
    "Date": "04-10-2008",
    "Scientific Name": "Setophaga americana",
    "Common Name": "Northern Parula",
    "Filename": "2008-04-10-norpar.jpg",
    "County": "Hidalgo",
    "State/Province": "US-TX"
  },
  {
    "Location": "Frontera Audubon",
    "Date": "04-10-2008",
    "Scientific Name": "Mniotilta varia",
    "Common Name": "Black-and-white Warbler",
    "Filename": "2008-04-10-bawwar.jpg",
    "County": "Hidalgo",
    "State/Province": "US-TX"
  },
  {
    "Location": "South Padre Island",
    "Date": "04-11-2008",
    "Scientific Name": "Protonotaria citrea",
    "Common Name": "Prothonotary Warbler",
    "Filename": "2008-04-11-prowar.jpg",
    "County": "Cameron",
    "State/Province": "US-TX"
  },
  {
    "Location": "Laguna Atascosa NWR",
    "Date": "04-11-2008",
    "Scientific Name": "Molothrus aeneus",
    "Common Name": "Bronzed Cowbird",
    "Filename": "2008-04-11-brocow.jpg",
    "County": "Cameron",
    "State/Province": "US-TX"
  },
  {
    "Location": "Santa Ana NWR",
    "Date": "04-12-2008",
    "Scientific Name": "Megaceryle torquata",
    "Common Name": "Ringed Kingfisher",
    "Filename": "2008-04-12-rinkin.jpg",
    "County": "Hidalgo",
    "State/Province": "US-TX"
  },
  {
    "Location": "Frontera Audubon",
    "Date": "04-13-2008",
    "Scientific Name": "Amazilia yucatanensis",
    "Common Name": "Buff-bellied Hummingbird",
    "Filename": "2008-04-13-bubhum.jpg",
    "County": "Hidalgo",
    "State/Province": "US-TX"
  },
  {
    "Location": "Frontera Audubon",
    "Date": "04-13-2008",
    "Scientific Name": "Icteria virens",
    "Common Name": "Yellow-breasted Chat",
    "Filename": "2008-04-13-yebcha.jpg",
    "County": "Hidalgo",
    "State/Province": "US-TX"
  },
  {
    "Location": "Sierra Road",
    "Date": "05-14-2008",
    "Scientific Name": "Eremophila alpestris",
    "Common Name": "Horned Lark",
    "Filename": "2008-05-14-horlar.jpg",
    "County": "Santa Clara",
    "State/Province": "US-CA"
  },
  {
    "Location": "Antelope Valley Road",
    "Date": "05-27-2008",
    "Scientific Name": "Selasphorus calliope",
    "Common Name": "Calliope Hummingbird",
    "Filename": "2008-05-27-calhum.jpg",
    "County": "Sierra",
    "State/Province": "US-CA"
  },
  {
    "Location": "Plumas-Eureka State Park",
    "Date": "05-28-2008",
    "Scientific Name": "Myadestes townsendi",
    "Common Name": "Townsend's Solitaire",
    "Filename": "2008-05-28-towsol.jpg",
    "County": "Plumas",
    "State/Province": "US-CA"
  },
  {
    "Location": "Yuba Pass",
    "Date": "05-29-2008",
    "Scientific Name": "Poecile gambeli",
    "Common Name": "Mountain Chickadee",
    "Filename": "2008-05-29-mouchi.jpg",
    "County": "Sierra",
    "State/Province": "US-CA"
  },
  {
    "Location": "Sardine Lakes",
    "Date": "05-29-2008",
    "Scientific Name": "Oreothlypis ruficapilla",
    "Common Name": "Nashville Warbler",
    "Filename": "2008-05-29-naswar.jpg",
    "County": "Sierra",
    "State/Province": "US-CA"
  },
  {
    "Location": "Coyote Lake Dam",
    "Date": "10-26-2006",
    "Scientific Name": "Salpinctes obsoletus",
    "Common Name": "Rock Wren",
    "Filename": "2006-10-26-rocwre.jpg",
    "County": "Santa Clara",
    "State/Province": "US-CA"
  },
  {
    "Location": "Antelope Valley Road",
    "Date": "05-27-2008",
    "Scientific Name": "Spizella breweri",
    "Common Name": "Brewer's Sparrow",
    "Filename": "2008-05-27-brespa.jpg",
    "County": "Sierra",
    "State/Province": "US-CA"
  },
  {
    "Location": "Union City Library",
    "Date": "01-11-2007",
    "Scientific Name": "Aix sponsa",
    "Common Name": "Wood Duck",
    "Filename": "2007-01-11-wooduc.jpg",
    "County": "Alameda",
    "State/Province": "US-CA"
  },
  {
    "Location": "Union City Library",
    "Date": "01-11-2007",
    "Scientific Name": "Bucephala albeola",
    "Common Name": "Bufflehead",
    "Filename": "2007-01-11-buffle.jpg",
    "County": "Alameda",
    "State/Province": "US-CA"
  },
  {
    "Location": "Javelina Ranch / Martin Refuge",
    "Date": "04-06-2008",
    "Scientific Name": "Cardinalis sinuatus",
    "Common Name": "Pyrrhuloxia",
    "Filename": "2008-04-06-pyrrhu.jpg",
    "County": "Hidalgo",
    "State/Province": "US-TX"
  },
  {
    "Location": "El Canelo Ranch",
    "Date": "04-08-2008",
    "Scientific Name": "Colinus virginianus",
    "Common Name": "Northern Bobwhite",
    "Filename": "2008-04-08-norbob.jpg",
    "County": "Kenedy",
    "State/Province": "US-TX"
  },
  {
    "Location": "Estero Llano Grande State Park",
    "Date": "04-10-2008",
    "Scientific Name": "Megascops asio",
    "Common Name": "Eastern Screech-Owl",
    "Filename": "2008-04-10-easowl.jpg",
    "County": "Hidalgo",
    "State/Province": "US-TX"
  },
  {
    "Location": "McClellan Ranch Preserve",
    "Date": "07-02-2008",
    "Scientific Name": "Poecile rufescens",
    "Common Name": "Chestnut-backed Chickadee",
    "Filename": "2008-07-02-chbchi.jpg",
    "County": "Santa Clara",
    "State/Province": "US-CA"
  },
  {
    "Location": "UC Santa Cruz--Arboretum",
    "Date": "06-21-2008",
    "Scientific Name": "Calypte anna",
    "Common Name": "Anna's Hummingbird",
    "Filename": "2008-06-21-annhum.jpg",
    "County": "Santa Cruz",
    "State/Province": "US-CA"
  },
  {
    "Location": "Moss Landing State Beach",
    "Date": "07-12-2008",
    "Scientific Name": "Numenius phaeopus",
    "Common Name": "Whimbrel",
    "Filename": "2008-07-12-whimbr.jpg",
    "County": "Monterey",
    "State/Province": "US-CA"
  },
  {
    "Location": "Moss Landing State Beach",
    "Date": "07-12-2008",
    "Scientific Name": "Limosa fedoa",
    "Common Name": "Marbled Godwit",
    "Filename": "2008-07-12-margod.jpg",
    "County": "Monterey",
    "State/Province": "US-CA"
  },
  {
    "Location": "Moss Landing State Beach",
    "Date": "07-12-2008",
    "Scientific Name": "Tringa semipalmata",
    "Common Name": "Willet",
    "Filename": "2008-07-12-willet.jpg",
    "County": "Monterey",
    "State/Province": "US-CA"
  },
  {
    "Location": "Moss Landing State Beach",
    "Date": "07-12-2008",
    "Scientific Name": "Charadrius nivosus",
    "Common Name": "Snowy Plover",
    "Filename": "2008-07-12-snoplo.jpg",
    "County": "Monterey",
    "State/Province": "US-CA"
  },
  {
    "Location": "San Francisco Zoo",
    "Date": "05-08-2004",
    "Scientific Name": "Calypte anna",
    "Common Name": "Anna's Hummingbird",
    "Filename": "2004-05-08-annhum.jpg",
    "County": "San Francisco",
    "State/Province": "US-CA"
  },
  {
    "Location": "Palo Alto Duck Pond",
    "Date": "05-23-2004",
    "Scientific Name": "Nycticorax nycticorax",
    "Common Name": "Black-crowned Night-Heron",
    "Filename": "2004-05-23-bcnher-crw_8745.jpg",
    "County": "Santa Clara",
    "State/Province": "US-CA"
  },
  {
    "Location": "Hayward Regional Shoreline",
    "Date": "08-06-2008",
    "Scientific Name": "Falco peregrinus",
    "Common Name": "Peregrine Falcon",
    "Filename": "2008-08-06-perfal-7v5z2254.jpg",
    "County": "Alameda",
    "State/Province": "US-CA"
  },
  {
    "Location": "Javelina Ranch / Martin Refuge",
    "Date": "04-06-2008",
    "Scientific Name": "Passerina caerulea",
    "Common Name": "Blue Grosbeak",
    "Filename": "2008-04-06-blugrb-7v5z9887.jpg",
    "County": "Hidalgo",
    "State/Province": "US-TX"
  },
  {
    "Location": "El Canelo Ranch",
    "Date": "04-08-2008",
    "Scientific Name": "Parabuteo unicinctus",
    "Common Name": "Harris's Hawk",
    "Filename": "2008-04-08-hrshaw-7v5z1016.jpg",
    "County": "Kenedy",
    "State/Province": "US-TX"
  },
  {
    "Location": "South Padre Island",
    "Date": "04-11-2008",
    "Scientific Name": "Charadrius wilsonia",
    "Common Name": "Wilson's Plover",
    "Filename": "2008-04-11-wilplo-7v5z3492.jpg",
    "County": "Cameron",
    "State/Province": "US-TX"
  },
  {
    "Location": "Allen Williams's Yard",
    "Date": "04-07-2008",
    "Scientific Name": "Piranga rubra",
    "Common Name": "Summer Tanager",
    "Filename": "2008-04-07-sumtan-7v5z0552.jpg",
    "County": "Hidalgo",
    "State/Province": "US-TX"
  },
  {
    "Location": "Alviso Marina",
    "Date": "09-11-2008",
    "Scientific Name": "Stercorarius longicaudus",
    "Common Name": "Long-tailed Jaeger",
    "Filename": "2008-09-11-lotjae-7v5z3522.jpg",
    "County": "Santa Clara",
    "State/Province": "US-CA"
  },
  {
    "Location": "Vasona Creek",
    "Date": "09-03-2008",
    "Scientific Name": "Tringa solitaria",
    "Common Name": "Solitary Sandpiper",
    "Filename": "2008-09-03-solsan-7v5z3242.jpg",
    "County": "Santa Clara",
    "State/Province": "US-CA"
  },
  {
    "Location": "Coyote Point Marina",
    "Date": "09-20-2008",
    "Scientific Name": "Sitta pygmaea",
    "Common Name": "Pygmy Nuthatch",
    "Filename": "2008-09-20-pygnut-7v5z3603.jpg",
    "County": "San Mateo",
    "State/Province": "US-CA"
  },
  {
    "Location": "Palo Alto Duck Pond",
    "Date": "10-15-2008",
    "Scientific Name": "Falco columbarius",
    "Common Name": "Merlin",
    "Filename": "2008-10-15-merlin-7v5z4093.jpg",
    "County": "Santa Clara",
    "State/Province": "US-CA"
  },
  {
    "Location": "Palo Alto Duck Pond",
    "Date": "10-15-2008",
    "Scientific Name": "Bubulcus ibis",
    "Common Name": "Cattle Egret",
    "Filename": "2008-10-15-categr-7v5z4051.jpg",
    "County": "Santa Clara",
    "State/Province": "US-CA"
  },
  {
    "Location": "Palo Alto Duck Pond",
    "Date": "10-15-2008",
    "Scientific Name": "Thryomanes bewickii",
    "Common Name": "Bewick's Wren",
    "Filename": "2008-10-15-bewwre-7v5z3916.jpg",
    "County": "Santa Clara",
    "State/Province": "US-CA"
  },
  {
    "Location": "Potosi Point",
    "Date": "10-25-2008",
    "Scientific Name": "Plectrophenax nivalis",
    "Common Name": "Snow Bunting",
    "Filename": "2008-10-25-snobun-7v5z4516.jpg",
    "County": "Grant",
    "State/Province": "US-WI"
  },
  {
    "Location": "Bodega Bay",
    "Date": "11-14-2008",
    "Scientific Name": "Gavia adamsii",
    "Common Name": "Yellow-billed Loon",
    "Filename": "2008-11-14-yebloo-7v5z5187.jpg",
    "County": "Marin",
    "State/Province": "US-CA"
  },
  {
    "Location": "Limantour Beach",
    "Date": "11-13-2008",
    "Scientific Name": "Sialia mexicana",
    "Common Name": "Western Bluebird",
    "Filename": "2008-11-13-wesblu-7v5z4817.jpg",
    "County": "Marin",
    "State/Province": "US-CA"
  },
  {
    "Location": "Pt. Reyes--Drakes Bay",
    "Date": "11-15-2008",
    "Scientific Name": "Arenaria melanocephala",
    "Common Name": "Black Turnstone",
    "Filename": "2008-11-15-blktur-7v5z5494.jpg",
    "County": "Marin",
    "State/Province": "US-CA"
  },
  {
    "Location": "Limantour Beach",
    "Date": "11-13-2008",
    "Scientific Name": "Corvus corax",
    "Common Name": "Common Raven",
    "Filename": "2008-11-13-comrav-7v5z4776.jpg",
    "County": "Marin",
    "State/Province": "US-CA"
  },
  {
    "Location": "Sacramento NWR",
    "Date": "11-28-2008",
    "Scientific Name": "Sturnella neglecta",
    "Common Name": "Western Meadowlark",
    "Filename": "2008-11-28-wesmea-7v5z9357.jpg",
    "County": "Glenn",
    "State/Province": "US-CA"
  },
  {
    "Location": "Bolinas Lagoon",
    "Date": "11-16-2008",
    "Scientific Name": "Anas penelope",
    "Common Name": "Eurasian Wigeon",
    "Filename": "2008-11-16-eurwig-7v5z9228.jpg",
    "County": "Marin",
    "State/Province": "US-CA"
  },
  {
    "Location": "Bolinas Lagoon",
    "Date": "11-16-2008",
    "Scientific Name": "Egretta thula",
    "Common Name": "Snowy Egret",
    "Filename": "2008-11-16-snoegr-7v5z9146.jpg",
    "County": "Marin",
    "State/Province": "US-CA"
  },
  {
    "Location": "Monte Bello Open Space Preserve",
    "Date": "07-09-2008",
    "Scientific Name": "Myiarchus cinerascens",
    "Common Name": "Ash-throated Flycatcher",
    "Filename": "2008-07-09-astfly-7v5z1118.jpg",
    "County": "Santa Clara",
    "State/Province": "US-CA"
  },
  {
    "Location": "Shoreline Lake",
    "Date": "01-07-2009",
    "Scientific Name": "Bucephala islandica",
    "Common Name": "Barrow's Goldeneye",
    "Filename": "2009-01-07-bargol-7v5z0599.jpg",
    "County": "Santa Clara",
    "State/Province": "US-CA"
  },
  {
    "Location": "Foster City Radio Tower",
    "Date": "01-14-2009",
    "Scientific Name": "Anas penelope",
    "Common Name": "Eurasian Wigeon",
    "Filename": "2009-01-14-eurwig-7v5z0884.jpg",
    "County": "San Mateo",
    "State/Province": "US-CA"
  },
  {
    "Location": "Foster City Radio Tower",
    "Date": "01-14-2009",
    "Scientific Name": "Anas discors",
    "Common Name": "Blue-winged Teal",
    "Filename": "2009-01-14-buwtea-7v5z0855.jpg",
    "County": "San Mateo",
    "State/Province": "US-CA"
  },
  {
    "Location": "Foster City Radio Tower",
    "Date": "01-14-2009",
    "Scientific Name": "Anas discors",
    "Common Name": "Blue-winged Teal",
    "Filename": "2009-01-14-buwtea-7v5z0784.jpg",
    "County": "San Mateo",
    "State/Province": "US-CA"
  },
  {
    "Location": "Foster City Radio Tower",
    "Date": "01-14-2009",
    "Scientific Name": "Anas cyanoptera",
    "Common Name": "Cinnamon Teal",
    "Filename": "2009-01-14-cintea-7v5z0712.jpg",
    "County": "San Mateo",
    "State/Province": "US-CA"
  },
  {
    "Location": "Shoreline Lake",
    "Date": "01-07-2009",
    "Scientific Name": "Bucephala islandica",
    "Common Name": "Barrow's Goldeneye",
    "Filename": "2009-01-07-bargol-7v5z0650.jpg",
    "County": "Santa Clara",
    "State/Province": "US-CA"
  },
  {
    "Location": "Shoreline Lake",
    "Date": "01-07-2009",
    "Scientific Name": "Lophodytes cucullatus",
    "Common Name": "Hooded Merganser",
    "Filename": "2009-01-07-hoomer-7v5z0442.jpg",
    "County": "Santa Clara",
    "State/Province": "US-CA"
  },
  {
    "Location": "Parcourse Marsh",
    "Date": "01-28-2009",
    "Scientific Name": "Turdus migratorius",
    "Common Name": "American Robin",
    "Filename": "2009-01-28-amerob-7v5z1032.jpg",
    "County": "Santa Clara",
    "State/Province": "US-CA"
  },
  {
    "Location": "Flannery Road",
    "Date": "02-01-2009",
    "Scientific Name": "Falco sparverius",
    "Common Name": "American Kestrel",
    "Filename": "2009-02-01-amekes-7v5z1145.jpg",
    "County": "Solano",
    "State/Province": "US-CA"
  },
  {
    "Location": "Lemon Canyon Road",
    "Date": "05-27-2008",
    "Scientific Name": "Petrochelidon pyrrhonota",
    "Common Name": "Cliff Swallow",
    "Filename": "2008-05-27-cliswa-7v5z9977.jpg",
    "County": "Sierra",
    "State/Province": "US-CA"
  },
  {
    "Location": "Merced NWR",
    "Date": "02-21-2009",
    "Scientific Name": "Oreothlypis celata",
    "Common Name": "Orange-crowned Warbler",
    "Filename": "2009-02-21-orcwar-7v5z2064.jpg",
    "County": "Merced",
    "State/Province": "US-CA"
  },
  {
    "Location": "Merced NWR",
    "Date": "02-21-2009",
    "Scientific Name": "Anser albifrons",
    "Common Name": "Greater White-fronted Goose",
    "Filename": "2009-02-21-gwfgoo-7v5z2011.jpg",
    "County": "Merced",
    "State/Province": "US-CA"
  },
  {
    "Location": "Foster City Radio Tower",
    "Date": "01-14-2009",
    "Scientific Name": "Branta canadensis",
    "Common Name": "Canada Goose",
    "Filename": "2009-01-14-cangoo-7v5z0715.jpg",
    "County": "San Mateo",
    "State/Province": "US-CA"
  },
  {
    "Location": "Lake Elizabeth",
    "Date": "12-10-2008",
    "Scientific Name": "Sayornis nigricans",
    "Common Name": "Black Phoebe",
    "Filename": "2008-12-10-blkpho-7v5z9964.jpg",
    "County": "Alameda",
    "State/Province": "US-CA"
  },
  {
    "Location": "Ed Levin County Park Sandy Wool",
    "Date": "03-11-2009",
    "Scientific Name": "Tachycineta bicolor",
    "Common Name": "Tree Swallow",
    "Filename": "2009-03-11-treswa-7v5z2629.jpg",
    "County": "Santa Clara",
    "State/Province": "US-CA"
  },
  {
    "Location": "Charleston Slough",
    "Date": "04-11-2009",
    "Scientific Name": "Tachycineta bicolor",
    "Common Name": "Tree Swallow",
    "Filename": "2009-04-11-treswa-7v5z2827.jpg",
    "County": "Santa Clara",
    "State/Province": "US-CA"
  },
  {
    "Location": "Charleston Slough",
    "Date": "04-11-2009",
    "Scientific Name": "Haemorhous mexicanus",
    "Common Name": "House Finch",
    "Filename": "2009-04-11-houfin-7v5z2779.jpg",
    "County": "Santa Clara",
    "State/Province": "US-CA"
  },
  {
    "Location": "Palo Alto Duck Pond",
    "Date": "04-18-2009",
    "Scientific Name": "Icterus bullockii",
    "Common Name": "Bullock's Oriole",
    "Filename": "2009-04-18-bulori-7v5z2955.jpg",
    "County": "Santa Clara",
    "State/Province": "US-CA"
  },
  {
    "Location": "Sisters",
    "Date": "05-14-2009",
    "Scientific Name": "Gymnorhinus cyanocephalus",
    "Common Name": "Pinyon Jay",
    "Filename": "2009-05-14-pinjay-7v5z9906.jpg",
    "County": "Deschutes",
    "State/Province": "US-OR"
  },
  {
    "Location": "Sisters",
    "Date": "05-14-2009",
    "Scientific Name": "Nucifraga columbiana",
    "Common Name": "Clark's Nutcracker",
    "Filename": "2009-05-14-clanut-7v5z9878.jpg",
    "County": "Deschutes",
    "State/Province": "US-OR"
  },
  {
    "Location": "Fall River Mills",
    "Date": "05-11-2009",
    "Scientific Name": "Sphyrapicus ruber",
    "Common Name": "Red-breasted Sapsucker",
    "Filename": "2009-05-11-rebsap-7v5z3836.jpg",
    "County": "Shasta",
    "State/Province": "US-CA"
  },
  {
    "Location": "Fall River Mills",
    "Date": "05-11-2009",
    "Scientific Name": "Riparia riparia",
    "Common Name": "Bank Swallow",
    "Filename": "2009-05-11-banswa-7v5z3602.jpg",
    "County": "Shasta",
    "State/Province": "US-CA"
  },
  {
    "Location": "Tomales Bay--general area",
    "Date": "05-24-2009",
    "Scientific Name": "Larus occidentalis",
    "Common Name": "Western Gull",
    "Filename": "2009-05-24-wesgul-7v5z9512.jpg",
    "County": "Marin",
    "State/Province": "US-CA"
  },
  {
    "Location": "Stevens Creek County Park",
    "Date": "05-21-2009",
    "Scientific Name": "Vireo gilvus",
    "Common Name": "Warbling Vireo",
    "Filename": "2009-05-21-warvir-7v5z9986.jpg",
    "County": "Santa Clara",
    "State/Province": "US-CA"
  },
  {
    "Location": "Stevens Creek County Park",
    "Date": "05-21-2009",
    "Scientific Name": "Polioptila caerulea",
    "Common Name": "Blue-gray Gnatcatcher",
    "Filename": "2009-05-21-buggna-7v5z0044.jpg",
    "County": "Santa Clara",
    "State/Province": "US-CA"
  },
  {
    "Location": "Skylawn Memorial Park",
    "Date": "07-24-2009",
    "Scientific Name": "Junco hyemalis",
    "Common Name": "Dark-eyed Junco",
    "Filename": "2009-07-24-daejun-7v5z2061.jpg",
    "County": "San Mateo",
    "State/Province": "US-CA"
  },
  {
    "Location": "McClellan Ranch Preserve",
    "Date": "08-07-2009",
    "Scientific Name": "Thryomanes bewickii",
    "Common Name": "Bewick's Wren",
    "Filename": "2009-08-07-bewwre-7v5z2241.jpg",
    "County": "Santa Clara",
    "State/Province": "US-CA"
  },
  {
    "Location": "Pillar Point",
    "Date": "09-04-2009",
    "Scientific Name": "Gavia stellata",
    "Common Name": "Red-throated Loon",
    "Filename": "2009-09-04-retloo-7v5z9743.jpg",
    "County": "San Mateo",
    "State/Province": "US-CA"
  },
  {
    "Location": "Pillar Point",
    "Date": "09-04-2009",
    "Scientific Name": "Pluvialis squatarola",
    "Common Name": "Black-bellied Plover",
    "Filename": "2009-09-04-bkbplo-7v5z9669.jpg",
    "County": "San Mateo",
    "State/Province": "US-CA"
  },
  {
    "Location": "Pillar Point",
    "Date": "09-04-2009",
    "Scientific Name": "Tringa incana",
    "Common Name": "Wandering Tattler",
    "Filename": "2009-09-04-wantat-7v5z9721.jpg",
    "County": "San Mateo",
    "State/Province": "US-CA"
  },
  {
    "Location": "Calliope Crossing",
    "Date": "05-14-2009",
    "Scientific Name": "Sphyrapicus nuchalis",
    "Common Name": "Red-naped Sapsucker",
    "Filename": "2009-05-14-rensap-7v5z9785.jpg",
    "County": "Deschutes",
    "State/Province": "US-OR"
  },
  {
    "Location": "Union City Library",
    "Date": "01-08-2010",
    "Scientific Name": "Aix sponsa",
    "Common Name": "Wood Duck",
    "Filename": "2010-01-08-wooduc-7v5z5324.jpg",
    "County": "Alameda",
    "State/Province": "US-CA"
  },
  {
    "Location": "Union City Library",
    "Date": "01-08-2010",
    "Scientific Name": "Aix sponsa",
    "Common Name": "Wood Duck",
    "Filename": "2010-01-08-wooduc-7v5z5305.jpg",
    "County": "Alameda",
    "State/Province": "US-CA"
  },
  {
    "Location": "Lake Merritt",
    "Date": "01-15-2010",
    "Scientific Name": "Aythya fuligula",
    "Common Name": "Tufted Duck",
    "Filename": "2010-01-15-tufduc-7v5z5493.jpg",
    "County": "Alameda",
    "State/Province": "US-CA"
  },
  {
    "Location": "Lake Merritt",
    "Date": "01-15-2010",
    "Scientific Name": "Aythya fuligula",
    "Common Name": "Tufted Duck",
    "Filename": "2010-01-15-tufduc-7v5z5483.jpg",
    "County": "Alameda",
    "State/Province": "US-CA"
  },
  {
    "Location": "Panoche Valley--general area (SBT Co.)",
    "Date": "01-16-2010",
    "Scientific Name": "Asio otus",
    "Common Name": "Long-eared Owl",
    "Filename": "2010-01-16-loeowl-7v5z5839.jpg",
    "County": "San Benito",
    "State/Province": "US-CA"
  },
  {
    "Location": "Panoche Valley--general area (SBT Co.)",
    "Date": "01-16-2010",
    "Scientific Name": "Chondestes grammacus",
    "Common Name": "Lark Sparrow",
    "Filename": "2010-01-16-larspa-7v5z5776.jpg",
    "County": "San Benito",
    "State/Province": "US-CA"
  },
  {
    "Location": "San Antonio Valley",
    "Date": "01-02-2010",
    "Scientific Name": "Melanerpes lewis",
    "Common Name": "Lewis's Woodpecker",
    "Filename": "2010-01-02-lewwoo-7v5z5115.jpg",
    "County": "Santa Clara",
    "State/Province": "US-CA"
  },
  {
    "Location": "Panoche Valley--general area (SBT Co.)",
    "Date": "01-16-2010",
    "Scientific Name": "Sialia currucoides",
    "Common Name": "Mountain Bluebird",
    "Filename": "2010-01-16-moublu-7v5z5790.jpg",
    "County": "San Benito",
    "State/Province": "US-CA"
  },
  {
    "Location": "Lake Merritt",
    "Date": "01-15-2010",
    "Scientific Name": "Aechmophorus occidentalis",
    "Common Name": "Western Grebe",
    "Filename": "2010-01-15-wesgre-7v5z5476.jpg",
    "County": "Alameda",
    "State/Province": "US-CA"
  },
  {
    "Location": "Panoche Valley--general area (SBT Co.)",
    "Date": "01-16-2010",
    "Scientific Name": "Sitta carolinensis",
    "Common Name": "White-breasted Nuthatch",
    "Filename": "2010-01-16-whbnut-7v5z5678.jpg",
    "County": "San Benito",
    "State/Province": "US-CA"
  },
  {
    "Location": "UC Santa Cruz--Arboretum",
    "Date": "03-19-2010",
    "Scientific Name": "Accipiter striatus",
    "Common Name": "Sharp-shinned Hawk",
    "Filename": "2010-03-19-shshaw-7v5z7356.jpg",
    "County": "Santa Cruz",
    "State/Province": "US-CA"
  },
  {
    "Location": "Neary Lagoon",
    "Date": "03-19-2010",
    "Scientific Name": "Setophaga coronata",
    "Common Name": "Yellow-rumped Warbler",
    "Filename": "2010-03-19-yerwar-7v5z7361.jpg",
    "County": "Santa Cruz",
    "State/Province": "US-CA"
  },
  {
    "Location": "UC Santa Cruz--Arboretum",
    "Date": "03-19-2010",
    "Scientific Name": "Selasphorus sasin",
    "Common Name": "Allen's Hummingbird",
    "Filename": "2010-03-19-allhum-7v5z7565.jpg",
    "County": "Santa Cruz",
    "State/Province": "US-CA"
  },
  {
    "Location": "Capitola State Beach",
    "Date": "01-23-2010",
    "Scientific Name": "Larus glaucescens",
    "Common Name": "Glaucous-winged Gull",
    "Filename": "2010-01-23-glwgul-7v5z6149.jpg",
    "County": "Santa Cruz",
    "State/Province": "US-CA"
  },
  {
    "Location": "Mount Madonna County Park",
    "Date": "03-27-2010",
    "Scientific Name": "Troglodytes pacificus",
    "Common Name": "Pacific Wren",
    "Filename": "2010-03-27-winwre-7v5z7870.jpg",
    "County": "Santa Clara",
    "State/Province": "US-CA"
  },
  {
    "Location": "Rancho San Antonio",
    "Date": "04-16-2010",
    "Scientific Name": "Passerina amoena",
    "Common Name": "Lazuli Bunting",
    "Filename": "2010-04-16-lazbun-7v5z8579.jpg",
    "County": "Santa Clara",
    "State/Province": "US-CA"
  },
  {
    "Location": "Rancho San Antonio",
    "Date": "04-16-2010",
    "Scientific Name": "Tachycineta thalassina",
    "Common Name": "Violet-green Swallow",
    "Filename": "2010-04-16-vigswa-7v5z8694.jpg",
    "County": "Santa Clara",
    "State/Province": "US-CA"
  },
  {
    "Location": "Rancho San Antonio",
    "Date": "04-16-2010",
    "Scientific Name": "Troglodytes aedon",
    "Common Name": "House Wren",
    "Filename": "2010-04-16-houwre-7v5z8755.jpg",
    "County": "Santa Clara",
    "State/Province": "US-CA"
  },
  {
    "Location": "Rancho San Antonio",
    "Date": "04-16-2010",
    "Scientific Name": "Sialia mexicana",
    "Common Name": "Western Bluebird",
    "Filename": "2010-04-16-wesblu-7v5z8461.jpg",
    "County": "Santa Clara",
    "State/Province": "US-CA"
  },
  {
    "Location": "Pearson-Arastradero Preserve",
    "Date": "04-09-2010",
    "Scientific Name": "Troglodytes aedon",
    "Common Name": "House Wren",
    "Filename": "2010-04-09-houwre-7v5z8105.jpg",
    "County": "Santa Clara",
    "State/Province": "US-CA"
  },
  {
    "Location": "Ed Levin County Park Sandy Wool",
    "Date": "04-09-2010",
    "Scientific Name": "Selasphorus calliope",
    "Common Name": "Calliope Hummingbird",
    "Filename": "2010-04-09-calhum-7v5z8198.jpg",
    "County": "Santa Clara",
    "State/Province": "US-CA"
  },
  {
    "Location": "Ed Levin County Park Sandy Wool",
    "Date": "04-09-2010",
    "Scientific Name": "Selasphorus calliope",
    "Common Name": "Calliope Hummingbird",
    "Filename": "2010-04-09-calhum-7v5z8172.jpg",
    "County": "Santa Clara",
    "State/Province": "US-CA"
  },
  {
    "Location": "Pearson-Arastradero Preserve",
    "Date": "04-09-2010",
    "Scientific Name": "Haemorhous mexicanus",
    "Common Name": "House Finch",
    "Filename": "2010-04-09-houfin-7v5z8146.jpg",
    "County": "Santa Clara",
    "State/Province": "US-CA"
  },
  {
    "Location": "Mount Madonna County Park Sprig Lake",
    "Date": "04-17-2010",
    "Scientific Name": "Dryocopus pileatus",
    "Common Name": "Pileated Woodpecker",
    "Filename": "2010-04-17-pilwoo-7v5z8849.jpg",
    "County": "Santa Clara",
    "State/Province": "US-CA"
  },
  {
    "Location": "Shoreline Lake",
    "Date": "04-26-2010",
    "Scientific Name": "Branta canadensis",
    "Common Name": "Canada Goose",
    "Filename": "2010-04-26-cangoo-7v5z9362.jpg",
    "County": "Santa Clara",
    "State/Province": "US-CA"
  },
  {
    "Location": "Ed Levin County Park Sandy Wool",
    "Date": "03-26-2010",
    "Scientific Name": "Aimophila ruficeps",
    "Common Name": "Rufous-crowned Sparrow",
    "Filename": "2010-03-26-rucspa-7v5z7708.jpg",
    "County": "Santa Clara",
    "State/Province": "US-CA"
  },
  {
    "Location": "Marsh Road",
    "Date": "03-26-2010",
    "Scientific Name": "Chondestes grammacus",
    "Common Name": "Lark Sparrow",
    "Filename": "2010-03-26-larspa-7v5z7664.jpg",
    "County": "Santa Clara",
    "State/Province": "US-CA"
  },
  {
    "Location": "Anchorage",
    "Date": "06-05-2010",
    "Scientific Name": "Podiceps grisegena",
    "Common Name": "Red-necked Grebe",
    "Filename": "2010-06-05-rengre-7v5z0376.jpg",
    "County": "Anchorage",
    "State/Province": "US-AK"
  },
  {
    "Location": "Wasilla and Palmer",
    "Date": "06-06-2010",
    "Scientific Name": "Acanthis flammea",
    "Common Name": "Common Redpoll",
    "Filename": "2010-06-06-comrdp-7v5z0033.jpg",
    "County": "Matanuska-Susitna",
    "State/Province": "US-AK"
  },
  {
    "Location": "Teller Road",
    "Date": "06-12-2010",
    "Scientific Name": "Limosa lapponica",
    "Common Name": "Bar-tailed Godwit",
    "Filename": "2010-06-12-batgod-7v5z0354.jpg",
    "County": "Nome",
    "State/Province": "US-AK"
  },
  {
    "Location": "Kougarok Road",
    "Date": "06-11-2010",
    "Scientific Name": "Phylloscopus borealis",
    "Common Name": "Arctic Warbler",
    "Filename": "2010-06-11-arcwar-7v5z2896.jpg",
    "County": "Nome",
    "State/Province": "US-AK"
  },
  {
    "Location": "Kougarok Road",
    "Date": "06-10-2010",
    "Scientific Name": "Lagopus lagopus",
    "Common Name": "Willow Ptarmigan",
    "Filename": "2010-06-10-wilpta-7v5z2486.jpg",
    "County": "Nome",
    "State/Province": "US-AK"
  },
  {
    "Location": "Council Road",
    "Date": "06-09-2010",
    "Scientific Name": "Somateria mollissima",
    "Common Name": "Common Eider",
    "Filename": "2010-06-09-comeid-7v5z1748.jpg",
    "County": "Nome",
    "State/Province": "US-AK"
  },
  {
    "Location": "Teller Road",
    "Date": "06-08-2010",
    "Scientific Name": "Stercorarius longicaudus",
    "Common Name": "Long-tailed Jaeger",
    "Filename": "2010-06-08-lotjae-7v5z1505.jpg",
    "County": "Nome",
    "State/Province": "US-AK"
  },
  {
    "Location": "Council Road",
    "Date": "06-07-2010",
    "Scientific Name": "Phalaropus lobatus",
    "Common Name": "Red-necked Phalarope",
    "Filename": "2010-06-07-renpha-7v5z0403.jpg",
    "County": "Nome",
    "State/Province": "US-AK"
  },
  {
    "Location": "Teller Road",
    "Date": "06-12-2010",
    "Scientific Name": "Asio flammeus",
    "Common Name": "Short-eared Owl",
    "Filename": "2010-06-12-sheowl-7v5z0188.jpg",
    "County": "Nome",
    "State/Province": "US-AK"
  },
  {
    "Location": "Teller Road",
    "Date": "06-12-2010",
    "Scientific Name": "Lagopus muta",
    "Common Name": "Rock Ptarmigan",
    "Filename": "2010-06-12-rocpta-7v5z0501.jpg",
    "County": "Nome",
    "State/Province": "US-AK"
  },
  {
    "Location": "Teller Road",
    "Date": "06-12-2010",
    "Scientific Name": "Lagopus muta",
    "Common Name": "Rock Ptarmigan",
    "Filename": "2010-06-12-rocpta-7v5z1050.jpg",
    "County": "Nome",
    "State/Province": "US-AK"
  },
  {
    "Location": "Council Road",
    "Date": "06-07-2010",
    "Scientific Name": "Clangula hyemalis",
    "Common Name": "Long-tailed Duck",
    "Filename": "2010-06-07-lotduc-7v5z0563.jpg",
    "County": "Nome",
    "State/Province": "US-AK"
  },
  {
    "Location": "Teller Road",
    "Date": "06-08-2010",
    "Scientific Name": "Parkesia noveboracensis",
    "Common Name": "Northern Waterthrush",
    "Filename": "2010-06-08-norwat-7v5z0775.jpg",
    "County": "Nome",
    "State/Province": "US-AK"
  },
  {
    "Location": "Council Road",
    "Date": "06-09-2010",
    "Scientific Name": "Calcarius lapponicus",
    "Common Name": "Lapland Longspur",
    "Filename": "2010-06-09-laplon-7v5z1924.jpg",
    "County": "Nome",
    "State/Province": "US-AK"
  },
  {
    "Location": "Council Road",
    "Date": "06-09-2010",
    "Scientific Name": "Sterna paradisaea",
    "Common Name": "Arctic Tern",
    "Filename": "2010-06-09-arcter-7v5z2297.jpg",
    "County": "Nome",
    "State/Province": "US-AK"
  },
  {
    "Location": "Council Road",
    "Date": "06-09-2010",
    "Scientific Name": "Oenanthe oenanthe",
    "Common Name": "Northern Wheatear",
    "Filename": "2010-06-09-norwhe-7v5z2167.jpg",
    "County": "Nome",
    "State/Province": "US-AK"
  },
  {
    "Location": "Kougarok Road",
    "Date": "06-10-2010",
    "Scientific Name": "Catharus minimus",
    "Common Name": "Gray-cheeked Thrush",
    "Filename": "2010-06-10-gycthr-7v5z2630.jpg",
    "County": "Nome",
    "State/Province": "US-AK"
  },
  {
    "Location": "Teller Road",
    "Date": "06-08-2010",
    "Scientific Name": "Calidris pusilla",
    "Common Name": "Semipalmated Sandpiper",
    "Filename": "2010-06-08-semsan-7v5z1592.jpg",
    "County": "Nome",
    "State/Province": "US-AK"
  },
  {
    "Location": "Council Road",
    "Date": "06-09-2010",
    "Scientific Name": "Mergus serrator",
    "Common Name": "Red-breasted Merganser",
    "Filename": "2010-06-09-rebmer-7v5z2045.jpg",
    "County": "Nome",
    "State/Province": "US-AK"
  },
  {
    "Location": "Farallon Islands",
    "Date": "07-17-2010",
    "Scientific Name": "Cerorhinca monocerata",
    "Common Name": "Rhinoceros Auklet",
    "Filename": "2010-07-17-rhiauk-7V5Z2092.jpg",
    "County": "San Francisco",
    "State/Province": "US-CA"
  },
  {
    "Location": "Council Road",
    "Date": "06-11-2010",
    "Scientific Name": "Rissa tridactyla",
    "Common Name": "Black-legged Kittiwake",
    "Filename": "2010-06-11-bklkit-7v5z9890.jpg",
    "County": "Nome",
    "State/Province": "US-AK"
  },
  {
    "Location": "Farallon Islands",
    "Date": "07-17-2010",
    "Scientific Name": "Uria aalge",
    "Common Name": "Common Murre",
    "Filename": "2010-07-17-commur-7V5Z1790.jpg",
    "County": "San Francisco",
    "State/Province": "US-CA"
  },
  {
    "Location": "Farallon Islands",
    "Date": "07-17-2010",
    "Scientific Name": "Uria aalge",
    "Common Name": "Common Murre",
    "Filename": "2010-07-17-commur-7V5Z2133.jpg",
    "County": "San Francisco",
    "State/Province": "US-CA"
  },
  {
    "Location": "Farallon Islands",
    "Date": "07-17-2010",
    "Scientific Name": "Larus occidentalis",
    "Common Name": "Western Gull",
    "Filename": "2010-07-17-wesgul-7V5Z2537.jpg",
    "County": "San Francisco",
    "State/Province": "US-CA"
  },
  {
    "Location": "Farallon Islands",
    "Date": "07-17-2010",
    "Scientific Name": "Phoebastria nigripes",
    "Common Name": "Black-footed Albatross",
    "Filename": "2010-07-17-bkfalb-7V5Z2574.jpg",
    "County": "San Francisco",
    "State/Province": "US-CA"
  },
  {
    "Location": "Butterbredt Spring",
    "Date": "05-27-2006",
    "Scientific Name": "Calypte costae",
    "Common Name": "Costa's Hummingbird",
    "Filename": "2006-05-27-coshum-img_5469.jpg",
    "County": "Kern",
    "State/Province": "US-CA"
  },
  {
    "Location": "Hidalgo",
    "Date": "04-09-2008",
    "Scientific Name": "Toxostoma longirostre",
    "Common Name": "Long-billed Thrasher",
    "Filename": "2008-04-09-lobthr-7v5z1841.jpg",
    "County": "Hidalgo",
    "State/Province": "US-TX"
  },
  {
    "Location": "Javelina Ranch / Martin Refuge",
    "Date": "04-06-2008",
    "Scientific Name": "Cardinalis cardinalis",
    "Common Name": "Northern Cardinal",
    "Filename": "2008-04-06-norcar-7v5z0127.jpg",
    "County": "Hidalgo",
    "State/Province": "US-TX"
  },
  {
    "Location": "Laguna Atascosa NWR",
    "Date": "04-11-2008",
    "Scientific Name": "Geococcyx californianus",
    "Common Name": "Greater Roadrunner",
    "Filename": "2008-04-11-greroa-7v5z3124.jpg",
    "County": "Cameron",
    "State/Province": "US-TX"
  },
  {
    "Location": "Monterey Bay",
    "Date": "09-13-2009",
    "Scientific Name": "Ardenna creatopus",
    "Common Name": "Pink-footed Shearwater",
    "Filename": "2009-09-13-pifshe-7v5z0918.jpg",
    "County": "Monterey",
    "State/Province": "US-CA"
  },
  {
    "Location": "Teller Road",
    "Date": "06-12-2010",
    "Scientific Name": "Motacilla tschutschensis",
    "Common Name": "Eastern Yellow Wagtail",
    "Filename": "2010-06-12-yelwag-7v5z1339.jpg",
    "County": "Nome",
    "State/Province": "US-AK"
  },
  {
    "Location": "Rural Areas of San Benito County",
    "Date": "01-16-2010",
    "Scientific Name": "Phainopepla nitens",
    "Common Name": "Phainopepla",
    "Filename": "2010-01-16-phaino-7v5z5601.jpg",
    "County": "San Benito",
    "State/Province": "US-CA"
  },
  {
    "Location": "Arizona-Sonoran Desert Museum",
    "Date": "08-07-2010",
    "Scientific Name": "Peucaea carpalis",
    "Common Name": "Rufous-winged Sparrow",
    "Filename": "2010-08-07-ruwspa-7v5z3013.jpg",
    "County": "Pima",
    "State/Province": "US-AZ"
  },
  {
    "Location": "Arizona-Sonoran Desert Museum",
    "Date": "08-07-2010",
    "Scientific Name": "Peucaea carpalis",
    "Common Name": "Rufous-winged Sparrow",
    "Filename": "2010-08-07-ruwspa-7v5z2997.jpg",
    "County": "Pima",
    "State/Province": "US-AZ"
  },
  {
    "Location": "Arizona-Sonoran Desert Museum",
    "Date": "08-07-2010",
    "Scientific Name": "Cardinalis cardinalis",
    "Common Name": "Northern Cardinal",
    "Filename": "2010-08-07-norcar-7v5z2988.jpg",
    "County": "Pima",
    "State/Province": "US-AZ"
  },
  {
    "Location": "Arizona-Sonoran Desert Museum",
    "Date": "08-07-2010",
    "Scientific Name": "Passerina versicolor",
    "Common Name": "Varied Bunting",
    "Filename": "2010-08-07-varbun-7v5z2918.jpg",
    "County": "Pima",
    "State/Province": "US-AZ"
  },
  {
    "Location": "Madera Canyon--Upper Nature Trail from Amphitheater to Chuparosa",
    "Date": "08-09-2010",
    "Scientific Name": "Trogon elegans",
    "Common Name": "Elegant Trogon",
    "Filename": "2010-08-09-eletro-7v5z3619.jpg",
    "County": "Santa Cruz",
    "State/Province": "US-AZ"
  },
  {
    "Location": "Cave Creek Canyon",
    "Date": "08-10-2010",
    "Scientific Name": "Callipepla squamata",
    "Common Name": "Scaled Quail",
    "Filename": "2010-08-10-scaqua-7v5z4123.jpg",
    "County": "Cochise",
    "State/Province": "US-AZ"
  },
  {
    "Location": "Cave Creek Canyon--Southwestern Research Station",
    "Date": "08-11-2010",
    "Scientific Name": "Junco phaeonotus",
    "Common Name": "Yellow-eyed Junco",
    "Filename": "2010-08-11-yeejun-7v5z4545.jpg",
    "County": "Cochise",
    "State/Province": "US-AZ"
  },
  {
    "Location": "Barfoot Park",
    "Date": "08-12-2010",
    "Scientific Name": "Buteo brachyurus",
    "Common Name": "Short-tailed Hawk",
    "Filename": "2010-08-12-shthaw-7v5z4677.jpg",
    "County": "Cochise",
    "State/Province": "US-AZ"
  },
  {
    "Location": "Ash Canyon Bed and Breakfast",
    "Date": "08-13-2010",
    "Scientific Name": "Calothorax lucifer",
    "Common Name": "Lucifer Hummingbird",
    "Filename": "2010-08-13-luchum-7v5z5036.jpg",
    "County": "Cochise",
    "State/Province": "US-AZ"
  },
  {
    "Location": "Miller Canyon",
    "Date": "08-14-2010",
    "Scientific Name": "Strix occidentalis",
    "Common Name": "Spotted Owl",
    "Filename": "2010-08-14-spoowl-7v5z5368.jpg",
    "County": "Cochise",
    "State/Province": "US-AZ"
  },
  {
    "Location": "St. David--Holy Trinity Monastery",
    "Date": "08-15-2010",
    "Scientific Name": "Camptostoma imberbe",
    "Common Name": "Northern Beardless-Tyrannulet",
    "Filename": "2010-08-15-nobtyr-7v5z5615.jpg",
    "County": "Cochise",
    "State/Province": "US-AZ"
  },
  {
    "Location": "Patagonia Roadside Rest Area",
    "Date": "08-08-2010",
    "Scientific Name": "Buteo plagiatus",
    "Common Name": "Gray Hawk",
    "Filename": "2010-08-08-gryhaw-7v5z3181.jpg",
    "County": "Santa Cruz",
    "State/Province": "US-AZ"
  },
  {
    "Location": "Rio Rico",
    "Date": "08-08-2010",
    "Scientific Name": "Coragyps atratus",
    "Common Name": "Black Vulture",
    "Filename": "2010-08-08-blkvul-7v5z3082.jpg",
    "County": "Santa Cruz",
    "State/Province": "US-AZ"
  },
  {
    "Location": "Rio Rico",
    "Date": "08-08-2010",
    "Scientific Name": "Passerina ciris",
    "Common Name": "Painted Bunting",
    "Filename": "2010-08-08-paibun-7v5z3074.jpg",
    "County": "Santa Cruz",
    "State/Province": "US-AZ"
  },
  {
    "Location": "Patagonia-Sonoita Creek Preserve",
    "Date": "08-08-2010",
    "Scientific Name": "Cynanthus latirostris",
    "Common Name": "Broad-billed Hummingbird",
    "Filename": "2010-08-08-brbhum-7v5z3136.jpg",
    "County": "Santa Cruz",
    "State/Province": "US-AZ"
  },
  {
    "Location": "San Pedro River Conservation",
    "Date": "08-09-2010",
    "Scientific Name": "Peucaea botterii",
    "Common Name": "Botteri's Sparrow",
    "Filename": "2010-08-09-botspa-7v5z3804.jpg",
    "County": "Unknown",
    "State/Province": "Unknown"
  },
  {
    "Location": "Paton Center for Hummingbirds (Patons' Yard)",
    "Date": "08-08-2010",
    "Scientific Name": "Amazilia violiceps",
    "Common Name": "Violet-crowned Hummingbird",
    "Filename": "2010-08-08-vichum-7v5z3268.jpg",
    "County": "Santa Cruz",
    "State/Province": "US-AZ"
  },
  {
    "Location": "Cave Creek Canyon",
    "Date": "08-11-2010",
    "Scientific Name": "Sitta carolinensis",
    "Common Name": "White-breasted Nuthatch",
    "Filename": "2010-08-11-whbnut-7v5z4385.jpg",
    "County": "Cochise",
    "State/Province": "US-AZ"
  },
  {
    "Location": "Cave Creek Canyon",
    "Date": "08-11-2010",
    "Scientific Name": "Lampornis clemenciae",
    "Common Name": "Blue-throated Hummingbird",
    "Filename": "2010-08-11-buthum-7v5z4413.jpg",
    "County": "Cochise",
    "State/Province": "US-AZ"
  },
  {
    "Location": "Barfoot Park",
    "Date": "08-12-2010",
    "Scientific Name": "Poecile sclateri",
    "Common Name": "Mexican Chickadee",
    "Filename": "2010-08-12-mexchi-7v5z4686.jpg",
    "County": "Cochise",
    "State/Province": "US-AZ"
  },
  {
    "Location": "Miller Canyon--upper",
    "Date": "08-14-2010",
    "Scientific Name": "Empidonax fulvifrons",
    "Common Name": "Buff-breasted Flycatcher",
    "Filename": "2010-08-14-bubfly-7v5z5208.jpg",
    "County": "Cochise",
    "State/Province": "US-AZ"
  },
  {
    "Location": "Portal",
    "Date": "08-12-2010",
    "Scientific Name": "Pheucticus melanocephalus",
    "Common Name": "Black-headed Grosbeak",
    "Filename": "2010-08-12-bkhgro-7v5z4744.jpg",
    "County": "Cochise",
    "State/Province": "US-AZ"
  },
  {
    "Location": "Miller Canyon--upper",
    "Date": "08-14-2010",
    "Scientific Name": "Piranga flava",
    "Common Name": "Hepatic Tanager",
    "Filename": "2010-08-14-heptan-7v5z5190.jpg",
    "County": "Cochise",
    "State/Province": "US-AZ"
  },
  {
    "Location": "Miller Canyon--Beatty's Guest Ranch",
    "Date": "08-14-2010",
    "Scientific Name": "Hylocharis leucotis",
    "Common Name": "White-eared Hummingbird",
    "Filename": "2010-08-14-whehum-7v5z5336.jpg",
    "County": "Cochise",
    "State/Province": "US-AZ"
  },
  {
    "Location": "Las Cienegas NCA (Pima Co.)",
    "Date": "08-15-2010",
    "Scientific Name": "Campylorhynchus brunneicapillus",
    "Common Name": "Cactus Wren",
    "Filename": "2010-08-15-cacwre-7v5z5533.jpg",
    "County": "Pima",
    "State/Province": "US-AZ"
  },
  {
    "Location": "Sierra Vista",
    "Date": "08-15-2010",
    "Scientific Name": "Callipepla gambelii",
    "Common Name": "Gambel's Quail",
    "Filename": "2010-08-15-gamqua-7v5z5482.jpg",
    "County": "Cochise",
    "State/Province": "US-AZ"
  },
  {
    "Location": "Teller Road",
    "Date": "06-12-2010",
    "Scientific Name": "Clangula hyemalis",
    "Common Name": "Long-tailed Duck",
    "Filename": "2010-06-12-lotduc-7v5z1295.jpg",
    "County": "Nome",
    "State/Province": "US-AK"
  },
  {
    "Location": "Teller Road",
    "Date": "06-12-2010",
    "Scientific Name": "Lagopus lagopus",
    "Common Name": "Willow Ptarmigan",
    "Filename": "2010-06-12-wilpta-7v5z0628.jpg",
    "County": "Nome",
    "State/Province": "US-AK"
  },
  {
    "Location": "St. David--Holy Trinity Monastery",
    "Date": "08-15-2010",
    "Scientific Name": "Ictinia mississippiensis",
    "Common Name": "Mississippi Kite",
    "Filename": "2010-08-15-miskit-7v5z5752.jpg",
    "County": "Cochise",
    "State/Province": "US-AZ"
  },
  {
    "Location": "Teller Road",
    "Date": "06-08-2010",
    "Scientific Name": "Plectrophenax nivalis",
    "Common Name": "Snow Bunting",
    "Filename": "2010-06-08-snobun-7v5z1180.jpg",
    "County": "Nome",
    "State/Province": "US-AK"
  },
  {
    "Location": "Sutter Buttes",
    "Date": "05-15-2010",
    "Scientific Name": "Tyrannus verticalis",
    "Common Name": "Western Kingbird",
    "Filename": "2010-05-15-weskin-img_0473.jpg",
    "County": "Sutter",
    "State/Province": "US-CA"
  },
  {
    "Location": "Elkhorn Slough",
    "Date": "10-14-2006",
    "Scientific Name": "Charadrius nivosus",
    "Common Name": "Snowy Plover",
    "Filename": "2006-10-14-snoplo-img_8561.jpg",
    "County": "Monterey",
    "State/Province": "US-CA"
  },
  {
    "Location": "Elkhorn Slough",
    "Date": "10-14-2006",
    "Scientific Name": "Charadrius nivosus",
    "Common Name": "Snowy Plover",
    "Filename": "2006-10-14-snoplo-img_8587.jpg",
    "County": "Monterey",
    "State/Province": "US-CA"
  },
  {
    "Location": "Council Road",
    "Date": "06-09-2010",
    "Scientific Name": "Larus canus",
    "Common Name": "Mew Gull",
    "Filename": "2010-06-09-mewgul-7v5z1855.jpg",
    "County": "Nome",
    "State/Province": "US-AK"
  },
  {
    "Location": "Teller Road",
    "Date": "06-08-2010",
    "Scientific Name": "Setophaga petechia",
    "Common Name": "Yellow Warbler",
    "Filename": "2010-06-08-yelwar-7v5z0921.jpg",
    "County": "Nome",
    "State/Province": "US-AK"
  },
  {
    "Location": "Drawbridge",
    "Date": "12-20-2009",
    "Scientific Name": "Falco mexicanus",
    "Common Name": "Prairie Falcon",
    "Filename": "2009-12-20-prafal-7v5z4445.jpg",
    "County": "Alameda",
    "State/Province": "US-CA"
  },
  {
    "Location": "Pillar Point",
    "Date": "01-23-2011",
    "Scientific Name": "Larus canus",
    "Common Name": "Mew Gull",
    "Filename": "2011-01-23-mewgul-7v5z0089.jpg",
    "County": "San Mateo",
    "State/Province": "US-CA"
  },
  {
    "Location": "Bean Hollow State Beach",
    "Date": "01-23-2011",
    "Scientific Name": "Larus argentatus",
    "Common Name": "Herring Gull",
    "Filename": "2011-01-23-hergul-7v5z0574.jpg",
    "County": "San Mateo",
    "State/Province": "US-CA"
  },
  {
    "Location": "Bean Hollow State Beach",
    "Date": "01-23-2011",
    "Scientific Name": "Larus hyperboreus",
    "Common Name": "Glaucous Gull",
    "Filename": "2011-01-23-glagul-7v5z0608.jpg",
    "County": "San Mateo",
    "State/Province": "US-CA"
  },
  {
    "Location": "Bean Hollow State Beach",
    "Date": "01-23-2011",
    "Scientific Name": "Larus glaucoides thayeri",
    "Common Name": "Iceland Gull (Thayer's)",
    "Filename": "2011-01-23-thagul-7v5z0615.jpg",
    "County": "San Mateo",
    "State/Province": "US-CA"
  },
  {
    "Location": "Panoche Valley--general area (SBT Co.)",
    "Date": "02-05-2011",
    "Scientific Name": "Tyrannus vociferans",
    "Common Name": "Cassin's Kingbird",
    "Filename": "2011-02-05-caskin-7v5z0783.jpg",
    "County": "San Benito",
    "State/Province": "US-CA"
  },
  {
    "Location": "Big Sur",
    "Date": "01-15-2011",
    "Scientific Name": "Gymnogyps californianus",
    "Common Name": "California Condor",
    "Filename": "2011-01-15-calcon-7v5z9451.jpg",
    "County": "Monterey",
    "State/Province": "US-CA"
  },
  {
    "Location": "Ed Levin County Park -- Spring Valley",
    "Date": "02-04-2011",
    "Scientific Name": "Sphyrapicus ruber",
    "Common Name": "Red-breasted Sapsucker",
    "Filename": "2011-02-04-rebsap-7v5z0633.jpg",
    "County": "Santa Clara",
    "State/Province": "US-CA"
  },
  {
    "Location": "Panoche Valley--general area (SBT Co.)",
    "Date": "02-19-2011",
    "Scientific Name": "Charadrius montanus",
    "Common Name": "Mountain Plover",
    "Filename": "2011-02-19-mouplo-7v5z5657.jpg",
    "County": "San Benito",
    "State/Province": "US-CA"
  },
  {
    "Location": "Rural Areas of Champaign County",
    "Date": "12-26-2007",
    "Scientific Name": "Lanius excubitor",
    "Common Name": "Northern Shrike",
    "Filename": "2007-12-26-norshr-img_4634.jpg",
    "County": "Champaign",
    "State/Province": "US-IL"
  },
  {
    "Location": "Venice Rookery",
    "Date": "12-27-2006",
    "Scientific Name": "Ardea herodias",
    "Common Name": "Great Blue Heron",
    "Filename": "2006-12-27-grbher-img_1411.jpg",
    "County": "Sarasota",
    "State/Province": "US-FL"
  },
  {
    "Location": "Lake Tohopekaliga",
    "Date": "01-28-2008",
    "Scientific Name": "Ardea herodias",
    "Common Name": "Great Blue Heron",
    "Filename": "2008-01-28-grbher-img_6041.jpg",
    "County": "Osceola",
    "State/Province": "US-FL"
  },
  {
    "Location": "Edinburg Scenic Wetlands",
    "Date": "04-08-2008",
    "Scientific Name": "Buteo swainsoni",
    "Common Name": "Swainson's Hawk",
    "Filename": "2008-04-08-swahaw-7v5z1149.jpg",
    "County": "Hidalgo",
    "State/Province": "US-TX"
  },
  {
    "Location": "Edinburg Scenic Wetlands",
    "Date": "04-08-2008",
    "Scientific Name": "Tachybaptus dominicus",
    "Common Name": "Least Grebe",
    "Filename": "2008-04-08-leagre-7v5z1241.jpg",
    "County": "Hidalgo",
    "State/Province": "US-TX"
  },
  {
    "Location": "Edinburg Scenic Wetlands",
    "Date": "04-08-2008",
    "Scientific Name": "Cardinalis cardinalis",
    "Common Name": "Northern Cardinal",
    "Filename": "2008-04-08-norcar-7v5z1306.jpg",
    "County": "Hidalgo",
    "State/Province": "US-TX"
  },
  {
    "Location": "Edinburg Scenic Wetlands",
    "Date": "04-08-2008",
    "Scientific Name": "Butorides virescens",
    "Common Name": "Green Heron",
    "Filename": "2008-04-08-grnher-7v5z1349.jpg",
    "County": "Hidalgo",
    "State/Province": "US-TX"
  },
  {
    "Location": "Laguna Atascosa NWR",
    "Date": "04-11-2008",
    "Scientific Name": "Crotophaga sulcirostris",
    "Common Name": "Groove-billed Ani",
    "Filename": "2008-04-11-grbani-7v5z3156.jpg",
    "County": "Cameron",
    "State/Province": "US-TX"
  },
  {
    "Location": "Laguna Atascosa NWR",
    "Date": "04-11-2008",
    "Scientific Name": "Crotophaga sulcirostris",
    "Common Name": "Groove-billed Ani",
    "Filename": "2008-04-11-grbani-7v5z3176.jpg",
    "County": "Cameron",
    "State/Province": "US-TX"
  },
  {
    "Location": "Laguna Atascosa NWR",
    "Date": "04-11-2008",
    "Scientific Name": "Aythya americana",
    "Common Name": "Redhead",
    "Filename": "2008-04-11-redhea-7v5z3796.jpg",
    "County": "Cameron",
    "State/Province": "US-TX"
  },
  {
    "Location": "South Padre Island",
    "Date": "04-11-2008",
    "Scientific Name": "Ardea herodias",
    "Common Name": "Great Blue Heron",
    "Filename": "2008-04-11-grbher-7v5z3805.jpg",
    "County": "Cameron",
    "State/Province": "US-TX"
  },
  {
    "Location": "Mercey Hot Springs",
    "Date": "02-19-2011",
    "Scientific Name": "Asio otus",
    "Common Name": "Long-eared Owl",
    "Filename": "2011-02-19-loeowl-7v5z5850.jpg",
    "County": "Fresno",
    "State/Province": "US-CA"
  },
  {
    "Location": "Cave Creek Canyon--South Fork",
    "Date": "08-11-2010",
    "Scientific Name": "Myiodynastes luteiventris",
    "Common Name": "Sulphur-bellied Flycatcher",
    "Filename": "2010-08-11-subfly-7v5z4306.jpg",
    "County": "Cochise",
    "State/Province": "US-AZ"
  },
  {
    "Location": "Charleston Slough",
    "Date": "11-13-2010",
    "Scientific Name": "Ardea herodias",
    "Common Name": "Great Blue Heron",
    "Filename": "2010-11-13-grbher-7v5z8021.jpg",
    "County": "Santa Clara",
    "State/Province": "US-CA"
  },
  {
    "Location": "New Idria Road",
    "Date": "02-05-2011",
    "Scientific Name": "Falco mexicanus",
    "Common Name": "Prairie Falcon",
    "Filename": "2011-02-05-prafal-7v5z0981.jpg",
    "County": "San Benito",
    "State/Province": "US-CA"
  },
  {
    "Location": "New Idria Road",
    "Date": "02-05-2011",
    "Scientific Name": "Aquila chrysaetos",
    "Common Name": "Golden Eagle",
    "Filename": "2011-02-05-goleag-7v5z0986.jpg",
    "County": "San Benito",
    "State/Province": "US-CA"
  },
  {
    "Location": "Patagonia-Sonoita Creek Preserve",
    "Date": "08-08-2010",
    "Scientific Name": "Melozone fusca",
    "Common Name": "Canyon Towhee",
    "Filename": "2010-08-08-cantow-7v5z3208.jpg",
    "County": "Santa Cruz",
    "State/Province": "US-AZ"
  },
  {
    "Location": "Cave Creek Canyon",
    "Date": "08-13-2010",
    "Scientific Name": "Melozone fusca",
    "Common Name": "Canyon Towhee",
    "Filename": "2010-08-13-cantow-7v5z5092.jpg",
    "County": "Cochise",
    "State/Province": "US-AZ"
  },
  {
    "Location": "Arizona-Sonoran Desert Museum",
    "Date": "08-07-2010",
    "Scientific Name": "Melanerpes uropygialis",
    "Common Name": "Gila Woodpecker",
    "Filename": "2010-08-07-gilwoo-7v5z2914.jpg",
    "County": "Pima",
    "State/Province": "US-AZ"
  },
  {
    "Location": "Council Road",
    "Date": "06-09-2010",
    "Scientific Name": "Perisoreus canadensis",
    "Common Name": "Gray Jay",
    "Filename": "2010-06-09-gryjay-7v5z2225.jpg",
    "County": "Nome",
    "State/Province": "US-AK"
  },
  {
    "Location": "Kougarok Road",
    "Date": "06-10-2010",
    "Scientific Name": "Luscinia svecica",
    "Common Name": "Bluethroat",
    "Filename": "2010-06-10-blueth-7v5z2718.jpg",
    "County": "Nome",
    "State/Province": "US-AK"
  },
  {
    "Location": "Kougarok Road",
    "Date": "06-10-2010",
    "Scientific Name": "Riparia riparia",
    "Common Name": "Bank Swallow",
    "Filename": "2010-06-10-banswa-7v5z2740.jpg",
    "County": "Nome",
    "State/Province": "US-AK"
  },
  {
    "Location": "Fall River Mills",
    "Date": "05-11-2009",
    "Scientific Name": "Riparia riparia",
    "Common Name": "Bank Swallow",
    "Filename": "2009-05-11-banswa-7v5z3733.jpg",
    "County": "Shasta",
    "State/Province": "US-CA"
  },
  {
    "Location": "Portal-Paradise Road",
    "Date": "08-12-2010",
    "Scientific Name": "Picoides arizonae",
    "Common Name": "Arizona Woodpecker",
    "Filename": "2010-08-12-strwoo-7v5z4842.jpg",
    "County": "Cochise",
    "State/Province": "US-AZ"
  },
  {
    "Location": "Miller Canyon--Beatty's Guest Ranch",
    "Date": "08-14-2010",
    "Scientific Name": "Amazilia beryllina",
    "Common Name": "Berylline Hummingbird",
    "Filename": "2010-08-14-berhum-7v5z5331.jpg",
    "County": "Cochise",
    "State/Province": "US-AZ"
  },
  {
    "Location": "Sutter Buttes",
    "Date": "05-15-2010",
    "Scientific Name": "Tyto alba",
    "Common Name": "Barn Owl",
    "Filename": "2010-05-15-brnowl-_mk_5433.jpg",
    "County": "Sutter",
    "State/Province": "US-CA"
  },
  {
    "Location": "Viera Wetlands",
    "Date": "01-27-2008",
    "Scientific Name": "Plegadis falcinellus",
    "Common Name": "Glossy Ibis",
    "Filename": "2008-01-27-gloibi-img_5628.jpg",
    "County": "Brevard",
    "State/Province": "US-FL"
  },
  {
    "Location": "Jasper National Park",
    "Date": "07-09-2007",
    "Scientific Name": "Surnia ulula",
    "Common Name": "Northern Hawk Owl",
    "Filename": "2007-07-09-nohowl-img_9762.jpg",
    "County": "Banff",
    "State/Province": "CA-AB"
  },
  {
    "Location": "Charleston Slough",
    "Date": "11-13-2010",
    "Scientific Name": "Larus glaucescens",
    "Common Name": "Glaucous-winged Gull",
    "Filename": "2010-11-13-glwgul-7v5z8114.jpg",
    "County": "Santa Clara",
    "State/Province": "US-CA"
  },
  {
    "Location": "Wasilla and Palmer",
    "Date": "06-06-2010",
    "Scientific Name": "Poecile atricapillus",
    "Common Name": "Black-capped Chickadee",
    "Filename": "2010-06-06-bkcchi-7v5z0025.jpg",
    "County": "Matanuska-Susitna",
    "State/Province": "US-AK"
  },
  {
    "Location": "Cave Creek Canyon--South Fork",
    "Date": "08-11-2010",
    "Scientific Name": "Myioborus pictus",
    "Common Name": "Painted Redstart",
    "Filename": "2010-08-11-paired-7v5z4271.jpg",
    "County": "Cochise",
    "State/Province": "US-AZ"
  },
  {
    "Location": "Wasilla and Palmer",
    "Date": "06-06-2010",
    "Scientific Name": "Euphagus carolinus",
    "Common Name": "Rusty Blackbird",
    "Filename": "2010-06-06-rusbla-7v5z9860.jpg",
    "County": "Matanuska-Susitna",
    "State/Province": "US-AK"
  },
  {
    "Location": "Wasilla and Palmer",
    "Date": "06-06-2010",
    "Scientific Name": "Empidonax alnorum",
    "Common Name": "Alder Flycatcher",
    "Filename": "2010-06-06-aldfly-7v5z9895.jpg",
    "County": "Matanuska-Susitna",
    "State/Province": "US-AK"
  },
  {
    "Location": "Wasilla and Palmer",
    "Date": "06-06-2010",
    "Scientific Name": "Passerella iliaca",
    "Common Name": "Fox Sparrow",
    "Filename": "2010-06-06-foxspa-7v5z9952.jpg",
    "County": "Matanuska-Susitna",
    "State/Province": "US-AK"
  },
  {
    "Location": "Jasper National Park",
    "Date": "07-11-2007",
    "Scientific Name": "Leucosticte tephrocotis",
    "Common Name": "Gray-crowned Rosy-Finch",
    "Filename": "2007-07-11-gcrfin-img_0203.jpg",
    "County": "Banff",
    "State/Province": "CA-AB"
  },
  {
    "Location": "Jasper National Park",
    "Date": "07-11-2007",
    "Scientific Name": "Leucosticte tephrocotis",
    "Common Name": "Gray-crowned Rosy-Finch",
    "Filename": "2007-07-11-gcrfin-img_0208.jpg",
    "County": "Banff",
    "State/Province": "CA-AB"
  },
  {
    "Location": "Madera Canyon--Upper Nature Trail from Amphitheater to Chuparosa",
    "Date": "08-09-2010",
    "Scientific Name": "Vireo plumbeus",
    "Common Name": "Plumbeous Vireo",
    "Filename": "2010-08-09-pluvir-7v5z3527.jpg",
    "County": "Santa Cruz",
    "State/Province": "US-AZ"
  },
  {
    "Location": "Venice Rookery",
    "Date": "12-27-2006",
    "Scientific Name": "Haliaeetus leucocephalus",
    "Common Name": "Bald Eagle",
    "Filename": "2006-12-27-baleag-img_1527.jpg",
    "County": "Sarasota",
    "State/Province": "US-FL"
  },
  {
    "Location": "Slave Lake",
    "Date": "07-08-2007",
    "Scientific Name": "Bonasa umbellus",
    "Common Name": "Ruffed Grouse",
    "Filename": "2007-07-08-rufgro-img_9541.jpg",
    "County": "Slave Lake",
    "State/Province": "CA-AB"
  },
  {
    "Location": "Teller Road",
    "Date": "06-08-2010",
    "Scientific Name": "Cygnus columbianus",
    "Common Name": "Tundra Swan",
    "Filename": "2010-06-08-tunswa-7v5z1528.jpg",
    "County": "Nome",
    "State/Province": "US-AK"
  },
  {
    "Location": "Sunnyvale WPCP--marsh adjacent to Yahoo",
    "Date": "03-05-2011",
    "Scientific Name": "Podilymbus podiceps",
    "Common Name": "Pied-billed Grebe",
    "Filename": "2011-03-05-pibgre-7v5z6091.jpg",
    "County": "Santa Clara",
    "State/Province": "US-CA"
  },
  {
    "Location": "Shoreline Lake",
    "Date": "04-11-2011",
    "Scientific Name": "Podiceps auritus",
    "Common Name": "Horned Grebe",
    "Filename": "2011-04-11-horgre-7v5z6686.jpg",
    "County": "Santa Clara",
    "State/Province": "US-CA"
  },
  {
    "Location": "Shoreline Lake",
    "Date": "04-11-2011",
    "Scientific Name": "Podiceps auritus",
    "Common Name": "Horned Grebe",
    "Filename": "2011-04-11-horgre-7v5z6772.jpg",
    "County": "Santa Clara",
    "State/Province": "US-CA"
  },
  {
    "Location": "Stevens Creek County Park",
    "Date": "03-13-2011",
    "Scientific Name": "Junco hyemalis",
    "Common Name": "Dark-eyed Junco",
    "Filename": "2011-03-13-daejun-7v5z6193.jpg",
    "County": "Santa Clara",
    "State/Province": "US-CA"
  },
  {
    "Location": "Santa Cruz",
    "Date": "04-08-2011",
    "Scientific Name": "Calidris virgata",
    "Common Name": "Surfbird",
    "Filename": "2011-04-08-surfbi-7v5z6612.jpg",
    "County": "Santa Cruz",
    "State/Province": "US-CA"
  },
  {
    "Location": "Stile Ranch Trail",
    "Date": "04-22-2011",
    "Scientific Name": "Aimophila ruficeps",
    "Common Name": "Rufous-crowned Sparrow",
    "Filename": "2011-04-22-rucspa-7v5z6903.jpg",
    "County": "Santa Clara",
    "State/Province": "US-CA"
  },
  {
    "Location": "Stile Ranch Trail",
    "Date": "04-22-2011",
    "Scientific Name": "Aimophila ruficeps",
    "Common Name": "Rufous-crowned Sparrow",
    "Filename": "2011-04-22-rucspa-7v5z6933.jpg",
    "County": "Santa Clara",
    "State/Province": "US-CA"
  },
  {
    "Location": "Stile Ranch Trail",
    "Date": "04-22-2011",
    "Scientific Name": "Chamaea fasciata",
    "Common Name": "Wrentit",
    "Filename": "2011-04-22-wrenti-7v5z6997.jpg",
    "County": "Santa Clara",
    "State/Province": "US-CA"
  },
  {
    "Location": "Sunnyvale WPCP--marsh adjacent to Yahoo",
    "Date": "03-05-2011",
    "Scientific Name": "Bucephala clangula",
    "Common Name": "Common Goldeneye",
    "Filename": "2011-03-05-comgol-7v5z6152.jpg",
    "County": "Santa Clara",
    "State/Province": "US-CA"
  },
  {
    "Location": "Garin / Dry Creek Regional Parks",
    "Date": "04-29-2011",
    "Scientific Name": "Ammodramus savannarum",
    "Common Name": "Grasshopper Sparrow",
    "Filename": "2011-04-29-graspa-7v5z7318.jpg",
    "County": "Alameda",
    "State/Province": "US-CA"
  },
  {
    "Location": "Glenn",
    "Date": "11-23-2007",
    "Scientific Name": "Buteo lagopus",
    "Common Name": "Rough-legged Hawk",
    "Filename": "2007-11-23-rolhaw-img_3552.jpg",
    "County": "Glenn",
    "State/Province": "US-CA"
  },
  {
    "Location": "Fontini Trail",
    "Date": "05-14-2011",
    "Scientific Name": "Toxostoma redivivum",
    "Common Name": "California Thrasher",
    "Filename": "2011-05-14-calthr-7v5z8326.jpg",
    "County": "Santa Clara",
    "State/Province": "US-CA"
  },
  {
    "Location": "Fontini Trail",
    "Date": "05-14-2011",
    "Scientific Name": "Toxostoma redivivum",
    "Common Name": "California Thrasher",
    "Filename": "2011-05-14-calthr-7v5z8332.jpg",
    "County": "Santa Clara",
    "State/Province": "US-CA"
  },
  {
    "Location": "Fontini Trail",
    "Date": "05-14-2011",
    "Scientific Name": "Aimophila ruficeps",
    "Common Name": "Rufous-crowned Sparrow",
    "Filename": "2011-05-14-rucspa-7v5z8377.jpg",
    "County": "Santa Clara",
    "State/Province": "US-CA"
  },
  {
    "Location": "Fontini Trail",
    "Date": "05-14-2011",
    "Scientific Name": "Cathartes aura",
    "Common Name": "Turkey Vulture",
    "Filename": "2011-05-14-turvul-7v5z8390.jpg",
    "County": "Santa Clara",
    "State/Province": "US-CA"
  },
  {
    "Location": "Sierra Azul Open Space Preserve",
    "Date": "05-14-2011",
    "Scientific Name": "Myiarchus cinerascens",
    "Common Name": "Ash-throated Flycatcher",
    "Filename": "2011-05-14-astfly-7v5z8408.jpg",
    "County": "Santa Clara",
    "State/Province": "US-CA"
  },
  {
    "Location": "Stevens Creek County Park",
    "Date": "05-14-2011",
    "Scientific Name": "Turdus migratorius",
    "Common Name": "American Robin",
    "Filename": "2011-05-14-amerob-7v5z8465.jpg",
    "County": "Santa Clara",
    "State/Province": "US-CA"
  },
  {
    "Location": "Stevens Creek County Park",
    "Date": "05-14-2011",
    "Scientific Name": "Pheucticus melanocephalus",
    "Common Name": "Black-headed Grosbeak",
    "Filename": "2011-05-14-bkhgro-7v5z8500.jpg",
    "County": "Santa Clara",
    "State/Province": "US-CA"
  },
  {
    "Location": "Don Edwards Center",
    "Date": "05-13-2011",
    "Scientific Name": "Recurvirostra americana",
    "Common Name": "American Avocet",
    "Filename": "2011-05-13-ameavo-7v5z7777.jpg",
    "County": "Santa Clara",
    "State/Province": "US-CA"
  },
  {
    "Location": "Foster City Radio Tower",
    "Date": "05-13-2011",
    "Scientific Name": "Corvus corax",
    "Common Name": "Common Raven",
    "Filename": "2011-05-13-comrav-7v5z7898.jpg",
    "County": "San Mateo",
    "State/Province": "US-CA"
  },
  {
    "Location": "Foster City Radio Tower",
    "Date": "05-13-2011",
    "Scientific Name": "Falco columbarius",
    "Common Name": "Merlin",
    "Filename": "2011-05-13-merlin-7v5z8020.jpg",
    "County": "San Mateo",
    "State/Province": "US-CA"
  },
  {
    "Location": "Foster City Radio Tower",
    "Date": "05-13-2011",
    "Scientific Name": "Limosa fedoa",
    "Common Name": "Marbled Godwit",
    "Filename": "2011-05-13-margod-7v5z8064.jpg",
    "County": "San Mateo",
    "State/Province": "US-CA"
  },
  {
    "Location": "Foster City Radio Tower",
    "Date": "05-13-2011",
    "Scientific Name": "Limnodromus scolopaceus",
    "Common Name": "Long-billed Dowitcher",
    "Filename": "2011-05-13-lobdow-7v5z8074.jpg",
    "County": "San Mateo",
    "State/Province": "US-CA"
  },
  {
    "Location": "Foster City Radio Tower",
    "Date": "05-13-2011",
    "Scientific Name": "Rynchops niger",
    "Common Name": "Black Skimmer",
    "Filename": "2011-05-13-blkski-7v5z8002.jpg",
    "County": "San Mateo",
    "State/Province": "US-CA"
  },
  {
    "Location": "Palo Alto Duck Pond",
    "Date": "05-05-2011",
    "Scientific Name": "Nycticorax nycticorax",
    "Common Name": "Black-crowned Night-Heron",
    "Filename": "2011-05-05-bcnher-7v5z7490.jpg",
    "County": "Santa Clara",
    "State/Province": "US-CA"
  },
  {
    "Location": "Palo Alto Baylands Boat Launch",
    "Date": "05-05-2011",
    "Scientific Name": "Petrochelidon pyrrhonota",
    "Common Name": "Cliff Swallow",
    "Filename": "2011-05-05-cliswa-7v5z7617.jpg",
    "County": "Santa Clara",
    "State/Province": "US-CA"
  },
  {
    "Location": "Coyote Hills Regional Park",
    "Date": "05-15-2011",
    "Scientific Name": "Bubo virginianus",
    "Common Name": "Great Horned Owl",
    "Filename": "2011-05-15-grhowl-7v5z8572.jpg",
    "County": "Alameda",
    "State/Province": "US-CA"
  },
  {
    "Location": "Coyote Hills Regional Park",
    "Date": "05-15-2011",
    "Scientific Name": "Vireo gilvus",
    "Common Name": "Warbling Vireo",
    "Filename": "2011-05-15-warvir-7v5z8611.jpg",
    "County": "Alameda",
    "State/Province": "US-CA"
  },
  {
    "Location": "Coyote Hills Regional Park",
    "Date": "05-15-2011",
    "Scientific Name": "Cardellina pusilla",
    "Common Name": "Wilson's Warbler",
    "Filename": "2011-05-15-wlswar-7v5z8625.jpg",
    "County": "Alameda",
    "State/Province": "US-CA"
  },
  {
    "Location": "Bean Hollow State Beach",
    "Date": "01-23-2011",
    "Scientific Name": "Larus glaucescens",
    "Common Name": "Glaucous-winged Gull",
    "Filename": "2011-01-23-glwgul-7v5z0560.jpg",
    "County": "San Mateo",
    "State/Province": "US-CA"
  },
  {
    "Location": "Shoreline Lake",
    "Date": "04-11-2011",
    "Scientific Name": "Melanitta perspicillata",
    "Common Name": "Surf Scoter",
    "Filename": "2011-04-11-sursco-7v5z6834.jpg",
    "County": "Santa Clara",
    "State/Province": "US-CA"
  },
  {
    "Location": "Palo Alto Duck Pond",
    "Date": "05-05-2011",
    "Scientific Name": "Nycticorax nycticorax",
    "Common Name": "Black-crowned Night-Heron",
    "Filename": "2011-05-05-bcnher-7v5z7534.jpg",
    "County": "Santa Clara",
    "State/Province": "US-CA"
  },
  {
    "Location": "Panoche Valley--general area (SBT Co.)",
    "Date": "02-05-2011",
    "Scientific Name": "Passerculus sandwichensis",
    "Common Name": "Savannah Sparrow",
    "Filename": "2011-02-05-savspa-7v5z1096.jpg",
    "County": "San Benito",
    "State/Province": "US-CA"
  },
  {
    "Location": "Stevens Creek County Park",
    "Date": "03-13-2011",
    "Scientific Name": "Picoides villosus",
    "Common Name": "Hairy Woodpecker",
    "Filename": "2011-03-13-haiwoo-7v5z6180.jpg",
    "County": "Santa Clara",
    "State/Province": "US-CA"
  },
  {
    "Location": "Ulistac Natural Area",
    "Date": "01-07-2011",
    "Scientific Name": "Colaptes auratus",
    "Common Name": "Northern Flicker",
    "Filename": "2011-01-07-norfli-7v5z9075.jpg",
    "County": "Santa Clara",
    "State/Province": "US-CA"
  },
  {
    "Location": "Anchorage",
    "Date": "06-05-2010",
    "Scientific Name": "Limosa haemastica",
    "Common Name": "Hudsonian Godwit",
    "Filename": "2010-06-05-hudgod-7v5z0515.jpg",
    "County": "Anchorage",
    "State/Province": "US-AK"
  },
  {
    "Location": "Cold Lake Provincial Park",
    "Date": "07-04-2007",
    "Scientific Name": "Poecile hudsonicus",
    "Common Name": "Boreal Chickadee",
    "Filename": "2007-07-04-borchi-img_8884.jpg",
    "County": "St. Paul",
    "State/Province": "CA-AB"
  },
  {
    "Location": "Cold Lake Provincial Park",
    "Date": "07-05-2007",
    "Scientific Name": "Setophaga pensylvanica",
    "Common Name": "Chestnut-sided Warbler",
    "Filename": "2007-07-05-chswar-img_8984.jpg",
    "County": "St. Paul",
    "State/Province": "CA-AB"
  },
  {
    "Location": "Lake Tohopekaliga",
    "Date": "01-28-2008",
    "Scientific Name": "Rostrhamus sociabilis",
    "Common Name": "Snail Kite",
    "Filename": "2008-01-28-snakit-img_6204.jpg",
    "County": "Osceola",
    "State/Province": "US-FL"
  },
  {
    "Location": "Sierra Valley (SIE Co.)",
    "Date": "06-12-2007",
    "Scientific Name": "Oreoscoptes montanus",
    "Common Name": "Sage Thrasher",
    "Filename": "2007-06-12-sagthr-img_7762.jpg",
    "County": "Sierra",
    "State/Province": "US-CA"
  },
  {
    "Location": "Del Puerto Canyon Rd.--middle canyon (mile 8.0-12.0)",
    "Date": "05-29-2011",
    "Scientific Name": "Contopus sordidulus",
    "Common Name": "Western Wood-Pewee",
    "Filename": "2011-05-29-wewpew-7v5z8758.jpg",
    "County": "Stanislaus",
    "State/Province": "US-CA"
  },
  {
    "Location": "Del Puerto Canyon Rd.--middle canyon (mile 8.0-12.0)",
    "Date": "05-29-2011",
    "Scientific Name": "Haliaeetus leucocephalus",
    "Common Name": "Bald Eagle",
    "Filename": "2011-05-29-baleag-7v5z8871.jpg",
    "County": "Stanislaus",
    "State/Province": "US-CA"
  },
  {
    "Location": "San Antonio Valley",
    "Date": "05-29-2011",
    "Scientific Name": "Melanerpes lewis",
    "Common Name": "Lewis's Woodpecker",
    "Filename": "2011-05-29-lewwoo-7v5z9095.jpg",
    "County": "Santa Clara",
    "State/Province": "US-CA"
  },
  {
    "Location": "San Antonio Valley",
    "Date": "05-29-2011",
    "Scientific Name": "Spinus lawrencei",
    "Common Name": "Lawrence's Goldfinch",
    "Filename": "2011-05-29-lawgol-7v5z9219.jpg",
    "County": "Santa Clara",
    "State/Province": "US-CA"
  },
  {
    "Location": "Monte Bello Open Space Preserve",
    "Date": "05-28-2011",
    "Scientific Name": "Setophaga nigrescens",
    "Common Name": "Black-throated Gray Warbler",
    "Filename": "2011-05-28-btywar-7v5z8706.jpg",
    "County": "Santa Clara",
    "State/Province": "US-CA"
  },
  {
    "Location": "Palo Alto Duck Pond",
    "Date": "06-17-2011",
    "Scientific Name": "Recurvirostra americana",
    "Common Name": "American Avocet",
    "Filename": "2011-06-17-ameavo-7v5z9955.jpg",
    "County": "Santa Clara",
    "State/Province": "US-CA"
  },
  {
    "Location": "Palo Alto Duck Pond",
    "Date": "06-17-2011",
    "Scientific Name": "Himantopus mexicanus",
    "Common Name": "Black-necked Stilt",
    "Filename": "2011-06-17-bknsti-7v5z9996.jpg",
    "County": "Santa Clara",
    "State/Province": "US-CA"
  },
  {
    "Location": "Don Edwards Center",
    "Date": "08-11-2011",
    "Scientific Name": "Calidris bairdii",
    "Common Name": "Baird's Sandpiper",
    "Filename": "2011-08-11-baisan-7v5z2983.jpg",
    "County": "Santa Clara",
    "State/Province": "US-CA"
  },
  {
    "Location": "Don Edwards Center",
    "Date": "08-11-2011",
    "Scientific Name": "Calidris bairdii",
    "Common Name": "Baird's Sandpiper",
    "Filename": "2011-08-11-baisan-7v5z3059.jpg",
    "County": "Santa Clara",
    "State/Province": "US-CA"
  },
  {
    "Location": "Don Edwards Center",
    "Date": "08-11-2011",
    "Scientific Name": "Calidris bairdii",
    "Common Name": "Baird's Sandpiper",
    "Filename": "2011-08-11-baisan-7v5z2955.jpg",
    "County": "Santa Clara",
    "State/Province": "US-CA"
  },
  {
    "Location": "Muir Woods NM",
    "Date": "07-17-2011",
    "Scientific Name": "Strix varia",
    "Common Name": "Barred Owl",
    "Filename": "2011-07-17-brdowl-7v5z0864.jpg",
    "County": "Marin",
    "State/Province": "US-CA"
  },
  {
    "Location": "Prairie du Chien--La Riviere Park",
    "Date": "08-07-2011",
    "Scientific Name": "Spizella pusilla",
    "Common Name": "Field Sparrow",
    "Filename": "2011-08-07-fiespa-7v5z2417.jpg",
    "County": "Crawford",
    "State/Province": "US-WI"
  },
  {
    "Location": "Prairie du Chien--La Riviere Park",
    "Date": "08-07-2011",
    "Scientific Name": "Spizella pusilla",
    "Common Name": "Field Sparrow",
    "Filename": "2011-08-07-fiespa-7v5z2425.jpg",
    "County": "Crawford",
    "State/Province": "US-WI"
  },
  {
    "Location": "Schlitz Audubon Nature Center",
    "Date": "08-04-2011",
    "Scientific Name": "Cardinalis cardinalis",
    "Common Name": "Northern Cardinal",
    "Filename": "2011-08-04-norcar-7v5z2020.jpg",
    "County": "Milwaukee",
    "State/Province": "US-WI"
  },
  {
    "Location": "Schlitz Audubon Nature Center",
    "Date": "08-04-2011",
    "Scientific Name": "Melanerpes carolinus",
    "Common Name": "Red-bellied Woodpecker",
    "Filename": "2011-08-04-rebwoo-7v5z2032.jpg",
    "County": "Milwaukee",
    "State/Province": "US-WI"
  },
  {
    "Location": "Whitefish Bay",
    "Date": "08-02-2011",
    "Scientific Name": "Passer domesticus",
    "Common Name": "House Sparrow",
    "Filename": "2011-08-02-houspa-7v5z1414.jpg",
    "County": "Door",
    "State/Province": "US-WI"
  },
  {
    "Location": "Whitefish Bay",
    "Date": "08-02-2011",
    "Scientific Name": "Poecile atricapillus",
    "Common Name": "Black-capped Chickadee",
    "Filename": "2011-08-02-bkcchi-7v5z1453.jpg",
    "County": "Door",
    "State/Province": "US-WI"
  },
  {
    "Location": "Lake Park--general",
    "Date": "08-02-2011",
    "Scientific Name": "Sitta carolinensis",
    "Common Name": "White-breasted Nuthatch",
    "Filename": "2011-08-02-whbnut-7v5z1548.jpg",
    "County": "Milwaukee",
    "State/Province": "US-WI"
  },
  {
    "Location": "Schlitz Audubon Nature Center",
    "Date": "08-03-2011",
    "Scientific Name": "Vireo olivaceus",
    "Common Name": "Red-eyed Vireo",
    "Filename": "2011-08-03-reevir-7v5z1775.jpg",
    "County": "Milwaukee",
    "State/Province": "US-WI"
  },
  {
    "Location": "Schlitz Audubon Nature Center",
    "Date": "08-03-2011",
    "Scientific Name": "Vireo olivaceus",
    "Common Name": "Red-eyed Vireo",
    "Filename": "2011-08-03-reevir-7v5z1785.jpg",
    "County": "Milwaukee",
    "State/Province": "US-WI"
  },
  {
    "Location": "Prairie du Chien--La Riviere Park",
    "Date": "08-05-2011",
    "Scientific Name": "Sialia sialis",
    "Common Name": "Eastern Bluebird",
    "Filename": "2011-08-05-easblu-7v5z2054.jpg",
    "County": "Crawford",
    "State/Province": "US-WI"
  },
  {
    "Location": "Schlitz Audubon Nature Center",
    "Date": "08-03-2011",
    "Scientific Name": "Poecile atricapillus",
    "Common Name": "Black-capped Chickadee",
    "Filename": "2011-08-03-bkcchi-7v5z1721.jpg",
    "County": "Milwaukee",
    "State/Province": "US-WI"
  },
  {
    "Location": "Farallon Islands",
    "Date": "08-13-2011",
    "Scientific Name": "Pterodroma sandwichensis",
    "Common Name": "Hawaiian Petrel",
    "Filename": "2011-08-13-hawpet-7v5z4187.jpg",
    "County": "San Francisco",
    "State/Province": "US-CA"
  },
  {
    "Location": "Farallon Islands",
    "Date": "08-13-2011",
    "Scientific Name": "Pterodroma sandwichensis",
    "Common Name": "Hawaiian Petrel",
    "Filename": "2011-08-13-hawpet-7v5z4189.jpg",
    "County": "San Francisco",
    "State/Province": "US-CA"
  },
  {
    "Location": "Farallon Islands",
    "Date": "08-13-2011",
    "Scientific Name": "Pterodroma sandwichensis",
    "Common Name": "Hawaiian Petrel",
    "Filename": "2011-08-13-hawpet-7v5z4199.jpg",
    "County": "San Francisco",
    "State/Province": "US-CA"
  },
  {
    "Location": "Farallon Islands",
    "Date": "08-13-2011",
    "Scientific Name": "Pterodroma sandwichensis",
    "Common Name": "Hawaiian Petrel",
    "Filename": "2011-08-13-hawpet-7v5z4192.jpg",
    "County": "San Francisco",
    "State/Province": "US-CA"
  },
  {
    "Location": "Farallon Islands",
    "Date": "08-13-2011",
    "Scientific Name": "Phalaropus fulicarius",
    "Common Name": "Red Phalarope",
    "Filename": "2011-08-13-redpha-7v5z3888.jpg",
    "County": "San Francisco",
    "State/Province": "US-CA"
  },
  {
    "Location": "Farallon Islands",
    "Date": "08-13-2011",
    "Scientific Name": "Fratercula cirrhata",
    "Common Name": "Tufted Puffin",
    "Filename": "2011-08-13-tufpuf-7v5z4151.jpg",
    "County": "San Francisco",
    "State/Province": "US-CA"
  },
  {
    "Location": "Farallon Islands",
    "Date": "08-13-2011",
    "Scientific Name": "Ardenna bulleri",
    "Common Name": "Buller's Shearwater",
    "Filename": "2011-08-13-bulshe-7v5z4279.jpg",
    "County": "San Francisco",
    "State/Province": "US-CA"
  },
  {
    "Location": "Farallon Islands",
    "Date": "08-13-2011",
    "Scientific Name": "Ardenna bulleri",
    "Common Name": "Buller's Shearwater",
    "Filename": "2011-08-13-bulshe-7v5z4285.jpg",
    "County": "San Francisco",
    "State/Province": "US-CA"
  },
  {
    "Location": "Anchorage",
    "Date": "06-05-2010",
    "Scientific Name": "Pica hudsonia",
    "Common Name": "Black-billed Magpie",
    "Filename": "2010-06-05-bkbmag-7v5z0507.jpg",
    "County": "Anchorage",
    "State/Province": "US-AK"
  },
  {
    "Location": "Anchorage",
    "Date": "06-05-2010",
    "Scientific Name": "Podiceps grisegena",
    "Common Name": "Red-necked Grebe",
    "Filename": "2010-06-05-rengre-7v5z0538.jpg",
    "County": "Anchorage",
    "State/Province": "US-AK"
  },
  {
    "Location": "Donald M. Somers Water Pollution Control Plant",
    "Date": "10-29-2011",
    "Scientific Name": "Gavia adamsii",
    "Common Name": "Yellow-billed Loon",
    "Filename": "2011-10-29-yebloo-7v5z5686.jpg",
    "County": "Santa Clara",
    "State/Province": "US-CA"
  },
  {
    "Location": "Hidalgo",
    "Date": "04-09-2008",
    "Scientific Name": "Icteria virens",
    "Common Name": "Yellow-breasted Chat",
    "Filename": "2008-04-09-yebcha-7v5z1669.jpg",
    "County": "Hidalgo",
    "State/Province": "US-TX"
  },
  {
    "Location": "Charleston Slough",
    "Date": "01-01-2012",
    "Scientific Name": "Calidris pugnax",
    "Common Name": "Ruff",
    "Filename": "2012-01-01-ruff-7v5z9147.jpg",
    "County": "Santa Clara",
    "State/Province": "US-CA"
  },
  {
    "Location": "Palo Alto",
    "Date": "01-06-2012",
    "Scientific Name": "Zonotrichia albicollis",
    "Common Name": "White-throated Sparrow",
    "Filename": "2012-01-06-whtspa-7v5z9329.jpg",
    "County": "Santa Clara",
    "State/Province": "US-CA"
  },
  {
    "Location": "Chileno Valley",
    "Date": "12-17-2011",
    "Scientific Name": "Sphyrapicus nuchalis",
    "Common Name": "Red-naped Sapsucker",
    "Filename": "2011-12-17-rensap-7v5z7379.jpg",
    "County": "Marin",
    "State/Province": "US-CA"
  },
  {
    "Location": "Merced NWR",
    "Date": "01-15-2012",
    "Scientific Name": "Buteo jamaicensis",
    "Common Name": "Red-tailed Hawk",
    "Filename": "2012-01-15-rethaw-7v5z9448.jpg",
    "County": "Merced",
    "State/Province": "US-CA"
  },
  {
    "Location": "Merced NWR",
    "Date": "01-15-2012",
    "Scientific Name": "Plegadis chihi",
    "Common Name": "White-faced Ibis",
    "Filename": "2012-01-15-whfibi-7v5z9854.jpg",
    "County": "Merced",
    "State/Province": "US-CA"
  },
  {
    "Location": "Cascade Ranch",
    "Date": "12-22-2011",
    "Scientific Name": "Setophaga townsendi",
    "Common Name": "Townsend's Warbler",
    "Filename": "2011-12-22-towwar-7v5z7738.jpg",
    "County": "San Mateo",
    "State/Province": "US-CA"
  },
  {
    "Location": "Cascade Ranch",
    "Date": "12-22-2011",
    "Scientific Name": "Zonotrichia querula",
    "Common Name": "Harris's Sparrow",
    "Filename": "2011-12-22-harspa-7v5z7948.jpg",
    "County": "San Mateo",
    "State/Province": "US-CA"
  },
  {
    "Location": "Charleston Slough",
    "Date": "11-05-2011",
    "Scientific Name": "Zonotrichia atricapilla",
    "Common Name": "Golden-crowned Sparrow",
    "Filename": "2011-11-05-gocspa-7v5z6150.jpg",
    "County": "Santa Clara",
    "State/Province": "US-CA"
  },
  {
    "Location": "Drawbridge",
    "Date": "12-18-2011",
    "Scientific Name": "Falco mexicanus",
    "Common Name": "Prairie Falcon",
    "Filename": "2011-12-18-prafal-7v5z7577.jpg",
    "County": "Alameda",
    "State/Province": "US-CA"
  },
  {
    "Location": "Cascade Ranch",
    "Date": "01-28-2012",
    "Scientific Name": "Zonotrichia albicollis",
    "Common Name": "White-throated Sparrow",
    "Filename": "2012-01-28-whtspa-7v5z0526.jpg",
    "County": "San Mateo",
    "State/Province": "US-CA"
  },
  {
    "Location": "Cascade Ranch",
    "Date": "01-28-2012",
    "Scientific Name": "Melospiza lincolnii",
    "Common Name": "Lincoln's Sparrow",
    "Filename": "2012-01-28-linspa-7v5z0564.jpg",
    "County": "San Mateo",
    "State/Province": "US-CA"
  },
  {
    "Location": "Prairie du Chien",
    "Date": "05-10-2012",
    "Scientific Name": "Chaetura pelagica",
    "Common Name": "Chimney Swift",
    "Filename": "2012-05-10-chiswi-7v5z8891.jpg",
    "County": "Crawford",
    "State/Province": "US-WI"
  },
  {
    "Location": "Prairie du Chien",
    "Date": "05-10-2012",
    "Scientific Name": "Icterus galbula",
    "Common Name": "Baltimore Oriole",
    "Filename": "2012-05-10-balori-7v5z8930.jpg",
    "County": "Crawford",
    "State/Province": "US-WI"
  },
  {
    "Location": "Prairie du Chien",
    "Date": "05-10-2012",
    "Scientific Name": "Sphyrapicus varius",
    "Common Name": "Yellow-bellied Sapsucker",
    "Filename": "2012-05-10-yebsap-7v5z8945.jpg",
    "County": "Crawford",
    "State/Province": "US-WI"
  },
  {
    "Location": "Schlitz Audubon Nature Center",
    "Date": "05-12-2012",
    "Scientific Name": "Cyanocitta cristata",
    "Common Name": "Blue Jay",
    "Filename": "2012-05-12-blujay-7v5z9133.jpg",
    "County": "Milwaukee",
    "State/Province": "US-WI"
  },
  {
    "Location": "Schlitz Audubon Nature Center",
    "Date": "05-12-2012",
    "Scientific Name": "Setophaga ruticilla",
    "Common Name": "American Redstart",
    "Filename": "2012-05-12-amered-7v5z9238.jpg",
    "County": "Milwaukee",
    "State/Province": "US-WI"
  },
  {
    "Location": "Lion's Den Gorge Nature Preserve",
    "Date": "05-14-2012",
    "Scientific Name": "Setophaga pensylvanica",
    "Common Name": "Chestnut-sided Warbler",
    "Filename": "2012-05-14-chswar-7v5z9899.jpg",
    "County": "Ozaukee",
    "State/Province": "US-WI"
  },
  {
    "Location": "Lion's Den Gorge Nature Preserve",
    "Date": "05-14-2012",
    "Scientific Name": "Coccyzus erythropthalmus",
    "Common Name": "Black-billed Cuckoo",
    "Filename": "2012-05-14-bkbcuc-7v5z9941.jpg",
    "County": "Ozaukee",
    "State/Province": "US-WI"
  },
  {
    "Location": "Lion's Den Gorge Nature Preserve",
    "Date": "05-14-2012",
    "Scientific Name": "Setophaga palmarum",
    "Common Name": "Palm Warbler",
    "Filename": "2012-05-14-palwar-7v5z0060.jpg",
    "County": "Ozaukee",
    "State/Province": "US-WI"
  },
  {
    "Location": "Horicon NWR--General",
    "Date": "05-13-2012",
    "Scientific Name": "Melospiza georgiana",
    "Common Name": "Swamp Sparrow",
    "Filename": "2012-05-13-swaspa-7v5z9683.jpg",
    "County": "Dodge",
    "State/Province": "US-WI"
  },
  {
    "Location": "Lion's Den Gorge Nature Preserve",
    "Date": "05-15-2012",
    "Scientific Name": "Setophaga striata",
    "Common Name": "Blackpoll Warbler",
    "Filename": "2012-05-15-bkpwar-7v5z0231.jpg",
    "County": "Ozaukee",
    "State/Province": "US-WI"
  },
  {
    "Location": "Lion's Den Gorge Nature Preserve",
    "Date": "05-15-2012",
    "Scientific Name": "Pipilo erythrophthalmus",
    "Common Name": "Eastern Towhee",
    "Filename": "2012-05-15-eastow-7v5z0256.jpg",
    "County": "Ozaukee",
    "State/Province": "US-WI"
  },
  {
    "Location": "Lion's Den Gorge Nature Preserve",
    "Date": "05-15-2012",
    "Scientific Name": "Setophaga ruticilla",
    "Common Name": "American Redstart",
    "Filename": "2012-05-15-amered-7v5z0279.jpg",
    "County": "Ozaukee",
    "State/Province": "US-WI"
  },
  {
    "Location": "Lion's Den Gorge Nature Preserve",
    "Date": "05-15-2012",
    "Scientific Name": "Setophaga fusca",
    "Common Name": "Blackburnian Warbler",
    "Filename": "2012-05-15-bkbwar-7v5z0296.jpg",
    "County": "Ozaukee",
    "State/Province": "US-WI"
  },
  {
    "Location": "Lion's Den Gorge Nature Preserve",
    "Date": "05-15-2012",
    "Scientific Name": "Piranga olivacea",
    "Common Name": "Scarlet Tanager",
    "Filename": "2012-05-15-scatan-7v5z0147.jpg",
    "County": "Ozaukee",
    "State/Province": "US-WI"
  },
  {
    "Location": "Lion's Den Gorge Nature Preserve",
    "Date": "05-15-2012",
    "Scientific Name": "Setophaga striata",
    "Common Name": "Blackpoll Warbler",
    "Filename": "2012-05-15-bkpwar-7v5z0218.jpg",
    "County": "Ozaukee",
    "State/Province": "US-WI"
  },
  {
    "Location": "Lion's Den Gorge Nature Preserve",
    "Date": "05-14-2012",
    "Scientific Name": "Polioptila caerulea",
    "Common Name": "Blue-gray Gnatcatcher",
    "Filename": "2012-05-14-buggna-7v5z9946.jpg",
    "County": "Ozaukee",
    "State/Province": "US-WI"
  },
  {
    "Location": "Lion's Den Gorge Nature Preserve",
    "Date": "05-14-2012",
    "Scientific Name": "Oreothlypis ruficapilla",
    "Common Name": "Nashville Warbler",
    "Filename": "2012-05-14-naswar-7v5z9979.jpg",
    "County": "Ozaukee",
    "State/Province": "US-WI"
  },
  {
    "Location": "Horicon NWR--General",
    "Date": "05-13-2012",
    "Scientific Name": "Passerina cyanea",
    "Common Name": "Indigo Bunting",
    "Filename": "2012-05-13-indbun-7v5z9402.jpg",
    "County": "Dodge",
    "State/Province": "US-WI"
  },
  {
    "Location": "Horicon NWR--General",
    "Date": "05-13-2012",
    "Scientific Name": "Pheucticus ludovicianus",
    "Common Name": "Rose-breasted Grosbeak",
    "Filename": "2012-05-13-robgro-7v5z9455.jpg",
    "County": "Dodge",
    "State/Province": "US-WI"
  },
  {
    "Location": "Horicon NWR--General",
    "Date": "05-13-2012",
    "Scientific Name": "Cypseloides niger",
    "Common Name": "Black Swift",
    "Filename": "2012-05-13-blkswi-7v5z9522-2.jpg",
    "County": "Dodge",
    "State/Province": "US-WI"
  },
  {
    "Location": "Lion's Den Gorge Nature Preserve",
    "Date": "05-14-2012",
    "Scientific Name": "Vireo philadelphicus",
    "Common Name": "Philadelphia Vireo",
    "Filename": "2012-05-14-phivir-7v5z9860-2.jpg",
    "County": "Ozaukee",
    "State/Province": "US-WI"
  },
  {
    "Location": "Windy Hill OSP",
    "Date": "06-08-2012",
    "Scientific Name": "Passerina amoena",
    "Common Name": "Lazuli Bunting",
    "Filename": "2012-06-08-lazbun-7v5z0418.jpg",
    "County": "San Mateo",
    "State/Province": "US-CA"
  },
  {
    "Location": "Windy Hill OSP",
    "Date": "06-08-2012",
    "Scientific Name": "Passerina amoena",
    "Common Name": "Lazuli Bunting",
    "Filename": "2012-06-08-lazbun-7v5z0452.jpg",
    "County": "San Mateo",
    "State/Province": "US-CA"
  },
  {
    "Location": "Windy Hill OSP",
    "Date": "06-08-2012",
    "Scientific Name": "Melozone crissalis",
    "Common Name": "California Towhee",
    "Filename": "2012-06-08-caltow-7v5z0469.jpg",
    "County": "San Mateo",
    "State/Province": "US-CA"
  },
  {
    "Location": "Windy Hill OSP",
    "Date": "06-08-2012",
    "Scientific Name": "Chamaea fasciata",
    "Common Name": "Wrentit",
    "Filename": "2012-06-08-wrenti-7v5z0508.jpg",
    "County": "San Mateo",
    "State/Province": "US-CA"
  },
  {
    "Location": "Our House",
    "Date": "08-14-2012",
    "Scientific Name": "Selasphorus rufus",
    "Common Name": "Rufous Hummingbird",
    "Filename": "2012-08-14-rufhum-_m6c5178.jpg",
    "County": "Santa Clara",
    "State/Province": "US-CA"
  },
  {
    "Location": "Our House",
    "Date": "08-14-2012",
    "Scientific Name": "Selasphorus rufus",
    "Common Name": "Rufous Hummingbird",
    "Filename": "2012-08-14-rufhum-_m6c5211.jpg",
    "County": "Santa Clara",
    "State/Province": "US-CA"
  },
  {
    "Location": "Charleston Slough",
    "Date": "08-10-2012",
    "Scientific Name": "Rynchops niger",
    "Common Name": "Black Skimmer",
    "Filename": "2012-08-10-blkski-_m6c4983.jpg",
    "County": "Santa Clara",
    "State/Province": "US-CA"
  },
  {
    "Location": "Coyote Hills Regional Park",
    "Date": "09-29-2012",
    "Scientific Name": "Rallus limicola",
    "Common Name": "Virginia Rail",
    "Filename": "2012-09-29-virrai-_m6c7354.jpg",
    "County": "Alameda",
    "State/Province": "US-CA"
  },
  {
    "Location": "Hawk Hill",
    "Date": "10-14-2012",
    "Scientific Name": "Accipiter striatus",
    "Common Name": "Sharp-shinned Hawk",
    "Filename": "2012-10-14-shshaw-_m6c7484.jpg",
    "County": "Marin",
    "State/Province": "US-CA"
  },
  {
    "Location": "Farallon Islands",
    "Date": "08-18-2012",
    "Scientific Name": "Cerorhinca monocerata",
    "Common Name": "Rhinoceros Auklet",
    "Filename": "2012-08-18-rhiauk-_m6c6212.jpg",
    "County": "San Francisco",
    "State/Province": "US-CA"
  },
  {
    "Location": "Farallon Islands",
    "Date": "08-18-2012",
    "Scientific Name": "Thalasseus elegans",
    "Common Name": "Elegant Tern",
    "Filename": "2012-08-18-eleter-_m6c6471.jpg",
    "County": "San Francisco",
    "State/Province": "US-CA"
  },
  {
    "Location": "Farallon Islands",
    "Date": "08-18-2012",
    "Scientific Name": "Thalasseus elegans",
    "Common Name": "Elegant Tern",
    "Filename": "2012-08-18-eleter-_m6c6506.jpg",
    "County": "San Francisco",
    "State/Province": "US-CA"
  },
  {
    "Location": "Farallon Islands",
    "Date": "08-18-2012",
    "Scientific Name": "Thalasseus elegans",
    "Common Name": "Elegant Tern",
    "Filename": "2012-08-18-eleter-_m6c6511.jpg",
    "County": "San Francisco",
    "State/Province": "US-CA"
  },
  {
    "Location": "Rio Rico",
    "Date": "08-08-2010",
    "Scientific Name": "Tyrannus crassirostris",
    "Common Name": "Thick-billed Kingbird",
    "Filename": "2010-08-08-thbkin-7v5z3315.jpg",
    "County": "Santa Cruz",
    "State/Province": "US-AZ"
  },
  {
    "Location": "Rio Rico",
    "Date": "08-08-2010",
    "Scientific Name": "Pyrocephalus rubinus",
    "Common Name": "Vermilion Flycatcher",
    "Filename": "2010-08-08-verfly-7v5z3092.jpg",
    "County": "Santa Cruz",
    "State/Province": "US-AZ"
  },
  {
    "Location": "Rio Rico",
    "Date": "08-08-2010",
    "Scientific Name": "Pyrocephalus rubinus",
    "Common Name": "Vermilion Flycatcher",
    "Filename": "2010-08-08-verfly-7v5z3097.jpg",
    "County": "Santa Cruz",
    "State/Province": "US-AZ"
  },
  {
    "Location": "Donald M. Somers Water Pollution Control Plant",
    "Date": "10-29-2011",
    "Scientific Name": "Lanius ludovicianus",
    "Common Name": "Loggerhead Shrike",
    "Filename": "2011-10-29-logshr-7v5z5817-2.jpg",
    "County": "Santa Clara",
    "State/Province": "US-CA"
  },
  {
    "Location": "Anna Maria Island--City Pier",
    "Date": "12-22-2012",
    "Scientific Name": "Alca torda",
    "Common Name": "Razorbill",
    "Filename": "2012-12-22-razorb-_m6c0280.jpg",
    "County": "Manatee",
    "State/Province": "US-FL"
  },
  {
    "Location": "Schlitz Audubon Nature Center",
    "Date": "05-12-2012",
    "Scientific Name": "Poecile atricapillus",
    "Common Name": "Black-capped Chickadee",
    "Filename": "2012-05-12-bkcchi-7v5z9274.jpg",
    "County": "Milwaukee",
    "State/Province": "US-WI"
  },
  {
    "Location": "Horicon NWR--General",
    "Date": "05-13-2012",
    "Scientific Name": "Melospiza georgiana",
    "Common Name": "Swamp Sparrow",
    "Filename": "2012-05-13-swaspa-7v5z9683-2.jpg",
    "County": "Dodge",
    "State/Province": "US-WI"
  },
  {
    "Location": "Lion's Den Gorge Nature Preserve",
    "Date": "05-15-2012",
    "Scientific Name": "Spinus tristis",
    "Common Name": "American Goldfinch",
    "Filename": "2012-05-15-amegfi-7v5z0101-2.jpg",
    "County": "Ozaukee",
    "State/Province": "US-WI"
  },
  {
    "Location": "Lion's Den Gorge Nature Preserve",
    "Date": "05-15-2012",
    "Scientific Name": "Setophaga pensylvanica",
    "Common Name": "Chestnut-sided Warbler",
    "Filename": "2012-05-15-chswar-7v5z0207.jpg",
    "County": "Ozaukee",
    "State/Province": "US-WI"
  },
  {
    "Location": "Alviso Marina",
    "Date": "09-07-2012",
    "Scientific Name": "Accipiter cooperii",
    "Common Name": "Cooper's Hawk",
    "Filename": "2012-09-07-coohaw-_m6c6595.jpg",
    "County": "Santa Clara",
    "State/Province": "US-CA"
  },
  {
    "Location": "Pescadero Marsh",
    "Date": "11-16-2012",
    "Scientific Name": "Haematopus bachmani",
    "Common Name": "Black Oystercatcher",
    "Filename": "2012-11-16-blkoys-_m6c8461.jpg",
    "County": "San Mateo",
    "State/Province": "US-CA"
  },
  {
    "Location": "Ed Levin County Park -- Spring Valley",
    "Date": "04-28-2012",
    "Scientific Name": "Buteo lineatus",
    "Common Name": "Red-shouldered Hawk",
    "Filename": "2012-04-28-reshaw-_61P9198.jpg",
    "County": "Santa Clara",
    "State/Province": "US-CA"
  },
  {
    "Location": "Foster City Shellbar",
    "Date": "12-06-2012",
    "Scientific Name": "Calidris canutus",
    "Common Name": "Red Knot",
    "Filename": "2012-12-06-redkno-_m6c9259.jpg",
    "County": "San Mateo",
    "State/Province": "US-CA"
  },
  {
    "Location": "San Antonio Valley",
    "Date": "04-15-2012",
    "Scientific Name": "Corvus corax",
    "Common Name": "Common Raven",
    "Filename": "2012-04-15-comrav-7v5z8789-2.jpg",
    "County": "Santa Clara",
    "State/Province": "US-CA"
  },
  {
    "Location": "Anna Maria Island--City Pier",
    "Date": "12-22-2012",
    "Scientific Name": "Thalasseus maximus",
    "Common Name": "Royal Tern",
    "Filename": "2012-12-22-royter-_m6c0137.jpg",
    "County": "Manatee",
    "State/Province": "US-FL"
  },
  {
    "Location": "Anna Maria Island",
    "Date": "12-26-2012",
    "Scientific Name": "Melanerpes carolinus",
    "Common Name": "Red-bellied Woodpecker",
    "Filename": "2012-12-26-rebwoo-_m6c1234.jpg",
    "County": "Manatee",
    "State/Province": "US-FL"
  },
  {
    "Location": "Foster City Shellbar",
    "Date": "12-06-2012",
    "Scientific Name": "Arenaria interpres",
    "Common Name": "Ruddy Turnstone",
    "Filename": "2012-12-06-rudtur-_m6c9202.jpg",
    "County": "San Mateo",
    "State/Province": "US-CA"
  },
  {
    "Location": "Celery Fields",
    "Date": "12-24-2012",
    "Scientific Name": "Mycteria americana",
    "Common Name": "Wood Stork",
    "Filename": "2012-12-24-woosto-_m6c0724.jpg",
    "County": "Sarasota",
    "State/Province": "US-FL"
  },
  {
    "Location": "Celery Fields",
    "Date": "12-24-2012",
    "Scientific Name": "Corvus ossifragus",
    "Common Name": "Fish Crow",
    "Filename": "2012-12-24-fiscro-_m6c0797.jpg",
    "County": "Sarasota",
    "State/Province": "US-FL"
  },
  {
    "Location": "Celery Fields",
    "Date": "12-24-2012",
    "Scientific Name": "Corvus ossifragus",
    "Common Name": "Fish Crow",
    "Filename": "2012-12-24-fiscro-_m6c0801.jpg",
    "County": "Sarasota",
    "State/Province": "US-FL"
  },
  {
    "Location": "Celery Fields",
    "Date": "12-24-2012",
    "Scientific Name": "Botaurus lentiginosus",
    "Common Name": "American Bittern",
    "Filename": "2012-12-24-amebit-_m6c0841.jpg",
    "County": "Sarasota",
    "State/Province": "US-FL"
  },
  {
    "Location": "Coyote Hills Regional Park",
    "Date": "12-07-2012",
    "Scientific Name": "Melospiza georgiana",
    "Common Name": "Swamp Sparrow",
    "Filename": "2012-12-07-swaspa-_m6c9341.jpg",
    "County": "Alameda",
    "State/Province": "US-CA"
  },
  {
    "Location": "Drawbridge",
    "Date": "12-16-2012",
    "Scientific Name": "Falco columbarius",
    "Common Name": "Merlin",
    "Filename": "2012-12-16-merlin-_m6c9944.jpg",
    "County": "Alameda",
    "State/Province": "US-CA"
  },
  {
    "Location": "Dearborn Park Rd.",
    "Date": "01-05-2013",
    "Scientific Name": "Setophaga townsendi",
    "Common Name": "Townsend's Warbler",
    "Filename": "2013-01-05-towwar-_m6c1715.jpg",
    "County": "San Mateo",
    "State/Province": "US-CA"
  },
  {
    "Location": "Dearborn Park Rd.",
    "Date": "01-05-2013",
    "Scientific Name": "Setophaga caerulescens",
    "Common Name": "Black-throated Blue Warbler",
    "Filename": "2013-01-05-btbwar-_m6c1743.jpg",
    "County": "San Mateo",
    "State/Province": "US-CA"
  },
  {
    "Location": "Los Gatos Creek County Park (aka Oka Ponds)",
    "Date": "01-05-2013",
    "Scientific Name": "Zonotrichia querula",
    "Common Name": "Harris's Sparrow",
    "Filename": "2013-01-05-harspa-_m6c1808.jpg",
    "County": "Santa Clara",
    "State/Province": "US-CA"
  },
  {
    "Location": "Los Gatos Creek County Park (aka Oka Ponds)",
    "Date": "01-05-2013",
    "Scientific Name": "Zonotrichia querula",
    "Common Name": "Harris's Sparrow",
    "Filename": "2013-01-05-harspa-_m6c1821.jpg",
    "County": "Santa Clara",
    "State/Province": "US-CA"
  },
  {
    "Location": "Chileno Valley",
    "Date": "12-15-2012",
    "Scientific Name": "Regulus satrapa",
    "Common Name": "Golden-crowned Kinglet",
    "Filename": "2012-12-15-gockin-_m6c9483.jpg",
    "County": "Marin",
    "State/Province": "US-CA"
  },
  {
    "Location": "Lleida Steppes",
    "Date": "03-03-2013",
    "Scientific Name": "Milvus milvus",
    "Common Name": "Red Kite",
    "Filename": "2013-03-03-milvus_milvus-_m6c3501.jpg",
    "County": "Lleida",
    "State/Province": "ES-CT"
  },
  {
    "Location": "Delta del Llobregat PNat--Area general",
    "Date": "03-01-2013",
    "Scientific Name": "Phalacrocorax carbo",
    "Common Name": "Great Cormorant",
    "Filename": "2013-03-01-phalacrocorax_carbo-_m6c2378.jpg",
    "County": "Barcelona",
    "State/Province": "ES-CT"
  },
  {
    "Location": "Delta del Llobregat PNat--Area general",
    "Date": "03-01-2013",
    "Scientific Name": "Tachybaptus ruficollis",
    "Common Name": "Little Grebe",
    "Filename": "2013-03-01-tachybaptus_ruficollis-_m6c2414.jpg",
    "County": "Barcelona",
    "State/Province": "ES-CT"
  },
  {
    "Location": "Delta del Llobregat PNat--Area general",
    "Date": "03-01-2013",
    "Scientific Name": "Anser anser",
    "Common Name": "Graylag Goose",
    "Filename": "2013-03-01-anser_anser-_m6c2688.jpg",
    "County": "Barcelona",
    "State/Province": "ES-CT"
  },
  {
    "Location": "Catalu\u00f1a",
    "Date": "03-02-2013",
    "Scientific Name": "Porphyrio porphyrio",
    "Common Name": "Western Swamphen",
    "Filename": "2013-03-02-porphyrio_porphyrio-_m6c2964.jpg",
    "County": "",
    "State/Province": "ES-CT"
  },
  {
    "Location": "Catalu\u00f1a",
    "Date": "03-02-2013",
    "Scientific Name": "Motacilla alba",
    "Common Name": "White Wagtail",
    "Filename": "2013-03-02-motacilla_alba-_m6c3036.jpg",
    "County": "",
    "State/Province": "ES-CT"
  },
  {
    "Location": "Catalu\u00f1a",
    "Date": "03-02-2013",
    "Scientific Name": "Chroicocephalus genei",
    "Common Name": "Slender-billed Gull",
    "Filename": "2013-03-02-chroicocephalus_genei-_m6c3278.jpg",
    "County": "",
    "State/Province": "ES-CT"
  },
  {
    "Location": "Delta del Llobregat PNat--Area general",
    "Date": "03-01-2013",
    "Scientific Name": "Erithacus rubecula",
    "Common Name": "European Robin",
    "Filename": "2013-03-01-erithacus_rubecula-_m6c2797.jpg",
    "County": "Barcelona",
    "State/Province": "ES-CT"
  },
  {
    "Location": "Delta del Llobregat PNat--Area general",
    "Date": "03-01-2013",
    "Scientific Name": "Columba palumbus",
    "Common Name": "Common Wood-Pigeon",
    "Filename": "2013-03-01-columba_palumbus-_m6c2847.jpg",
    "County": "Barcelona",
    "State/Province": "ES-CT"
  },
  {
    "Location": "Catalu\u00f1a",
    "Date": "03-02-2013",
    "Scientific Name": "Phoenicopterus roseus",
    "Common Name": "Greater Flamingo",
    "Filename": "2013-03-02-phoenicopterus_roseus-_m6c3137.jpg",
    "County": "",
    "State/Province": "ES-CT"
  },
  {
    "Location": "Catalu\u00f1a",
    "Date": "03-02-2013",
    "Scientific Name": "Cisticola juncidis",
    "Common Name": "Zitting Cisticola",
    "Filename": "2013-03-02-cisticola_juncidis-_m6c3322.jpg",
    "County": "",
    "State/Province": "ES-CT"
  },
  {
    "Location": "Candasnos",
    "Date": "03-03-2013",
    "Scientific Name": "Pterocles alchata",
    "Common Name": "Pin-tailed Sandgrouse",
    "Filename": "2013-03-03-pterocles_alchata-_m6c3429.jpg",
    "County": "Huesca",
    "State/Province": "ES-AR"
  },
  {
    "Location": "Delta del Llobregat PNat--Area general",
    "Date": "03-03-2013",
    "Scientific Name": "Alectoris rufa",
    "Common Name": "Red-legged Partridge",
    "Filename": "2013-03-03-alectoris_rufa-_m6c3671.jpg",
    "County": "Barcelona",
    "State/Province": "ES-CT"
  },
  {
    "Location": "Candasnos",
    "Date": "03-03-2013",
    "Scientific Name": "Emberiza calandra",
    "Common Name": "Corn Bunting",
    "Filename": "2013-03-03-emberiza_calandra-_m6c3823.jpg",
    "County": "Huesca",
    "State/Province": "ES-AR"
  },
  {
    "Location": "Lleida Steppes",
    "Date": "03-03-2013",
    "Scientific Name": "Burhinus oedicnemus",
    "Common Name": "Eurasian Thick-knee",
    "Filename": "2013-03-03-burhinus_oedicnemus-_m6c3918.jpg",
    "County": "Lleida",
    "State/Province": "ES-CT"
  },
  {
    "Location": "Parc Natural del Cad\u00ed-Moixer\u00f3 / Terradelles",
    "Date": "03-04-2013",
    "Scientific Name": "Gyps fulvus",
    "Common Name": "Eurasian Griffon",
    "Filename": "2013-03-04-gyps_fulvus-_m6c4121.jpg",
    "County": "Barcelona",
    "State/Province": "ES-CT"
  },
  {
    "Location": "Parc Natural del Cad\u00ed-Moixer\u00f3 / Terradelles",
    "Date": "03-04-2013",
    "Scientific Name": "Turdus merula",
    "Common Name": "Eurasian Blackbird",
    "Filename": "2013-03-04-turdus_merula-_m6c3959.jpg",
    "County": "Barcelona",
    "State/Province": "ES-CT"
  },
  {
    "Location": "Parc Natural del Cad\u00ed-Moixer\u00f3 / Terradelles",
    "Date": "03-04-2013",
    "Scientific Name": "Corvus corone",
    "Common Name": "Carrion Crow",
    "Filename": "2013-03-04-corvus_corone-_m6c3983.jpg",
    "County": "Barcelona",
    "State/Province": "ES-CT"
  },
  {
    "Location": "Parc Natural del Cad\u00ed-Moixer\u00f3 / Terradelles",
    "Date": "03-04-2013",
    "Scientific Name": "Montifringilla nivalis",
    "Common Name": "White-winged Snowfinch",
    "Filename": "2013-03-04-montifringilla_nivalis-_m6c4038.jpg",
    "County": "Barcelona",
    "State/Province": "ES-CT"
  },
  {
    "Location": "Parc Natural del Cad\u00ed-Moixer\u00f3 / Terradelles",
    "Date": "03-04-2013",
    "Scientific Name": "Cinclus cinclus",
    "Common Name": "White-throated Dipper",
    "Filename": "2013-03-04-cinclus_cinclus-_m6c4409.jpg",
    "County": "Barcelona",
    "State/Province": "ES-CT"
  },
  {
    "Location": "Castle O'Burrian",
    "Date": "06-16-2013",
    "Scientific Name": "Fulmarus glacialis",
    "Common Name": "Northern Fulmar",
    "Filename": "2013-06-16-norful-_m6c7407.jpg",
    "County": "Orkney Islands",
    "State/Province": "GB-SCT"
  },
  {
    "Location": "Castle O'Burrian",
    "Date": "06-16-2013",
    "Scientific Name": "Fratercula arctica",
    "Common Name": "Atlantic Puffin",
    "Filename": "2013-06-16-fratercula_arctica-_m6c7486.jpg",
    "County": "Orkney Islands",
    "State/Province": "GB-SCT"
  },
  {
    "Location": "Noup Head",
    "Date": "06-16-2013",
    "Scientific Name": "Morus bassanus",
    "Common Name": "Northern Gannet",
    "Filename": "2013-06-16-norgan-_m6c7626.jpg",
    "County": "Orkney Islands",
    "State/Province": "GB-SCT"
  },
  {
    "Location": "Noup Head",
    "Date": "06-16-2013",
    "Scientific Name": "Stercorarius skua",
    "Common Name": "Great Skua",
    "Filename": "2013-06-16-stercorarius_skua-_m6c7650.jpg",
    "County": "Orkney Islands",
    "State/Province": "GB-SCT"
  },
  {
    "Location": "Okney Islands",
    "Date": "06-18-2013",
    "Scientific Name": "Chloris chloris",
    "Common Name": "European Greenfinch",
    "Filename": "2013-06-18-chloris_chloris-_m6c8117.jpg",
    "County": "Orkney Islands",
    "State/Province": "GB-SCT"
  },
  {
    "Location": "Okney Islands",
    "Date": "06-18-2013",
    "Scientific Name": "Chloris chloris",
    "Common Name": "European Greenfinch",
    "Filename": "2013-06-18-chloris_chloris-_m6c8128.jpg",
    "County": "Orkney Islands",
    "State/Province": "GB-SCT"
  },
  {
    "Location": "South Ronaldsay",
    "Date": "06-17-2013",
    "Scientific Name": "Corvus cornix",
    "Common Name": "Hooded Crow",
    "Filename": "2013-06-17-corvus_cornix-_m6c7929.jpg",
    "County": "Orkney Islands",
    "State/Province": "GB-SCT"
  },
  {
    "Location": "Vasona Creek",
    "Date": "11-24-2013",
    "Scientific Name": "Calypte costae",
    "Common Name": "Costa's Hummingbird",
    "Filename": "2013-11-24-coshum-_m6c3281.jpg",
    "County": "Santa Clara",
    "State/Province": "US-CA"
  },
  {
    "Location": "Vasona Creek",
    "Date": "11-24-2013",
    "Scientific Name": "Calypte anna",
    "Common Name": "Anna's Hummingbird",
    "Filename": "2013-11-24-annhum-_m6c3340.jpg",
    "County": "Santa Clara",
    "State/Province": "US-CA"
  },
  {
    "Location": "Farallon Islands",
    "Date": "10-12-2013",
    "Scientific Name": "Ptychoramphus aleuticus",
    "Common Name": "Cassin's Auklet",
    "Filename": "2013-10-12-casauk-_m6c2279.jpg",
    "County": "San Francisco",
    "State/Province": "US-CA"
  },
  {
    "Location": "Pearson-Arastradero Preserve",
    "Date": "04-10-2013",
    "Scientific Name": "Baeolophus inornatus",
    "Common Name": "Oak Titmouse",
    "Filename": "2013-04-10-oaktit-_m6c5447.jpg",
    "County": "Santa Clara",
    "State/Province": "US-CA"
  },
  {
    "Location": "Pearson-Arastradero Preserve",
    "Date": "04-10-2013",
    "Scientific Name": "Baeolophus inornatus",
    "Common Name": "Oak Titmouse",
    "Filename": "2013-04-10-oaktit-_m6c5472.jpg",
    "County": "Santa Clara",
    "State/Province": "US-CA"
  },
  {
    "Location": "Rousay",
    "Date": "06-24-2013",
    "Scientific Name": "Troglodytes troglodytes",
    "Common Name": "Eurasian Wren",
    "Filename": "2013-06-24-troglodytes_troglodytes-_m6c0284.jpg",
    "County": "Orkney Islands",
    "State/Province": "GB-SCT"
  },
  {
    "Location": "Bankburn House",
    "Date": "06-15-2013",
    "Scientific Name": "Larus canus",
    "Common Name": "Mew Gull",
    "Filename": "2013-06-15-mewgul-_m6c7013.jpg",
    "County": "Orkney Islands",
    "State/Province": "GB-SCT"
  },
  {
    "Location": "South Ronaldsay",
    "Date": "06-19-2013",
    "Scientific Name": "Cepphus grylle",
    "Common Name": "Black Guillemot",
    "Filename": "2013-06-19-blkgui-_m6c8635.jpg",
    "County": "Orkney Islands",
    "State/Province": "GB-SCT"
  },
  {
    "Location": "Marwick Head",
    "Date": "06-20-2013",
    "Scientific Name": "Fulmarus glacialis",
    "Common Name": "Northern Fulmar",
    "Filename": "2013-06-20-norful-_m6c9051.jpg",
    "County": "Orkney Islands",
    "State/Province": "GB-SCT"
  },
  {
    "Location": "Marwick Head",
    "Date": "06-20-2013",
    "Scientific Name": "Alca torda",
    "Common Name": "Razorbill",
    "Filename": "2013-06-20-razorb-_m6c9053.jpg",
    "County": "Orkney Islands",
    "State/Province": "GB-SCT"
  },
  {
    "Location": "Marwick Head",
    "Date": "06-20-2013",
    "Scientific Name": "Anthus pratensis",
    "Common Name": "Meadow Pipit",
    "Filename": "2013-06-20-anthus_pratensis-_m6c9103.jpg",
    "County": "Orkney Islands",
    "State/Province": "GB-SCT"
  },
  {
    "Location": "PN Carara",
    "Date": "02-23-2012",
    "Scientific Name": "Onychorhynchus coronatus",
    "Common Name": "Royal Flycatcher",
    "Filename": "2012-02-23-onychorhynchus_coronatus-7v5z2692.jpg",
    "County": "",
    "State/Province": "CR-P"
  },
  {
    "Location": "Alajuela",
    "Date": "02-21-2012",
    "Scientific Name": "Peucaea ruficauda",
    "Common Name": "Stripe-headed Sparrow",
    "Filename": "2012-02-21-peucaea_ruficauda-7v5z1410.jpg",
    "County": "",
    "State/Province": "CR-A"
  },
  {
    "Location": "Alajuela",
    "Date": "02-21-2012",
    "Scientific Name": "Megascops choliba",
    "Common Name": "Tropical Screech-Owl",
    "Filename": "2012-02-21-megascops_choliba-7v5z1655.jpg",
    "County": "",
    "State/Province": "CR-A"
  },
  {
    "Location": "Alajuela",
    "Date": "02-21-2012",
    "Scientific Name": "Piaya cayana",
    "Common Name": "Squirrel Cuckoo",
    "Filename": "2012-02-21-piaya_cayana-7v5z1438.jpg",
    "County": "",
    "State/Province": "CR-A"
  },
  {
    "Location": "Alajuela",
    "Date": "02-22-2012",
    "Scientific Name": "Columbina inca",
    "Common Name": "Inca Dove",
    "Filename": "2012-02-22-incdov-7v5z1786.jpg",
    "County": "",
    "State/Province": "CR-A"
  },
  {
    "Location": "Villa Lapas",
    "Date": "02-22-2012",
    "Scientific Name": "Myiodynastes maculatus",
    "Common Name": "Streaked Flycatcher",
    "Filename": "2012-02-22-myiodynastes_maculatus-7v5z1872.jpg",
    "County": "",
    "State/Province": "CR-P"
  },
  {
    "Location": "Villa Lapas",
    "Date": "02-22-2012",
    "Scientific Name": "Ara macao",
    "Common Name": "Scarlet Macaw",
    "Filename": "2012-02-22-ara_macao-7v5z2062.jpg",
    "County": "",
    "State/Province": "CR-P"
  },
  {
    "Location": "Cerro Lodge",
    "Date": "02-22-2012",
    "Scientific Name": "Crotophaga sulcirostris",
    "Common Name": "Groove-billed Ani",
    "Filename": "2012-02-22-grbani-7v5z2421.jpg",
    "County": "",
    "State/Province": "CR-P"
  },
  {
    "Location": "R\u00edo Tarcoles--Boat Tour",
    "Date": "02-23-2012",
    "Scientific Name": "Numenius phaeopus",
    "Common Name": "Whimbrel",
    "Filename": "2012-02-23-whimbr-7v5z3278.jpg",
    "County": "",
    "State/Province": "CR-P"
  },
  {
    "Location": "R\u00edo Tarcoles--Boat Tour",
    "Date": "02-23-2012",
    "Scientific Name": "Milvago chimachima",
    "Common Name": "Yellow-headed Caracara",
    "Filename": "2012-02-23-milvago_chimachima-7v5z3318.jpg",
    "County": "",
    "State/Province": "CR-P"
  },
  {
    "Location": "R\u00edo Tarcoles--Boat Tour",
    "Date": "02-23-2012",
    "Scientific Name": "Chloroceryle amazona",
    "Common Name": "Amazon Kingfisher",
    "Filename": "2012-02-23-chloroceryle_amazona-7v5z3387.jpg",
    "County": "",
    "State/Province": "CR-P"
  },
  {
    "Location": "R\u00edo Tarcoles--Boat Tour",
    "Date": "02-23-2012",
    "Scientific Name": "Jacana spinosa",
    "Common Name": "Northern Jacana",
    "Filename": "2012-02-23-jacana_spinosa-7v5z3485.jpg",
    "County": "",
    "State/Province": "CR-P"
  },
  {
    "Location": "R\u00edo Tarcoles--Boat Tour",
    "Date": "02-23-2012",
    "Scientific Name": "Tigrisoma mexicanum",
    "Common Name": "Bare-throated Tiger-Heron",
    "Filename": "2012-02-23-tigrisoma_mexicanum-7v5z3662-2.jpg",
    "County": "",
    "State/Province": "CR-P"
  },
  {
    "Location": "R\u00edo Tarcoles--Boat Tour",
    "Date": "02-23-2012",
    "Scientific Name": "Cochlearius cochlearius",
    "Common Name": "Boat-billed Heron",
    "Filename": "2012-02-23-cochlearius_cochlearius-7v5z3805-2.jpg",
    "County": "",
    "State/Province": "CR-P"
  },
  {
    "Location": "R\u00edo Tarcoles--Boat Tour",
    "Date": "02-23-2012",
    "Scientific Name": "Charadrius collaris",
    "Common Name": "Collared Plover",
    "Filename": "2012-02-23-charadrius_collaris-7v5z3452-3.jpg",
    "County": "",
    "State/Province": "CR-P"
  },
  {
    "Location": "Alajuela",
    "Date": "02-25-2012",
    "Scientific Name": "Piranga bidentata",
    "Common Name": "Flame-colored Tanager",
    "Filename": "2012-02-25-piranga_bidentata-7v5z5163.jpg",
    "County": "",
    "State/Province": "CR-A"
  },
  {
    "Location": "Alajuela",
    "Date": "02-25-2012",
    "Scientific Name": "Megascops clarkii",
    "Common Name": "Bare-shanked Screech-Owl",
    "Filename": "2012-02-25-megascops_clarkii-7v5z5182.jpg",
    "County": "",
    "State/Province": "CR-A"
  },
  {
    "Location": "Savegre Valley (upper)",
    "Date": "02-26-2012",
    "Scientific Name": "Diglossa plumbea",
    "Common Name": "Slaty Flowerpiercer",
    "Filename": "2012-02-26-diglossa_plumbea-7v5z5523.jpg",
    "County": "",
    "State/Province": "CR-SJ"
  },
  {
    "Location": "La Quinta de Sarapiqu\u00ed\u00ad Lodge",
    "Date": "02-27-2012",
    "Scientific Name": "Saltator maximus",
    "Common Name": "Buff-throated Saltator",
    "Filename": "2012-02-27-saltator_maximus-7v5z6163.jpg",
    "County": "",
    "State/Province": "CR-H"
  },
  {
    "Location": "La Quinta de Sarapiqu\u00ed\u00ad Lodge",
    "Date": "02-27-2012",
    "Scientific Name": "Ramphocelus passerinii",
    "Common Name": "Passerini's Tanager",
    "Filename": "2012-02-27-ramphocelus_passerinii-7v5z6185.jpg",
    "County": "",
    "State/Province": "CR-H"
  },
  {
    "Location": "PN Braulio Carrillo",
    "Date": "02-28-2012",
    "Scientific Name": "Myrmeciza laemosticta",
    "Common Name": "Dull-mantled Antbird",
    "Filename": "2012-02-28-myrmeciza_laemosticta-7v5z6576.jpg",
    "County": "",
    "State/Province": "CR-SJ"
  },
  {
    "Location": "Bosque de Paz",
    "Date": "03-01-2012",
    "Scientific Name": "Tangara icterocephala",
    "Common Name": "Silver-throated Tanager",
    "Filename": "2012-03-01-tangara_icterocephala-7v5z7805.jpg",
    "County": "",
    "State/Province": "CR-A"
  },
  {
    "Location": "Bosque de Paz",
    "Date": "03-01-2012",
    "Scientific Name": "Chlorospingus flavopectus",
    "Common Name": "Common Chlorospingus",
    "Filename": "2012-03-01-chlorospingus_ophthalmicus-7v5z7969.jpg",
    "County": "",
    "State/Province": "CR-A"
  },
  {
    "Location": "Genovesa--Darwin Bay",
    "Date": "12-18-2013",
    "Scientific Name": "Creagrus furcatus",
    "Common Name": "Swallow-tailed Gull",
    "Filename": "2013-12-18-creagrus_furcatus-7v5z1903.jpg",
    "County": "",
    "State/Province": "EC-W"
  },
  {
    "Location": "Genovesa--Darwin Bay",
    "Date": "12-18-2013",
    "Scientific Name": "Creagrus furcatus",
    "Common Name": "Swallow-tailed Gull",
    "Filename": "2013-12-18-creagrus_furcatus-7v5z1987.jpg",
    "County": "",
    "State/Province": "EC-W"
  },
  {
    "Location": "Genovesa--Darwin Bay",
    "Date": "12-18-2013",
    "Scientific Name": "Leucophaeus fuliginosus",
    "Common Name": "Lava Gull",
    "Filename": "2013-12-18-leucophaeus_fuliginosus-_m6c5259.jpg",
    "County": "",
    "State/Province": "EC-W"
  },
  {
    "Location": "Genovesa--Darwin Bay",
    "Date": "12-18-2013",
    "Scientific Name": "Geospiza magnirostris",
    "Common Name": "Large Ground-Finch",
    "Filename": "2013-12-18-geospiza_magnirostris-_m6c5147.jpg",
    "County": "",
    "State/Province": "EC-W"
  },
  {
    "Location": "Punta Albemarle",
    "Date": "12-20-2013",
    "Scientific Name": "Spheniscus mendiculus",
    "Common Name": "Galapagos Penguin",
    "Filename": "2013-12-20-spheniscus_mendiculus-7v5z4022.jpg",
    "County": "",
    "State/Province": "EC-W"
  },
  {
    "Location": "Delta del Llobregat PNat--Area general",
    "Date": "03-01-2013",
    "Scientific Name": "Anas penelope",
    "Common Name": "Eurasian Wigeon",
    "Filename": "2013-03-01-eurwig-_m6c2694.jpg",
    "County": "Barcelona",
    "State/Province": "ES-CT"
  },
  {
    "Location": "Punta Albemarle",
    "Date": "12-20-2013",
    "Scientific Name": "Butorides striata",
    "Common Name": "Striated Heron",
    "Filename": "2013-12-20-butorides_striata-_m6c5979.jpg",
    "County": "",
    "State/Province": "EC-W"
  },
  {
    "Location": "Punta Albemarle",
    "Date": "12-20-2013",
    "Scientific Name": "Phalacrocorax harrisi",
    "Common Name": "Flightless Cormorant",
    "Filename": "2013-12-20-phalacrocorax_harrisi-_m6c6014.jpg",
    "County": "",
    "State/Province": "EC-W"
  },
  {
    "Location": "Isla Fernandina--Espinoza Point",
    "Date": "12-21-2013",
    "Scientific Name": "Geospiza fuliginosa",
    "Common Name": "Small Ground-Finch",
    "Filename": "2013-12-21-geospiza_fortis-_m6c7070.jpg",
    "County": "",
    "State/Province": "EC-W"
  },
  {
    "Location": "Isla Fernandina--Espinoza Point",
    "Date": "12-21-2013",
    "Scientific Name": "Setophaga petechia",
    "Common Name": "Yellow Warbler",
    "Filename": "2013-12-21-yelwar-_m6c6523.jpg",
    "County": "",
    "State/Province": "EC-W"
  },
  {
    "Location": "Offshore--continental shelf (northern SM Co.)",
    "Date": "05-04-2014",
    "Scientific Name": "Fratercula cirrhata",
    "Common Name": "Tufted Puffin",
    "Filename": "2014-05-04-tufpuf-dm6c9329.jpg",
    "County": "San Mateo",
    "State/Province": "US-CA"
  },
  {
    "Location": "Offshore--continental shelf (northern SM Co.)",
    "Date": "05-04-2014",
    "Scientific Name": "Phoebastria immutabilis",
    "Common Name": "Laysan Albatross",
    "Filename": "2014-05-04-phoebastria_immutabilis-dm6c9829.jpg",
    "County": "San Mateo",
    "State/Province": "US-CA"
  },
  {
    "Location": "Punta Mejia",
    "Date": "12-19-2013",
    "Scientific Name": "Puffinus subalaris",
    "Common Name": "Galapagos Shearwater",
    "Filename": "2013-12-19-puffinus_subalaris-7v5z3356.jpg",
    "County": "",
    "State/Province": "EC-W"
  },
  {
    "Location": "La Mina en route to refugio paz de las aves",
    "Date": "12-26-2013",
    "Scientific Name": "Semnornis ramphastinus",
    "Common Name": "Toucan Barbet",
    "Filename": "2013-12-26-semnornis_ramphastinus-_m6c9091.jpg",
    "County": "",
    "State/Province": "EC-P"
  },
  {
    "Location": "La Mina en route to refugio paz de las aves",
    "Date": "12-26-2013",
    "Scientific Name": "Anisognathus somptuosus",
    "Common Name": "Blue-winged Mountain-Tanager",
    "Filename": "2013-12-26-anisognathus_somptuosus-_m6c9101.jpg",
    "County": "",
    "State/Province": "EC-P"
  },
  {
    "Location": "La Mina en route to refugio paz de las aves",
    "Date": "12-26-2013",
    "Scientific Name": "Pipreola jucunda",
    "Common Name": "Orange-breasted Fruiteater",
    "Filename": "2013-12-26-pipreola_jucunda-_m6c9434.jpg",
    "County": "",
    "State/Province": "EC-P"
  },
  {
    "Location": "La Mina en route to refugio paz de las aves",
    "Date": "12-26-2013",
    "Scientific Name": "Cranioleuca erythrops",
    "Common Name": "Red-faced Spinetail",
    "Filename": "2013-12-26-cranioleuca_erythrops-7v5z8738.jpg",
    "County": "",
    "State/Province": "EC-P"
  },
  {
    "Location": "La Mina en route to refugio paz de las aves",
    "Date": "12-26-2013",
    "Scientific Name": "Sclerurus mexicanus",
    "Common Name": "Tawny-throated Leaftosser",
    "Filename": "2013-12-26-sclerurus_mexicanus-_m6c8821.jpg",
    "County": "",
    "State/Province": "EC-P"
  },
  {
    "Location": "La Mina en route to refugio paz de las aves",
    "Date": "12-26-2013",
    "Scientific Name": "Uropsalis lyra",
    "Common Name": "Lyre-tailed Nightjar",
    "Filename": "2013-12-26-uropsalis_lyra-_m6c8904.jpg",
    "County": "",
    "State/Province": "EC-P"
  },
  {
    "Location": "La Mina en route to refugio paz de las aves",
    "Date": "12-26-2013",
    "Scientific Name": "Grallaria flavotincta",
    "Common Name": "Yellow-breasted Antpitta",
    "Filename": "2013-12-26-grallaria_flavotincta-_m6c8965.jpg",
    "County": "",
    "State/Province": "EC-P"
  },
  {
    "Location": "South Ronaldsay",
    "Date": "06-19-2013",
    "Scientific Name": "Charadrius hiaticula",
    "Common Name": "Common Ringed Plover",
    "Filename": "2013-06-19-charadrius_hiaticula-_mg_7606.jpg",
    "County": "Orkney Islands",
    "State/Province": "GB-SCT"
  },
  {
    "Location": "South Ronaldsay",
    "Date": "06-19-2013",
    "Scientific Name": "Charadrius hiaticula",
    "Common Name": "Common Ringed Plover",
    "Filename": "2013-06-19-charadrius_hiaticula-_mg_7611.jpg",
    "County": "Orkney Islands",
    "State/Province": "GB-SCT"
  },
  {
    "Location": "South Ronaldsay",
    "Date": "06-19-2013",
    "Scientific Name": "Corvus monedula",
    "Common Name": "Eurasian Jackdaw",
    "Filename": "2013-06-19-corvus_monedula-_mg_7632.jpg",
    "County": "Orkney Islands",
    "State/Province": "GB-SCT"
  },
  {
    "Location": "Candasnos",
    "Date": "03-03-2013",
    "Scientific Name": "Athene noctua",
    "Common Name": "Little Owl",
    "Filename": "2013-03-03-athene_noctua-_m6c3907.jpg",
    "County": "Huesca",
    "State/Province": "ES-AR"
  },
  {
    "Location": "Monte Bello Open Space Preserve",
    "Date": "05-08-2014",
    "Scientific Name": "Ammodramus savannarum",
    "Common Name": "Grasshopper Sparrow",
    "Filename": "2014-05-08-graspa-dm6c0145.jpg",
    "County": "Santa Clara",
    "State/Province": "US-CA"
  },
  {
    "Location": "Tigertail Beach",
    "Date": "12-26-2014",
    "Scientific Name": "Charadrius melodus",
    "Common Name": "Piping Plover",
    "Filename": "2014-12-26-pipplo-dm6c9553.jpg",
    "County": "Unknown",
    "State/Province": "Unknown"
  },
  {
    "Location": "Monte Bello Open Space Preserve",
    "Date": "05-08-2014",
    "Scientific Name": "Polioptila caerulea",
    "Common Name": "Blue-gray Gnatcatcher",
    "Filename": "2014-05-08-buggna-dm6c0289.jpg",
    "County": "Santa Clara",
    "State/Province": "US-CA"
  },
  {
    "Location": "La Rinconada Park",
    "Date": "04-17-2014",
    "Scientific Name": "Baeolophus inornatus",
    "Common Name": "Oak Titmouse",
    "Filename": "2014-04-17-oaktit-dm6c8081.jpg",
    "County": "Santa Clara",
    "State/Province": "US-CA"
  },
  {
    "Location": "Rancho San Antonio",
    "Date": "04-24-2014",
    "Scientific Name": "Passerina amoena",
    "Common Name": "Lazuli Bunting",
    "Filename": "2014-04-24-lazbun-dm6c8215.jpg",
    "County": "Santa Clara",
    "State/Province": "US-CA"
  },
  {
    "Location": "Asa Wright Nature Centre",
    "Date": "01-16-2014",
    "Scientific Name": "Cyanerpes caeruleus",
    "Common Name": "Purple Honeycreeper",
    "Filename": "2014-01-16-cyanerpes_caeruleus-dm6c0171.jpg",
    "County": "",
    "State/Province": "TT-TUP"
  },
  {
    "Location": "Asa Wright Nature Centre",
    "Date": "01-16-2014",
    "Scientific Name": "Tachyphonus rufus",
    "Common Name": "White-lined Tanager",
    "Filename": "2014-01-16-tachyphonus_rufus-dm6c0269.jpg",
    "County": "",
    "State/Province": "TT-TUP"
  },
  {
    "Location": "Asa Wright Nature Centre",
    "Date": "01-16-2014",
    "Scientific Name": "Lophornis ornatus",
    "Common Name": "Tufted Coquette",
    "Filename": "2014-01-16-lophornis_ornatus-dm6c0304.jpg",
    "County": "",
    "State/Province": "TT-TUP"
  },
  {
    "Location": "Asa Wright Nature Centre",
    "Date": "01-16-2014",
    "Scientific Name": "Mionectes oleagineus",
    "Common Name": "Ochre-bellied Flycatcher",
    "Filename": "2014-01-16-mionectes_oleagineus-dm6c0342.jpg",
    "County": "",
    "State/Province": "TT-TUP"
  },
  {
    "Location": "Asa Wright Nature Centre",
    "Date": "01-16-2014",
    "Scientific Name": "Tangara gyrola",
    "Common Name": "Bay-headed Tanager",
    "Filename": "2014-01-16-tangara_gyrola-dm6c0179.jpg",
    "County": "",
    "State/Province": "TT-TUP"
  },
  {
    "Location": "Asa Wright Nature Centre",
    "Date": "01-16-2014",
    "Scientific Name": "Tachyphonus rufus",
    "Common Name": "White-lined Tanager",
    "Filename": "2014-01-16-tachyphonus_rufus-dm6c0231.jpg",
    "County": "",
    "State/Province": "TT-TUP"
  },
  {
    "Location": "Asa Wright Nature Centre",
    "Date": "01-16-2014",
    "Scientific Name": "Chlorophanes spiza",
    "Common Name": "Green Honeycreeper",
    "Filename": "2014-01-16-chlorophanes_spiza-dm6c0250.jpg",
    "County": "",
    "State/Province": "TT-TUP"
  },
  {
    "Location": "Monte Bello Open Space Preserve",
    "Date": "05-08-2014",
    "Scientific Name": "Ammodramus savannarum",
    "Common Name": "Grasshopper Sparrow",
    "Filename": "2014-05-08-graspa-dm6c0260-2.jpg",
    "County": "Santa Clara",
    "State/Province": "US-CA"
  },
  {
    "Location": "Asa Wright Nature Centre",
    "Date": "01-16-2014",
    "Scientific Name": "Thraupis palmarum",
    "Common Name": "Palm Tanager",
    "Filename": "2014-01-16-thraupis_palmarum-dm6c0260-3.jpg",
    "County": "",
    "State/Province": "TT-TUP"
  },
  {
    "Location": "Asa Wright Nature Centre",
    "Date": "01-17-2014",
    "Scientific Name": "Nyctibius griseus",
    "Common Name": "Common Potoo",
    "Filename": "2014-01-17-nyctibius_griseus-dm6c0712.jpg",
    "County": "",
    "State/Province": "TT-TUP"
  },
  {
    "Location": "Asa Wright Nature Centre",
    "Date": "01-17-2014",
    "Scientific Name": "Steatornis caripensis",
    "Common Name": "Oilbird",
    "Filename": "2014-01-17-steatornis_caripensis-dm6c1015.jpg",
    "County": "",
    "State/Province": "TT-TUP"
  },
  {
    "Location": "Asa Wright Nature Centre",
    "Date": "01-18-2014",
    "Scientific Name": "Lophornis ornatus",
    "Common Name": "Tufted Coquette",
    "Filename": "2014-01-18-lophornis_ornatus-dm6c1453.jpg",
    "County": "",
    "State/Province": "TT-TUP"
  },
  {
    "Location": "Asa Wright Nature Centre",
    "Date": "01-18-2014",
    "Scientific Name": "Turdus nudigenis",
    "Common Name": "Spectacled Thrush",
    "Filename": "2014-01-18-turdus_nudigenis-dm6c1460.jpg",
    "County": "",
    "State/Province": "TT-TUP"
  },
  {
    "Location": "Tandayapa Bird Lodge",
    "Date": "12-27-2013",
    "Scientific Name": "Aulacorhynchus haematopygus",
    "Common Name": "Crimson-rumped Toucanet",
    "Filename": "2013-12-27-aulacorhynchus_haematopygus-_m6c9610.jpg",
    "County": "",
    "State/Province": "EC-P"
  },
  {
    "Location": "Caba\u00f1as San Isidro",
    "Date": "12-28-2013",
    "Scientific Name": "Grallaria hypoleuca",
    "Common Name": "White-bellied Antpitta",
    "Filename": "2013-12-28-grallaria_hypoleuca-_m6c9971.jpg",
    "County": "",
    "State/Province": "EC-N"
  },
  {
    "Location": "Delta del Llobregat PNat--Area general",
    "Date": "03-01-2013",
    "Scientific Name": "Fringilla coelebs",
    "Common Name": "Common Chaffinch",
    "Filename": "2013-03-01-fringilla_coelebs-_m6c2861.jpg",
    "County": "Barcelona",
    "State/Province": "ES-CT"
  },
  {
    "Location": "South Ronaldsay",
    "Date": "06-21-2013",
    "Scientific Name": "Somateria mollissima",
    "Common Name": "Common Eider",
    "Filename": "2013-06-21-comeid-_m6c9198.jpg",
    "County": "Orkney Islands",
    "State/Province": "GB-SCT"
  },
  {
    "Location": "South Ronaldsay",
    "Date": "06-23-2013",
    "Scientific Name": "Larus marinus",
    "Common Name": "Great Black-backed Gull",
    "Filename": "2013-06-23-gbbgul-_m6c9943.jpg",
    "County": "Orkney Islands",
    "State/Province": "GB-SCT"
  },
  {
    "Location": "Virginia Lakes",
    "Date": "07-02-2014",
    "Scientific Name": "Nucifraga columbiana",
    "Common Name": "Clark's Nutcracker",
    "Filename": "2014-07-02-clanut-dm6c1132.jpg",
    "County": "Mono",
    "State/Province": "US-CA"
  },
  {
    "Location": "Virginia Lakes",
    "Date": "07-02-2014",
    "Scientific Name": "Leucosticte tephrocotis",
    "Common Name": "Gray-crowned Rosy-Finch",
    "Filename": "2014-07-02-gcrfin-dm6c1296.jpg",
    "County": "Mono",
    "State/Province": "US-CA"
  },
  {
    "Location": "Old State Hwy Rd just south of Oil Plant",
    "Date": "07-04-2014",
    "Scientific Name": "Pooecetes gramineus",
    "Common Name": "Vesper Sparrow",
    "Filename": "2014-07-04-vesspa-dm6c2442.jpg",
    "County": "Mono",
    "State/Province": "US-CA"
  },
  {
    "Location": "Asa Wright Nature Centre",
    "Date": "01-21-2014",
    "Scientific Name": "Trogon violaceus",
    "Common Name": "Guianan Trogon",
    "Filename": "2014-01-21-trogon_violaceus-dm6c3628.jpg",
    "County": "",
    "State/Province": "TT-TUP"
  },
  {
    "Location": "Drawbridge",
    "Date": "12-14-2014",
    "Scientific Name": "Branta hutchinsii",
    "Common Name": "Cackling Goose",
    "Filename": "2014-12-14-cacgoo-dm6c7631.jpg",
    "County": "Alameda",
    "State/Province": "US-CA"
  },
  {
    "Date": "12-19-2015",
    "Location": "Crooked Tree Village - Dec 19, 2015 1:04 PM",
    "Scientific Name": "Rupornis magnirostris",
    "Common Name": "Roadside Hawk",
    "Filename": "2015-12-19-rupornis-magnirostris-6p5a1358.jpg",
    "County": "",
    "State/Province": "BZ-OW"
  },
  {
    "Date": "12-24-2015",
    "Location": "Caye Caulker--The Split",
    "Scientific Name": "Fregata magnificens",
    "Common Name": "Magnificent Frigatebird",
    "Filename": "2015-12-24-fregata-magnificens-6p5a7347.jpg",
    "County": "",
    "State/Province": "BZ-BZ"
  },
  {
    "Date": "12-20-2015",
    "Location": "Guinea Grass Rd - 18.026x-88.563 - Dec 20, 2015 4:01 PM",
    "Scientific Name": "Crotophaga sulcirostris",
    "Common Name": "Groove-billed Ani",
    "Filename": "2015-12-20-crotophaga-sulcirostris-6p5a3216.jpg",
    "County": "",
    "State/Province": "BZ-OW"
  },
  {
    "Date": "12-19-2015",
    "Location": "Crooked Tree Lagoon",
    "Scientific Name": "Busarellus nigricollis",
    "Common Name": "Black-collared Hawk",
    "Filename": "2015-12-19-busarellus-nigricollis-6p5a2513.jpg",
    "County": "",
    "State/Province": "BZ-OW"
  },
  {
    "Date": "04-13-2016",
    "Location": "Corkscrew Swamp Sanctuary",
    "Scientific Name": "Passerina ciris",
    "Common Name": "Painted Bunting",
    "Filename": "2016-04-13-passerina-ciris-6p5a2189.jpg",
    "County": "Collier",
    "State/Province": "US-FL"
  },
  {
    "Date": "04-20-2016",
    "Location": "Dry Tortugas NP",
    "Scientific Name": "Setophaga citrina",
    "Common Name": "Hooded Warbler",
    "Filename": "2016-04-20-setophaga-citrina-img_9953.jpg",
    "County": "Monroe",
    "State/Province": "US-FL"
  },
  {
    "Date": "04-20-2016",
    "Location": "Dry Tortugas NP",
    "Scientific Name": "Setophaga tigrina",
    "Common Name": "Cape May Warbler",
    "Filename": "2016-04-20-setophaga-tigrina-img_9792.jpg",
    "County": "Monroe",
    "State/Province": "US-FL"
  },
  {
    "Date": "12-31-2013",
    "Location": "Antisana Ecological Reserve--general area",
    "Scientific Name": "Phalcoboenus carunculatus",
    "Common Name": "Carunculated Caracara",
    "Filename": "2013-12-31-phalcoboenus-carunculatus-_o5c6708.jpg",
    "County": "",
    "State/Province": "EC-N"
  },
  {
    "Date": "12-31-2013",
    "Location": "Antisana Ecological Reserve--general area",
    "Scientific Name": "Aglaeactis cupripennis",
    "Common Name": "Shining Sunbeam",
    "Filename": "2013-12-31-aglaeactis-cupripennis-_o5c7443.jpg",
    "County": "",
    "State/Province": "EC-N"
  },
  {
    "Date": "12-26-2013",
    "Location": "La Mina en route to refugio paz de las aves",
    "Scientific Name": "Grallaria alleni",
    "Common Name": "Moustached Antpitta",
    "Filename": "2013-12-26-grallaria-alleni-_m6c9208.jpg",
    "County": "",
    "State/Province": "EC-P"
  },
  {
    "Date": "01-17-2014",
    "Location": "Aripo Livestock (Agriculture Research) Station",
    "Scientific Name": "Hydropsalis cayennensis",
    "Common Name": "White-tailed Nightjar",
    "Filename": "2014-01-17-hydropsalis-cayennensis-dm6c1412.jpg",
    "County": "",
    "State/Province": "TT-TUP"
  },
  {
    "Date": "04-21-2016",
    "Location": "Fort Zachary Taylor Historic SP",
    "Scientific Name": "Vireo gundlachii",
    "Common Name": "Cuban Vireo",
    "Filename": "2016-04-21-vireo-gundlachii-img_0505.jpg",
    "County": "Monroe",
    "State/Province": "US-FL"
  },
  {
    "Date": "04-20-2016",
    "Location": "Fort Zachary Taylor Historic SP",
    "Scientific Name": "Coccyzus minor",
    "Common Name": "Mangrove Cuckoo",
    "Filename": "2016-04-20-coccyzus-minor-img_0376.jpg",
    "County": "Monroe",
    "State/Province": "US-FL"
  },
  {
    "Date": "04-15-2016",
    "Location": "Pelican Blvd. Baseball Fields",
    "Scientific Name": "Myiopsitta monachus",
    "Common Name": "Monk Parakeet",
    "Filename": "2016-04-15-myiopsitta-monachus-6p5a4350.jpg",
    "County": "Lee",
    "State/Province": "US-FL"
  },
  {
    "Date": "04-13-2016",
    "Location": "Little Estero Lagoon",
    "Scientific Name": "Megaceryle alcyon",
    "Common Name": "Belted Kingfisher",
    "Filename": "2016-04-13-megaceryle-alcyon-6p5a2631.jpg",
    "County": "Lee",
    "State/Province": "US-FL"
  },
  {
    "Date": "11-05-2011",
    "Location": "Palo Alto Duck Pond",
    "Scientific Name": "Anas clypeata",
    "Common Name": "Northern Shoveler",
    "Filename": "2011-11-05-anas-clypeata-7v5z5954.jpg",
    "County": "Santa Clara",
    "State/Province": "US-CA"
  },
  {
    "Date": "04-20-2016",
    "Location": "Dry Tortugas NP",
    "Scientific Name": "Seiurus aurocapilla",
    "Common Name": "Ovenbird",
    "Filename": "2016-04-20-seiurus-aurocapilla-img_9930.jpg",
    "County": "Monroe",
    "State/Province": "US-FL"
  },
  {
    "Date": "04-16-2016",
    "Location": "US-Florida - 25.762x-80.66 - Apr 16, 2016 6:38 PM",
    "Scientific Name": "Bartramia longicauda",
    "Common Name": "Upland Sandpiper",
    "Filename": "2016-04-16-bartramia-longicauda-6p5a5013.jpg",
    "County": "Miami-Dade",
    "State/Province": "US-FL"
  },
  {
    "Date": "06-19-2013",
    "Location": "South Ronaldsay",
    "Scientific Name": "Alauda arvensis",
    "Common Name": "Eurasian Skylark",
    "Filename": "2013-06-19-alauda-arvensis-_mg_7557.jpg",
    "County": "Orkney Islands",
    "State/Province": "GB-SCT"
  },
  {
    "Date": "01-17-2014",
    "Location": "Asa Wright Nature Centre",
    "Scientific Name": "Trogon collaris",
    "Common Name": "Collared Trogon",
    "Filename": "2014-01-17-trogon-collaris-DM6C0780.jpg",
    "County": "",
    "State/Province": "TT-TUP"
  },
  {
    "Date": "12-18-2015",
    "Location": "Crooked Tree Lodge",
    "Scientific Name": "Jacana spinosa",
    "Common Name": "Northern Jacana",
    "Filename": "2015-12-18-jacana-spinosa-6P5A0636.jpg",
    "County": "",
    "State/Province": "BZ-OW"
  },
  {
    "Date": "02-27-2012",
    "Location": "La Quinta de Sarapiqu\u00ed\u00ad Lodge",
    "Scientific Name": "Trogon massena",
    "Common Name": "Slaty-tailed Trogon",
    "Filename": "2012-02-27-trogon-massena-7V5Z6389.jpg",
    "County": "",
    "State/Province": "CR-H"
  },
  {
    "Date": "02-29-2012",
    "Location": "PN Braulio Carrillo",
    "Scientific Name": "Trogon rufus",
    "Common Name": "Black-throated Trogon",
    "Filename": "2012-02-29-trogon-rufus-7V5Z7098.jpg",
    "County": "",
    "State/Province": "CR-SJ"
  },
  {
    "Date": "02-24-2012",
    "Location": "Talari Mountain Lodge",
    "Scientific Name": "Cyanerpes cyaneus",
    "Common Name": "Red-legged Honeycreeper",
    "Filename": "2012-02-24-cyanerpes-cyaneus-7V5Z3993.jpg",
    "County": "",
    "State/Province": "CR-SJ"
  },
  {
    "Date": "01-23-2014",
    "Location": "Main Ridge Forest Reserve",
    "Scientific Name": "Galbula ruficauda",
    "Common Name": "Rufous-tailed Jacamar",
    "Filename": "2014-01-23-galbula-ruficauda-DM6C5262.jpg",
    "County": "",
    "State/Province": "TT-TOB"
  },
  {
    "Date": "01-19-2014",
    "Location": "Yarrete - Hummingbirds",
    "Scientific Name": "Amazilia tobaci",
    "Common Name": "Copper-rumped Hummingbird",
    "Filename": "2014-01-19-amazilia-tobaci-DM6C2734.jpg",
    "County": "",
    "State/Province": "TT-TUP"
  },
  {
    "Date": "12-21-2013",
    "Location": "Isla Fernandina--Espinoza Point",
    "Scientific Name": "Oceanites gracilis",
    "Common Name": "Elliot's Storm-Petrel",
    "Filename": "2013-12-21-oceanites-gracilis-_M6C6727.jpg",
    "County": "",
    "State/Province": "EC-W"
  },
  {
    "Date": "01-21-2014",
    "Location": "Carli Bay",
    "Scientific Name": "Sicalis flaveola",
    "Common Name": "Saffron Finch",
    "Filename": "2014-01-21-sicalis-flaveola-DM6C4074.jpg",
    "County": "",
    "State/Province": "TT-CTT"
  },
  {
    "Date": "02-23-2012",
    "Location": "R\u00edo Tarcoles--Boat Tour",
    "Scientific Name": "Thamnophilus doliatus",
    "Common Name": "Barred Antshrike",
    "Filename": "2012-02-23-thamnophilus-doliatus-7V5Z3266.jpg",
    "County": "",
    "State/Province": "CR-P"
  },
  {
    "Date": "02-26-2012",
    "Location": "Savegre Valley (upper)",
    "Scientific Name": "Pharomachrus mocinno",
    "Common Name": "Resplendent Quetzal",
    "Filename": "2012-02-26-pharomachrus-mocinno-7V5Z4698.jpg",
    "County": "",
    "State/Province": "CR-SJ"
  },
  {
    "Date": "04-13-2016",
    "Location": "Six Mile Cypress Slough Preserve",
    "Scientific Name": "Setophaga magnolia",
    "Common Name": "Magnolia Warbler",
    "Filename": "2016-04-13-setophaga-magnolia-6P5A2788.jpg",
    "County": "Lee",
    "State/Province": "US-FL"
  },
  {
    "Date": "04-13-2016",
    "Location": "Little Estero Lagoon",
    "Scientific Name": "Charadrius wilsonia",
    "Common Name": "Wilson's Plover",
    "Filename": "2016-04-13-charadrius-wilsonia-6P5A2541.jpg",
    "County": "Lee",
    "State/Province": "US-FL"
  },
  {
    "Date": "02-15-2016",
    "Location": "Robinson Rd.",
    "Scientific Name": "Falco columbarius",
    "Common Name": "Merlin",
    "Filename": "2016-02-15-falco-columbarius-6P5A0010.jpg",
    "County": "Solano",
    "State/Province": "US-CA"
  },
  {
    "Date": "01-17-2014",
    "Location": "Asa Wright Nature Centre",
    "Scientific Name": "Procnias averano",
    "Common Name": "Bearded Bellbird",
    "Filename": "2014-01-17-procnias-averano-DM6C0854.jpg",
    "County": "",
    "State/Province": "TT-TUP"
  },
  {
    "Date": "01-17-2014",
    "Location": "Asa Wright Nature Centre",
    "Scientific Name": "Manacus manacus",
    "Common Name": "White-bearded Manakin",
    "Filename": "2014-01-17-manacus-manacus-DM6C0767.jpg",
    "County": "",
    "State/Province": "TT-TUP"
  },
  {
    "Date": "04-16-2016",
    "Location": "Eagle Lakes Community Park",
    "Scientific Name": "Elanoides forficatus",
    "Common Name": "Swallow-tailed Kite",
    "Filename": "2016-04-16-elanoides-forficatus-6P5A4732-2.jpg",
    "County": "Collier",
    "State/Province": "US-FL"
  },
  {
    "Date": "12-29-2013",
    "Location": "Caba\u00f1as San Isidro",
    "Scientific Name": "Myiothlypis nigrocristata",
    "Common Name": "Black-crested Warbler",
    "Filename": "2013-12-29-myiothlypis-nigrocristata-_M6C0599.jpg",
    "County": "",
    "State/Province": "EC-N"
  },
  {
    "Date": "02-25-2012",
    "Location": "Alajuela",
    "Scientific Name": "Piranga bidentata",
    "Common Name": "Flame-colored Tanager",
    "Filename": "2012-02-25-piranga-bidentata-7V5Z5068.jpg",
    "County": "",
    "State/Province": "CR-A"
  },
  {
    "Date": "07-20-2016",
    "Location": "Isla Champion",
    "Scientific Name": "Anous stolidus",
    "Common Name": "Brown Noddy",
    "Filename": "2016-07-20-anous-stolidus-0L5A0537.jpg",
    "County": "",
    "State/Province": "EC-W"
  },
  {
    "Date": "07-20-2016",
    "Location": "Isla Champion",
    "Scientific Name": "Sula nebouxii",
    "Common Name": "Blue-footed Booby",
    "Filename": "2016-07-20-sula-nebouxii-0L5A1098.jpg",
    "County": "",
    "State/Province": "EC-W"
  },
  {
    "Date": "07-20-2016",
    "Location": "Isla Champion",
    "Scientific Name": "Geospiza fuliginosa",
    "Common Name": "Small Ground-Finch",
    "Filename": "2016-07-20-geospiza-fuliginosa-0L5A1027.jpg",
    "County": "",
    "State/Province": "EC-W"
  },
  {
    "Date": "04-14-2016",
    "Location": "Prairie/Shell Creek Preserve",
    "Scientific Name": "Chordeiles minor",
    "Common Name": "Common Nighthawk",
    "Filename": "2016-04-14-chordeiles-minor-6P5A3254.jpg",
    "County": "Charlotte",
    "State/Province": "US-FL"
  },
  {
    "Date": "04-20-2016",
    "Location": "Fort Zachary Taylor Historic SP",
    "Scientific Name": "Setophaga discolor",
    "Common Name": "Prairie Warbler",
    "Filename": "2016-04-20-setophaga-discolor-IMG_0076.jpg",
    "County": "Monroe",
    "State/Province": "US-FL"
  },
  {
    "Date": "04-14-2016",
    "Location": "J. N. Ding Darling NWR",
    "Scientific Name": "Setophaga dominica",
    "Common Name": "Yellow-throated Warbler",
    "Filename": "2016-04-14-setophaga-dominica-6P5A2978.jpg",
    "County": "Lee",
    "State/Province": "US-FL"
  },
  {
    "Date": "07-16-2016",
    "Location": "Reserva Amagusa",
    "Scientific Name": "Anisognathus notabilis",
    "Common Name": "Black-chinned Mountain-Tanager",
    "Filename": "2016-07-16-anisognathus-notabilis-0L5A8630.jpg",
    "County": "",
    "State/Province": "EC-P"
  },
  {
    "Date": "07-16-2016",
    "Location": "Reserva Amagusa",
    "Scientific Name": "Pachyramphus albogriseus",
    "Common Name": "Black-and-white Becard",
    "Filename": "2016-07-16-pachyramphus-albogriseus-0L5A8604.jpg",
    "County": "",
    "State/Province": "EC-P"
  },
  {
    "Date": "07-16-2016",
    "Location": "Reserva Amagusa",
    "Scientific Name": "Entomodestes coracinus",
    "Common Name": "Black Solitaire",
    "Filename": "2016-07-16-entomodestes-coracinus-0L5A8362.jpg",
    "County": "",
    "State/Province": "EC-P"
  },
  {
    "Date": "07-05-2016",
    "Location": "New Chicago Marsh",
    "Scientific Name": "Hirundo rustica",
    "Common Name": "Barn Swallow",
    "Filename": "2016-07-05-hirundo-rustica-0L5A0732.jpg",
    "County": "Santa Clara",
    "State/Province": "US-CA"
  },
  {
    "Date": "03-01-2013",
    "Location": "Delta del Llobregat PNat--Area general",
    "Scientific Name": "Phoenicurus ochruros",
    "Common Name": "Black Redstart",
    "Filename": "2013-03-01-phoenicurus-ochruros-_M6C2834.jpg",
    "County": "Barcelona",
    "State/Province": "ES-CT"
  },
  {
    "Date": "12-18-2015",
    "Location": "Crooked Tree Lodge",
    "Scientific Name": "Butorides virescens",
    "Common Name": "Green Heron",
    "Filename": "2015-12-18-butorides-virescens-6P5A0698.jpg",
    "County": "",
    "State/Province": "BZ-OW"
  },
  {
    "Date": "07-17-2016",
    "Location": "Milpe--Milpe Gardens",
    "Scientific Name": "Ramphastos brevis",
    "Common Name": "Choco Toucan",
    "Filename": "2016-07-17-ramphastos-brevis-0L5A9139.jpg",
    "County": "",
    "State/Province": "EC-P"
  },
  {
    "Date": "12-21-2015",
    "Location": "Crooked Tree Village",
    "Scientific Name": "Cyclarhis gujanensis",
    "Common Name": "Rufous-browed Peppershrike",
    "Filename": "2015-12-21-cyclarhis-gujanensis-6P5A3876.jpg",
    "County": "",
    "State/Province": "BZ-OW"
  },
  {
    "Date": "04-21-2016",
    "Location": "US-Florida-Key West-900 Flagler Ave - 24.549x-81.79",
    "Scientific Name": "Patagioenas leucocephala",
    "Common Name": "White-crowned Pigeon",
    "Filename": "2016-04-21-patagioenas-leucocephala-IMG_0470.jpg",
    "County": "Monroe",
    "State/Province": "US-FL"
  },
  {
    "Date": "04-20-2016",
    "Location": "Dry Tortugas NP",
    "Scientific Name": "Setophaga striata",
    "Common Name": "Blackpoll Warbler",
    "Filename": "2016-04-20-setophaga-striata-IMG_0196.jpg",
    "County": "Monroe",
    "State/Province": "US-FL"
  },
  {
    "Date": "12-20-2015",
    "Location": "Guinea Grass Rd - 18.026x-88.563 - Dec 20, 2015 4:01 PM",
    "Scientific Name": "Psilorhinus morio",
    "Common Name": "Brown Jay",
    "Filename": "2015-12-20-psilorhinus-morio-6P5A3102.jpg",
    "County": "",
    "State/Province": "BZ-OW"
  },
  {
    "Date": "07-16-2016",
    "Location": "Reserva Amagusa",
    "Scientific Name": "Tangara ruficervix",
    "Common Name": "Golden-naped Tanager",
    "Filename": "2016-07-16-tangara-ruficervix-0L5A8554.jpg",
    "County": "",
    "State/Province": "EC-P"
  },
  {
    "Date": "12-19-2015",
    "Location": "Crooked Tree Lagoon",
    "Scientific Name": "Sporophila torqueola",
    "Common Name": "White-collared Seedeater",
    "Filename": "2015-12-19-sporophila-torqueola-6P5A1574.jpg",
    "County": "",
    "State/Province": "BZ-OW"
  },
  {
    "Date": "07-16-2016",
    "Location": "Reserva Amagusa",
    "Scientific Name": "Aulacorhynchus haematopygus",
    "Common Name": "Crimson-rumped Toucanet",
    "Filename": "2016-07-16-aulacorhynchus-haematopygus-0L5A8401.jpg",
    "County": "",
    "State/Province": "EC-P"
  },
  {
    "Date": "12-18-2015",
    "Location": "Crooked Tree Lodge",
    "Scientific Name": "Quiscalus mexicanus",
    "Common Name": "Great-tailed Grackle",
    "Filename": "2015-12-18-quiscalus-mexicanus-6P5A0648.jpg",
    "County": "",
    "State/Province": "BZ-OW"
  },
  {
    "Date": "12-21-2015",
    "Location": "Crooked Tree Village",
    "Scientific Name": "Jabiru mycteria",
    "Common Name": "Jabiru",
    "Filename": "2015-12-21-jabiru-mycteria-6P5A4052.jpg",
    "County": "",
    "State/Province": "BZ-OW"
  },
  {
    "Date": "04-21-2016",
    "Location": "US-Florida-Big Pine Key-3636 Town St - 24.721x-81.399",
    "Scientific Name": "Chordeiles minor",
    "Common Name": "Common Nighthawk",
    "Filename": "2016-04-21-chordeiles-minor-IMG_0531.jpg",
    "County": "Monroe",
    "State/Province": "US-FL"
  },
  {
    "Date": "04-20-2016",
    "Location": "Dry Tortugas NP",
    "Scientific Name": "Setophaga ruticilla",
    "Common Name": "American Redstart",
    "Filename": "2016-04-20-setophaga-ruticilla-IMG_9742.jpg",
    "County": "Monroe",
    "State/Province": "US-FL"
  },
  {
    "Date": "04-20-2016",
    "Location": "Dry Tortugas NP",
    "Scientific Name": "Setophaga caerulescens",
    "Common Name": "Black-throated Blue Warbler",
    "Filename": "2016-04-20-setophaga-caerulescens-IMG_9803.jpg",
    "County": "Monroe",
    "State/Province": "US-FL"
  },
  {
    "Date": "12-19-2015",
    "Location": "Crooked Tree Village - Dec 19, 2015 1:04 PM",
    "Scientific Name": "Aramides albiventris",
    "Common Name": "Russet-naped Wood-Rail",
    "Filename": "2015-12-19-aramides-albiventris-6P5A1812.jpg",
    "County": "",
    "State/Province": "BZ-OW"
  },
  {
    "Date": "12-18-2016",
    "Location": "San Jose CBC, Alviso, Party 4",
    "Scientific Name": "Circus cyaneus",
    "Common Name": "Northern Harrier",
    "Filename": "2016-12-18-circus-cyaneus-0L5A9332.jpg",
    "County": "Alameda",
    "State/Province": "US-CA"
  },
  {
    "Date": "01-24-2014",
    "Location": "Little Tobago Island",
    "Scientific Name": "Phaethon lepturus",
    "Common Name": "White-tailed Tropicbird",
    "Filename": "2014-01-24-phaethon-lepturus-DM6C6156.jpg",
    "County": "",
    "State/Province": "TT-TOB"
  },
  {
    "Date": "01-24-2014",
    "Location": "Little Tobago Island",
    "Scientific Name": "Phaethon aethereus",
    "Common Name": "Red-billed Tropicbird",
    "Filename": "2014-01-24-phaethon-aethereus-DM6C5959.jpg",
    "County": "",
    "State/Province": "TT-TOB"
  },
  {
    "Date": "01-24-2014",
    "Location": "Blue Waters Inn",
    "Scientific Name": "Ortalis ruficauda",
    "Common Name": "Rufous-vented Chachalaca",
    "Filename": "2014-01-24-ortalis-ruficauda-DM6C5718.jpg",
    "County": "",
    "State/Province": "TT-TOB"
  },
  {
    "Date": "01-23-2014",
    "Location": "11.2795x-60.5442 - Jan 23, 2014, 8:45 AM",
    "Scientific Name": "Formicivora grisea",
    "Common Name": "White-fringed Antwren",
    "Filename": "2014-01-23-formicivora-grisea-DM6C5166.jpg",
    "County": "",
    "State/Province": "TT-TOB"
  },
  {
    "Date": "01-21-2014",
    "Location": "Cacandee",
    "Scientific Name": "Eudocimus ruber",
    "Common Name": "Scarlet Ibis",
    "Filename": "2014-01-21-eudocimus-ruber-DM6C4492.jpg",
    "County": "",
    "State/Province": "TT-SJL"
  },
  {
    "Date": "01-18-2014",
    "Location": "10.4310x-61.0321 - Jan 18, 2014, 1:34 PM",
    "Scientific Name": "Chloroceryle aenea",
    "Common Name": "American Pygmy Kingfisher",
    "Filename": "2014-01-18-chloroceryle-aenea-DM6C1822.jpg",
    "County": "",
    "State/Province": "TT-RCM"
  },
  {
    "Date": "01-18-2014",
    "Location": "Aripo Livestock (Agriculture Research) Station",
    "Scientific Name": "Arundinicola leucocephala",
    "Common Name": "White-headed Marsh Tyrant",
    "Filename": "2014-01-18-arundinicola-leucocephala-DM6C1557.jpg",
    "County": "",
    "State/Province": "TT-TUP"
  },
  {
    "Date": "01-17-2014",
    "Location": "Asa Wright Nature Centre",
    "Scientific Name": "Myrmeciza longipes",
    "Common Name": "White-bellied Antbird",
    "Filename": "2014-01-17-myrmeciza-longipes-DM6C0905.jpg",
    "County": "",
    "State/Province": "TT-TUP"
  },
  {
    "Date": "07-17-2016",
    "Location": "Milpe--Milpe Gardens",
    "Scientific Name": "Electron platyrhynchum",
    "Common Name": "Broad-billed Motmot",
    "Filename": "2016-07-17-electron-platyrhynchum-0L5A9930.jpg",
    "County": "",
    "State/Province": "EC-P"
  },
  {
    "Date": "07-16-2016",
    "Location": "Reserva Amagusa",
    "Scientific Name": "Chlorochrysa phoenicotis",
    "Common Name": "Glistening-green Tanager",
    "Filename": "2016-07-16-chlorochrysa-phoenicotis-0L5A8375.jpg",
    "County": "",
    "State/Province": "EC-P"
  },
  {
    "Date": "07-17-2016",
    "Location": "Milpe--Milpe Gardens",
    "Scientific Name": "Discosura conversii",
    "Common Name": "Green Thorntail",
    "Filename": "2016-07-17-discosura-conversii-0L5A9796.jpg",
    "County": "",
    "State/Province": "EC-P"
  },
  {
    "Date": "07-17-2016",
    "Location": "Milpe--Milpe Gardens",
    "Scientific Name": "Discosura conversii",
    "Common Name": "Green Thorntail",
    "Filename": "2016-07-17-discosura-conversii-0L5A9738.jpg",
    "County": "",
    "State/Province": "EC-P"
  },
  {
    "Date": "07-16-2016",
    "Location": "Reserva Amagusa",
    "Scientific Name": "Tangara arthus",
    "Common Name": "Golden Tanager",
    "Filename": "2016-07-16-tangara-arthus-0L5A8279.jpg",
    "County": "",
    "State/Province": "EC-P"
  },
  {
    "Date": "07-16-2016",
    "Location": "Reserva Amagusa",
    "Scientific Name": "Tangara rufigula",
    "Common Name": "Rufous-throated Tanager",
    "Filename": "2016-07-16-tangara-rufigula-0L5A8249.jpg",
    "County": "",
    "State/Province": "EC-P"
  },
  {
    "Date": "07-17-2016",
    "Location": "Septimo Paraiso",
    "Scientific Name": "Eubucco bourcierii",
    "Common Name": "Red-headed Barbet",
    "Filename": "2016-07-17-eubucco-bourcierii-179A7428.jpg",
    "County": "",
    "State/Province": "EC-P"
  },
  {
    "Date": "01-14-2017",
    "Location": "Airport St. along Half Moon Bay Airport fields",
    "Scientific Name": "Rhodostethia rosea",
    "Common Name": "Ross's Gull",
    "Filename": "2017-01-14-rhodostethia-rosea-0L5A9742.jpg",
    "County": "San Mateo",
    "State/Province": "US-CA"
  },
  {
    "Date": "01-14-2017",
    "Location": "Airport St. along Half Moon Bay Airport fields",
    "Scientific Name": "Rhodostethia rosea",
    "Common Name": "Ross's Gull",
    "Filename": "2017-01-14-rhodostethia-rosea-0L5A9761.jpg",
    "County": "San Mateo",
    "State/Province": "US-CA"
  },
  {
    "Date": "01-16-2014",
    "Location": "Asa Wright Nature Centre",
    "Scientific Name": "Turdus albicollis",
    "Common Name": "White-necked Thrush",
    "Filename": "2014-01-16-turdus-albicollis-DM6C0549.jpg",
    "County": "",
    "State/Province": "TT-TUP"
  },
  {
    "Date": "07-17-2016",
    "Location": "Milpe--Milpe Gardens",
    "Scientific Name": "Colibri delphinae",
    "Common Name": "Brown Violetear",
    "Filename": "2016-07-17-colibri-delphinae-0L5A0185.jpg",
    "County": "",
    "State/Province": "EC-P"
  },
  {
    "Date": "12-21-2015",
    "Location": "Crooked Tree Village",
    "Scientific Name": "Setophaga magnolia",
    "Common Name": "Magnolia Warbler",
    "Filename": "2015-12-21-setophaga-magnolia-6P5A3806.jpg",
    "County": "",
    "State/Province": "BZ-OW"
  },
  {
    "Date": "12-21-2015",
    "Location": "Crooked Tree Village",
    "Scientific Name": "Campephilus guatemalensis",
    "Common Name": "Pale-billed Woodpecker",
    "Filename": "2015-12-21-campephilus-guatemalensis-6P5A4507.jpg",
    "County": "",
    "State/Province": "BZ-OW"
  },
  {
    "Date": "07-21-2016",
    "Location": "Espaola--Punta Suarez",
    "Scientific Name": "Phoebastria irrorata",
    "Common Name": "Waved Albatross",
    "Filename": "2016-07-21-phoebastria-irrorata-0L5A1700.jpg",
    "County": "",
    "State/Province": "EC-W"
  },
  {
    "Date": "07-21-2016",
    "Location": "Espaola--Punta Suarez",
    "Scientific Name": "Haematopus palliatus",
    "Common Name": "American Oystercatcher",
    "Filename": "2016-07-21-haematopus-palliatus-0L5A2302.jpg",
    "County": "",
    "State/Province": "EC-W"
  },
  {
    "Date": "07-05-2014",
    "Location": "Sotcher Lake",
    "Scientific Name": "Sphyrapicus thyroideus",
    "Common Name": "Williamson's Sapsucker",
    "Filename": "2014-07-05-sphyrapicus-thyroideus-DM6C3112.jpg",
    "County": "Madera",
    "State/Province": "US-CA"
  },
  {
    "Date": "12-26-2013",
    "Location": "La Mina en route to refugio paz de las aves",
    "Scientific Name": "Rupicola peruvianus",
    "Common Name": "Andean Cock-of-the-rock",
    "Filename": "2013-12-26-rupicola-peruvianus-_M6C8756.jpg",
    "County": "",
    "State/Province": "EC-P"
  },
  {
    "Date": "12-18-2013",
    "Location": "Genovesa--Darwin Bay",
    "Scientific Name": "Sula granti",
    "Common Name": "Nazca Booby",
    "Filename": "2013-12-18-sula-granti-7V5Z3036.jpg",
    "County": "",
    "State/Province": "EC-W"
  },
  {
    "Date": "12-27-2013",
    "Location": "Cabaas San Isidro",
    "Scientific Name": "Boissonneaua matthewsii",
    "Common Name": "Chestnut-breasted Coronet",
    "Filename": "2013-12-27-boissonneaua-matthewsii-_M6C9706.jpg",
    "County": "",
    "State/Province": "EC-N"
  },
  {
    "Date": "07-21-2016",
    "Location": "Espaola--Punta Suarez",
    "Scientific Name": "Sula granti",
    "Common Name": "Nazca Booby",
    "Filename": "2016-07-21-sula-granti-0L5A1438.jpg",
    "County": "",
    "State/Province": "EC-W"
  },
  {
    "Date": "12-25-2013",
    "Location": "Tandayapa Bird Lodge",
    "Scientific Name": "Coeligena wilsoni",
    "Common Name": "Brown Inca",
    "Filename": "2013-12-25-coeligena-wilsoni-_M6C8566.jpg",
    "County": "",
    "State/Province": "EC-P"
  },
  {
    "Date": "01-20-2014",
    "Location": "Las Lapas Trace",
    "Scientific Name": "Celeus elegans",
    "Common Name": "Chestnut Woodpecker",
    "Filename": "2014-01-20-celeus-elegans-DM6C3355.jpg",
    "County": "",
    "State/Province": "TT-TUP"
  },
  {
    "Date": "01-20-2014",
    "Location": "10.7456x-61.3224 - Jan 20, 2014, 3:30 PM",
    "Scientific Name": "Pionus menstruus",
    "Common Name": "Blue-headed Parrot",
    "Filename": "2014-01-20-pionus-menstruus-DM6C3537.jpg",
    "County": "",
    "State/Province": "TT-TUP"
  },
  {
    "Date": "01-21-2014",
    "Location": "Cacandee",
    "Scientific Name": "Coragyps atratus",
    "Common Name": "Black Vulture",
    "Filename": "2014-01-21-coragyps-atratus-DM6C3875.jpg",
    "County": "",
    "State/Province": "TT-SJL"
  },
  {
    "Date": "03-11-2017",
    "Location": "Panoche Rd.",
    "Scientific Name": "Aeronautes saxatalis",
    "Common Name": "White-throated Swift",
    "Filename": "2017-03-11-aeronautes-saxatalis-0L5A0362.jpg",
    "County": "San Benito",
    "State/Province": "US-CA"
  },
  {
    "Date": "12-02-2016",
    "Location": "Randall Davey Audubon Center",
    "Scientific Name": "Poecile atricapillus",
    "Common Name": "Black-capped Chickadee",
    "Filename": "2016-12-02-poecile-atricapillus-179A8845.jpg",
    "County": "Santa Fe",
    "State/Province": "US-NM"
  },
  {
    "Date": "04-14-2016",
    "Location": "Babcock-Webb WMA",
    "Scientific Name": "Melanerpes carolinus",
    "Common Name": "Red-bellied Woodpecker",
    "Filename": "2016-04-14-melanerpes-carolinus-6P5A2870.jpg",
    "County": "Charlotte",
    "State/Province": "US-FL"
  },
  {
    "Date": "05-06-2017",
    "Location": "Picchetti Ranch OSP",
    "Scientific Name": "Vireo huttoni",
    "Common Name": "Hutton's Vireo",
    "Filename": "2017-05-06-vireo-huttoni-0L5A1103.jpg",
    "County": "Santa Clara",
    "State/Province": "US-CA"
  },
  {
    "Date": "04-14-2017",
    "Location": "Charleston Slough/Coast Casey Forebay",
    "Scientific Name": "Circus cyaneus",
    "Common Name": "Northern Harrier",
    "Filename": "2017-04-14-circus-cyaneus-0L5A1060.jpg",
    "County": "Santa Clara",
    "State/Province": "US-CA"
  },
  {
    "Date": "05-22-2017",
    "Location": "West Cliff Dr. at Stockton Ave.",
    "Scientific Name": "Cepphus columba",
    "Common Name": "Pigeon Guillemot",
    "Filename": "2017-05-22-cepphus-columba-0L5A0187.jpg",
    "County": "Santa Cruz",
    "State/Province": "US-CA"
  },
  {
    "Date": "12-31-2013",
    "Location": "Antisana Ecological Reserve--general area",
    "Scientific Name": "Cinclodes excelsior",
    "Common Name": "Stout-billed Cinclodes",
    "Filename": "2013-12-31-cinclodes-excelsior-_O5C6573.jpg",
    "County": "",
    "State/Province": "EC-N"
  },
  {
    "Date": "12-30-2013",
    "Location": "Cabaas San Isidro",
    "Scientific Name": "Myioborus melanocephalus",
    "Common Name": "Spectacled Redstart",
    "Filename": "2013-12-30-myioborus-melanocephalus-_O5C6191.jpg",
    "County": "",
    "State/Province": "EC-N"
  },
  {
    "Date": "12-29-2013",
    "Location": "Cabaas San Isidro",
    "Scientific Name": "Adelomyia melanogenys",
    "Common Name": "Speckled Hummingbird",
    "Filename": "2013-12-29-adelomyia-melanogenys-_M6C0884.jpg",
    "County": "",
    "State/Province": "EC-N"
  },
  {
    "Date": "12-28-2013",
    "Location": "Cabaas San Isidro",
    "Scientific Name": "Colibri coruscans",
    "Common Name": "Sparkling Violetear",
    "Filename": "2013-12-28-colibri-coruscans-_M6C0214.jpg",
    "County": "",
    "State/Province": "EC-N"
  },
  {
    "Date": "01-23-2014",
    "Location": "Main Ridge Forest Reserve",
    "Scientific Name": "Synallaxis cinnamomea",
    "Common Name": "Stripe-breasted Spinetail",
    "Filename": "2014-01-23-synallaxis-cinnamomea-DM6C5522.jpg",
    "County": "",
    "State/Province": "TT-TOB"
  },
  {
    "Date": "01-18-2014",
    "Location": "10.4310x-61.0321 - Jan 18, 2014, 1:34 PM",
    "Scientific Name": "Camptostoma obsoletum",
    "Common Name": "Southern Beardless-Tyrannulet",
    "Filename": "2014-01-18-camptostoma-obsoletum-DM6C1840.jpg",
    "County": "",
    "State/Province": "TT-RCM"
  },
  {
    "Date": "12-18-2015",
    "Location": "Crooked Tree Lodge",
    "Scientific Name": "Myiozetetes similis",
    "Common Name": "Social Flycatcher",
    "Filename": "2015-12-18-myiozetetes-similis-6P5A0758.jpg",
    "County": "",
    "State/Province": "BZ-OW"
  },
  {
    "Date": "05-31-2017",
    "Location": "Canebrake Ecological Reserve",
    "Scientific Name": "Agelaius phoeniceus",
    "Common Name": "Red-winged Blackbird",
    "Filename": "2017-05-31-agelaius-phoeniceus-0L5A0360.jpg",
    "County": "Kern",
    "State/Province": "US-CA"
  },
  {
    "Date": "05-15-2017",
    "Location": "North Mountain Park",
    "Scientific Name": "Poecile atricapillus",
    "Common Name": "Black-capped Chickadee",
    "Filename": "2017-05-15-poecile-atricapillus-0L5A0007.jpg",
    "County": "Jackson",
    "State/Province": "US-OR"
  },
  {
    "Date": "07-16-2016",
    "Location": "Reserva Amagusa",
    "Scientific Name": "Crotophaga ani",
    "Common Name": "Smooth-billed Ani",
    "Filename": "2016-07-16-crotophaga-ani-0L5A8872.jpg",
    "County": "",
    "State/Province": "EC-P"
  },
  {
    "Date": "03-11-2017",
    "Location": "Panoche Valley--New Idria Rd.",
    "Scientific Name": "Buteo regalis",
    "Common Name": "Ferruginous Hawk",
    "Filename": "2017-03-11-buteo-regalis-0L5A0521.jpg",
    "County": "San Benito",
    "State/Province": "US-CA"
  },
  {
    "Date": "12-19-2015",
    "Location": "Crooked Tree Village - Dec 19, 2015 1:04 PM",
    "Scientific Name": "Herpetotheres cachinnans",
    "Common Name": "Laughing Falcon",
    "Filename": "2015-12-19-herpetotheres-cachinnans-6P5A1328.jpg",
    "County": "",
    "State/Province": "BZ-OW"
  },
  {
    "Date": "12-23-2015",
    "Location": "Slate Creek Lookout - 17.079x-88.967 - Dec 23, 2015 7:19 PM",
    "Scientific Name": "Falco rufigularis",
    "Common Name": "Bat Falcon",
    "Filename": "2015-12-23-falco-rufigularis-6P5A6787.jpg",
    "County": "",
    "State/Province": "BZ-CY"
  },
  {
    "Date": "01-19-2014",
    "Location": "TT-Tunapuna-Piarco - 10.7175x-61.2983 - Jan 16, 2014, 6:27 PM",
    "Scientific Name": "Buteogallus anthracinus",
    "Common Name": "Common Black Hawk",
    "Filename": "2014-01-19-buteogallus-anthracinus-DM6C2293.jpg",
    "County": "",
    "State/Province": "TT-TUP"
  },
  {
    "Date": "12-30-2013",
    "Location": "Guango Lodge",
    "Scientific Name": "Coeligena torquata",
    "Common Name": "Collared Inca",
    "Filename": "2013-12-30-coeligena-torquata-_O5C5955.jpg",
    "County": "",
    "State/Province": "EC-N"
  },
  {
    "Date": "07-21-2016",
    "Location": "Espaola--Punta Suarez",
    "Scientific Name": "Creagrus furcatus",
    "Common Name": "Swallow-tailed Gull",
    "Filename": "2016-07-21-creagrus-furcatus-0L5A1533.jpg",
    "County": "",
    "State/Province": "EC-W"
  },
  {
    "Date": "12-26-2013",
    "Location": "Mindo--general area",
    "Scientific Name": "Tersina viridis",
    "Common Name": "Swallow Tanager",
    "Filename": "2013-12-26-tersina-viridis-7V5Z8558.jpg",
    "County": "",
    "State/Province": "EC-P"
  },
  {
    "Date": "01-17-2014",
    "Location": "Asa Wright Nature Centre",
    "Scientific Name": "Trogon viridis",
    "Common Name": "Green-backed Trogon",
    "Filename": "2014-01-17-trogon-viridis-DM6C0687.jpg",
    "County": "",
    "State/Province": "TT-TUP"
  },
  {
    "Date": "01-18-2014",
    "Location": "Aripo Livestock (Agriculture Research) Station",
    "Scientific Name": "Forpus passerinus",
    "Common Name": "Green-rumped Parrotlet",
    "Filename": "2014-01-18-forpus-passerinus-DM6C1672.jpg",
    "County": "",
    "State/Province": "TT-TUP"
  },
  {
    "Date": "12-30-2013",
    "Location": "Guango Lodge",
    "Scientific Name": "Ensifera ensifera",
    "Common Name": "Sword-billed Hummingbird",
    "Filename": "2013-12-30-ensifera-ensifera-_O5C5465.jpg",
    "County": "",
    "State/Province": "EC-N"
  },
  {
    "Date": "08-12-2016",
    "Location": "Howard Prairie Circuit",
    "Scientific Name": "Strix nebulosa",
    "Common Name": "Great Gray Owl",
    "Filename": "2016-08-12-strix-nebulosa-179A7279.jpg",
    "County": "Jackson",
    "State/Province": "US-OR"
  },
  {
    "Date": "06-03-2017",
    "Location": "Sequoia NF--Holey Meadow Campground",
    "Scientific Name": "Troglodytes pacificus",
    "Common Name": "Pacific Wren",
    "Filename": "2017-06-03-troglodytes-pacificus-0L5A1343.jpg",
    "County": "Tulare",
    "State/Province": "US-CA"
  },
  {
    "Date": "08-26-2017",
    "Location": "(37.4548,-122.6928)",
    "Scientific Name": "Thalasseus elegans",
    "Common Name": "Elegant Tern",
    "Filename": "2017-08-26-thalasseus-elegans-0L5A2820.jpg",
    "County": "San Mateo",
    "State/Province": "US-CA"
  },
  {
    "Date": "04-13-2016",
    "Location": "Little Estero Lagoon",
    "Scientific Name": "Sternula antillarum",
    "Common Name": "Least Tern",
    "Filename": "2016-04-13-sternula-antillarum-6P5A2458.jpg",
    "County": "Lee",
    "State/Province": "US-FL"
  },
  {
    "Date": "04-14-2016",
    "Location": "Babcock-Webb WMA",
    "Scientific Name": "Setophaga discolor",
    "Common Name": "Prairie Warbler",
    "Filename": "2016-04-14-setophaga-discolor-6P5A3140.jpg",
    "County": "Charlotte",
    "State/Province": "US-FL"
  },
  {
    "Date": "12-23-2015",
    "Location": "Slate Creek Lookout - 17.079x-88.967 - Dec 23, 2015 7:19 PM",
    "Scientific Name": "Pseudastur albicollis",
    "Common Name": "White Hawk",
    "Filename": "2015-12-23-pseudastur-albicollis-6P5A6075-2.jpg",
    "County": "",
    "State/Province": "BZ-CY"
  },
  {
    "Date": "01-19-2014",
    "Location": "Mexico Road",
    "Scientific Name": "Milvago chimachima",
    "Common Name": "Yellow-headed Caracara",
    "Filename": "2014-01-19-milvago-chimachima-DM6C2406.jpg",
    "County": "",
    "State/Province": "TT-TUP"
  },
  {
    "Date": "08-26-2017",
    "Location": "(37.5068,-122.8279)",
    "Scientific Name": "Cerorhinca monocerata",
    "Common Name": "Rhinoceros Auklet",
    "Filename": "2017-08-26-cerorhinca-monocerata-0L5A2222.jpg",
    "County": "San Francisco",
    "State/Province": "US-CA"
  },
  {
    "Date": "12-20-2015",
    "Location": "Guinea Grass Rd - 18.026x-88.563 - Dec 20, 2015 4:01 PM",
    "Scientific Name": "Columbina talpacoti",
    "Common Name": "Ruddy Ground-Dove",
    "Filename": "2015-12-20-columbina-talpacoti-6P5A3180.jpg",
    "County": "",
    "State/Province": "BZ-OW"
  },
  {
    "Date": "02-21-2012",
    "Location": "Alajuela",
    "Scientific Name": "Melanerpes hoffmannii",
    "Common Name": "Hoffmann's Woodpecker",
    "Filename": "2012-02-21-melanerpes-hoffmannii-7V5Z1572.jpg",
    "County": "",
    "State/Province": "CR-A"
  },
  {
    "Date": "01-23-2014",
    "Location": "Blue Waters Inn",
    "Scientific Name": "Tyrannus dominicensis",
    "Common Name": "Gray Kingbird",
    "Filename": "2014-01-23-tyrannus-dominicensis-DM6C4968.jpg",
    "County": "",
    "State/Province": "TT-TOB"
  },
  {
    "Date": "12-21-2015",
    "Location": "Crooked Tree Village",
    "Scientific Name": "Piaya cayana",
    "Common Name": "Squirrel Cuckoo",
    "Filename": "2015-12-21-piaya-cayana-6P5A4626.jpg",
    "County": "",
    "State/Province": "BZ-BZ"
  },
  {
    "Date": "02-25-2012",
    "Location": "Savegre Mountain Lodge",
    "Scientific Name": "Turdus nigrescens",
    "Common Name": "Sooty Thrush",
    "Filename": "2012-02-25-turdus-nigrescens-7V5Z5107.jpg",
    "County": "",
    "State/Province": "CR-SJ"
  },
  {
    "Date": "02-26-2012",
    "Location": "P.N. Los Quetzales, Costa Rica.",
    "Scientific Name": "Thryorchilus browni",
    "Common Name": "Timberline Wren",
    "Filename": "2012-02-26-thryorchilus-browni-7V5Z5202.jpg",
    "County": "",
    "State/Province": "CR-SJ"
  },
  {
    "Date": "02-26-2012",
    "Location": "P.N. Los Quetzales, Costa Rica.",
    "Scientific Name": "Zeledonia coronata",
    "Common Name": "Wrenthrush",
    "Filename": "2012-02-26-zeledonia-coronata-7V5Z5287.jpg",
    "County": "",
    "State/Province": "CR-SJ"
  },
  {
    "Date": "02-26-2012",
    "Location": "P.N. Los Quetzales, Costa Rica.",
    "Scientific Name": "Junco vulcani",
    "Common Name": "Volcano Junco",
    "Filename": "2012-02-26-junco-vulcani-7V5Z5378.jpg",
    "County": "",
    "State/Province": "CR-SJ"
  },
  {
    "Date": "01-19-2014",
    "Location": "Asa Wright Nature Centre",
    "Scientific Name": "Vanellus chilensis",
    "Common Name": "Southern Lapwing",
    "Filename": "2014-01-19-vanellus-chilensis-DM6C2378.jpg",
    "County": "",
    "State/Province": "TT-TUP"
  },
  {
    "Date": "01-19-2014",
    "Location": "Asa Wright Nature Centre",
    "Scientific Name": "Piaya cayana",
    "Common Name": "Squirrel Cuckoo",
    "Filename": "2014-01-19-piaya-cayana-DM6C2402.jpg",
    "County": "",
    "State/Province": "TT-TUP"
  },
  {
    "Date": "06-14-2016",
    "Location": "Rancho San Antonio",
    "Scientific Name": "Patagioenas fasciata",
    "Common Name": "Band-tailed Pigeon",
    "Filename": "2016-06-14-patagioenas-fasciata-0L5A0482.jpg",
    "County": "Santa Clara",
    "State/Province": "US-CA"
  },
  {
    "Date": "08-12-2016",
    "Location": "Howard Prairie Circuit",
    "Scientific Name": "Oreortyx pictus",
    "Common Name": "Mountain Quail",
    "Filename": "2016-08-12-oreortyx-pictus-0L5A7044.jpg",
    "County": "Jackson",
    "State/Province": "US-OR"
  },
  {
    "Date": "07-16-2016",
    "Location": "Reserva Amagusa",
    "Scientific Name": "Piranga leucoptera",
    "Common Name": "White-winged Tanager",
    "Filename": "2016-07-16-piranga-leucoptera-0L5A8084.jpg",
    "County": "",
    "State/Province": "EC-P"
  },
  {
    "Date": "07-16-2016",
    "Location": "Reserva Amagusa",
    "Scientific Name": "Pipreola jucunda",
    "Common Name": "Orange-breasted Fruiteater",
    "Filename": "2016-07-16-pipreola-jucunda-0L5A8103.jpg",
    "County": "",
    "State/Province": "EC-P"
  },
  {
    "Date": "07-16-2016",
    "Location": "Reserva Amagusa",
    "Scientific Name": "Tangara parzudakii",
    "Common Name": "Flame-faced Tanager",
    "Filename": "2016-07-16-tangara-parzudakii-0L5A8155.jpg",
    "County": "",
    "State/Province": "EC-P"
  },
  {
    "Date": "12-02-2016",
    "Location": "Randall Davey Audubon Center",
    "Scientific Name": "Melozone fusca",
    "Common Name": "Canyon Towhee",
    "Filename": "2016-12-02-melozone-fusca-179A8885.jpg",
    "County": "Santa Fe",
    "State/Province": "US-NM"
  },
  {
    "Date": "12-24-2015",
    "Location": "San Antonio MPR Junction - Dec 24, 2015 10:24 PM",
    "Scientific Name": "Chondrohierax uncinatus",
    "Common Name": "Hook-billed Kite",
    "Filename": "2015-12-24-chondrohierax-uncinatus-6P5A7136.jpg",
    "County": "",
    "State/Province": "BZ-CY"
  },
  {
    "Date": "12-28-2013",
    "Location": "Cabaas San Isidro",
    "Scientific Name": "Zonotrichia capensis",
    "Common Name": "Rufous-collared Sparrow",
    "Filename": "2013-12-28-zonotrichia-capensis-_M6C0143.jpg",
    "County": "",
    "State/Province": "EC-N"
  },
  {
    "Date": "12-29-2013",
    "Location": "Cabaas San Isidro",
    "Scientific Name": "Merganetta armata",
    "Common Name": "Torrent Duck",
    "Filename": "2013-12-29-merganetta-armata-_M6C1002.jpg",
    "County": "",
    "State/Province": "EC-N"
  },
  {
    "Date": "04-09-2016",
    "Location": "Sunnyvale WPCP",
    "Scientific Name": "Columba livia (Feral Pigeon)",
    "Common Name": "Rock Pigeon (Feral Pigeon)",
    "Filename": "2016-04-09-columba-livia-6P5A1750.jpg",
    "County": "Santa Clara",
    "State/Province": "US-CA"
  },
  {
    "Date": "12-28-2013",
    "Location": "Cabaas San Isidro",
    "Scientific Name": "Diglossa caerulescens",
    "Common Name": "Bluish Flowerpiercer",
    "Filename": "2013-12-28-diglossa-caerulescens-_M6C0376.jpg",
    "County": "",
    "State/Province": "EC-N"
  },
  {
    "Date": "04-08-2008",
    "Location": "El Canelo Ranch",
    "Scientific Name": "Melanerpes aurifrons",
    "Common Name": "Golden-fronted Woodpecker",
    "Filename": "2008-04-08-melanerpes-aurifrons-7V5Z0797.jpg",
    "County": "Kenedy",
    "State/Province": "US-TX"
  },
  {
    "Date": "04-08-2008",
    "Location": "El Canelo Ranch",
    "Scientific Name": "Geranoaetus albicaudatus",
    "Common Name": "White-tailed Hawk",
    "Filename": "2008-04-08-geranoaetus-albicaudatus-7V5Z0997.jpg",
    "County": "Kenedy",
    "State/Province": "US-TX"
  },
  {
    "Date": "04-10-2008",
    "Location": "Frontera Audubon",
    "Scientific Name": "Setophaga virens",
    "Common Name": "Black-throated Green Warbler",
    "Filename": "2008-04-10-setophaga-virens-7V5Z2678.jpg",
    "County": "Hidalgo",
    "State/Province": "US-TX"
  },
  {
    "Date": "04-11-2008",
    "Location": "Laguna Atascosa NWR",
    "Scientific Name": "Geococcyx californianus",
    "Common Name": "Greater Roadrunner",
    "Filename": "2008-04-11-geococcyx-californianus-7V5Z3005.jpg",
    "County": "Cameron",
    "State/Province": "US-TX"
  },
  {
    "Date": "04-12-2008",
    "Location": "Santa Ana NWR",
    "Scientific Name": "Buteo platypterus",
    "Common Name": "Broad-winged Hawk",
    "Filename": "2008-04-12-buteo-platypterus-7V5Z3979.jpg",
    "County": "Hidalgo",
    "State/Province": "US-TX"
  },
  {
    "Date": "04-12-2008",
    "Location": "Santa Ana NWR",
    "Scientific Name": "Buteo platypterus",
    "Common Name": "Broad-winged Hawk",
    "Filename": "2008-04-12-buteo-platypterus-7V5Z3998.jpg",
    "County": "Hidalgo",
    "State/Province": "US-TX"
  },
  {
    "Date": "06-01-2017",
    "Location": "Walker Pass",
    "Scientific Name": "Artemisiospiza belli",
    "Common Name": "Bell's Sparrow",
    "Filename": "2017-06-01-artemisiospiza-belli-0L5A0484.jpg",
    "County": "Kern",
    "State/Province": "US-CA"
  },
  {
    "Date": "12-24-2015",
    "Location": "San Antonio MPR Junction - Dec 24, 2015 10:24 PM",
    "Scientific Name": "Aimophila rufescens",
    "Common Name": "Rusty Sparrow",
    "Filename": "2015-12-24-aimophila-rufescens-6P5A6917.jpg",
    "County": "",
    "State/Province": "BZ-CY"
  },
  {
    "Date": "04-09-2008",
    "Location": "Hidalgo",
    "Scientific Name": "Columbina passerina",
    "Common Name": "Common Ground-Dove",
    "Filename": "2008-04-09-columbina-passerina-7V5Z1720.jpg",
    "County": "Hidalgo",
    "State/Province": "US-TX"
  },
  {
    "Date": "04-09-2008",
    "Location": "Hidalgo",
    "Scientific Name": "Leptotila verreauxi",
    "Common Name": "White-tipped Dove",
    "Filename": "2008-04-09-leptotila-verreauxi-7V5Z1725.jpg",
    "County": "Hidalgo",
    "State/Province": "US-TX"
  },
  {
    "Date": "04-09-2008",
    "Location": "Hidalgo",
    "Scientific Name": "Spinus psaltria",
    "Common Name": "Lesser Goldfinch",
    "Filename": "2008-04-09-spinus-psaltria-7V5Z1746.jpg",
    "County": "Hidalgo",
    "State/Province": "US-TX"
  },
  {
    "Date": "04-09-2008",
    "Location": "Hidalgo",
    "Scientific Name": "Melanerpes aurifrons",
    "Common Name": "Golden-fronted Woodpecker",
    "Filename": "2008-04-09-melanerpes-aurifrons-7V5Z2217.jpg",
    "County": "Hidalgo",
    "State/Province": "US-TX"
  },
  {
    "Date": "07-16-2016",
    "Location": "Reserva Amagusa",
    "Scientific Name": "Pipreola jucunda",
    "Common Name": "Orange-breasted Fruiteater",
    "Filename": "2016-07-16-pipreola-jucunda-0L5A8686.jpg",
    "County": "",
    "State/Province": "EC-P"
  },
  {
    "Date": "07-17-2016",
    "Location": "Milpe--Milpe Gardens",
    "Scientific Name": "Ramphastos brevis",
    "Common Name": "Choco Toucan",
    "Filename": "2016-07-17-ramphastos-brevis-0L5A9126.jpg",
    "County": "",
    "State/Province": "EC-P"
  },
  {
    "Date": "04-14-2016",
    "Location": "J. N. Ding Darling NWR",
    "Scientific Name": "Pandion haliaetus",
    "Common Name": "Osprey",
    "Filename": "2016-04-14-pandion-haliaetus-6P5A2840.jpg",
    "County": "Lee",
    "State/Province": "US-FL"
  },
  {
    "Date": "04-14-2016",
    "Location": "J. N. Ding Darling NWR",
    "Scientific Name": "Vireo solitarius",
    "Common Name": "Blue-headed Vireo",
    "Filename": "2016-04-14-vireo-solitarius-6P5A2907.jpg",
    "County": "Lee",
    "State/Province": "US-FL"
  },
  {
    "Date": "04-14-2016",
    "Location": "Prairie/Shell Creek Preserve",
    "Scientific Name": "Aphelocoma coerulescens",
    "Common Name": "Florida Scrub-Jay",
    "Filename": "2016-04-14-aphelocoma-coerulescens-6P5A3300.jpg",
    "County": "Charlotte",
    "State/Province": "US-FL"
  },
  {
    "Date": "04-15-2016",
    "Location": "Babcock-Webb WMA",
    "Scientific Name": "Sturnella magna",
    "Common Name": "Eastern Meadowlark",
    "Filename": "2016-04-15-sturnella-magna-6P5A3574.jpg",
    "County": "Charlotte",
    "State/Province": "US-FL"
  },
  {
    "Date": "04-20-2016",
    "Location": "Dry Tortugas NP (Please consider using more specific locations)",
    "Scientific Name": "Setophaga discolor",
    "Common Name": "Prairie Warbler",
    "Filename": "2016-04-20-setophaga-discolor-IMG_0253.jpg",
    "County": "Monroe",
    "State/Province": "US-FL"
  },
  {
    "Date": "07-16-2016",
    "Location": "Reserva Amagusa",
    "Scientific Name": "Chlorochrysa phoenicotis",
    "Common Name": "Glistening-green Tanager",
    "Filename": "2016-07-16-chlorochrysa-phoenicotis-0L5A8491.jpg",
    "County": "",
    "State/Province": "EC-P"
  },
  {
    "Date": "04-15-2016",
    "Location": "Babcock-Webb WMA",
    "Scientific Name": "Peucaea aestivalis",
    "Common Name": "Bachman's Sparrow",
    "Filename": "2016-04-15-peucaea-aestivalis-6P5A3715.jpg",
    "County": "Charlotte",
    "State/Province": "US-FL"
  },
  {
    "Date": "04-21-2016",
    "Location": "US-Florida-Big Pine Key-3636 Town St - 24.721x-81.399",
    "Scientific Name": "Chordeiles gundlachii",
    "Common Name": "Antillean Nighthawk",
    "Filename": "2016-04-21-chordeiles-gundlachii-IMG_0759.jpg",
    "County": "Monroe",
    "State/Province": "US-FL"
  },
  {
    "Date": "12-18-2015",
    "Location": "Crooked Tree Lodge",
    "Scientific Name": "Egretta caerulea",
    "Common Name": "Little Blue Heron",
    "Filename": "2015-12-18-egretta-caerulea-6P5A0621.jpg",
    "County": "",
    "State/Province": "BZ-OW"
  },
  {
    "Date": "12-18-2015",
    "Location": "Crooked Tree Lodge",
    "Scientific Name": "Parkesia noveboracensis",
    "Common Name": "Northern Waterthrush",
    "Filename": "2015-12-18-parkesia-noveboracensis-6P5A0748.jpg",
    "County": "",
    "State/Province": "BZ-OW"
  },
  {
    "Date": "12-19-2015",
    "Location": "Crooked Tree Lagoon",
    "Scientific Name": "Jacana spinosa",
    "Common Name": "Northern Jacana",
    "Filename": "2015-12-19-jacana-spinosa-6P5A1929.jpg",
    "County": "",
    "State/Province": "BZ-BZ"
  },
  {
    "Date": "12-19-2015",
    "Location": "Crooked Tree Lagoon",
    "Scientific Name": "Chloroceryle americana",
    "Common Name": "Green Kingfisher",
    "Filename": "2015-12-19-chloroceryle-americana-6P5A2288.jpg",
    "County": "",
    "State/Province": "BZ-BZ"
  },
  {
    "Date": "12-19-2015",
    "Location": "Crooked Tree Lagoon",
    "Scientific Name": "Vireo griseus",
    "Common Name": "White-eyed Vireo",
    "Filename": "2015-12-19-vireo-griseus-6P5A2316.jpg",
    "County": "",
    "State/Province": "BZ-BZ"
  },
  {
    "Date": "12-20-2015",
    "Location": "Guinea Grass Rd - 18.026x-88.563 - Dec 20, 2015 4:01 PM",
    "Scientific Name": "Psilorhinus morio",
    "Common Name": "Brown Jay",
    "Filename": "2015-12-20-psilorhinus-morio-6P5A2739.jpg",
    "County": "",
    "State/Province": "BZ-OW"
  },
  {
    "Date": "12-20-2015",
    "Location": "Guinea Grass Rd - 18.026x-88.563 - Dec 20, 2015 4:01 PM",
    "Scientific Name": "Amazona oratrix",
    "Common Name": "Yellow-headed Parrot",
    "Filename": "2015-12-20-amazona-oratrix-6P5A2797.jpg",
    "County": "",
    "State/Province": "BZ-OW"
  },
  {
    "Date": "12-20-2015",
    "Location": "Guinea Grass Rd - 18.026x-88.563 - Dec 20, 2015 4:01 PM",
    "Scientific Name": "Trogon caligatus",
    "Common Name": "Gartered Trogon",
    "Filename": "2015-12-20-trogon-caligatus-6P5A3368.jpg",
    "County": "",
    "State/Province": "BZ-OW"
  },
  {
    "Date": "12-21-2015",
    "Location": "Crooked Tree Village",
    "Scientific Name": "Cyanocorax yucatanicus",
    "Common Name": "Yucatan Jay",
    "Filename": "2015-12-21-cyanocorax-yucatanicus-6P5A3747.jpg",
    "County": "",
    "State/Province": "BZ-BZ"
  },
  {
    "Date": "12-22-2015",
    "Location": "Chiquibul Forest Reserve - Scarlet Creek Camp",
    "Scientific Name": "Falco rufigularis",
    "Common Name": "Bat Falcon",
    "Filename": "2015-12-22-falco-rufigularis-6P5A5110.jpg",
    "County": "",
    "State/Province": "BZ-CY"
  },
  {
    "Date": "12-22-2015",
    "Location": "Chiquibul Forest Reserve--Chalillo Reservoir",
    "Scientific Name": "Penelope purpurascens",
    "Common Name": "Crested Guan",
    "Filename": "2015-12-22-penelope-purpurascens-6P5A5157.jpg",
    "County": "",
    "State/Province": "BZ-CY"
  },
  {
    "Date": "07-03-2014",
    "Location": "Inyo Craters",
    "Scientific Name": "Nucifraga columbiana",
    "Common Name": "Clark's Nutcracker",
    "Filename": "2014-07-03-nucifraga-columbiana-DM6C2147.jpg",
    "County": "Mono",
    "State/Province": "US-CA"
  },
  {
    "Date": "11-28-2015",
    "Location": "Colusa NWR--Auto Tour Route",
    "Scientific Name": "Anser albifrons",
    "Common Name": "Greater White-fronted Goose",
    "Filename": "2015-11-28-anser-albifrons-DM6C9719.jpg",
    "County": "Colusa",
    "State/Province": "US-CA"
  },
  {
    "Date": "12-20-2015",
    "Location": "Guinea Grass Rd - 18.026x-88.563 - Dec 20, 2015 4:01 PM",
    "Scientific Name": "Volatinia jacarina",
    "Common Name": "Blue-black Grassquit",
    "Filename": "2015-12-20-volatinia-jacarina-6P5A2983.jpg",
    "County": "",
    "State/Province": "BZ-OW"
  },
  {
    "Date": "12-22-2015",
    "Location": "Chiquibul Forest Reserve--Chalillo Reservoir",
    "Scientific Name": "Ramphastos sulfuratus",
    "Common Name": "Keel-billed Toucan",
    "Filename": "2015-12-22-ramphastos-sulfuratus-6P5A4986.jpg",
    "County": "",
    "State/Province": "BZ-CY"
  },
  {
    "Date": "12-22-2015",
    "Location": "Chiquibul Forest Reserve--Chalillo Reservoir",
    "Scientific Name": "Ramphastos sulfuratus",
    "Common Name": "Keel-billed Toucan",
    "Filename": "2015-12-22-ramphastos-sulfuratus-6P5A5182.jpg",
    "County": "",
    "State/Province": "BZ-CY"
  },
  {
    "Date": "05-31-2017",
    "Location": "Canebrake Ecological Reserve",
    "Scientific Name": "Empidonax traillii",
    "Common Name": "Willow Flycatcher",
    "Filename": "2017-05-31-empidonax-traillii-0L5A0310.jpg",
    "County": "Kern",
    "State/Province": "US-CA"
  },
  {
    "Date": "09-19-2017",
    "Location": "Sunnyvale Baylands Park",
    "Scientific Name": "Empidonax difficilis",
    "Common Name": "Pacific-slope Flycatcher",
    "Filename": "2017-09-19-empidonax-difficilis-0L5A3078.jpg",
    "County": "Santa Clara",
    "State/Province": "US-CA"
  },
  {
    "Date": "07-23-2016",
    "Location": "Isla Santa Fe",
    "Scientific Name": "Zenaida galapagoensis",
    "Common Name": "Galapagos Dove",
    "Filename": "2016-07-23-zenaida-galapagoensis-0L5A3730.jpg",
    "County": "",
    "State/Province": "EC-W"
  },
  {
    "Date": "12-19-2015",
    "Location": "Crooked Tree Village - Dec 19, 2015 1:04 PM",
    "Scientific Name": "Turdus grayi",
    "Common Name": "Clay-colored Thrush",
    "Filename": "2015-12-19-turdus-grayi-6P5A1768.jpg",
    "County": "",
    "State/Province": "BZ-OW"
  },
  {
    "Date": "12-19-2015",
    "Location": "Crooked Tree Village - Dec 19, 2015 1:04 PM",
    "Scientific Name": "Turdus grayi",
    "Common Name": "Clay-colored Thrush",
    "Filename": "2015-12-19-turdus-grayi-6P5A1782.jpg",
    "County": "",
    "State/Province": "BZ-OW"
  },
  {
    "Date": "12-20-2015",
    "Location": "Guinea Grass Rd - 18.026x-88.563 - Dec 20, 2015 4:01 PM",
    "Scientific Name": "Icterus spurius",
    "Common Name": "Orchard Oriole",
    "Filename": "2015-12-20-icterus-spurius-6P5A3037.jpg",
    "County": "",
    "State/Province": "BZ-OW"
  },
  {
    "Date": "01-23-2016",
    "Location": "Keith Hansen's Gallery ",
    "Scientific Name": "Passerella iliaca",
    "Common Name": "Fox Sparrow",
    "Filename": "2016-01-23-passerella-iliaca-6P5A8910.jpg",
    "County": "Marin",
    "State/Province": "US-CA"
  },
  {
    "Date": "11-27-2015",
    "Location": "Road Y / Gridley Rd",
    "Scientific Name": "Sturnella neglecta",
    "Common Name": "Western Meadowlark",
    "Filename": "2015-11-27-sturnella-neglecta-DM6C9415.jpg",
    "County": "Glenn",
    "State/Province": "US-CA"
  },
  {
    "Date": "03-04-2013",
    "Location": "Parc Natural del Cad-Moixer / Terradelles",
    "Scientific Name": "Pyrrhocorax graculus",
    "Common Name": "Yellow-billed Chough",
    "Filename": "2013-03-04-pyrrhocorax-graculus-_M6C4089.jpg",
    "County": "Barcelona",
    "State/Province": "ES-CT"
  },
  {
    "Date": "12-19-2015",
    "Location": "Crooked Tree Lagoon",
    "Scientific Name": "Pyrocephalus rubinus",
    "Common Name": "Vermilion Flycatcher",
    "Filename": "2015-12-19-pyrocephalus-rubinus-6P5A1404.jpg",
    "County": "",
    "State/Province": "BZ-BZ"
  },
  {
    "Date": "03-01-2013",
    "Location": "Delta del Llobregat PNat--Area general",
    "Scientific Name": "Prunella collaris",
    "Common Name": "Alpine Accentor",
    "Filename": "2013-03-01-prunella-collaris-_M6C2763.jpg",
    "County": "Barcelona",
    "State/Province": "ES-CT"
  },
  {
    "Date": "02-25-2012",
    "Location": "Savegre Mountain Lodge",
    "Scientific Name": "Basileuterus melanogenys",
    "Common Name": "Black-cheeked Warbler",
    "Filename": "2012-02-25-basileuterus-melanogenys-7V5Z4870.jpg",
    "County": "",
    "State/Province": "CR-SJ"
  },
  {
    "Date": "02-25-2012",
    "Location": "Savegre Mountain Lodge",
    "Scientific Name": "Catharus gracilirostris",
    "Common Name": "Black-billed Nightingale-Thrush",
    "Filename": "2012-02-25-catharus-gracilirostris-7V5Z5121.jpg",
    "County": "",
    "State/Province": "CR-SJ"
  },
  {
    "Date": "07-03-2014",
    "Location": "Owens River Rd. .4 miles east of 395",
    "Scientific Name": "Picoides arcticus",
    "Common Name": "Black-backed Woodpecker",
    "Filename": "2014-07-03-picoides-arcticus-DM6C2008.jpg",
    "County": "Mono",
    "State/Province": "US-CA"
  },
  {
    "Date": "06-08-2010",
    "Location": "Teller Road",
    "Scientific Name": "Larus hyperboreus",
    "Common Name": "Glaucous Gull",
    "Filename": "2010-06-08-larus-hyperboreus-7V5Z1546.jpg",
    "County": "Nome",
    "State/Province": "US-AK"
  },
  {
    "Date": "06-10-2010",
    "Location": "Kougarok Road",
    "Scientific Name": "Larus hyperboreus",
    "Common Name": "Glaucous Gull",
    "Filename": "2010-06-10-larus-hyperboreus-7V5Z2603.jpg",
    "County": "Nome",
    "State/Province": "US-AK"
  },
  {
    "Date": "04-11-2008",
    "Location": "Laguna Atascosa NWR",
    "Scientific Name": "Parabuteo unicinctus",
    "Common Name": "Harris's Hawk",
    "Filename": "2008-04-11-parabuteo-unicinctus-7V5Z2930.jpg",
    "County": "Cameron",
    "State/Province": "US-TX"
  },
  {
    "Date": "01-19-2014",
    "Location": "Yarrete - Hummingbirds",
    "Scientific Name": "Anthracothorax nigricollis",
    "Common Name": "Black-throated Mango",
    "Filename": "2014-01-19-anthracothorax-nigricollis-DM6C2714.jpg",
    "County": "",
    "State/Province": "TT-TUP"
  },
  {
    "Date": "12-27-2013",
    "Location": "Cabaas San Isidro",
    "Scientific Name": "Ciccaba huhula",
    "Common Name": "Black-banded Owl",
    "Filename": "2013-12-27-ciccaba-huhula-_M6C9913.jpg",
    "County": "",
    "State/Province": "EC-N"
  },
  {
    "Date": "12-31-2013",
    "Location": "Antisana Ecological Reserve--general area (*Please consider using a more precise hotspot or personal location when possible.)",
    "Scientific Name": "Theristicus melanopis",
    "Common Name": "Black-faced Ibis",
    "Filename": "2013-12-31-theristicus-melanopis-_O5C6763.jpg",
    "County": "",
    "State/Province": "EC-N"
  },
  {
    "Date": "02-23-2012",
    "Location": "PN Carara",
    "Scientific Name": "Manacus aurantiacus",
    "Common Name": "Orange-collared Manakin",
    "Filename": "2012-02-23-manacus-aurantiacus-7V5Z2780.jpg",
    "County": "",
    "State/Province": "CR-P"
  },
  {
    "Date": "01-19-2014",
    "Location": "10.6355x-61.2399 - Jan 8, 2013, 1:51 PM",
    "Scientific Name": "Chrysolampis mosquitus",
    "Common Name": "Ruby-topaz Hummingbird",
    "Filename": "2014-01-19-chrysolampis-mosquitus-DM6C2838.jpg",
    "County": "",
    "State/Province": "TT-TUP"
  },
  {
    "Date": "12-29-2013",
    "Location": "Cabaas San Isidro",
    "Scientific Name": "Psarocolius angustifrons",
    "Common Name": "Russet-backed Oropendola",
    "Filename": "2013-12-29-psarocolius-angustifrons-_M6C0795.jpg",
    "County": "",
    "State/Province": "EC-N"
  },
  {
    "Date": "01-23-2016",
    "Location": "Keith Hansen's Gallery ",
    "Scientific Name": "Passer domesticus",
    "Common Name": "House Sparrow",
    "Filename": "2016-01-23-passer-domesticus-6P5A8994.jpg",
    "County": "Marin",
    "State/Province": "US-CA"
  },
  {
    "Date": "02-22-2012",
    "Location": "Cerro Lodge",
    "Scientific Name": "Eupsittula canicularis",
    "Common Name": "Orange-fronted Parakeet",
    "Filename": "2012-02-22-eupsittula-canicularis-7V5Z2325.jpg",
    "County": "",
    "State/Province": "CR-P"
  }
]
